### DISCUSSION TITLE
Help with VTI (Route Based VPN) network configuration

### DISCUSSION THREAD

**Discussion by FlyingTable782** [strongswan/strongswan#1720] [Q&A] [answered]
Hi, I have been trying to get a VTI VPN connection going. I think I have one up, but I'm not sure if it is working correctly and if this is the expected output.

Here is my network setup:
```
             172.18.153.35 <-> 172.18.154.43
Ubuntu Gateway 1 <-------------------------> Ubuntu Gateway 2
      | Private                                | Private
      | 192.168.10.XX                          | 192.168.11.XX
      |                                        |
Ubuntu Client 1                            Ubuntu Client 2

```

From `ip -s tunnel`. I see this:
```
vti0: ip/ip remote 172.18.153.35 local 172.18.154.43 ttl inherit nopmtudisc key 42
RX: Packets    Bytes        Errors CsumErrs OutOfSeq Mcasts
    1046       87837        0      0        0        0
TX: Packets    Bytes        Errors DeadLoop NoRoute  NoBufs
    0          0            0     0        0       0
```

Both Ubuntu Gateways are using VTI interfaces. The TX packet count never goes up regardless of which side I send traffic from. I can see the pings from BOTH Ubuntu Client 1 and Client 2 getting responses from pinging one another, but TX never goes up on either side.

Is this expected behavior that TX never goes up on either side?

From `swanctl -l`, I can see that the tunnel is being utilized for both transmit and receive:
```
psk_P: #104, ESTABLISHED, IKEv2, 41fc054be225cf25_i* cc00c5bab01ee5b4_r
  local  '172.18.153.35' @ 172.18.153.35[500]
  remote '172.18.154.43' @ 172.18.154.43[500]
  AES_CBC-128/HMAC_SHA2_256_128/PRF_HMAC_SHA2_256/MODP_2048
  established 303s ago, rekeying in 3228s
  psk_C: #111, reqid 1, INSTALLED, TUNNEL, ESP:AES_CBC-128/HMAC_SHA2_256_128
    installed 303s ago, rekeying in 3109s, expires in 3657s
    in  c2f0fbd7 (0x0000002a),  30240 bytes,   360 packets,     0s ago
    out c9f80990 (0x0000002a),  30240 bytes,   360 packets,     0s ago
    local  192.168.10.0/24
    remote 192.168.11.0/24
```

Here are my `ip route rules` from Ubuntu Gateway 1:
```
# ip route
default via 172.18.153.1 dev ens192 proto static metric 20100
169.254.0.0/16 dev ens192 scope link metric 1000
172.18.153.0/24 dev ens192 proto kernel scope link src 172.18.153.35 metric 100
192.168.10.0/24 dev ens224 proto kernel scope link src 192.168.10.2 metric 101
192.168.11.0/24 dev vti0 proto kernel scope link src 192.168.11.0
```

Here is `ip a` from Ubuntu Gateway 1:
```
2: ens192: <BROADCAST,MULTICAST,UP,LOWER_UP> mtu 1500 qdisc mq state UP group default qlen 1000
    altname enp11s0
    inet 172.18.153.35/24 brd 172.18.153.255 scope global noprefixroute ens192
       valid_lft forever preferred_lft forever
3: ens224: <BROADCAST,MULTICAST,UP,LOWER_UP> mtu 1500 qdisc mq state UP group default qlen 1000
    altname enp19s0
    inet 192.168.10.2/24 brd 192.168.10.255 scope global noprefixroute ens224
       valid_lft forever preferred_lft forever
5: vti0@NONE: <POINTOPOINT,NOARP,UP,LOWER_UP> mtu 1400 qdisc noqueue state UNKNOWN group default qlen 1000
    link/ipip 172.18.153.35 peer 172.18.154.43
    inet 192.168.11.0/24 scope global vti0
       valid_lft forever preferred_lft forever
```

Here is a brief packet capture from Ubuntu Gateway 1:
```
# tcpdump -i any -f icmp or esp
tcpdump: data link type LINUX_SLL2
tcpdump: verbose output suppressed, use -v[v]... for full protocol decode
listening on any, link-type LINUX_SLL2 (Linux cooked v2), snapshot length 262144 bytes
14:16:03.292291 ens224 In  IP 192.168.10.3 > 192.168.11.3: ICMP echo request, id 60, seq 268, length 64
14:16:03.292367 ens192 Out IP arbiter > ocelot: ESP(spi=0xc9f80990,seq=0x197), length 136
14:16:03.293064 ens192 In  IP ocelot > arbiter: ESP(spi=0xc2f0fbd7,seq=0x197), length 136
14:16:03.293116 vti0  In  IP 192.168.11.3 > 192.168.10.3: ICMP echo reply, id 60, seq 268, length 64
14:16:03.293131 ens224 Out IP 192.168.11.3 > 192.168.10.3: ICMP echo reply, id 60, seq 268, length 64
14:16:04.293485 ens224 In  IP 192.168.10.3 > 192.168.11.3: ICMP echo request, id 60, seq 269, length 64
14:16:04.293552 ens192 Out IP arbiter > ocelot: ESP(spi=0xc9f80990,seq=0x198), length 136
14:16:04.294231 ens192 In  IP ocelot > arbiter: ESP(spi=0xc2f0fbd7,seq=0x198), length 136
14:16:04.294261 vti0  In  IP 192.168.11.3 > 192.168.10.3: ICMP echo reply, id 60, seq 269, length 64
```

Here is my configuration:
```
connections {
    psk_P {
        local_addrs = 172.18.153.35
        remote_addrs = 172.18.154.43
        local {
            id = 172.18.153.35
            auth = psk
        }
        remote {
            id = 172.18.154.43
            auth = psk
        }
        children {
            psk_C {
                mark_in = 42
                mark_out = 42
                mode = tunnel
                local_ts = 192.168.10.0/24
                remote_ts = 192.168.11.0/24
                rand_time = 540
                life_time = 3960
                rekey_time = 3600
                rekey_bytes = 500000000
                rekey_packets = 1000000
                esp_proposals = aes128-sha256
                start_action = none
            }
        }
        version = 2
        mobike = no
        unique = never
        send_certreq = no
        send_cert = never
        rekey_time = 3600
        reauth_time = 0
        proposals = aes128-sha256-modp2048
    }
}
secrets {
    ike-psk_S {
        id = 0.0.0.0
        secret = "123456"
    }
}
```

Any help would be appreciated! Thank you!

**Comment by tobiasbrunner** [comment]
> Is this expected behavior that TX never goes up on either side?

I don't think so, but might depend on the kernel version. What version are you using?

Anyway, if you are using a recently enough kernel and strongSwan version, I'd recommend using [XFRM interfaces](https://docs.strongswan.org/docs/5.9/features/routeBasedVpn.html#_xfrm_interfaces_on_linux) instead of VTIs. They offer a greatly improved experience overall.

**Reply by FlyingTable782** [reply]
Hi! I'm using kernel version `4.18.0`.
I'll try using XFRM, they really seem like a VTI Version 2 kind of thing.
EDIT: Seems like my kernel is too low of a version to use XFRM, I can't upgrade it for this environment. 

So it seems like I need to debug the TX of VTI, what could I try to do next?

**Reply by tobiasbrunner** [reply]
> I'm using kernel version `4.18.0`.

When using that kernel (vanilla version, so no patches Ubuntu might have applied) in our testing environment, stats on the VTI interfaces are increased in both directions. I also see the outbound packets on the VTI interface in tcpdump (you apparently only see the inbound packets there).

Did you add `192.168.11.0/24` on purpose to the VTI interface on GW1 (and reference it in the route)? (That's the net address of the remote subnet, so why add that locally? And the route should probably use `192.168.10.2` as preferred source address.)

Also, why are you using VTI interfaces at all for this simple site-to-site setup? Or is there more to it?

**Reply by FlyingTable782** [reply]
I’m using VTI interfaces because this network will eventually become a larger network with multiple subnets. This is just testing for now to get it working.

I didn’t add 192.168.10.0 to the interface, I just copy and pasted the command from the documentation of `ip route add 192.168.10.0/24 dev vti0` and it added the `src 192.168.10.0` to the route.

I’ll try making the src 192.168.10.2 and seeing what happens.

**Reply by FlyingTable782** [reply]
So unfortunately, setting src to use `192.168.10.2` does not do anything different, it just continue to exhibit the same behavior of receiving but not transmitting.

**Comment by FlyingTable782** [comment, marked as answer]
Thanks for all your help! The `forecast` and `bypass-lan` plugins were the reason why TX was not working. Disabling them allows for TX to increment. And I can see the packets using vti0 to transfer the packets from tcpdump.
```
vti0: ip/ip remote 172.18.154.43 local 172.18.153.35 ttl inherit nopmtudisc key 42
RX: Packets    Bytes        Errors CsumErrs OutOfSeq Mcasts
    734        61656        0      0        0        0
TX: Packets    Bytes        Errors DeadLoop NoRoute  NoBufs
    45         3780         102    0        102      0
```

```
tcpdump -i any -f icmp or esp
tcpdump: data link type LINUX_SLL2
tcpdump: verbose output suppressed, use -v[v]... for full protocol decode
listening on any, link-type LINUX_SLL2 (Linux cooked v2), snapshot length 262144 bytes
13:45:15.741126 ens224 In  IP 192.168.10.3 > 192.168.11.3: ICMP echo request, id 70, seq 1, length 64
13:45:15.741147 vti0  Out IP 192.168.10.3 > 192.168.11.3: ICMP echo request, id 70, seq 1, length 64
13:45:15.741187 ens192 Out IP arbiter > ocelot: ESP(spi=0xcf181d0e,seq=0x3c), length 136
13:45:15.741890 ens192 In  IP ocelot > arbiter: ESP(spi=0xc0399b65,seq=0x3c), length 136
13:45:15.741918 vti0  In  IP 192.168.11.3 > 192.168.10.3: ICMP echo reply, id 70, seq 1, length 64
13:45:15.741929 ens224 Out IP 192.168.11.3 > 192.168.10.3: ICMP echo reply, id 70, seq 1, length 64
13:45:16.742356 ens224 In  IP 192.168.10.3 > 192.168.11.3: ICMP echo request, id 70, seq 2, length 64
13:45:16.742384 vti0  Out IP 192.168.10.3 > 192.168.11.3: ICMP echo request, id 70, seq 2, length 64
13:45:16.742427 ens192 Out IP arbiter > ocelot: ESP(spi=0xcf181d0e,seq=0x3d), length 136
13:45:16.743013 ens192 In  IP ocelot > arbiter: ESP(spi=0xc0399b65,seq=0x3d), length 136
13:45:16.743065 vti0  In  IP 192.168.11.3 > 192.168.10.3: ICMP echo reply, id 70, seq 2, length 64
13:45:16.743081 ens224 Out IP 192.168.11.3 > 192.168.10.3: ICMP echo reply, id 70, seq 2, length 64
13:45:17.743317 ens224 In  IP 192.168.10.3 > 192.168.11.3: ICMP echo request, id 70, seq 3, length 64
13:45:17.743348 vti0  Out IP 192.168.10.3 > 192.168.11.3: ICMP echo request, id 70, seq 3, length 64
13:45:17.743394 ens192 Out IP arbiter > ocelot: ESP(spi=0xcf181d0e,seq=0x3e), length 136
13:45:17.744142 ens192 In  IP ocelot > arbiter: ESP(spi=0xc0399b65,seq=0x3e), length 136
13:45:17.744191 vti0  In  IP 192.168.11.3 > 192.168.10.3: ICMP echo reply, id 70, seq 3, length 64
13:45:17.744206 ens224 Out IP 192.168.11.3 > 192.168.10.3: ICMP echo reply, id 70, seq 3, length 64
```

```
default via 172.18.153.1 dev ens192 proto static metric 20100
169.254.0.0/16 dev ens192 scope link metric 1000
172.18.153.0/24 dev ens192 proto kernel scope link src 172.18.153.35 metric 100
192.168.10.0/24 dev ens224 proto kernel scope link src 192.168.10.2 metric 101
192.168.11.0/24 dev vti0 scope link src 192.168.10.2 metric 102
```

**Comment by dungru** [comment]
How to install the bypass-lan on openwrt?

**Comment by Kotodian** [comment]
Do you have any tutorial about it?
