### DISCUSSION TITLE
ESP packets sent from my Ubuntu server, but no response from VPN server

### DISCUSSION THREAD

**Discussion by ksushant881** [strongswan/strongswan#2851] [General]
I'm trying to set up an IPsec VPN from my Ubuntu server to a remote VPN endpoint. The connection seems to initiate correctly, but I only see outgoing ESP packets and no incoming responses.

From tcpdump when I curl to an IP in rightsubnet range, this is what I see:

    19:08:36.168726 eth0  Out IP 128.140.x.x > 62.152.x.x: ESP(spi=0xcdf48a2b,seq=0x6), length 96

My server IP: 128.140.x.x
Remote VPN server: 62.152.x.x
I'm using strongSwan for IPsec
UDP 500/4500 and protocol 50 (ESP) are open in the firewall
Tunnel negotiation shows success in the logs
tcpdump shows only outgoing ESP packets — nothing coming back

Here is my VPN tunnel established log

    fsn1-2:/etc$ sudo ipsec up myvpn 
    establishing CHILD_SA myvpn{2}
    generating CREATE_CHILD_SA request 2 [ SA No KE TSi TSr ]
    sending packet: from 128.140.x.x[4500] to 62.152.x.x[4500] (849 bytes)
    received packet: from 62.152.x.x[4500] to 128.140.x.x[4500] (705 bytes)
    parsed CREATE_CHILD_SA response 2 [ SA No KE TSi TSr ]
    selected proposal: ESP:AES_GCM_16_256/MODP_4096/NO_EXT_SEQ
    CHILD_SA myvpn{2} established with SPIs cbd23896_i cdf48a2b_o and TS 128.140.x.x/32 === 10.2xx.x.x/32
    connection 'myvpn' established successfully

10.2xx.x.x/32 is the rightsubnet in ipsec.conf.

What I want to know:

1. Why is the remote server not replying with ESP packets?
2. How can I debug incoming ESP traffic?
3. What could be blocking incoming ESP, even if outbound works?

Any help would be appreciated. Thanks!

**Comment by ksushant881** [comment]
I added a dummy0 bridge in netplan but the tcpdump says it used eth0. Is that an issue? How can I change that to go through dummy0?

**Reply by tobiasbrunner** [reply]
No idea what you are talking about.

**Reply by ksushant881** [reply]
Sorry I will add more files that I changed
ipsec.conf
```
config setup
    charondebug="ike 2, knl 2, cfg 2, net 2, esp 2, dmn 2, mgr 2"

conn myvpn
    keyexchange=ikev2
    auto=start
    left=%defaultroute        # local IP
    leftauth=psk
    leftsourceip=%config
    right=62.152.x.x
   # rightid=@vpn.example.com    # optional: server identity
   # rightsubnet=0.0.0.0/0       # route all traffic through VPN
    rightauth=psk
   # eap_identity=username
   # ike=aes256-sha384-modp4096,aes256-sha384-ecp521,aes256-sha384-curve25519
    esp=aes256gcm16-sha384-modp4096
    ike=aes256gcm16-sha256-modp4096
    aggressive=no
    authby=secret
    closeaction=restart
    ikelifetime=24h
    lifetime=1h
    keyingtries=5
    margintime=15m
    rekey=yes
    rekeyfuzz=60%
    type=tunnel
###################################
    rightsubnet=10.200.x.x/32
    leftsubnet=128.140.x.x/32,10.24.4.2/32
```

50-cloud-init.yaml
```
network:
    version: 2
    bridges:
      dummy0:
        dhcp4: no
        dhcp6: no
        accept-ra: no
        interfaces: [ ]
        addresses:
          - 10.24.4.2/30

    ethernets:
        eth0:
            addresses:
            - 2a01:4f8:c013:3522::1/64
            dhcp4: true
            match:
                macaddress: 96:00:03:3e:d3:21
            nameservers:
                addresses:
                - 2a01:4ff:ff00::add:1
                - 2a01:4ff:ff00::add:2
            routes:
            -   on-link: true
                to: default
                via: fe80::1
            set-name: eth0
```

The PSK is set in ipsec.secrets

**Reply by ksushant881** [reply]
ipsec.conf were added by me with help of other party's network guy and we were able to  establish the tunnel atleast. We also added the dummy0 in netplan file. I dont understand it clearly but now its my responsibility to make it work. Make it work would be if I am successfully able to reach 10.200.x.x, ping or curl which is the service I actually want to make rest calls to for which we did all this (setting up this tunnel)

**Reply by ksushant881** [reply]
But when the VPN is up and i run a ping 10.200.x.x
sudo tcpdump -i any \(host 10.200.x.x or host 62.152.x.x\) -nn
I get this logs
07:33:29.230703 eth0  Out IP 128.140.x.x > 62.152.x.x: ESP(spi=0xc0cff318,seq=0x14), length 120
07:33:30.248772 eth0  Out IP 128.140.x.x > 62.152.x.x: ESP(spi=0xc0cff318,seq=0x15), length 120
07:33:31.272839 eth0  Out IP 128.140.x.x > 62.152.x.x: ESP(spi=0xc0cff318,seq=0x16), length 120

**Comment by tobiasbrunner** [comment]
> Why is the remote server not replying with ESP packets?

Check what's going on at the other end. Does the peer receive the ESP packets? Does it properly handle the decrypted traffic and actually send a response? Possibly have a look at [how to forward traffic](https://docs.strongswan.org/docs/latest/howtos/forwarding.html).

> How can I debug incoming ESP traffic?

Use the counters in the status output to see whether ESP packets are received. If they are, but you don't see them in tcpdump, you might have the [`esp4_offload` kernel module](https://docs.strongswan.org/docs/latest/install/kernelModules.html#_performance_improvements_with_esp_grogso_offload) loaded.

> What could be blocking incoming ESP, even if outbound works?

Does outbound traffic actually work? Is there actually an ESP sent by the other peer? Make sure no intermediate firewall blocks inbound ESP (IP protocol 50). If there is no NAT and plain ESP doesn't work for some reason, you could try forcing UDP encapsulation via config.

**Reply by ksushant881** [reply]
When i ping a service behind the tunnel that i want to reach the tcpdump is this
```
16:32:07.666835 eth0  Out IP 128.140.x.x > 62.152.x.x: ESP(spi=0xc73fac90,seq=0x7), length 96
16:32:08.680733 eth0  Out IP 128.140.x.x > 62.152.x.x: ESP(spi=0xc73fac90,seq=0x8), length 96
16:32:10.696712 eth0  Out IP 128.140.x.x> 62.152.x.x ESP(spi=0xc73fac90,seq=0x9), length 96
16:32:14.792750 eth0  Out IP 128.140.x.x > 62.152.x.x8: ESP(spi=0xc73fac90,seq=0xa), length 96
16:32:22.984786 eth0  Out IP 128.140.x.x > 662.152.x.x: ESP(spi=0xc73fac90,seq=0xb), length 96
```

I got to know only this from them "This is a tunnel based interface, not a route based".

I dont know what it means!

**Reply by ksushant881** [reply]
@tobiasbrunner 
Does all the info I added help you understand the problem?

**Reply by tobiasbrunner** [reply]
Not really, because the problem is most likely at the other end.

**Reply by ksushant881** [reply]
> Not really, because the problem is most likely at the other end.

Okay, thanks for replying. I will ask them.

**Reply by ksushant881** [reply]
@tobiasbrunner Right now we see ping to 10.200.x.x going through eth0 which is normal as it is the default interface through which all request should go through.
But this request should have gone through the tunnel for which we have created dummy0 interface with our ip on that interface as 10.24.4.2/30. Do we not have to say somewhere for requests to 10.200.x.x dont use eth0, use dummy0?

I have added the netplan file above for your reference in my earlier replies.

**Reply by tobiasbrunner** [reply]
You don't need any dummy interfaces. Nor should ESP traffic go through it. Where did you get that dummy0 interface idea from?

**Reply by ksushant881** [reply]
> You don't need any dummy interfaces. Nor should ESP traffic go through it. Where did you get that dummy0 interface idea from?

They said it is required. How do you recommend I troubleshoot and solve it?

**Reply by tobiasbrunner** [reply]
Who said? But it won't cause your current issue anyway. If the ESP was sent, but there is no response, the issue is probably at the other end.

**Reply by ksushant881** [reply]
> Who said? But it won't cause your current issue anyway. If the ESP was sent, but there is no response, the issue is probably at the other end.

The network person from other side who helped setup the tunnel said it.
