### DISCUSSION TITLE
One side of tunnel cannot ping

### DISCUSSION THREAD

**Discussion by mehdi-sh-hm** [strongswan/strongswan#775] [Q&A]
I'm setting up a VPN using strongSwan,like this
```
[LAN A (192.168.88.0/24)]...192.168.88.242...(server A)84.*.*.* === 37.*.*.*(server B)...192.168.1.21...[LAN b (192.168.1.0/24)]
```
The connection is established OK.

1. **Server A**

```
$ ipsec status
Security Associations (1 up, 0 connecting):
office_to_mn[5]: ESTABLISHED 38 seconds ago, 192.168.88.242[84.*.*.*]...37.*.*.*[37.*.*.*]
office_to_mn{4}:  INSTALLED, TUNNEL, reqid 3, ESP in UDP SPIs: ca46eb7e_i ca6b3cbf_o
office_to_mn{4}:   192.168.88.0/24 === 192.168.1.0/24
```
```
$ cat /etc/ipsec.conf
# basic configuration
config setup
    uniqueids=yes
    strictcrlpolicy=no

# connection to datacenter
conn office_to_mn
    authby=secret
    left=%defaultroute
    leftid=84.*.*.*
    leftsubnet=192.168.88.0/24
    right=37.*.*.*
    rightsubnet=192.168.1.0/24
    ike=aes256-sha2_256-modp1024!
    esp=aes256-sha2_256!
    keyingtries=0
    ikelifetime=1h
    lifetime=8h
    dpddelay=30
    dpdtimeout=120
    dpdaction=restart
    auto=start
```
```
$ ipsec statusall
Status of IKE charon daemon (strongSwan 5.8.2, Linux 5.4.0-89-generic, x86_64):
  uptime: 5 minutes, since Nov 22 09:27:15 2021
  malloc: sbrk 1634304, mmap 0, used 651568, free 982736
  worker threads: 11 of 16 idle, 5/0/0/0 working, job queue: 0/0/0/0, scheduled: 5
  loaded plugins: charon aesni aes rc2 sha2 sha1 md5 mgf1 random nonce x509 revocation constraints pubkey pkcs1 pkcs7 pkcs8 pkcs12 pgp dnskey sshkey pem openssl fips-prf gmp agent xcbc hmac gcm drbg attr kernel-netlink resolve socket-default connmark stroke updown eap-mschapv2 xauth-generic counters
Listening IP addresses:
  192.168.88.242
  172.17.0.1
Connections:
office_to_mn:  %any...37.*.*.*  IKEv1/2, dpddelay=30s
office_to_mn:   local:  [84.*.*.*] uses pre-shared key authentication
office_to_mn:   remote: [37.*.*.*] uses pre-shared key authentication
office_to_mn:   child:  192.168.88.0/24 === 192.168.1.0/24 TUNNEL, dpdaction=restart
Security Associations (1 up, 0 connecting):
office_to_mn[1]: ESTABLISHED 5 minutes ago, 192.168.88.242[84.*.*.*]...37.*.*.*[37.*.*.*]
office_to_mn[1]: IKEv2 SPIs: cb9986115b17c556_i* a4bbcea67e834fac_r, pre-shared key reauthentication in 29 minutes
office_to_mn[1]: IKE proposal: AES_CBC_256/HMAC_SHA2_256_128/PRF_HMAC_SHA2_256/MODP_1024
office_to_mn{1}:  INSTALLED, TUNNEL, reqid 1, ESP in UDP SPIs: cbfe3e39_i c1f2f82a_o
office_to_mn{1}:  AES_CBC_256/HMAC_SHA2_256_128, 0 bytes_i, 0 bytes_o, rekeying in 7 hours
office_to_mn{1}:   192.168.88.0/24 === 192.168.1.0/24
```
```
$ ip route show table 220
192.168.1.0/24 via 192.168.88.1 dev enp0s3 proto static src 192.168.88.242
```
2. **Server B**
```
$ ipsec status
Security Associations (1 up, 1 connecting):
mn-to-office[2]: ESTABLISHED 4 seconds ago, 192.168.1.21[37.*.*.*]...84.*.*.*[84.*.*.*]
mn-to-office{1}:  INSTALLED, TUNNEL, reqid 1, 
ESP in UDP SPIs: c39ba028_i c72d5237_o
mn-to-office{1}:   192.168.1.0/24 === 192.168.88.0/24
mn-to-office[1]: CONNECTING, 192.168.1.21[%any]...84.*.*.*[%any]
```
```
$ cat /etc/ipsec.conf
config setup
    charondebug="all"
    uniqueids=yes
    strictcrlpolicy=no

conn mn-to-office
    authby=secret
    left=%defaultroute
    leftid=37.*.*.*
    leftsubnet=192.168.1.0/24
    right=84.*.*.*
    rightsubnet=192.168.88.0/24
    ike=aes256-sha2_256-modp1024!
    esp=aes256-sha2_256!
    keyingtries=0
    ikelifetime=1h
    lifetime=8h
    dpddelay=30
    dpdtimeout=120
    dpdaction=restart
    auto=start
```
```
$ ipsec statusall
Status of IKE charon daemon (strongSwan 5.8.2, Linux 5.4.0-39-generic, x86_64):
  uptime: 8 minutes, since Nov 22 09:26:59 2021     
  malloc: sbrk 1454080, mmap 0, used 468784, free 985296
  worker threads: 11 of 16 idle, 5/0/0/0 working, job queue: 0/0/0/0, scheduled: 5
  loaded plugins: charon aes rc2 sha2 sha1 md5 mgf1 
random nonce x509 revocation constraints pubkey pkcs1 pkcs7 pkcs8 pkcs12 pgp dnskey sshkey pem fips-prf 
gmp xcbc hmac drbg attr kernel-netlink resolve socket-default stroke updown counters
Listening IP addresses:
  192.168.1.21
Connections:
mn-to-office:  %any...84.*.*.*  IKEv1/2, dpddelay=30s
mn-to-office:   local:  [37.*.*.*] uses 
pre-shared key authentication
mn-to-office:   remote: [84.*.*.*] uses pre-shared key authentication
mn-to-office:   child:  192.168.1.0/24 === 192.168.88.0/24 TUNNEL, dpdaction=restart
Security Associations (1 up, 1 connecting):
mn-to-office[2]: ESTABLISHED 7 minutes ago, 192.168.1.21[37.*.*.*]...84.*.*.*[84.*.*.*]
mn-to-office[2]: IKEv2 SPIs: cb9986115b17c556_i a4bbcea67e834fac_r*, pre-shared key reauthentication in 36 minutes
mn-to-office[2]: IKE proposal: AES_CBC_256/HMAC_SHA2_256_128/PRF_HMAC_SHA2_256/MODP_1024
mn-to-office{1}:  INSTALLED, TUNNEL, reqid 1, ESP in UDP SPIs: c1f2f82a_i cbfe3e39_o
mn-to-office{1}:  AES_CBC_256/HMAC_SHA2_256_128, 0 bytes_i, 0 bytes_o, rekeying in 7 hours        
mn-to-office{1}:   192.168.1.0/24 === 192.168.88.0/24
mn-to-office[1]: CONNECTING, 192.168.1.21[%any]...84.*.*.*[%any]
mn-to-office[1]: IKEv2 SPIs: a39ff8ddec0735ff_i* 0000000000000000_r
mn-to-office[1]: Tasks active: IKE_VENDOR IKE_INIT IKE_NATD IKE_CERT_PRE IKE_AUTH IKE_CERT_POST IKE_CONFIG CHILD_CREATE IKE_AUTH_LIFETIME IKE_MOBIK
```
```
$ ip route show table 220
192.168.88.0/24 via 192.168.1.1 dev eth0 proto static src 192.168.1.21
```
And `iptables` rules in **Server A** 
```
sudo iptables -t nat -A POSTROUTING -s 192.168.1.0/24 -d 192.168.88.0/24 -j MASQUERADE
```
And `iptables` rules in **Server B** 
```
sudo iptables -t nat -A POSTROUTING -s 192.168.88.0/24 -d 192.168.1.0/24 -j MASQUERADE
```
and I set a static route on each client in both side
in **LAN A**
```
sudo ip r add 192.168.1.0/24 via 192.168.88.242
```
in **LAN B**
```
sudo ip r add 192.168.88.0/24 via 192.168.1.21
```
The problem is any clients in **LAN A** can ping any clients in **LAN B** but clients in **LAN B** cannot ping the other side. for example client with `192.168.88.248` can ping client with `192.168.1.16` but the opposite is not possible.
The process of passing packets when `192.168.1.16` ping `192.168.88.248` through machines is as follows:
- **Machine 192.168.1.21**
```
$ tcpdump icmp
09:53:06.882610 IP 192.168.1.16 > 192.168.88.248: ICMP echo request, id 44, seq 1, length 64
09:53:06.922419 IP 192.168.88.248 > 192.168.1.16: ICMP echo reply, id 44, seq 1, length 64
09:53:06.922522 IP 192.168.88.248 > 192.168.1.16: ICMP echo reply, id 44, seq 1, length 64
```
- **Machine 192.168.88.248**
```
$ tcpdump icmp
09:54:07.388136 IP 192.168.1.16 > 192.168.88.248: ICMP echo request, id 45, seq 1, length 64
09:54:07.388400 IP 192.168.88.242 > 192.168.88.248: ICMP echo request, id 45, seq 1, length 64
09:54:07.415685 IP 192.168.88.248 > 192.168.88.242: ICMP echo reply, id 45, seq 1, length 64
```

**Comment by tobiasbrunner** [comment]
What's the purpose of these NAT rules if you set up the routing and the traffic selectors correctly to route traffic between the two subnets directly?

**Reply by mehdi-sh-hm** [reply]
Two edge servers can communicate with each other without ***nat*** rules, for example `192.168.1.21` can ping `192.168.88.242` and vice versa (maybe because of policy), But when any of this edge server (for example **Server B**) wants to ping any client behind the other edge (for example **LAN A**), without ***nat*** rules no reply coming back for ping. I'm very confused :confused:. This has been done in some [references](https://sysadmins.co.za/setup-a-site-to-site-ipsec-vpn-with-strongswan-on-ubuntu/).

**Reply by tobiasbrunner** [reply]
Using NAT in a regular site-to-site scenario is not necessary and will only complicate things, so I'd definitely try to avoid it. Make sure forwarding is enabled and the firewall rules allow the traffic to pass (also see [ForwardingAndSplitTunneling](https://wiki.strongswan.org/projects/strongswan/wiki/ForwardingAndSplitTunneling)).

**Reply by mehdi-sh-hm** [reply]
I have read this [link](https://wiki.strongswan.org/projects/strongswan/wiki/ForwardingAndSplitTunneling) before and setting up kernel parameters such as `net.ipv4.ip_forward` and `net.ipv4.conf.all.send_redirects` properly, And I even looked at the `mtu` issue and applied the `iptables` rules associated with that based on our environment, but none of them helped.


IKEv2Examples
-
<p align="center">
  <img style="margin-left: 50px" src="https://www.strongswan.org/testing/testresults/images/a-m-w-s-b.png"/>
</p>

If you consider that famous scenario, in our environment Without **nat** rules :
- **moon** sees _just_ the **sun** (in **moon** `ping 10.2.0.1` working)
- **sun** sees _just_ the **moon** (in **sun** `ping 10.1.0.1` working)
- so **alice** and **bob** cannot ping each other

and with **nat** rules:

- **moon** sees the **sun** and **bob**  (in **moon** `ping 10.2.0.1` and `ping 10.2.0.10` working)
- **sun** sees the **moon** and **alice** (in **sun** `ping 10.1.0.1` and `ping 10.1.0.10` working)
- **BUT** **alice** and **bob** cannot ping each other still

You said not to use nat, but then how can I solve this issue?
Thank you for your help :pray:

**Reply by tobiasbrunner** [reply]
Well, debug what happens (e.g. check counters on firewall rules, capture traffic on hosts to see where packets go, how their addresses look, if routes and local firewall rules match etc.). It does sounds like a routing/firewall issue.
