### DISCUSSION TITLE
Traffic not bein routed through the VPN with table 220 not being populated

### DISCUSSION THREAD

**Discussion by juasiepo** [strongswan/strongswan#2389] [General]
I am trying to connect using strongswan to a Palo Alto device. I am using https://www.strongswan.org/testing/testresults/ikev2/net2net-psk/ as a template

I can establish the tunnel but I am not able to send traffic to it.

I think the problem is that table 220 is no being populated properly
**ip route list table 220**
```
Error: ipv4: FIB table does not exist.
Dump terminated`
```

Local and Remote have a public IP and there is no NAT involved
Local: A.A.A.A
Remote: B.B.B.B

**swanctl -l**
```
PaloAlto: #2, ESTABLISHED, IKEv2, 99e4d62a62c3ec1d_i 92f59b0e571dcc7e_r*
  local  'A.A.A.A' @ A.A.A.A[500]
  remote 'B.B.B.B' @ B.B.B.B[500]
  AES_CBC-256/HMAC_SHA2_512_256/PRF_HMAC_SHA2_512/ECP_384
  established 388s ago, rekeying in 12677s
  vpn: #2, reqid 2, INSTALLED, TUNNEL, ESP:AES_CBC-256/HMAC_SHA2_512_256
    installed 388s ago, rekeying in 3014s, expires in 3572s
    in  cfccc861 (-|0x0000012d),      0 bytes,     0 packets
    out f203bb33 (-|0x0000012d),      0 bytes,     0 packets
    local  10.32.53.10/32
    remote 172.21.95.101/32
EXMAR: #1, ESTABLISHED, IKEv2, 32b4cd680e159765_i* c4699aea084f471f_r
  local  'A.A.A.A' @ A.A.A.A[500]
  remote 'B.B.B.B' @ B.B.B.B[500]
  AES_CBC-256/HMAC_SHA2_512_256/PRF_HMAC_SHA2_512/ECP_384
  established 399s ago, rekeying in 13241s
  vpn: #1, reqid 1, INSTALLED, TUNNEL, ESP:AES_CBC-256/HMAC_SHA2_512_256
    installed 399s ago, rekeying in 2874s, expires in 3561s
    in  c6d55cad (-|0x0000012d),      0 bytes,     0 packets
    out e994c58c (-|0x0000012d),      0 bytes,     0 packets
    local  10.32.53.10/32
    remote 172.21.95.100/32
```

**swanctl.conf**

```
connections {
    PaloAlto {
        version = 2
        local_addrs = A.A.A.A
        remote_addrs = B.B.B.B
        proposals = aes256-sha512-ecp384
        keyingtries = 0
        dpd_delay = 30s
        local {
            auth = psk
            id = A.A.A.A
        }
        remote {
            auth = psk
            id = B.B.B.B
        }
        children {
            vpn {
                mode = tunnel
                local_ts = 10.32.53.10/24
                remote_ts = 172.21.95.0/24
                dpd_action = start
                start_action = start
                esp_proposals = aes256-sha512-ecp384
                updown = /usr/lib/ipsec/_updown iptables
                if_id_in = 301
                if_id_out = 301                                                                                                                                                                                                             
            }
        }
    }
}
secrets {
    ike-2 {
        id-1 = A.A.A.A
        id-2 = B.B.B.B
        secret = XXXXXXXXXXXXXXXXXXXXXXXXX
    }
}
```

**iptables -L**
```
Chain INPUT (policy ACCEPT)                                                                                                                                                                                                                 target     prot opt source               destination

Chain FORWARD (policy ACCEPT)
target     prot opt source               destination
ACCEPT     all  --  172.21.95.101        10.32.53.10          policy match dir in pol ipsec reqid 2 proto esp
ACCEPT     all  --  10.32.53.10          172.21.95.101        policy match dir out pol ipsec reqid 2 proto esp                                                                                                                              ACCEPT     all  --  172.21.95.100        10.32.53.10          policy match dir in pol ipsec reqid 1 proto esp
ACCEPT     all  --  10.32.53.10          172.21.95.100        policy match dir out pol ipsec reqid 1 proto esp

Chain OUTPUT (policy ACCEPT)
target     prot opt source               destination
``````

**tcpdump**

```
tcpdump: verbose output suppressed, use -v[v]... for full protocol decode
listening on any, link-type LINUX_SLL2 (Linux cooked v2), snapshot length 262144 bytes
11:10:39.007599 ens3  In  IP B.B.B.B.isakmp > A.A.A.A.isakmp: isakmp: child_sa  inf2
11:10:39.007599 ens3  In  IP B.B.B.B.isakmp > A.A.A.A.isakmp: isakmp: child_sa  inf2[I]
11:10:39.009946 ens3  Out IP A.A.A.A.isakmp > B.B.B.B.isakmp: isakmp: child_sa  inf2[IR]
11:10:39.009980 ens3  Out IP A.A.A.A.isakmp > B.B.B.B.isakmp: isakmp: child_sa  inf2[R]
11:10:44.007540 ens3  In  IP B.B.B.B.isakmp > A.A.A.A.isakmp: isakmp: child_sa  inf2
11:10:44.007541 ens3  In  IP B.B.B.B.isakmp > A.A.A.A.isakmp: isakmp: child_sa  inf2[I]
11:10:44.009098 ens3  Out IP A.A.A.A.isakmp > B.B.B.B.isakmp: isakmp: child_sa  inf2[IR]
11:10:44.009121 ens3  Out IP A.A.A.A.isakmp > B.B.B.B.isakmp: isakmp: child_sa  inf2[R]
```

**Comment by tobiasbrunner** [comment]
> if_id_in = 301
> if_id_out = 301

You configured interface IDs. Was that on purpose? Either way, please refer to [the docs](https://docs.strongswan.org/docs/5.9/features/routeBasedVpn.html#_configuration_2).

**Reply by juasiepo** [reply]
Thanks for your time @tobiasbrunner 

It was a remaining configuration from and older test. I have removed it.

I have launched the following commands as explained in [the docs](https://docs.strongswan.org/docs/5.9/features/routeBasedVpn.html#_configuration_2)

ip tunnel add vti0 mode vti local A.A.A.A remote B.B.B.B  key 42
sysctl -w net.ipv4.conf.vti0.disable_policy=1
ip link set vti0 up
ip addr add 10.32.53.10/24 remote 10.32.53.0/24 dev vti0
ip route add 172.21.95.0/24 via 10.32.53.10 dev vti0

**ip -s tunnel show vti0** returns:
`vti0: ip/ip remote B.B.B.B local A.A.A.A ttl inherit key 42`

I have launched a ping  and a infinite curl  to inject some traffic
**ping 172.21.95.100**
while true; do curl -m 1 -v  https://172.21.95.100; done

and now I can see **only the outgoing** traffic in the VPN using tcpdump:

**tcpdump -i any host B.B.B.B**
```
tcpdump: data link type LINUX_SLL2
tcpdump: verbose output suppressed, use -v[v]... for full protocol decode
listening on any, link-type LINUX_SLL2 (Linux cooked v2), snapshot length 262144 bytes
13:31:14.015572 ens3  In  IP B.B.B.B.isakmp > A.A.A.A.isakmp: isakmp: child_sa  inf2
13:31:14.016832 ens3  Out IP A.A.A.A.isakmp > B.B.B.B.isakmp: isakmp: child_sa  inf2[IR]
13:31:14.876828 ens3  Out IP A.A.A.A > B.B.B.B: ESP(spi=0xf9db5c35,seq=0x1), length 152
13:31:15.863727 ens3  Out IP A.A.A.A > B.B.B.B: ESP(spi=0xf9db5c35,seq=0x2), length 120
13:31:15.891072 ens3  Out IP A.A.A.A > B.B.B.B: ESP(spi=0xf9db5c35,seq=0x3), length 152
13:31:16.878055 ens3  Out IP A.A.A.A > B.B.B.B: ESP(spi=0xf9db5c35,seq=0x4), length 120
13:31:16.915108 ens3  Out IP A.A.A.A > B.B.B.B: ESP(spi=0xf9db5c35,seq=0x5), length 152
13:31:17.896286 ens3  Out IP A.A.A.A > B.B.B.B: ESP(spi=0xf9db5c35,seq=0x6), length 120
13:31:17.939056 ens3  Out IP A.A.A.A > B.B.B.B: ESP(spi=0xf9db5c35,seq=0x7), length 152
13:31:18.912572 ens3  Out IP A.A.A.A > B.B.B.B: ESP(spi=0xf9db5c35,seq=0x8), length 120
13:31:18.963089 ens3  Out IP A.A.A.A > B.B.B.B: ESP(spi=0xf9db5c35,seq=0x9), length 152
13:31:19.015633 ens3  In  IP B.B.B.B.isakmp > A.A.A.A.isakmp: isakmp: child_sa  inf2
13:31:19.017271 ens3  Out IP A.A.A.A.isakmp > B.B.B.B.isakmp: isakmp: child_sa  inf2[IR]
13:31:19.926748 ens3  Out IP A.A.A.A > B.B.B.B: ESP(spi=0xf9db5c35,seq=0xa), length 120
13:31:19.987111 ens3  Out IP A.A.A.A > B.B.B.B: ESP(spi=0xf9db5c35,seq=0xb), length 152
13:31:20.943953 ens3  Out IP A.A.A.A > B.B.B.B: ESP(spi=0xf9db5c35,seq=0xc), length 120
13:31:21.011104 ens3  Out IP A.A.A.A > B.B.B.B: ESP(spi=0xf9db5c35,seq=0xd), length 152
13:31:21.960768 ens3  Out IP A.A.A.A > B.B.B.B: ESP(spi=0xf9db5c35,seq=0xe), length 120
13:31:22.035075 ens3  Out IP A.A.A.A > B.B.B.B: ESP(spi=0xf9db5c35,seq=0xf), length 152
13:31:22.977277 ens3  Out IP A.A.A.A > B.B.B.B: ESP(spi=0xf9db5c35,seq=0x10), length 120
13:31:23.059067 ens3  Out IP A.A.A.A > B.B.B.B: ESP(spi=0xf9db5c35,seq=0x11), length 152
13:31:23.995628 ens3  Out IP A.A.A.A > B.B.B.B: ESP(spi=0xf9db5c35,seq=0x12), length 120
13:31:24.015606 ens3  In  IP B.B.B.B.isakmp > A.A.A.A.isakmp: isakmp: child_sa  inf2
13:31:24.017248 ens3  Out IP A.A.A.A.isakmp > B.B.B.B.isakmp: isakmp: child_sa  inf2[IR]
13:31:24.083103 ens3  Out IP A.A.A.A > B.B.B.B: ESP(spi=0xf9db5c35,seq=0x13), length 152
13:31:25.012063 ens3  Out IP A.A.A.A > B.B.B.B: ESP(spi=0xf9db5c35,seq=0x14), length 120
13:31:25.107161 ens3  Out IP A.A.A.A > B.B.B.B: ESP(spi=0xf9db5c35,seq=0x15), length 152
13:31:26.036346 ens3  Out IP A.A.A.A > B.B.B.B: ESP(spi=0xf9db5c35,seq=0x16), length 120
13:31:26.131142 ens3  Out IP A.A.A.A > B.B.B.B: ESP(spi=0xf9db5c35,seq=0x17), length 152
13:31:27.053939 ens3  Out IP A.A.A.A > B.B.B.B: ESP(spi=0xf9db5c35,seq=0x18), length 120
13:31:27.155096 ens3  Out IP A.A.A.A > B.B.B.B: ESP(spi=0xf9db5c35,seq=0x19), length 152
13:31:28.068791 ens3  Out IP A.A.A.A > B.B.B.B: ESP(spi=0xf9db5c35,seq=0x1a), length 120
13:31:28.179158 ens3  Out IP A.A.A.A > B.B.B.B: ESP(spi=0xf9db5c35,seq=0x1b), length 152
13:31:29.015576 ens3  In  IP B.B.B.B.isakmp > A.A.A.A.isakmp: isakmp: child_sa  inf2
13:31:29.016733 ens3  Out IP A.A.A.A.isakmp > B.B.B.B.isakmp: isakmp: child_sa  inf2[IR]
13:31:29.089506 ens3  Out IP A.A.A.A > B.B.B.B: ESP(spi=0xf9db5c35,seq=0x1c), length 120
13:31:29.203166 ens3  Out IP A.A.A.A > B.B.B.B: ESP(spi=0xf9db5c35,seq=0x1d), length 152
```

I have already been in this situation using ipsec.conf approach and now I am here using the swanctl.conf

There is nothing coming out from the tunnel. I think I am almost there but there is a missing piece in the puzzle.

the swanctl -l shows the out packages properly but no the incoming ones:
    out f9db5c35 (0x0000002a),  21036 bytes,   **293 packets**,     1s ago

**swanctl -l**
```

PaloAlto: #1, ESTABLISHED, IKEv2, e555332036e90604_i* 58b794f39826427e_r
  local  'A.A.A.A' @ A.A.A.A[500]
  remote 'B.B.B.B' @ B.B.B.B[500]
  AES_CBC-256/HMAC_SHA2_512_256/PRF_HMAC_SHA2_512/ECP_384
  established 158s ago, rekeying in 14236s
  vpn: #2, reqid 1, INSTALLED, TUNNEL, ESP:AES_CBC-256/HMAC_SHA2_512_256/ECP_384
    installed 153s ago, rekeying in 3185s, expires in 3807s
    in  c2e91e4a (0x0000002a),      0 bytes,     0 packets
    out f9db5c35 (0x0000002a),  21036 bytes,   **293 packets**,     1s ago
    local  10.32.53.10/32
    remote 172.21.95.100/32
  vpn: #3, reqid 2, INSTALLED, TUNNEL, ESP:AES_CBC-256/HMAC_SHA2_512_256/ECP_384
    installed 153s ago, rekeying in 3246s, expires in 3807s
    in  c37c9b0c (0x0000002a),      0 bytes,     0 packets
    out ffc3d6d0 (0x0000002a),      0 bytes,     0 packets
    local  10.32.53.10/32
    remote 172.21.95.101/32
```

**Reply by tobiasbrunner** [reply]
If you want to use route-based VPNs, then use XFRM interfaces, not VTIs. Anyway, there is apparently traffic in one direction but not the other (there is also a duplicate CHILD_SA, which might or might not be an issue).

**Comment by juasiepo** [comment]
Thanks for your time @tobiasbrunner :) I have done as you said and used XFRM  interfaces instead.

The [docs](https://docs.strongswan.org/docs/5.9/features/routeBasedVpn.html#_xfrm_interfaces_on_linux) says to configure the interface using the following commands

/usr/lib/ipsec/xfrmi --name ipsec0 --id 42 --dev ens3
ip link set ipsec0 up
ip route add 172.21.95.0/24 dev ipsec0

All the **ping 172.21.95.100** are marked as errors

**ip -s link show ipsec0**
```
3: ipsec0@ens3: <NOARP,UP,LOWER_UP> mtu 1500 qdisc noqueue state UNKNOWN mode DEFAULT group default qlen 1000
    link/none
    RX:  bytes packets errors dropped  missed   mcast
             0       0      0       0       0       0
    TX:  bytes packets errors dropped carrier collsns
             0       0    636     636     636       0
```
I think the problem as route is not properly set as the source is the public A.A.A.A IP address

**ip r get  172.21.95.100**
`172.21.95.100 dev ipsec0 src A.A.A.A uid 0`

As per my understanding it should be the internal private address 10.32.53.10/24 but I haven't seen how to manage this

**Reply by tobiasbrunner** [reply]
You can set a preferred source address when installing the route via `src x.x.x.x`.

**Comment by juasiepo** [comment]
Thanks for your time @tobiasbrunner 

The src paramenter doesn't work and is not mentioned in the [docs for the XFRM option](https://docs.strongswan.org/docs/5.9/features/routeBasedVpn.html#_xfrm_interfaces_on_linux)
```
ip route add 172.21.95.0/24 src 10.32.53.10 dev ipsec0
Error: Invalid prefsrc address.
```
AFAIK the error makes sense as the IP doesn't belong to any of the devices. with the **vti** approach there is a interface with the desired IP but with the **XFRM** i don't have any.

**ip a**
```
1: lo: <LOOPBACK,UP,LOWER_UP> mtu 65536 qdisc noqueue state UNKNOWN group default qlen 1000
    link/loopback 00:00:00:00:00:00 brd 00:00:00:00:00:00
    inet 127.0.0.1/8 scope host lo
       valid_lft forever preferred_lft forever
    inet6 ::1/128 scope host noprefixroute
       valid_lft forever preferred_lft forever
2: ens3: <BROADCAST,MULTICAST,UP,LOWER_UP> mtu 1500 qdisc fq_codel state UP group default qlen 1000
    link/ether fa:16:3e:4d:25:32 brd ff:ff:ff:ff:ff:ff
    altname enp0s3
    inet A.A.A.A/32 metric 100 scope global dynamic ens3
       valid_lft 72073sec preferred_lft 72073sec
    inet6 fe80::f816:3eff:fe4d:2532/64 scope link
       valid_lft forever preferred_lft forever
3: ipsec0@ens3: <NOARP,UP,LOWER_UP> mtu 1500 qdisc noqueue state UNKNOWN group default qlen 1000
    link/none
    inet6 fe80::375a:b4b:d1a4:6b6/64 scope link stable-privacy
       valid_lft forever preferred_lft forever
```
I wonder if this routing problem should be manage with iptables masquerading instead.

**Reply by tobiasbrunner** [reply]
> The src paramenter doesn't work and is not mentioned in the [docs for the XFRM option](https://docs.strongswan.org/docs/5.9/features/routeBasedVpn.html#_xfrm_interfaces_on_linux)

Well, not everything is simple copy-n-paste ;)



> AFAIK the error makes sense as the IP doesn't belong to any of the devices. with the **vti** approach there is a interface with the desired IP but with the **XFRM** i don't have any.

Well, yes, you obviously can't use an IP address as preferred source if it's not installed on **any** local interface (doesn't matter on which). It won't just automatically appear on a VTI device either. So just add it to one of the interfaces (if you install it as only IP on the XFRM interface, you won't need to use the IP in the route either as the kernel should select that IP automatically, although it won't hurt).



> I wonder if this routing problem should be manage with iptables masquerading instead.

Could be an option depending on the use case.

**Comment by juasiepo** [comment]
Thanks for your time @tobiasbrunner 

As you explained I have added the local ip to the XFRM interface
```
ip addr add 10.32.53.10/24 dev ipsec0
```

```
3: ipsec0@ens3: <NOARP,UP,LOWER_UP> mtu 1500 qdisc noqueue state UNKNOWN group default qlen 1000
    link/none
    inet 10.32.53.10/24 scope global ipsec0
       valid_lft forever preferred_lft forever
    inet6 fe80::375a:b4b:d1a4:6b6/64 scope link stable-privacy
       valid_lft forever preferred_lft forever
```
and have added the route too
```
ip route add 172.21.95.0/24 src 10.32.53.10 dev ipsec0
```

Now I am in the same case that in the VTI approach I can send traffic through the tunnel but I am not receiving anything.
```
tcpdump: data link type LINUX_SLL2
tcpdump: verbose output suppressed, use -v[v]... for full protocol decode
listening on any, link-type LINUX_SLL2 (Linux cooked v2), snapshot length 262144 bytes
06:58:06.202200 ens3  Out IP A.A.A.A > B.B.B.B: ESP(spi=0xdb4dd04f,seq=0x2d), length 120
06:58:06.978706 ens3  Out IP A.A.A.A > B.B.B.B: ESP(spi=0xdb4dd04f,seq=0x2e), length 152
06:58:07.202696 ens3  Out IP A.A.A.A > B.B.B.B: ESP(spi=0xdb4dd04f,seq=0x2f), length 120
06:58:07.218516 ens3  Out IP A.A.A.A > B.B.B.B: ESP(spi=0xdb4dd04f,seq=0x30), length 120
06:58:08.002768 ens3  Out IP A.A.A.A > B.B.B.B: ESP(spi=0xdb4dd04f,seq=0x31), length 152
06:58:08.235410 ens3  Out IP A.A.A.A > B.B.B.B: ESP(spi=0xdb4dd04f,seq=0x32), length 120
06:58:09.021118 ens3  In  IP B.B.B.B.isakmp > A.A.A.A.isakmp: isakmp: child_sa  inf2
06:58:09.022302 ens3  Out IP A.A.A.A.isakmp > B.B.B.B.isakmp: isakmp: child_sa  inf2[IR]
06:58:09.026700 ens3  Out IP A.A.A.A > B.B.B.B: ESP(spi=0xdb4dd04f,seq=0x33), length 152
06:58:09.252516 ens3  Out IP A.A.A.A > B.B.B.B: ESP(spi=0xdb4dd04f,seq=0x34), length 120
06:58:10.050692 ens3  Out IP A.A.A.A > B.B.B.B: ESP(spi=0xdb4dd04f,seq=0x35), length 152
06:58:10.267944 ens3  Out IP A.A.A.A > B.B.B.B: ESP(spi=0xdb4dd04f,seq=0x36), length 120
06:58:11.074720 ens3  Out IP A.A.A.A > B.B.B.B: ESP(spi=0xdb4dd04f,seq=0x37), length 152
```

I wonder if there a missing IPTABLES rule 

iptables -L
```
# Warning: iptables-legacy tables present, use iptables-legacy to see them
Chain INPUT (policy ACCEPT)
target     prot opt source               destination

Chain FORWARD (policy ACCEPT)
target     prot opt source               destination
ACCEPT     all  --  172.21.95.101        A.A.A.A         policy match dir in pol ipsec reqid 2 proto esp
ACCEPT     all  --  A.A.A.A         172.21.95.101        policy match dir out pol ipsec reqid 2 proto esp
ACCEPT     all  --  172.21.95.100        A.A.A.A         policy match dir in pol ipsec reqid 1 proto esp
ACCEPT     all  --  A.A.A.A         172.21.95.100        policy match dir out pol ipsec reqid 1 proto esp

Chain OUTPUT (policy ACCEPT)
target     prot opt source               destination

Chain f2b-sshd (0 references)
target     prot opt source               destination
```

**Reply by tobiasbrunner** [reply]
There are no inbound ESP packets, so it's most likely a problem at the other end.

**Reply by juasiepo** [reply]
Thanks for your time @tobiasbrunner

I will double check with the other side's administrators
