### DISCUSSION TITLE
Got "mediation with the same peer is already in progress, queued" and the queued SA are never finished

### DISCUSSION THREAD

**Discussion by bluven** [strongswan/strongswan#1584] [Q&A] [answered]
I was trying out the mediation plugin and my enviroment are composed of 3 machines and 2 containers:

- connector: 10.22.46.20, also used as mediation server.
- host-edge1: 10.22.46.57, which has an container edge1
- edge1: 172.17.0.2 (a container to mock NAT network)
- host-edge2: 10.40.20.181, which has an container edge2
- edge2: 192.168.0.3 (a container to mock NAT network)

Edge1 and edge2 is supposed to make connections via connector,  I got queued SAs when I initiated SA as following steps:

1. Execute "docker exec strongswan swanctl --initiate --child=edge1 --timeout=10" on edge2 (mediator connection is not initiated):
```
docker exec strongswan swanctl --initiate --child=edge1 --timeout=10
[IKE] initiating mediation connection
initiate failed: CHILD_SA 'edge1' not established after 10000ms
```

2. Execute "docker exec strongswan swanctl --initiate --child=edge2 --timeout=10" on edge1 (mediator connection is not initiated)
```
docker exec strongswan swanctl --initiate --child=edge2 --timeout=10
[IKE] initiating mediation connection
initiate failed: CHILD_SA 'edge2' not established after 10000ms
```

3. Execute "docker exec strongswan swanctl --initiate --child=edge1 --timeout=10" on edge2 again:
```
docker exec strongswan swanctl --initiate --child=edge1 --timeout=10
[IKE] initiating mediation connection
initiate failed: CHILD_SA 'edge1' not established after 10000ms
[IKE] mediation with the same peer is already in progress, queued
```

The output of "swanctl --list-sa" of edge1
edge1:
```
docker exec strongswan swanctl --list-sa
mediator: #2, ESTABLISHED, IKEv2, 23d20a8eff29eec8_i* fcb785124df37009_r
  local  'edge1' @ 172.17.0.2[4500]
  remote 'C=CH, O=strongswan, CN=connector.strongswan.org' @ 10.22.46.20[4500]
  AES_CBC-128/HMAC_SHA2_256_128/PRF_HMAC_SHA2_256/CURVE_25519
  established 859s ago, rekeying in 12600s
edge2: #1, CREATED, IKEv2, c3b2508238af75bb_i* 0000000000000000_r
  local  '%any' @ %any[500]
  remote '%any' @ %any[500]
  queued:  IKE_VENDOR IKE_INIT IKE_NATD IKE_CERT_PRE IKE_AUTH IKE_CERT_POST IKE_CONFIG IKE_AUTH_LIFETIME IKE_MOBIKE IKE_ESTABLISH IKE_ME CHILD_CREATE
```
and edge2: 
```
docker exec strongswan swanctl --list-sa
mediator: #2, ESTABLISHED, IKEv2, 9d23af81253af441_i* ee18879fd2a3f8cb_r
  local  'edge2' @ 192.168.0.3[4500]
  remote 'C=CH, O=strongswan, CN=connector.strongswan.org' @ 10.22.46.20[4500]
  AES_CBC-128/HMAC_SHA2_256_128/PRF_HMAC_SHA2_256/CURVE_25519
  established 478s ago, rekeying in 12538s
edge1: #1, CREATED, IKEv2, 437b8aaa70bf734b_i* 0000000000000000_r
  local  '%any' @ %any[500]
  remote '%any' @ %any[500]
  queued:  IKE_VENDOR IKE_INIT IKE_NATD IKE_CERT_PRE IKE_AUTH IKE_CERT_POST IKE_CONFIG IKE_AUTH_LIFETIME IKE_MOBIKE IKE_ESTABLISH IKE_ME CHILD_CREATE CHILD_CREATE
```

As you can see, the SA edge1 of edge2 was queued and was never finished, even I delete the SA and reinitiated it, it still won't succeed:
```
docker exec strongswan swanctl --terminate --ike=edge1
[IKE] deleting unestablished IKE_SA
terminate completed successfully

➜  edge2 docker exec strongswan swanctl --initiate --child=edge1 --timeout=10
[IKE] initiating mediation connection
initiate failed: CHILD_SA 'edge1' not established after 10000ms

docker exec strongswan swanctl --list-sa                            
edge1: #3, CREATED, IKEv2, d0f6ac0660753247_i* 0000000000000000_r
  local  '%any' @ %any[500]
  remote '%any' @ %any[500]
  queued:  IKE_VENDOR IKE_INIT IKE_NATD IKE_CERT_PRE IKE_AUTH IKE_CERT_POST IKE_CONFIG IKE_AUTH_LIFETIME IKE_MOBIKE IKE_ESTABLISH IKE_ME CHILD_CREATE
mediator: #2, ESTABLISHED, IKEv2, 9d23af81253af441_i* ee18879fd2a3f8cb_r
  local  'edge2' @ 192.168.0.3[4500]
  remote 'C=CH, O=strongswan, CN=connector.strongswan.org' @ 10.22.46.20[4500]
  AES_CBC-128/HMAC_SHA2_256_128/PRF_HMAC_SHA2_256/CURVE_25519
  established 1464s ago, rekeying in 11552s
```

I googled and found an issue metioned the threads of strongswan might be exhausted, but the threads of edge1 and edge2 are idle:
```
docker exec strongswan swanctl --stats  
uptime: 26 minutes, since Mar 09 06:14:11 2023
worker threads: 16 total, 11 idle, working: 4/0/1/0
job queues: 0/0/0/0
jobs scheduled: 3
IKE_SAs: 2 total, 0 half-open
loaded plugins: charon aesni sha3 md4 mgf1 random nonce x509 revocation constraints pubkey pkcs1 pkcs7 pkcs12 pgp dnskey sshkey pem openssl pkcs8 fips-prf gmp curve25519 chapoly xcbc cmac kdf gcm ntru drbg newhope curl files sqlite attr kernel-netlink resolve socket-default farp stroke vici updown eap-identity eap-sim eap-aka eap-aka-3gpp2 eap-simaka-pseudonym eap-simaka-reauth eap-md5 eap-mschapv2 eap-dynamic eap-radius eap-tls xauth-generic xauth-eap dhcp unity counters
```
```
# edge2 
docker exec strongswan swanctl --stats  
uptime: 26 minutes, since Mar 09 06:14:11 2023
worker threads: 16 total, 11 idle, working: 4/0/1/0
job queues: 0/0/0/0
jobs scheduled: 3
IKE_SAs: 2 total, 0 half-open
loaded plugins: charon aesni sha3 md4 mgf1 random nonce x509 revocation constraints pubkey pkcs1 pkcs7 pkcs12 pgp dnskey sshkey pem openssl pkcs8 fips-prf gmp curve25519 chapoly xcbc cmac kdf gcm ntru drbg newhope curl files sqlite attr kernel-netlink resolve socket-default farp stroke vici updown eap-identity eap-sim eap-aka eap-aka-3gpp2 eap-simaka-pseudonym eap-simaka-reauth eap-md5 eap-mschapv2 eap-dynamic eap-radius eap-tls xauth-generic xauth-eap dhcp unity counters
```

Below are the connections config files:

connector:
```
connections {
    mediator {
        version = 2
        proposals = default
        #local_addrs = 10.22.46.20
        local_addrs = %any
        remote_addrs = %any
        mediation = yes

        local {
            auth = pubkey
            id = C=CH, O=strongswan, CN=connector.strongswan.org
            certs = /etc/ipsec.d/certs/connector.crt
        }
    }

    edge1 {
        version = 2 
        proposals = default

        local {
            auth = pubkey
            id = C=CH, O=strongswan, CN=connector.strongswan.org
            certs = /etc/ipsec.d/certs/connector.crt
        }
    
        remote { 
            auth = pubkey
            id = C=CH, O=strongswan, CN=edge1.strongswan.org
        }
        
        children {
            edge1 {
                local_ts = 2.2.0.0/16
                remote_ts = 172.17.0.0/16
                esp_proposals = default
                #start_action = start
            }
        }
    }

    edge2 {
        version = 2 
        proposals = default

        local {
            auth = pubkey
            id = C=CH, O=strongswan, CN=connector.strongswan.org
            certs = /etc/ipsec.d/certs/connector.crt
        }
    
        remote { 
            auth = pubkey
            id = C=CH, O=strongswan, CN=edge2.strongswan.org
        }
        
        children {
            edge1 {
                local_ts = 2.2.0.0/16
                remote_ts = 192.168.0.0/16
                esp_proposals = default
                #start_action = start
            }
        }
    }
}
```

edge1: 
```
connections {
    mediator {
        version = 2
        proposals = default
        local_addrs = %any
        remote_addrs = 10.22.46.20
        mediation = yes

        local {
            auth = pubkey
            id = edge1
            certs = /etc/ipsec.d/certs/edge1.crt
        }

	remote {
	    auth = pubkey
	    id = C=CH, O=strongswan, CN=connector.strongswan.org
	}
    }

    edge2 {
	version = 2
	proposals = default
        mediated_by = mediator
        mediation_peer = edge2

        local {
	    auth = pubkey
            id = C=CH, O=strongswan, CN=edge1.strongswan.org
            certs = /etc/ipsec.d/certs/edge1.crt
        }

        remote {
            auth = pubkey
            id = C=CH, O=strongswan, CN=edge2.strongswan.org
        }

        children {
            edge2 {
                 remote_ts = 192.168.0.0/16
                 local_ts = 172.17.0.0/16
                 esp_proposals = default
            }
        }
    }

    connector {
        version = 2 
        proposals = default
        remote_addrs = 10.22.46.20

        local {
            auth = pubkey
            id = C=CH, O=strongswan, CN=edge1.strongswan.org
            certs = /etc/ipsec.d/certs/edge1.crt
        }

        remote {
            auth = pubkey
            id = C=CH, O=strongswan, CN=connector.strongswan.org
        }

        children {
            connector {
                local_ts = 172.17.0.0/16
                remote_ts = 2.2.0.0/16
                esp_proposals = default
                #start_action = start
            }   
        }   
    }   
}
```

edge2:
```
connections {
    mediator {
        version = 2
        proposals = default
        local_addrs = 192.168.0.3
        remote_addrs = 10.22.46.20
        mediation = yes

        local {
            auth = pubkey
            id = edge2
            certs = /etc/ipsec.d/certs/edge2.crt
        }

	    remote {
	        auth = pubkey
	        id = C=CH, O=strongswan, CN=connector.strongswan.org
	    }
    }

    edge1 {
		version = 2
		proposals = default
		mediated_by = mediator
                mediation_peer = edge1

		local {
			auth = pubkey
			id = C=CH, O=strongswan, CN=edge2.strongswan.org
                       certs = /etc/ipsec.d/certs/edge2.crt
		}

		remote {
			auth = pubkey
			id = C=CH, O=strongswan, CN=edge1.strongswan.org
		}

		children {
			edge1 {
				remote_ts = 172.17.0.0/16
				local_ts = 192.168.0.0/16
				esp_proposals = default
			}
		}
    }

    connector {
		version = 2
		proposals = default
                remote_addrs = 10.22.46.20

		local {
			auth = pubkey
			id = C=CH, O=strongswan, CN=edge2.strongswan.org
                       certs = /etc/ipsec.d/certs/edge2.crt
		}

		remote {
			auth = pubkey
			id = C=CH, O=strongswan, CN=connector.strongswan.org
		}

		children {
			connector {
				local_ts = 192.168.0.0/16
				remote_ts = 2.2.0.0/16
				esp_proposals = default
			}
		}
       }
}
```

And here is daemon log of them:
[connector.log](https://github.com/strongswan/strongswan/files/10928492/connector.log)
[edge1.log](https://github.com/strongswan/strongswan/files/10928494/edge1.log)
[edge2.log](https://github.com/strongswan/strongswan/files/10928498/edge2.log)

The strongswan is 5.9.9 and I compiled it myself:
```
FROM alpine:3.15

ENV STRONGSWAN_RELEASE https://download.strongswan.org/strongswan.tar.bz2

RUN sed -i 's/dl-cdn.alpinelinux.org/mirrors.tuna.tsinghua.edu.cn/g' /etc/apk/repositories && \
    apk --update add build-base \
            ca-certificates \
            curl \
            curl-dev \
            gmp-dev \
            sqlite-dev \
            libunwind-dev \
            binutils \
            ip6tables \
            iproute2 \
            iptables-dev \
            openssl \
            openssl-dev && \
    mkdir -p /tmp/strongswan && \
    curl -Lo /tmp/strongswan.tar.bz2 $STRONGSWAN_RELEASE && \
    tar --strip-components=1 -C /tmp/strongswan -xjf /tmp/strongswan.tar.bz2 && \
    cd /tmp/strongswan && \
    ./configure --prefix=/usr \
            --sysconfdir=/etc \
            --libexecdir=/usr/lib \
            --with-ipsecdir=/usr/lib/strongswan \
            --enable-aesni \
            --enable-chapoly \
            --enable-cmd \
            --enable-curl \
            --enable-dhcp \
            --enable-eap-dynamic \
            --enable-eap-identity \
            --enable-eap-md5 \
            --enable-eap-mschapv2 \
            --enable-eap-radius \
            --enable-eap-tls \
            --enable-farp \
            --enable-files \
            --enable-gcm \
            --enable-md4 \
            --enable-newhope \
            --enable-ntru \
            --enable-openssl \
            --enable-sha3 \
            --enable-shared \
            --enable-gmp \
            --enable-eap-aka \
            --enable-eap-aka-3gpp2 \
            --enable-eap-sim \
            --enable-eap-simaka-pseudonym \
            --enable-eap-simaka-reauth \
            --enable-sqlite \
            --enable-unity \
            --enable-xauth-eap \
            --enable-xauth-generic \
            --enable-mediation \
            --enable-medsrv \
            --enable-unwind-backtraces \
            --disable-aes \
            --disable-des \
            --disable-hmac \
            --disable-ikev1 \
            --disable-md5 \
            --disable-rc2 \
            --disable-sha1 \
            --disable-sha2 \
            --disable-static && \
    make && \
    make install && \
    rm -rf /tmp/* && \
    apk del build-base curl-dev openssl-dev && \
    rm -rf /var/cache/apk/*

EXPOSE 500/udp \
       4500/udp

ENTRYPOINT ["/usr/sbin/ipsec"]
CMD ["start", "--nofork"]
```

Any help is welcome and thanks in advance.

**Comment by tobiasbrunner** [comment, marked as answer]
Note that the timeout you pass to `swanctl --initiate` has no effect on the actual initiation of the SAs. It only lets the vici command timeout so that `swanctl` returns. So when you later initiate again, the previous SA still exists and you'll see that error.

Can the edge1 and edge2 peers actually reach each other? That is, can `172.17.0.2` actually reach `192.168.0.3`? Or is there maybe a firewall that prevents that?

Note that with NATs on Linux, there could be issues if inbound packets to unknown ports are not rejected/dropped (either via default policy or explicit rule that does so) as that creates a conntrack state that can prevent successful hole punching (in our test scenario, the NAT routers _sun_ and _moon_ both have a `DROP` policy for `INPUT`).

**Reply by bluven** [reply]
@tobiasbrunner Thanks for your reply, really appreciate it.

> Can the edge1 and edge2 peers actually reach each other? That is, can 172.17.0.2 actually reach 192.168.0.3? Or is there maybe a firewall that prevents that?

Yes, in fact, If I initiate mediator SA on edge1 and edge2, then execute "swanctl --initiate --child=edge1" on edge2, it will succeed:
```
docker exec strongswan swanctl --initiate --child=edge1 
[IKE] initiating mediation connection
[IKE] initiating IKE_SA edge1[2] to 10.22.46.57
[ENC] generating IKE_SA_INIT request 0 [ SA KE No N(NATD_S_IP) N(NATD_D_IP) N(FRAG_SUP) N(HASH_ALG) N(REDIR_SUP) N(ME_CID) ]
[NET] sending packet: from 192.168.0.3[4500] to 10.22.46.57[4500] (1016 bytes)
[NET] received packet: from 10.22.46.57[4500] to 192.168.0.3[4500] (273 bytes)
[ENC] parsed IKE_SA_INIT response 0 [ SA KE No N(NATD_S_IP) N(NATD_D_IP) CERTREQ N(FRAG_SUP) N(HASH_ALG) N(CHDLESS_SUP) N(MULT_AUTH) ]
[CFG] selected proposal: IKE:AES_CBC_128/HMAC_SHA2_256_128/PRF_HMAC_SHA2_256/CURVE_25519
[IKE] local host is behind NAT, sending keep alives
[IKE] remote host is behind NAT
[IKE] received cert request for "C=CH, O=strongSwan, CN=strongSwan Root CA"
[IKE] sending cert request for "C=CH, O=strongSwan, CN=strongSwan Root CA"
[IKE] authentication of 'C=CH, O=strongswan, CN=edge2.strongswan.org' (myself) with ED25519 successful
[IKE] sending end entity cert "C=CH, O=strongswan, CN=edge2.strongswan.org"
[IKE] establishing CHILD_SA edge1{1}
[ENC] generating IKE_AUTH request 1 [ IDi CERT N(INIT_CONTACT) CERTREQ IDr AUTH SA TSi TSr N(MOBIKE_SUP) N(NO_ADD_ADDR) N(MULT_AUTH) N(EAP_ONLY) N(MSG_ID_SYN_SUP) ]
[NET] sending packet: from 192.168.0.3[4500] to 10.22.46.57[4500] (960 bytes)
[NET] received packet: from 10.22.46.57[4500] to 192.168.0.3[4500] (720 bytes)
[ENC] parsed IKE_AUTH response 1 [ IDr CERT AUTH SA TSi TSr N(MOBIKE_SUP) N(NO_ADD_ADDR) ]
[IKE] received end entity cert "C=CH, O=strongswan, CN=edge1.strongswan.org"
[CFG]   using certificate "C=CH, O=strongswan, CN=edge1.strongswan.org"
[CFG]   using trusted ca certificate "C=CH, O=strongSwan, CN=strongSwan Root CA"
[CFG]   reached self-signed root ca with a path length of 0
[CFG] checking certificate status of "C=CH, O=strongswan, CN=edge1.strongswan.org"
[CFG] certificate status is not available
[IKE] authentication of 'C=CH, O=strongswan, CN=edge1.strongswan.org' with ED25519 successful
[IKE] peer supports MOBIKE
[IKE] IKE_SA edge1[2] established between 192.168.0.3[C=CH, O=strongswan, CN=edge2.strongswan.org]...10.22.46.57[C=CH, O=strongswan, CN=edge1.strongswan.org]
[IKE] scheduling rekeying in 13358s
[IKE] maximum IKE_SA lifetime 14798s
[CFG] selected proposal: ESP:AES_CBC_128/HMAC_SHA2_256_128/NO_EXT_SEQ
[IKE] CHILD_SA edge1{1} established with SPIs c6c19391_i c535b971_o and TS 192.168.0.0/16 === 172.17.0.0/16
initiate completed successfully

docker exec strongswan swanctl --list-sa               
edge1: #2, ESTABLISHED, IKEv2, 9c4bc171a3b5c355_i* 773ba3d855aafa9f_r
  local  'C=CH, O=strongswan, CN=edge2.strongswan.org' @ 192.168.0.3[4500]
  remote 'C=CH, O=strongswan, CN=edge1.strongswan.org' @ 10.22.46.57[4500]
  AES_CBC-128/HMAC_SHA2_256_128/PRF_HMAC_SHA2_256/CURVE_25519
  established 278s ago, rekeying in 13080s
  edge1: #1, reqid 1, INSTALLED, TUNNEL-in-UDP, ESP:AES_CBC-128/HMAC_SHA2_256_128
    installed 278s ago, rekeying in 3027s, expires in 3682s
    in  c6c19391,      0 bytes,     0 packets
    out c535b971,      0 bytes,     0 packets
    local  192.168.0.0/16
    remote 172.17.0.0/16
mediator: #1, ESTABLISHED, IKEv2, 727f9c39d3c3aa33_i* 917f159b06f6e99f_r
  local  'edge2' @ 192.168.0.3[4500]
  remote 'C=CH, O=strongswan, CN=connector.strongswan.org' @ 10.22.46.20[4500]
  AES_CBC-128/HMAC_SHA2_256_128/PRF_HMAC_SHA2_256/CURVE_25519
  established 284s ago, rekeying in 13761s
```

I use "--timeout' because I saw you metioned in this [issue](https://wiki.strongswan.org/issues/2120), although here I initiated SAs manually, but this is just an experiment environment。

In my hypothetical environment, there maybe a lot of edge nodes and I have to use vici API  to initiate SAs on those nodes, so it's not acceptable if one API call never finish.  Those nodes may have mediator connection initiated or not, but once an node like edge2 initiate an SA (e.g. edge1) while edge1 have no mediator SA initiated,  I hope edge2 can initiate edge1 SA later after edge1 initiate mediator SA.   

But as you can see, the edge1/edge2 SA is queued, and no matter what I do(except restarting strongswan),  once it happened, the state won't change. 

PS: After some tests, I found that It's possible to make queued SA to finish, although not 100%. 

What does a queued SA mean? It seems there are a lot of tasks created for a queued SA, but why thoses tasks are not finished?

**Reply by tobiasbrunner** [reply]
As I said, it's probably a network issue. If you look at the log, both peers send direct messages to each other, but neither receives a response. That's an issue with double NATs (in particular with Linux, although there is a relatively easy fix - you can read more about that in [our original theses](https://strongswan.org/docs/theses/DA_2006_IKEv2-P2P-NAT-T.pdf), unfortunately only available in German).

**Reply by bluven** [reply]
@tobiasbrunner Thanks for your help. After using tcpdump, I found that sometimes the traffic just can't pass, although I don't known why, edge1 and edge2 always used 4500 even after NAT, but sometimes they can succeed and sometimes they just fail. Glad to know it is not related to strongswan, I can keep my work going on. Thanks again.

```
14:32:51.601877 IP 192.168.0.3.4500 > 10.22.46.57.4500: NONESP-encap: isakmp: child_sa  inf2[I]
14:32:51.601955 IP 192.168.0.3.4500 > 10.22.46.57.4500: NONESP-encap: isakmp: child_sa  inf2[I]
14:32:51.611302 IP 10.22.46.57 > 192.168.0.3: ICMP 10.22.46.57 udp port 4500 unreachable, length 124
14:32:51.611318 IP 10.22.46.57 > 192.168.0.3: ICMP 10.22.46.57 udp port 4500 unreachable, length 124
14:32:56.864023 ARP, Request who-has 192.168.0.3 tell 192.168.0.1, length 28
```

**Reply by tobiasbrunner** [reply]
As I said, you have to reject/drop traffic to unknown ports to avoid that "port unreachable" response that also creates a temporary conntrack state (see `conntrack -L`) that later prevents the client behind that NAT from using the same NAT mapping that was created for the connection to the mediation server.

**Reply by bluven** [reply]
Got it.
