### DISCUSSION TITLE
VTI interface not working with VRF (wrong tunnel routing)

### DISCUSSION THREAD

**Discussion by ssasso** [strongswan/strongswan#302] [Q&A]
Hello,
  I am experimenting with VTI interfaces into VRF.
I am using this script as "leftupdown":
```
#!/bin/bash

set -o errexit

VTI_IF="vti${PLUTO_UNIQUEID}"
DATA_FILE="/etc/strongswan/ipsec.tunnel.d/${PLUTO_PEER_ID}.conf"

case "${PLUTO_VERB}" in
    up-client)
        ip tunnel add "${VTI_IF}" local "${PLUTO_ME}" remote "${PLUTO_PEER}" mode vti \
            key "${PLUTO_MARK_OUT%%/*}"
        sysctl -w "net.ipv4.conf.${VTI_IF}.disable_policy=1"
        sysctl -w net.ipv4.conf.${VTI_IF}.rp_filter=2 || sysctl -w net.ipv4.conf.${VTI_IF}.rp_filter=0
        if [ -f $DATA_FILE ]; then
            source $DATA_FILE
            # Check VRF
            [ ! -z "$IFACE_VRF" ] && ip link set dev "${VTI_IF}" master $IFACE_VRF
            # Bring up the interface
            ip link set "${VTI_IF}" up
            # MTU
            [ ! -z "$IFACE_MTU" ] && ip link set dev "${VTI_IF}" mtu $IFACE_MTU
            if [ -z "${IFACE_REMOTE_ADDRESS}" ]; then
                # REMOTE ADDRESS Not Specified. Assigning "standard" address
                ip addr add ${IFACE_LOCAL_ADDRESS} dev ${VTI_IF}
            else
                # REMOTE ADDRESS is set. Using point-to-point configuration.
                ip addr add ${IFACE_LOCAL_ADDRESS} remote ${IFACE_REMOTE_ADDRESS} dev ${VTI_IF}
            fi
        else
            echo "Tunnel DATA not found. Setting up basic default config only."
            ip link set "${VTI_IF}" up
        fi
        ;;
    down-client)
        ip tunnel del "${VTI_IF}"
        ;;
esac
```

When the peer connects, the interface is created and enslaved to the VRF:
```
[root@ip-172-31-17-180 ~]# ip addr sh vrf red
5: dummy1: <BROADCAST,NOARP,UP,LOWER_UP> mtu 1500 qdisc noqueue master red state UNKNOWN group default qlen 1000
    link/ether 7e:7b:59:40:9c:1a brd ff:ff:ff:ff:ff:ff
    inet 10.248.248.248/32 scope global dummy1
       valid_lft forever preferred_lft forever
    inet6 fe80::7c7b:59ff:fe40:9c1a/64 scope link
       valid_lft forever preferred_lft forever
11: vti1@NONE: <POINTOPOINT,NOARP,UP,LOWER_UP> mtu 8981 qdisc noqueue master red state UNKNOWN group default qlen 1000
    link/ipip 172.31.17.180 peer 94.126.x.y
    inet 10.20.30.2 peer 10.20.30.1/32 scope global vti1
       valid_lft forever preferred_lft forever
    inet6 fe80::5efe:ac1f:11b4/64 scope link
       valid_lft forever preferred_lft forever
```

However, I am not able to ping neither from the strongswan host, neither from the other host.
If I start a tcpdump on the vti interface, I see the full packet flow. However, the other host never receives the "answer".
```
[root@ip-172-31-17-180 ~]# tcpdump -n -i vti1
tcpdump: verbose output suppressed, use -v or -vv for full protocol decode
listening on vti1, link-type RAW (Raw IP), capture size 262144 bytes
15:04:01.208051 IP 10.20.30.1 > 10.20.30.2: ICMP echo request, id 14625, seq 0, length 64
15:04:01.208079 IP 10.20.30.2 > 10.20.30.1: ICMP echo reply, id 14625, seq 0, length 64
15:04:02.218651 IP 10.20.30.1 > 10.20.30.2: ICMP echo request, id 14625, seq 1, length 64
15:04:02.218679 IP 10.20.30.2 > 10.20.30.1: ICMP echo reply, id 14625, seq 1, length 64
15:04:04.240894 IP 10.20.30.1 > 10.20.30.2: ICMP echo request, id 14625, seq 3, length 64
15:04:04.240926 IP 10.20.30.2 > 10.20.30.1: ICMP echo reply, id 14625, seq 3, length 64
15:04:25.862538 IP6 fe80::5efe:ac1f:11b4 > ff02::2: ICMP6, router solicitation, length 16

7 packets captured
7 packets received by filter
0 packets dropped by kernel
```
```
jadmin@UNP-SRX> ping routing-instance vpn 10.20.30.2 count 4
PING 10.20.30.2 (10.20.30.2): 56 data bytes

--- 10.20.30.2 ping statistics ---
4 packets transmitted, 0 packets received, 100% packet loss
```

If I remove the VRF information (so, no VRF in use), then everything works fine:
```
[root@ip-172-31-17-180 ~]# ip route show
default via 172.31.16.1 dev eth0
10.20.30.1 dev vti1 proto kernel scope link src 10.20.30.2
169.254.169.254 dev eth0
172.31.16.0/20 dev eth0 proto kernel scope link src 172.31.17.180
```
```
jadmin@UNP-SRX> ping routing-instance vpn 10.20.30.2 count 4
PING 10.20.30.2 (10.20.30.2): 56 data bytes
64 bytes from 10.20.30.2: icmp_seq=0 ttl=255 time=45.199 ms
64 bytes from 10.20.30.2: icmp_seq=1 ttl=255 time=44.371 ms
64 bytes from 10.20.30.2: icmp_seq=2 ttl=255 time=44.362 ms
64 bytes from 10.20.30.2: icmp_seq=3 ttl=255 time=44.293 ms

--- 10.20.30.2 ping statistics ---
4 packets transmitted, 4 packets received, 0% packet loss
round-trip min/avg/max/stddev = 44.293/44.556/45.199/0.372 ms
```

(so we can exclude a configuration issue on Strongswan or on the other end)

Am I doing some wrong configuration on the VRF side, or I encountered a "bug"?
I'm using Strongswan 5.7.2 on Linux 5.4.105.

thanks!
Stefano

**Comment by ssasso** [comment]
Additional note:
It seems that, in case the VTI is enslaved to a VRF, the ESP packets with the data originated by the strongswan host, try to use the routes of the VRF itself.

With this routing table:
```
[root@ip-172-31-17-180 ~]# ip route show vrf red
default via 10.5.1.2 dev gre1
10.5.1.0/30 dev gre1 proto kernel scope link src 10.5.1.1
10.20.30.1 dev vti1 proto kernel scope link src 10.20.30.2
```

the ping is NOT working.

If I remove the default route from the VRF routing table:
```
[root@ip-172-31-17-180 ~]# ip route show vrf red
10.5.1.0/30 dev gre1 proto kernel scope link src 10.5.1.1
10.20.30.1 dev vti1 proto kernel scope link src 10.20.30.2
```

then the ping works fine.
```
jadmin@UNP-SRX> ping routing-instance vpn 10.20.30.2 count 4
PING 10.20.30.2 (10.20.30.2): 56 data bytes
64 bytes from 10.20.30.2: icmp_seq=0 ttl=255 time=44.509 ms
64 bytes from 10.20.30.2: icmp_seq=1 ttl=255 time=44.455 ms
64 bytes from 10.20.30.2: icmp_seq=2 ttl=255 time=44.570 ms
64 bytes from 10.20.30.2: icmp_seq=3 ttl=255 time=65.831 ms

--- 10.20.30.2 ping statistics ---
4 packets transmitted, 4 packets received, 0% packet loss
round-trip min/avg/max/stddev = 44.455/49.841/65.831/9.232 ms
```

Any hint to fix that behaviour?

thanks!
Stefano

**Comment by ssasso** [comment]
Current workaround:
Forcing a lookup on the main routing table for the outer address of the tunnel.
```
ip rule add pref 1 from 172.31.17.180 lookup main
```

**Reply by Thermi** [reply]
Well, yeah. That makes sense. That's not really a workaround but the proper fix kind of. You can try solving it generally by doing it for proto esp, and IKE, too. I don't know specifics right now to solve it generally.

**Comment by iluffk** [comment]
Hi, can you share your config of VRF? Interfaces, routes etc, please?
