### DISCUSSION TITLE
Nonstandard IKE port fails for initiator

### DISCUSSION THREAD

**Discussion by jlearman** [strongswan/strongswan#1808] [Q&A] [answered]
I'm configuring Strongswan via the `govici` API.  I'm trying to use a nonstandard port for IKE, between two site gateways (both of which are configured by us.)  It almost works; whichever gateway responds to the connection can both send and receive traffic, but the initiator doesn't receive any traffic.

In charon.conf we have
```
    port = 550
```
For each connection, we set `remote_port` and `local_port` to 550.   We also set `encap = yes`.

On the initiator:
```
$ swanctl --list-sas
_tun_gw2:F7GMO4P5WL3AK===: #2, ESTABLISHED, IKEv2, 5d00cfb333693f1a_i ef84a99bfc86b80a_r*
  local  '1.1.0.10' @ 1.1.0.10[550]
  remote '1.2.0.10' @ 1.2.0.10[4500]
  AES_CBC-128/HMAC_SHA2_256_128/PRF_HMAC_SHA2_256/ECP_256
  established 1087s ago, rekeying in 13003s
  _tun_gw2:F7GMO4P5WL3AK===: #1, reqid 1, INSTALLED, TUNNEL-in-UDP, ESP:AES_GCM_16-128
    installed 1087s ago, rekeying in 2217s, expires in 2873s
    in  c9c85c7b (0x00000004),      0 bytes,     0 packets
    out cb443985 (0x00000004),   6976 bytes,   109 packets,     6s ago
    local  0.0.0.0/0
    remote 0.0.0.0/0
```
The responder looks the same except that the input packets are nonzero.

The initiator seems to be using port 550 for data:
```
$ tcpdump -nni eth0 port 4500" | grep "ESP("
18:15:42.499145 IP 1.2.0.10.4500 > 1.1.0.10.550: UDP-encap: ESP(spi=0xc9c85c7b,seq=0xa1), length 104
18:15:42.755006 IP 1.1.0.10.550 > 1.2.0.10.4500: UDP-encap: ESP(spi=0xcb443985,seq=0x9f), length 100
18:15:52.499149 IP 1.2.0.10.4500 > 1.1.0.10.550: UDP-encap: ESP(spi=0xc9c85c7b,seq=0xa2), length 104
18:15:52.756245 IP 1.1.0.10.550 > 1.2.0.10.4500: UDP-encap: ESP(spi=0xcb443985,seq=0xa0), length 100
```

The packets are OSPF Hellos.  The difference in length is that one side has a neighbor but the other doesn't.

There are no errors in `ip -s link` or `/proc/net/xfrm_stats`.

Hopefully I'm just doing it wrong.  The intent is to use port 4500 rather than 550, so that only one port needs to be enabled in firewalls.

**Comment by jlearman** [comment, marked as answer]
After re-reading https://docs.strongswan.org/docs/5.9/features/natTraversal.html#_custom_server_ports I realized this was the wrong approach.  Setting `local_port` and `remote_port` to 4500 and NOT setting `charon.port = 4500` achieves the goal.
