### DISCUSSION TITLE
Traffic forwarding rules on GCE

### DISCUSSION THREAD

**Discussion by fancywriter** [strongswan/strongswan#1926] [Q&A] [answered]
Hello!

I have previously configured VPN server with adjusted roadwarrior case with EAP on Digital Ocean cloud which worked more or less as I expected. https://github.com/strongswan/strongswan/discussions/1410 The IP was public, which simplified configuration probably.

This time I am trying to do the same thing on Google Cloud Engine (GCE) and machine network is configured differently. Firewall is configured differently. There are both firewalls on the host itself (netfilter) and on the cloud.

The host itself seems is behind NAT, at least `ip address` command gives me private IP **10.x.x.x** only:

```
$ ip address
1: lo: <LOOPBACK,UP,LOWER_UP> mtu 65536 qdisc noqueue state UNKNOWN group default qlen 1000
    link/loopback 00:00:00:00:00:00 brd 00:00:00:00:00:00
    inet 127.0.0.1/8 scope host lo
       valid_lft forever preferred_lft forever
    inet6 ::1/128 scope host noprefixroute 
       valid_lft forever preferred_lft forever
2: ens4: <BROADCAST,MULTICAST,UP,LOWER_UP> mtu 1460 qdisc mq state UP group default qlen 1000
    link/ether 42:01:0a:8e:00:02 brd ff:ff:ff:ff:ff:ff
    altname enp0s4
    inet 10.142.0.2/32 metric 100 scope global dynamic ens4
       valid_lft 71818sec preferred_lft 71818sec
    inet6 fe80::4001:aff:fe8e:2/64 scope link 
       valid_lft forever preferred_lft forever
```

But it also has public (34.x.x.x) IP.

![image](https://github.com/strongswan/strongswan/assets/1200256/4863e45a-c3af-4c17-b495-a7696247600d)

However, not just SSH (port 22, which is allowed by default), but UDP on port 500 and 4500 are open after I added appropriate firewall rules on GCE firewall. It does not just allow traffic, but also forward TCP/UDP ports properly to the host behind NAT.

So, opening connection (from mobile android APP) and authentication (username + password) works exactly as I expected. But traffic forwarding does not.

```
$ cat /etc/swanctl/conf.d/my.conf 
connections {
    conn {
        version = 2
        pools = poolv4, poolv6
        local {
            certs = cert.pem
            id = <MY DNS HOST>
        }
        remote {
            id = %any
            auth = eap-mschapv2
        }
        children {
            conn {
                local_ts = 0.0.0.0/0, ::/0
            }
        }
        send_cert = always
    }
}
secrets {
    eap-username {
        secret = <PASSWORD>
        id = pavel
    }
}

pools {
    poolv4 {
        addrs = 10.10.10.0/24
        dns = 94.140.14.14, 94.140.15.15
    }
    poolv6 {
        addrs = fec1::0/16
        dns = 2a10:50c0::ad1:ff, 2a10:50c0::ad2:ff
    }
}
```

```
# iptables -L -t nat
Chain PREROUTING (policy ACCEPT)
target     prot opt source               destination         

Chain INPUT (policy ACCEPT)
target     prot opt source               destination         

Chain OUTPUT (policy ACCEPT)
target     prot opt source               destination         

Chain POSTROUTING (policy ACCEPT)
target     prot opt source               destination         
ACCEPT     all  --  10.10.10.0/24        anywhere             policy match dir out pol ipsec
MASQUERADE  all  --  10.10.10.0/24        anywhere            
```

```
# iptables -L -t mangle
Chain PREROUTING (policy ACCEPT)
target     prot opt source               destination         

Chain INPUT (policy ACCEPT)
target     prot opt source               destination         

Chain FORWARD (policy ACCEPT)
target     prot opt source               destination         
TCPMSS     tcp  --  10.10.10.0/24        anywhere             policy match dir in pol ipsec tcp flags:SYN,RST/SYN tcpmss match 1361:1536 TCPMSS set 1360

Chain OUTPUT (policy ACCEPT)
target     prot opt source               destination         

Chain POSTROUTING (policy ACCEPT)
target     prot opt source               destination 
```

```
# iptables -L -t filter
Chain INPUT (policy DROP)
target     prot opt source               destination         
ufw-before-logging-input  all  --  anywhere             anywhere            
ufw-before-input  all  --  anywhere             anywhere            
ufw-after-input  all  --  anywhere             anywhere            
ufw-after-logging-input  all  --  anywhere             anywhere            
ufw-reject-input  all  --  anywhere             anywhere            
ufw-track-input  all  --  anywhere             anywhere            

Chain FORWARD (policy DROP)
target     prot opt source               destination         
ufw-before-logging-forward  all  --  anywhere             anywhere            
ufw-before-forward  all  --  anywhere             anywhere            
ufw-after-forward  all  --  anywhere             anywhere            
ufw-after-logging-forward  all  --  anywhere             anywhere            
ufw-reject-forward  all  --  anywhere             anywhere            
ufw-track-forward  all  --  anywhere             anywhere            

Chain OUTPUT (policy ACCEPT)
target     prot opt source               destination         
ufw-before-logging-output  all  --  anywhere             anywhere            
ufw-before-output  all  --  anywhere             anywhere            
ufw-after-output  all  --  anywhere             anywhere            
ufw-after-logging-output  all  --  anywhere             anywhere            
ufw-reject-output  all  --  anywhere             anywhere            
ufw-track-output  all  --  anywhere             anywhere            

Chain ufw-after-forward (1 references)
target     prot opt source               destination         

Chain ufw-after-input (1 references)
target     prot opt source               destination         
ufw-skip-to-policy-input  udp  --  anywhere             anywhere             udp dpt:netbios-ns
ufw-skip-to-policy-input  udp  --  anywhere             anywhere             udp dpt:netbios-dgm
ufw-skip-to-policy-input  tcp  --  anywhere             anywhere             tcp dpt:netbios-ssn
ufw-skip-to-policy-input  tcp  --  anywhere             anywhere             tcp dpt:microsoft-ds
ufw-skip-to-policy-input  udp  --  anywhere             anywhere             udp dpt:bootps
ufw-skip-to-policy-input  udp  --  anywhere             anywhere             udp dpt:bootpc
ufw-skip-to-policy-input  all  --  anywhere             anywhere             ADDRTYPE match dst-type BROADCAST

Chain ufw-after-logging-forward (1 references)
target     prot opt source               destination         
LOG        all  --  anywhere             anywhere             limit: avg 3/min burst 10 LOG level warn prefix "[UFW BLOCK] "

Chain ufw-after-logging-input (1 references)
target     prot opt source               destination         
LOG        all  --  anywhere             anywhere             limit: avg 3/min burst 10 LOG level warn prefix "[UFW BLOCK] "

Chain ufw-after-logging-output (1 references)
target     prot opt source               destination         

Chain ufw-after-output (1 references)
target     prot opt source               destination         

Chain ufw-before-forward (1 references)
target     prot opt source               destination         
ACCEPT     all  --  10.10.10.0/24        anywhere             policy match dir in pol ipsec proto esp
ACCEPT     all  --  anywhere             10.10.10.0/24        policy match dir out pol ipsec proto esp
ACCEPT     all  --  anywhere             anywhere             ctstate RELATED,ESTABLISHED
ACCEPT     icmp --  anywhere             anywhere             icmp destination-unreachable
ACCEPT     icmp --  anywhere             anywhere             icmp time-exceeded
ACCEPT     icmp --  anywhere             anywhere             icmp parameter-problem
ACCEPT     icmp --  anywhere             anywhere             icmp echo-request
ufw-user-forward  all  --  anywhere             anywhere            

Chain ufw-before-input (1 references)
target     prot opt source               destination         
ACCEPT     all  --  anywhere             anywhere            
ACCEPT     all  --  anywhere             anywhere             ctstate RELATED,ESTABLISHED
ufw-logging-deny  all  --  anywhere             anywhere             ctstate INVALID
DROP       all  --  anywhere             anywhere             ctstate INVALID
ACCEPT     icmp --  anywhere             anywhere             icmp destination-unreachable
ACCEPT     icmp --  anywhere             anywhere             icmp time-exceeded
ACCEPT     icmp --  anywhere             anywhere             icmp parameter-problem
ACCEPT     icmp --  anywhere             anywhere             icmp echo-request
ACCEPT     udp  --  anywhere             anywhere             udp spt:bootps dpt:bootpc
ufw-not-local  all  --  anywhere             anywhere            
ACCEPT     udp  --  anywhere             mdns.mcast.net       udp dpt:mdns
ACCEPT     udp  --  anywhere             239.255.255.250      udp dpt:1900
ufw-user-input  all  --  anywhere             anywhere            

Chain ufw-before-logging-forward (1 references)
target     prot opt source               destination         

Chain ufw-before-logging-input (1 references)
target     prot opt source               destination         

Chain ufw-before-logging-output (1 references)
target     prot opt source               destination         

Chain ufw-before-output (1 references)
target     prot opt source               destination         
ACCEPT     all  --  anywhere             anywhere            
ACCEPT     all  --  anywhere             anywhere             ctstate RELATED,ESTABLISHED
ufw-user-output  all  --  anywhere             anywhere            

Chain ufw-logging-allow (0 references)
target     prot opt source               destination         
LOG        all  --  anywhere             anywhere             limit: avg 3/min burst 10 LOG level warn prefix "[UFW ALLOW] "

Chain ufw-logging-deny (2 references)
target     prot opt source               destination         
RETURN     all  --  anywhere             anywhere             ctstate INVALID limit: avg 3/min burst 10
LOG        all  --  anywhere             anywhere             limit: avg 3/min burst 10 LOG level warn prefix "[UFW BLOCK] "

Chain ufw-not-local (1 references)
target     prot opt source               destination         
RETURN     all  --  anywhere             anywhere             ADDRTYPE match dst-type LOCAL
RETURN     all  --  anywhere             anywhere             ADDRTYPE match dst-type MULTICAST
RETURN     all  --  anywhere             anywhere             ADDRTYPE match dst-type BROADCAST
ufw-logging-deny  all  --  anywhere             anywhere             limit: avg 3/min burst 10
DROP       all  --  anywhere             anywhere            

Chain ufw-reject-forward (1 references)
target     prot opt source               destination         

Chain ufw-reject-input (1 references)
target     prot opt source               destination         

Chain ufw-reject-output (1 references)
target     prot opt source               destination         

Chain ufw-skip-to-policy-forward (0 references)
target     prot opt source               destination         
DROP       all  --  anywhere             anywhere            

Chain ufw-skip-to-policy-input (7 references)
target     prot opt source               destination         
DROP       all  --  anywhere             anywhere            

Chain ufw-skip-to-policy-output (0 references)
target     prot opt source               destination         
ACCEPT     all  --  anywhere             anywhere            

Chain ufw-track-forward (1 references)
target     prot opt source               destination         

Chain ufw-track-input (1 references)
target     prot opt source               destination         

Chain ufw-track-output (1 references)
target     prot opt source               destination         
ACCEPT     tcp  --  anywhere             anywhere             ctstate NEW
ACCEPT     udp  --  anywhere             anywhere             ctstate NEW

Chain ufw-user-forward (1 references)
target     prot opt source               destination         

Chain ufw-user-input (1 references)
target     prot opt source               destination         
ACCEPT     tcp  --  anywhere             anywhere             tcp dpt:ssh /* 'dapp_OpenSSH' */
ACCEPT     udp  --  anywhere             anywhere             multiport dports isakmp,ipsec-nat-t

Chain ufw-user-limit (0 references)
target     prot opt source               destination         
LOG        all  --  anywhere             anywhere             limit: avg 3/min burst 5 LOG level warn prefix "[UFW LIMIT BLOCK] "
REJECT     all  --  anywhere             anywhere             reject-with icmp-port-unreachable

Chain ufw-user-limit-accept (0 references)
target     prot opt source               destination         
ACCEPT     all  --  anywhere             anywhere            

Chain ufw-user-logging-forward (0 references)
target     prot opt source               destination         

Chain ufw-user-logging-input (0 references)
target     prot opt source               destination         

Chain ufw-user-logging-output (0 references)
target     prot opt source               destination         

Chain ufw-user-output (1 references)
target     prot opt source               destination
```

(most of UFW filter rules are from default UFW configuration, I have tried to disable them all and only adding related to ipsec
```
ACCEPT     all  --  10.10.10.0/24        anywhere             policy match dir in pol ipsec proto esp
ACCEPT     all  --  anywhere             10.10.10.0/24        policy match dir out pol ipsec proto esp
```
Noticed no difference.

When I try to access any host (github.com for example) from mobile (when connection is ESTABLISHED), I see the following on TCPDUMP on the gateway:

```
# tcpdump -i ens4 'src host 10.10.10.1 and dst host 140.82.112.3'
tcpdump: verbose output suppressed, use -v[v]... for full protocol decode
listening on ens4, link-type EN10MB (Ethernet), snapshot length 262144 bytes
11:27:45.480816 IP 10.10.10.1.48158 > lb-140-82-112-3-iad.github.com.http: Flags [S], seq 2172418246, win 65535, options [mss 1360,sackOK,TS val 1478309391 ecr 0,nop,wscale 8], length 0
11:27:45.738700 IP 10.10.10.1.48168 > lb-140-82-112-3-iad.github.com.http: Flags [S], seq 575857469, win 65535, options [mss 1360,sackOK,TS val 1478309642 ecr 0,nop,wscale 8], length 0
11:27:45.744799 IP 10.10.10.1.48158 > lb-140-82-112-3-iad.github.com.http: Flags [.], ack 1567414263, win 256, options [nop,nop,TS val 1478309660 ecr 273160722], length 0
11:27:45.744799 IP 10.10.10.1.48158 > lb-140-82-112-3-iad.github.com.http: Flags [P.], seq 0:325, ack 1, win 256, options [nop,nop,TS val 1478309661 ecr 273160722], length 325: HTTP: GET / HTTP/1.1
11:27:45.906042 IP 10.10.10.1.48168 > lb-140-82-112-3-iad.github.com.http: Flags [.], ack 1223156639, win 256, options [nop,nop,TS val 1478309824 ecr 2645598428], length 0
11:27:45.906042 IP 10.10.10.1.48158 > lb-140-82-112-3-iad.github.com.http: Flags [.], ack 87, win 256, options [nop,nop,TS val 1478309824 ecr 273160988], length 0
11:27:45.934049 IP 10.10.10.1.45150 > lb-140-82-112-3-iad.github.com.https: Flags [S], seq 787423205, win 65535, options [mss 1360,sackOK,TS val 1478309852 ecr 0,nop,wscale 8], length 0
11:27:46.198395 IP 10.10.10.1.45164 > lb-140-82-112-3-iad.github.com.https: Flags [S], seq 1534014131, win 65535, options [mss 1360,sackOK,TS val 1478310102 ecr 0,nop,wscale 8], length 0
11:27:46.203588 IP 10.10.10.1.45150 > lb-140-82-112-3-iad.github.com.https: Flags [.], ack 551030295, win 256, options [nop,nop,TS val 1478310119 ecr 2125317218], length 0
11:27:46.207990 IP 10.10.10.1.45150 > lb-140-82-112-3-iad.github.com.https: Flags [P.], seq 0:517, ack 1, win 256, options [nop,nop,TS val 1478310124 ecr 2125317218], length 517
11:27:46.339145 IP 10.10.10.1.45164 > lb-140-82-112-3-iad.github.com.https: Flags [.], ack 3850081761, win 256, options [nop,nop,TS val 1478310250 ecr 3166869612], length 0
11:27:46.343448 IP 10.10.10.1.45164 > lb-140-82-112-3-iad.github.com.https: Flags [P.], seq 0:517, ack 1, win 256, options [nop,nop,TS val 1478310254 ecr 3166869612], length 517
11:27:46.357607 IP 10.10.10.1.45150 > lb-140-82-112-3-iad.github.com.https: Flags [.], ack 1347, win 267, options [nop,nop,TS val 1478310273 ecr 2125317492], length 0
11:27:46.357607 IP 10.10.10.1.45150 > lb-140-82-112-3-iad.github.com.https: Flags [.], ack 2693, win 278, options [nop,nop,TS val 1478310273 ecr 2125317492], length 0
11:27:46.357607 IP 10.10.10.1.45150 > lb-140-82-112-3-iad.github.com.https: Flags [.], ack 2810, win 278, options [nop,nop,TS val 1478310273 ecr 2125317492], length 0
11:27:46.372128 IP 10.10.10.1.45150 > lb-140-82-112-3-iad.github.com.https: Flags [P.], seq 517:541, ack 2810, win 278, options [nop,nop,TS val 1478310290 ecr 2125317492], length 24
11:27:46.372128 IP 10.10.10.1.45150 > lb-140-82-112-3-iad.github.com.https: Flags [F.], seq 541, ack 2810, win 278, options [nop,nop,TS val 1478310290 ecr 2125317492], length 0
11:27:46.489947 IP 10.10.10.1.45164 > lb-140-82-112-3-iad.github.com.https: Flags [.], ack 1347, win 267, options [nop,nop,TS val 1478310409 ecr 3166869757], length 0
11:27:46.489947 IP 10.10.10.1.45164 > lb-140-82-112-3-iad.github.com.https: Flags [.], ack 2693, win 278, options [nop,nop,TS val 1478310409 ecr 3166869757], length 0
11:27:46.494294 IP 10.10.10.1.45164 > lb-140-82-112-3-iad.github.com.https: Flags [.], ack 2811, win 278, options [nop,nop,TS val 1478310409 ecr 3166869757], length 0
11:27:46.504165 IP 10.10.10.1.45150 > lb-140-82-112-3-iad.github.com.https: Flags [.], ack 2811, win 278, options [nop,nop,TS val 1478310423 ecr 2125317656], length 0
11:27:46.519838 IP 10.10.10.1.45164 > lb-140-82-112-3-iad.github.com.https: Flags [P.], seq 517:541, ack 2811, win 278, options [nop,nop,TS val 1478310437 ecr 3166869757], length 24
11:27:46.519839 IP 10.10.10.1.45164 > lb-140-82-112-3-iad.github.com.https: Flags [F.], seq 541, ack 2811, win 278, options [nop,nop,TS val 1478310437 ecr 3166869757], length 0
11:27:46.726423 IP 10.10.10.1.45164 > lb-140-82-112-3-iad.github.com.https: Flags [.], ack 2812, win 278, options [nop,nop,TS val 1478310642 ecr 3166869933], length 0
11:27:46.944811 IP 10.10.10.1.48168 > lb-140-82-112-3-iad.github.com.http: Flags [.], ack 1, win 256, options [nop,nop,TS val 1478310857 ecr 2645598428], length 0
11:27:51.405515 IP 10.10.10.1.48168 > lb-140-82-112-3-iad.github.com.http: Flags [F.], seq 0, ack 1, win 256, options [nop,nop,TS val 1478315303 ecr 2645598428], length 0
11:27:51.545471 IP 10.10.10.1.48168 > lb-140-82-112-3-iad.github.com.http: Flags [R], seq 575857471, win 0, length 0
11:27:51.550908 IP 10.10.10.1.48168 > lb-140-82-112-3-iad.github.com.http: Flags [R], seq 575857471, win 0, length 0
11:27:55.970340 IP 10.10.10.1.48158 > lb-140-82-112-3-iad.github.com.http: Flags [.], ack 87, win 256, options [nop,nop,TS val 1478319871 ecr 273160988], length 0
11:28:00.885758 IP 10.10.10.1.48158 > lb-140-82-112-3-iad.github.com.http: Flags [F.], seq 325, ack 88, win 256, options [nop,nop,TS val 1478324803 ecr 273175986], length 0

```

Questions?
 - is it at least theoretically possible to setup gateway which is behind NAT on itself?
 -  what magic rules do I need to add to iptables on this host (or do I have to also configure GCE firewall for that?)

**Comment by tobiasbrunner** [comment, marked as answer]
Even though your capture only shows traffic from the client to the server, it does seem to show that traffic is exchanged (there is a TCP connection to port 80 established that results in a HTTP GET request, presumably this results in a redirect to HTTPS as there is a TCP connection to port 443 afterwards). So it does look like it's basically working. IP fragmentation could be an issue, so maybe try with a lower MSS value.

**Reply by fancywriter** [reply]
Oh, wow, indeed, didn't expect it could be that easy...
I have changed the rule a little bit (subtracted 40) to be `tcpmss match 1321:1536 TCPMSS set 1320`.
I decided to make it minus 40 because I have realised that GCE host has MTU of 1460, while my home wifi has 1500. (I do not remember how it was in DigitalOcean, just guessing it was likely 1500 because it's almost everywhere 1500...)
Thank you very much!

**Is 1320 generally recommended value? I should not expect any pitfalls, correct?** Except reasonable drawbacks like somewhat slower speed which is totally expected with any encryption and VPN anyway.

**Reply by tobiasbrunner** [reply]
It really depends on the native MTU(s) between the peers, but also the negotiated algorithms and IPsec mode, whether UDP-encapsulation is used etc.
