### DISCUSSION TITLE
Can the DHCP plugin support IPv6?

### DISCUSSION THREAD

**Discussion by weiqi-chen** [strongswan/strongswan#2996] [Q&A]
On OpenWRT, I use the following configuration to connect the VPN Client to the router's LAN.

```
# /etc/config/network
config device
        option name 'br-lan'
        option type 'bridge'
        list ports 'lan1'
        list ports 'lan2'
        list ports 'lan3'
        list ports 'lan4'
        list ports 'xfrm_357'

config interface 'xfrm_357'
        option ifid '357'
        option tunlink 'wan'
        option zone 'vpn'
        option proto 'xfrm'


# /etc/strongswan.d/charon/dhcp.conf
dhcp {
    force_server_address = yes
    identity_lease = yes
    load = yes
    server = 192.168.1.255
}

# /etc/swanctl/conf.d/vpn.conf
conn-defaults {
   version = 2
   send_cert = always
   mobike = yes
   keyingtries = 3
   pools = dhcp
}
local-defaults {
   auth = pubkey
   id = "<MASK>"
   certs = <MASK>
}
remote-defaults {
   auth  = eap-mschapv2
   id = %any
   eap_id = %any
}
child-defaults {
   mode = tunnel
   interface = pppoe-wan
   if_id_in = 357
   if_id_out = 357
   local_ts = 192.168.1.0/24
}

connections{
   conn : conn-defaults {
      local : local-defaults {}
      remote : remote-defaults {
      }
      children {
         child : child-defaults {}
      }
   }
}
```

logs

```
Tue Feb  3 23:47:13 2026 daemon.info ipsec: 12[IKE] authentication of 'Weiqis iPhone 8' with EAP successful
Tue Feb  3 23:47:13 2026 daemon.info ipsec: 12[IKE] authentication of '<MASK>' (myself) with EAP
Tue Feb  3 23:47:13 2026 daemon.info ipsec: 12[IKE] peer requested virtual IP %any
Tue Feb  3 23:47:13 2026 daemon.info ipsec: 12[CFG] sending DHCP DISCOVER for 7a:a7:69:59:ef:39 to 192.168.1.255
Tue Feb  3 23:47:14 2026 daemon.info ipsec: 12[CFG] sending DHCP DISCOVER for 7a:a7:69:59:ef:39 to 192.168.1.255
Tue Feb  3 23:47:16 2026 daemon.info ipsec: 12[CFG] sending DHCP DISCOVER for 7a:a7:69:59:ef:39 to 192.168.1.255
Tue Feb  3 23:47:16 2026 daemon.info dnsmasq-dhcp[1]: DHCPDISCOVER(br-lan) 7a:a7:69:59:ef:39
Tue Feb  3 23:47:16 2026 daemon.info dnsmasq-dhcp[1]: DHCPOFFER(br-lan) 192.168.1.249 7a:a7:69:59:ef:39
Tue Feb  3 23:47:16 2026 daemon.info dnsmasq-dhcp[1]: DHCPDISCOVER(br-lan) 7a:a7:69:59:ef:39
Tue Feb  3 23:47:16 2026 daemon.info dnsmasq-dhcp[1]: DHCPOFFER(br-lan) 192.168.1.249 7a:a7:69:59:ef:39
Tue Feb  3 23:47:16 2026 daemon.info dnsmasq-dhcp[1]: DHCPDISCOVER(br-lan) 7a:a7:69:59:ef:39
Tue Feb  3 23:47:16 2026 daemon.info dnsmasq-dhcp[1]: DHCPOFFER(br-lan) 192.168.1.249 7a:a7:69:59:ef:39
Tue Feb  3 23:47:16 2026 daemon.info ipsec: 12[CFG] received DHCP OFFER 192.168.1.249 from 192.168.1.1
Tue Feb  3 23:47:16 2026 daemon.info ipsec: 12[CFG] sending DHCP REQUEST for 192.168.1.249 to 192.168.1.1
Tue Feb  3 23:47:16 2026 daemon.info dnsmasq-dhcp[1]: DHCPREQUEST(br-lan) 192.168.1.249 7a:a7:69:59:ef:39
Tue Feb  3 23:47:16 2026 daemon.info dnsmasq-dhcp[1]: DHCPACK(br-lan) 192.168.1.249 7a:a7:69:59:ef:39 iPhone8
Tue Feb  3 23:47:16 2026 daemon.info ipsec: 12[CFG] received DHCP ACK for 192.168.1.249
Tue Feb  3 23:47:16 2026 daemon.info ipsec: 12[IKE] assigning virtual IP 192.168.1.249 to peer 'iPhone8'
Tue Feb  3 23:47:16 2026 daemon.info ipsec: 12[IKE] peer requested virtual IP %any6
Tue Feb  3 23:47:16 2026 daemon.info ipsec: 12[IKE] no virtual IP found for %any6 requested by 'iPhone8'

```

It seems that the DHCP plugin does not support IPv6 at the moment.

**Comment by weiqi-chen** [comment]
My settings suddenly stopped working. For some reason, the host at IP 192.168.1.118 on interface xfrm_357 (within br-lan) is not responding to ARP requests.

```
tcpdump -i any host 192.168.1.118
tcpdump: WARNING: any: That device doesn't support promiscuous mode
(Promiscuous mode not supported on the "any" device)
tcpdump: verbose output suppressed, use -v[v]... for full protocol decode
listening on any, link-type LINUX_SLL2 (Linux cooked v2), snapshot length 262144 bytes
03:25:23.623855 br-lan Out ARP, Request who-has 192.168.1.118 tell <MY_HOSTNAME>, length 28
03:25:23.623911 phy1-ap0 Out ARP, Request who-has 192.168.1.118 tell <MY_HOSTNAME>, length 28
03:25:23.623980 phy0-ap0 Out ARP, Request who-has 192.168.1.118 tell <MY_HOSTNAME>, length 28
03:25:23.624016 lan3  Out ARP, Request who-has 192.168.1.118 tell <MY_HOSTNAME>, length 28
03:25:23.624043 eth0  Out ARP, Request who-has 192.168.1.118 tell <MY_HOSTNAME>, length 46
03:25:23.624129 lan2  Out ARP, Request who-has 192.168.1.118 tell <MY_HOSTNAME>, length 28
03:25:23.624149 eth0  Out ARP, Request who-has 192.168.1.118 tell <MY_HOSTNAME>, length 46
03:25:23.624167 lan1  Out ARP, Request who-has 192.168.1.118 tell <MY_HOSTNAME>, length 28
03:25:23.624178 eth0  Out ARP, Request who-has 192.168.1.118 tell <MY_HOSTNAME>, length 46
03:25:24.660342 br-lan Out ARP, Request who-has 192.168.1.118 tell <MY_HOSTNAME>, length 28
03:25:24.660397 phy1-ap0 Out ARP, Request who-has 192.168.1.118 tell <MY_HOSTNAME>, length 28
03:25:24.660488 phy0-ap0 Out ARP, Request who-has 192.168.1.118 tell <MY_HOSTNAME>, length 28
03:25:24.660543 lan3  Out ARP, Request who-has 192.168.1.118 tell <MY_HOSTNAME>, length 28
03:25:24.660563 eth0  Out ARP, Request who-has 192.168.1.118 tell <MY_HOSTNAME>, length 46
03:25:24.660624 lan2  Out ARP, Request who-has 192.168.1.118 tell <MY_HOSTNAME>, length 28
03:25:24.660638 eth0  Out ARP, Request who-has 192.168.1.118 tell <MY_HOSTNAME>, length 46
03:25:24.660651 lan1  Out ARP, Request who-has 192.168.1.118 tell <MY_HOSTNAME>, length 28
03:25:24.660659 eth0  Out ARP, Request who-has 192.168.1.118 tell <MY_HOSTNAME>, length 46
03:25:25.700371 br-lan Out ARP, Request who-has 192.168.1.118 tell <MY_HOSTNAME>, length 28
03:25:25.700444 phy1-ap0 Out ARP, Request who-has 192.168.1.118 tell <MY_HOSTNAME>, length 28
03:25:25.700517 phy0-ap0 Out ARP, Request who-has 192.168.1.118 tell <MY_HOSTNAME>, length 28
03:25:25.700542 lan3  Out ARP, Request who-has 192.168.1.118 tell <MY_HOSTNAME>, length 28
03:25:25.700559 eth0  Out ARP, Request who-has 192.168.1.118 tell <MY_HOSTNAME>, length 46
03:25:25.700614 lan2  Out ARP, Request who-has 192.168.1.118 tell <MY_HOSTNAME>, length 28
03:25:25.700625 eth0  Out ARP, Request who-has 192.168.1.118 tell <MY_HOSTNAME>, length 46
03:25:25.700636 lan1  Out ARP, Request who-has 192.168.1.118 tell <MY_HOSTNAME>, length 28
03:25:25.700644 eth0  Out ARP, Request who-has 192.168.1.118 tell <MY_HOSTNAME>, length 46
03:25:27.727167 xfrm_357 In  IP 192.168.1.118.55213 > <MY_HOSTNAME>.53: 42526+ A? client.wns.windows.com. (40)
03:25:28.725519 xfrm_357 In  IP 192.168.1.118.55213 > <MY_HOSTNAME>.53: 42526+ A? client.wns.windows.com. (40)
03:25:29.725338 xfrm_357 In  IP 192.168.1.118.55213 > <MY_HOSTNAME>.53: 42526+ A? client.wns.windows.com. (40)
03:25:31.785731 xfrm_357 In  IP 192.168.1.118.55213 > <MY_HOSTNAME>.53: 42526+ A? client.wns.windows.com. (40)
03:25:35.835426 xfrm_357 In  IP 192.168.1.118.55213 > <MY_HOSTNAME>.53: 42526+ A? client.wns.windows.com. (40)
03:25:39.845751 xfrm_357 In  IP 192.168.1.118.57725 > <MY_HOSTNAME>.53: 51812+ A? dns.msftncsi.com. (34)
03:25:40.845795 xfrm_357 In  IP 192.168.1.118.57725 > <MY_HOSTNAME>.53: 51812+ A? dns.msftncsi.com. (34)
03:25:41.845634 xfrm_357 In  IP 192.168.1.118.57725 > <MY_HOSTNAME>.53: 51812+ A? dns.msftncsi.com. (34)
03:25:43.915564 xfrm_357 In  IP 192.168.1.118.57725 > <MY_HOSTNAME>.53: 51812+ A? dns.msftncsi.com. (34)
03:25:47.945326 xfrm_357 In  IP 192.168.1.118.57725 > <MY_HOSTNAME>.53: 51812+ A? dns.msftncsi.com. (34)
03:25:56.065861 xfrm_357 In  IP 192.168.1.118.64711 > <MY_HOSTNAME>.53: 65323+ A? www.msftconnecttest.com. (41)
03:25:56.065989 xfrm_357 In  IP 192.168.1.118.56713 > <MY_HOSTNAME>.53: 718+ A? ipv6.msftconnecttest.com. (42)
03:25:57.099217 xfrm_357 In  IP 192.168.1.118.56713 > <MY_HOSTNAME>.53: 718+ A? ipv6.msftconnecttest.com. (42)
03:25:57.099347 xfrm_357 In  IP 192.168.1.118.64711 > <MY_HOSTNAME>.53: 65323+ A? www.msftconnecttest.com. (41)


 arp
IP address       HW type     Flags       HW address            Mask     Device
192.168.1.113    0x1         0x0        ******************    *        br-lan
192.168.1.11     0x1         0x2         ******************     *        br-lan
192.168.1.233    0x1         0x2         ******************    *        br-lan
192.168.1.10     0x1         0x2        ******************     *        br-lan
192.168.1.118    0x1         0x0         00:00:00:00:00:00     *        br-lan
192.168.1.97     0x1         0x2         ******************    *        br-lan
192.168.1.135    0x1         0x2        ******************     *        br-lan
192.168.1.184    0x1         0x2         ******************     *        br-lan
192.168.1.128    0x1         0x2         ******************     *        br-lan

```

`<MY_HOSTNAME>` is hostname of router ip.

since my router does not have the MAC address of the VPN client, it cannot send any response to the client.

**Comment by weiqi-chen** [comment]
I separated the xfrm_357 interface from the LAN and assigned it a different subnet. Now OpenWRT no longer sends ARP requests for VPN virtual IP addresses and directly forwards traffic instead. However, this adds a slight layer of complexity. For VPN clients to access other hosts in the OpenWRT LAN zone, they need to go through the 10.0.2.1 gateway.

On the Windows VPN client side, if I disable "Use default gateway on remote network," I need to manually add a route to 192.168.1.0 (since I only want the VPN client to access 192.168.1.0/24 and 10.0.2.0/24). Other traffic will not go through the VPN tunnel.

**Comment by weiqi-chen** [comment]
Now i could use lan.
`opkg install strongswan-mod-updown`

#### `/etc/config/network`
```
config interface 'vpn'
        option device '@xfrm_357'
        option proto 'static'

config interface 'xfrm_357'
        option ifid '357'
        option tunlink 'wan'
        option proto 'xfrm'
```

#### `/etc/config/firewall`
```
config zone
        option name 'lan'
        option input 'ACCEPT'
        option output 'ACCEPT'
        option forward 'ACCEPT'
        list network 'lan'
        list network 'vpn'
```

#### `/etc/swanctl/conf.d/vpn.conf`
```
child-defaults {
   mode = tunnel
   if_id_in = 357
   if_id_out = 357
   local_ts = 192.168.1.0/24
   updown = /etc/swanctl/conf.d/updown.sh
}
```

#### `/etc/swanctl/conf.d/updown.sh`
```
#!/bin/sh
case "$PLUTO_VERB" in
    up-client)
        if [ -n "$PLUTO_PEER_SOURCEIP" ]; then
            ip route add "$PLUTO_PEER_SOURCEIP4_1" dev xfrm_357 scope link
            logger -t updown.sh "Route added for $PLUTO_PEER_SOURCEIP4_1 on xfrm_357"
        fi
        ;;
    down-client)
        if [ -n "$PLUTO_PEER_SOURCEIP" ]; then
            ip route del "$PLUTO_PEER_SOURCEIP4_1" dev xfrm_357 scope link
            logger -t updown.sh "Route removed for $PLUTO_PEER_SOURCEIP4_1"
        fi
        ;;
esac
```

#### `/etc/hotplug.d/iface/99-proxy-arp`
```
#!/bin/sh

[ "$ACTION" = "ifup" ] && [ "$DEVICE" = "br-lan" ] && {
    echo 1 > /proc/sys/net/ipv4/conf/br-lan/proxy_arp
    logger -p hotplug.d -t 99-proxy-arp "Proxy ARP enabled on br-lan"
}
```

**Reply by weiqi-chen** [reply]
> /etc/swanctl/conf.d/updown.sh

The updown.sh script is no longer required. You can achieve the same result by enabling `charon.plugins.kernel-netlink.install_routes_xfrmi = yes`.

```
ip route show table 220
192.168.1.158 dev xfrm_357 proto static src 192.168.1.1
```

https://www.strongswan.org/blog/2023/03/02/strongswan-5.9.10-released.html#:~:text=Optional%20Automatic%20Routes%20via%20XFRM%20Interfaces

**Comment by weiqi-chen** [comment]
Onse `charon.plugins.kernel-netlink.install_routes_xfrmi = yes` is set, `strongswan-mod-farp` works too. no needed to set `proxy_arp` anymore.
