### DISCUSSION TITLE
Site to Site VPN connection, client can't access each other.

### DISCUSSION THREAD

**Discussion by DeWaRs1206** [strongswan/strongswan#2510] [Q&A]
Hello,

I'm new to StrongSwan and try to achieve a basic Site to Site connection between two Openstack Region. Here is an overview of the plan. Operating system for all servers is Ubuntu 22.04
For the moment, iptables / ufw is disable on all servers. 
I have redacted public IPs for obvious reason. 

```

     GRA11 Client  ----------- GRA11 GW  ======================  BHS3 GW ---------------------- BSH3 Client
ens3: 91.134.XXX.XXX            ens3: 57.128.XXX.XXX         ens3: 54.39.XXX.XXX                  ens3: 54.39.XXX.XXX
ens7: 10.2.0.5/24               ens7: 10.2.0.4/24            ens7: 10.1.0.8                       ens7:10.1.0.6
```

### For BHS3 GW:

- IP infos

```
root@bhs3-strongwan:~# ip a
1: lo: <LOOPBACK,UP,LOWER_UP> mtu 65536 qdisc noqueue state UNKNOWN group default qlen 1000
    link/loopback 00:00:00:00:00:00 brd 00:00:00:00:00:00
    inet 127.0.0.1/8 scope host lo
       valid_lft forever preferred_lft forever
    inet6 ::1/128 scope host
       valid_lft forever preferred_lft forever
2: ens3: <BROADCAST,MULTICAST,UP,LOWER_UP> mtu 1500 qdisc fq_codel state UP group default qlen 1000
    link/ether fa:16:3e:ab:a8:e9 brd ff:ff:ff:ff:ff:ff
    altname enp0s3
    inet 54.39.XXX.XXX/32 metric 100 scope global dynamic ens3
       valid_lft 75419sec preferred_lft 75419sec
    inet6 2607:5300:201:2100::92f/56 scope global
       valid_lft forever preferred_lft forever
    inet6 fe80::f816:3eff:feab:a8e9/64 scope link
       valid_lft forever preferred_lft forever
3: ens4: <BROADCAST,MULTICAST,UP,LOWER_UP> mtu 1500 qdisc fq_codel state UP group default qlen 1000
    link/ether fa:16:3e:ba:b7:fc brd ff:ff:ff:ff:ff:ff
    altname enp0s4
    inet 10.1.0.8/24 brd 10.1.0.255 scope global ens4
       valid_lft forever preferred_lft forever
    inet6 fe80::f816:3eff:feba:b7fc/64 scope link
       valid_lft forever preferred_lft forever
```

- swanctl -L
```
root@bhs3-strongwan:~# swanctl -L
host-to-host: IKEv2, no reauthentication, rekeying every 14400s
  local:  54.39.XXX.XXX
  remote: 57.128.XXX.XXX
  local pre-shared key authentication:
    id: 54.39.XXX.XXX
  remote pre-shared key authentication:
    id: 57.128.XXX.XXX
  net: TUNNEL, rekeying every 3600s
    local:  10.1.0.0/24
    remote: 10.2.0.0/24
```

- List SAS

```
root@bhs3-strongwan:~# sudo swanctl --list-sas
host-to-host: #7, ESTABLISHED, IKEv2, 73a42038fd5b7392_i 675b50f1a433c08b_r*
  local  '54.39.XXX.XXX' @ 54.39.XXX.XXX[4500]
  remote '57.128.XXX.XXX' @ 57.128.XXX.XXX[4500]
  AES_CBC-256/HMAC_SHA2_256_128/PRF_HMAC_SHA2_256/MODP_1024
  established 12853s ago, rekeying in 364s
  net: #16, reqid 1, INSTALLED, TUNNEL, ESP:AES_CBC-256/HMAC_SHA2_256_128/MODP_1024
    installed 2597s ago, rekeying in 895s, expires in 1363s
    in  ccd6527e,   5712 bytes,    68 packets,   172s ago
    out cf720a73,   5712 bytes,    68 packets,   172s ago
    local  10.1.0.0/24
    remote 10.2.0.0/24
```

- Routes:
```
root@bhs3-strongwan:~# ip route show table all
10.2.0.0/24 via 54.39.176.1 dev ens3 table 220 proto static src 10.1.0.8
default via 54.39.176.1 dev ens3 proto dhcp src 54.39.XXX.XXX metric 100
10.1.0.0/24 dev ens4 proto kernel scope link src 10.1.0.8
54.39.176.1 dev ens3 proto dhcp scope link src 54.39.XXX.XXX metric 100
213.186.33.99 via 54.39.176.1 dev ens3 proto dhcp src 54.39.XXX.XXX metric 100
local 10.1.0.8 dev ens4 table local proto kernel scope host src 10.1.0.8
broadcast 10.1.0.255 dev ens4 table local proto kernel scope link src 10.1.0.8
local 54.39.XXX.XXX dev ens3 table local proto kernel scope host src 54.39.XXX.XXX
local 127.0.0.0/8 dev lo table local proto kernel scope host src 127.0.0.1
local 127.0.0.1 dev lo table local proto kernel scope host src 127.0.0.1
broadcast 127.255.255.255 dev lo table local proto kernel scope link src 127.0.0.1
::1 dev lo proto kernel metric 256 pref medium
2607:5300:201:2100::/56 dev ens3 proto kernel metric 256 pref medium
fe80::/64 dev ens4 proto kernel metric 256 pref medium
fe80::/64 dev ens3 proto kernel metric 256 pref medium
default via 2607:5300:201:2100::1 dev ens3 proto static metric 1024 pref medium
local ::1 dev lo table local proto kernel metric 0 pref medium
local 2607:5300:201:2100::92f dev ens3 table local proto kernel metric 0 pref medium
local fe80::f816:3eff:feab:a8e9 dev ens3 table local proto kernel metric 0 pref medium
local fe80::f816:3eff:feba:b7fc dev ens4 table local proto kernel metric 0 pref medium
multicast ff00::/8 dev ens4 table local proto kernel metric 256 pref medium
multicast ff00::/8 dev ens3 table local proto kernel metric 256 pref medium
```

- Iptables
```
root@bhs3-strongwan:~# iptables -S
-P INPUT ACCEPT
-P FORWARD ACCEPT
-P OUTPUT ACCEPT
-A FORWARD -s 10.2.0.0/24 -d 10.1.0.0/24 -i ens3 -m policy --dir in --pol ipsec --reqid 1 --proto esp -j ACCEPT
-A FORWARD -s 10.1.0.0/24 -d 10.2.0.0/24 -o ens3 -m policy --dir out --pol ipsec --reqid 1 --proto esp -j ACCEPT
```

### For GRA11 GW:
- IP Infos:
```
root@gra11-strongswan:~# ip a
1: lo: <LOOPBACK,UP,LOWER_UP> mtu 65536 qdisc noqueue state UNKNOWN group default qlen 1000
    link/loopback 00:00:00:00:00:00 brd 00:00:00:00:00:00
    inet 127.0.0.1/8 scope host lo
       valid_lft forever preferred_lft forever
    inet6 ::1/128 scope host
       valid_lft forever preferred_lft forever
2: ens3: <BROADCAST,MULTICAST,UP,LOWER_UP> mtu 1500 qdisc fq_codel state UP group default qlen 1000
    link/ether fa:16:3e:27:b3:77 brd ff:ff:ff:ff:ff:ff
    altname enp0s3
    inet 57.128.XXX.XXX/32 metric 100 scope global dynamic ens3
       valid_lft 76082sec preferred_lft 76082sec
    inet6 2001:41d0:304:300::5068/56 scope global
       valid_lft forever preferred_lft forever
    inet6 fe80::f816:3eff:fe27:b377/64 scope link
       valid_lft forever preferred_lft forever
3: ens4: <BROADCAST,MULTICAST,UP,LOWER_UP> mtu 1500 qdisc fq_codel state UP group default qlen 1000
    link/ether fa:16:3e:04:ff:ab brd ff:ff:ff:ff:ff:ff
    altname enp0s4
    inet 10.2.0.4/24 brd 10.2.0.255 scope global ens4
       valid_lft forever preferred_lft forever
    inet6 fe80::f816:3eff:fe04:ffab/64 scope link
       valid_lft forever preferred_lft forever
```

- swanctl -L
```
root@gra11-strongswan:~# swanctl -L
host-to-host: IKEv2, no reauthentication, rekeying every 14400s
  local:  57.128.XXX.XXX
  remote: 54.39.XXX.XXX
  local pre-shared key authentication:
    id: 57.128.XXX.XXX
  remote pre-shared key authentication:
    id: 54.39.XXX.XXX
  net: TUNNEL, rekeying every 3600s
    local:  10.2.0.0/24
    remote: 10.1.0.0/24
```

- List sas
```
root@gra11-strongswan:~# swanctl --list-sas
host-to-host: #11, ESTABLISHED, IKEv2, 73a42038fd5b7392_i* 675b50f1a433c08b_r
  local  '57.128.XXX.XXX' @ 57.128.XXX.XXX[4500]
  remote '54.39.XXX.XXX' @ 54.39.XXX.XXX[4500]
  AES_CBC-256/HMAC_SHA2_256_128/PRF_HMAC_SHA2_256/MODP_1024
  established 13060s ago, rekeying in 577s
  net: #17, reqid 1, INSTALLED, TUNNEL, ESP:AES_CBC-256/HMAC_SHA2_256_128/MODP_1024
    installed 2803s ago, rekeying in 645s, expires in 1157s
    in  cf720a73,   5712 bytes,    68 packets,   378s ago
    out ccd6527e,   5712 bytes,    68 packets,   378s ago
    local  10.2.0.0/24
    remote 10.1.0.0/24
```

- Routes 
```
root@gra11-strongswan:~# ip route show table all
10.1.0.0/24 via 57.128.80.1 dev ens3 table 220 proto static src 10.2.0.4
default via 57.128.80.1 dev ens3 proto dhcp src 57.128.85.138 metric 100
10.2.0.0/24 dev ens4 proto kernel scope link src 10.2.0.4
57.128.80.1 dev ens3 proto dhcp scope link src 57.128.XXX.XXX metric 100
213.186.XXX.XXX via 57.128.80.1 dev ens3 proto dhcp src 57.128.XXX.XXX metric 100
local 10.2.0.4 dev ens4 table local proto kernel scope host src 10.2.0.4
broadcast 10.2.0.255 dev ens4 table local proto kernel scope link src 10.2.0.4
local 57.128.XXX.XXX dev ens3 table local proto kernel scope host src 57.128.XXX.XXX
local 127.0.0.0/8 dev lo table local proto kernel scope host src 127.0.0.1
local 127.0.0.1 dev lo table local proto kernel scope host src 127.0.0.1
broadcast 127.255.255.255 dev lo table local proto kernel scope link src 127.0.0.1
::1 dev lo proto kernel metric 256 pref medium
2001:41d0:304:300::/56 dev ens3 proto kernel metric 256 pref medium
fe80::/64 dev ens4 proto kernel metric 256 pref medium
fe80::/64 dev ens3 proto kernel metric 256 pref medium
default via 2001:41d0:304:300::1 dev ens3 proto static metric 1024 pref medium
local ::1 dev lo table local proto kernel metric 0 pref medium
local 2001:41d0:304:300::5068 dev ens3 table local proto kernel metric 0 pref medium
local fe80::f816:3eff:fe04:ffab dev ens4 table local proto kernel metric 0 pref medium
local fe80::f816:3eff:fe27:b377 dev ens3 table local proto kernel metric 0 pref medium
multicast ff00::/8 dev ens4 table local proto kernel metric 256 pref medium
multicast ff00::/8 dev ens3 table local proto kernel metric 256 pref medium
```

- Iptables
```
root@gra11-strongswan:~# iptables -S
-P INPUT ACCEPT
-P FORWARD ACCEPT
-P OUTPUT ACCEPT
-A FORWARD -s 10.1.0.0/24 -d 10.2.0.0/24 -i ens3 -m policy --dir in --pol ipsec --reqid 1 --proto esp -j ACCEPT
-A FORWARD -s 10.2.0.0/24 -d 10.1.0.0/24 -o ens3 -m policy --dir out --pol ipsec --reqid 1 --proto esp -j ACCEPT
```

### BSH3 Client

- IP Infos
```
root@bhs3-client:~# ip a
1: lo: <LOOPBACK,UP,LOWER_UP> mtu 65536 qdisc noqueue state UNKNOWN group default qlen 1000
    link/loopback 00:00:00:00:00:00 brd 00:00:00:00:00:00
    inet 127.0.0.1/8 scope host lo
       valid_lft forever preferred_lft forever
    inet6 ::1/128 scope host
       valid_lft forever preferred_lft forever
2: ens3: <BROADCAST,MULTICAST,UP,LOWER_UP> mtu 1500 qdisc fq_codel state UP group default qlen 1000
    link/ether fa:16:3e:28:15:5b brd ff:ff:ff:ff:ff:ff
    altname enp0s3
    inet 54.39.XXX.XXX/32 metric 100 scope global dynamic ens3
       valid_lft 74590sec preferred_lft 74590sec
    inet6 2607:5300:201:2100::9bf/56 scope global
       valid_lft forever preferred_lft forever
    inet6 fe80::f816:3eff:fe28:155b/64 scope link
       valid_lft forever preferred_lft forever
3: ens4: <BROADCAST,MULTICAST,UP,LOWER_UP> mtu 1500 qdisc fq_codel state UP group default qlen 1000
    link/ether fa:16:3e:2e:34:46 brd ff:ff:ff:ff:ff:ff
    altname enp0s4
    inet 10.1.0.6/24 brd 10.1.0.255 scope global ens4
       valid_lft forever preferred_lft forever
    inet6 fe80::f816:3eff:fe2e:3446/64 scope link
       valid_lft forever preferred_lft forever
```

- Routes

```
root@bhs3-client:~# ip route show table all
default via 54.39.176.1 dev ens3 proto dhcp src 54.39.XXX.XXX metric 100
10.1.0.0/24 dev ens4 proto kernel scope link src 10.1.0.6
10.2.0.0/24 via 10.1.0.8 dev ens4 proto static
54.39.176.1 dev ens3 proto dhcp scope link src 54.39.XXX.XXX metric 100
213.186.33.99 via 54.39.176.1 dev ens3 proto dhcp src 54.39.XXX.XXX metric 100
local 10.1.0.6 dev ens4 table local proto kernel scope host src 10.1.0.6
broadcast 10.1.0.255 dev ens4 table local proto kernel scope link src 10.1.0.6
local 54.39.XXX.XXX dev ens3 table local proto kernel scope host src 54.39.XXX.XXX
local 127.0.0.0/8 dev lo table local proto kernel scope host src 127.0.0.1
local 127.0.0.1 dev lo table local proto kernel scope host src 127.0.0.1
broadcast 127.255.255.255 dev lo table local proto kernel scope link src 127.0.0.1
::1 dev lo proto kernel metric 256 pref medium
2607:5300:201:2100::/56 dev ens3 proto kernel metric 256 pref medium
fe80::/64 dev ens4 proto kernel metric 256 pref medium
fe80::/64 dev ens3 proto kernel metric 256 pref medium
default via 2607:5300:201:2100::1 dev ens3 proto static metric 1024 pref medium
local ::1 dev lo table local proto kernel metric 0 pref medium
local 2607:5300:201:2100::9bf dev ens3 table local proto kernel metric 0 pref medium
local fe80::f816:3eff:fe28:155b dev ens3 table local proto kernel metric 0 pref medium
local fe80::f816:3eff:fe2e:3446 dev ens4 table local proto kernel metric 0 pref medium
multicast ff00::/8 dev ens4 table local proto kernel metric 256 pref medium
multicast ff00::/8 dev ens3 table local proto kernel metric 256 pref medium
```

### GRA11 Client

- IP Infos
```
root@gra11-client:~# ip a
1: lo: <LOOPBACK,UP,LOWER_UP> mtu 65536 qdisc noqueue state UNKNOWN group default qlen 1000
    link/loopback 00:00:00:00:00:00 brd 00:00:00:00:00:00
    inet 127.0.0.1/8 scope host lo
       valid_lft forever preferred_lft forever
    inet6 ::1/128 scope host
       valid_lft forever preferred_lft forever
2: ens3: <BROADCAST,MULTICAST,UP,LOWER_UP> mtu 1500 qdisc fq_codel state UP group default qlen 1000
    link/ether fa:16:3e:b6:61:93 brd ff:ff:ff:ff:ff:ff
    altname enp0s3
    inet 91.134.XXX.XXX/32 metric 100 scope global dynamic ens3
       valid_lft 75081sec preferred_lft 75081sec
    inet6 2001:41d0:304:300::5db8/56 scope global
       valid_lft forever preferred_lft forever
    inet6 fe80::f816:3eff:feb6:6193/64 scope link
       valid_lft forever preferred_lft forever
3: ens4: <BROADCAST,MULTICAST,UP,LOWER_UP> mtu 1500 qdisc fq_codel state UP group default qlen 1000
    link/ether fa:16:3e:98:18:0e brd ff:ff:ff:ff:ff:ff
    altname enp0s4
    inet 10.2.0.5/24 brd 10.2.0.255 scope global ens4
       valid_lft forever preferred_lft forever
    inet6 fe80::f816:3eff:fe98:180e/64 scope link
       valid_lft forever preferred_lft forever
```

- Routes
```
root@gra11-client:~# ip route show table all
default via 91.134.11.1 dev ens3 proto dhcp src 91.134.XXX.XXX metric 100
10.1.0.0/24 via 10.2.0.4 dev ens4 proto static
10.2.0.0/24 dev ens4 proto kernel scope link src 10.2.0.5
91.134.11.1 dev ens3 proto dhcp scope link src 91.134.XXX.XXX metric 100
213.186.XXX.XXX via 91.134.11.1 dev ens3 proto dhcp src 91.134.XXX.XXX metric 100
local 10.2.0.5 dev ens4 table local proto kernel scope host src 10.2.0.5
broadcast 10.2.0.255 dev ens4 table local proto kernel scope link src 10.2.0.5
local 91.134.XXX.XXX dev ens3 table local proto kernel scope host src 91.134.XXX.XXX
local 127.0.0.0/8 dev lo table local proto kernel scope host src 127.0.0.1
local 127.0.0.1 dev lo table local proto kernel scope host src 127.0.0.1
broadcast 127.255.255.255 dev lo table local proto kernel scope link src 127.0.0.1
::1 dev lo proto kernel metric 256 pref medium
2001:41d0:304:300::/56 dev ens3 proto kernel metric 256 pref medium
fe80::/64 dev ens4 proto kernel metric 256 pref medium
fe80::/64 dev ens3 proto kernel metric 256 pref medium
default via 2001:41d0:304:300::1 dev ens3 proto static metric 1024 pref medium
local ::1 dev lo table local proto kernel metric 0 pref medium
local 2001:41d0:304:300::5db8 dev ens3 table local proto kernel metric 0 pref medium
local fe80::f816:3eff:fe98:180e dev ens4 table local proto kernel metric 0 pref medium
local fe80::f816:3eff:feb6:6193 dev ens3 table local proto kernel metric 0 pref medium
multicast ff00::/8 dev ens4 table local proto kernel metric 256 pref medium
multicast ff00::/8 dev ens3 table local proto kernel metric 256 pref medium
```

The VPN connection seems to works, from GRA11 GW I can ping BHS3 GW using private IP, but clients can't ping each other nor the opposite gateway. Ping between client / gateway in the same region works. 

I'm obviously missing something probably very basics, but I can't understand what. 

Does anyone has any idea ?

Thanks in advance !

**Comment by tobiasbrunner** [comment]
Try reading [the docs](https://docs.strongswan.org/docs/5.9/howtos/forwarding.html).

**Comment by DeWaRs1206** [comment]
Hello @tobiasbrunner ,

Thanks for your answer. I read this doc already, but I can't find my problem / solution here. 
If I'm not wrong, my configuration use Split-Tunneling so everything should works by design ?

```
With split-tunneling the clients will only send traffic for specific destination subnets to the gateway. For both protocol versions split-tunneling is easy to deploy f traffic selectors (TS) can freely be configured on both peers. In that case you’d simply use specific values for the local_ts and remote_ts options.
```

Or did I miss something ?

**Reply by tobiasbrunner** [reply]
Depends on routing, firewall rules (forwarding or NAT), forwarding config etc. And no, split-tunneling doesn't just work, in particular not for hosts beyond the VPN gateways (these clients don't know anything about split-tunneling or the VPN and might not send traffic for the remote networks to the VPN gateways).

**Reply by DeWaRs1206** [reply]
From this example here https://www.strongswan.org/testing/testresults/ikev2/net2net-cert/ my understanding is:
- Client Alice has as gateway 10.1.0.1 configured. 
- Gateway Moon would receive the trafic from Client Alice and forward it to Gateway Sun. 

So in my case, the issue is the configuration in Gateway Moon? Nothing to fix on the client side ?

**Reply by tobiasbrunner** [reply]
Possible, you'd have to check traffic counters, capture traffic etc. to see where packets might get stuck. And at least this route on one of the gateways looks kinda weird:

> root@gra11-strongswan:~# ip route
> ...
> 10.1.0.0/16 via 10.2.0.9 dev ens7
> ...

it should probably be more like this:

    10.1.0.0/16 via 141.94.172.1 dev ens3 proto static src 10.2.0.9

Also note that strongSwan installs routes for remote networks automatically in table 220 (so that route might not actually have any effect).

**Reply by DeWaRs1206** [reply]
Thanks for the details. I will continue my investigations... 
I noticed that updown config was pointing to the wrong file path, so had no effect. I updated my configuration, iptables rules looks more similar as the one in the example. 

I will update my initial message with the new routes / outputs

**Reply by DeWaRs1206** [reply]
Hello @tobiasbrunner,

I restarted everything from scratch (new servers) so I updated my initial message with couple of more information. 
So far, no progress, ping between the 2 GW using private IP works. 

From BHS3 client (10.1.0.6) when I ping GRA11 GW the ping seems to reach GRA11 GW:

```
root@gra11-strongswan:~# tcpdump -i any icmp -vvv
tcpdump: data link type LINUX_SLL2
tcpdump: listening on any, link-type LINUX_SLL2 (Linux cooked v2), snapshot length 262144 bytes
06:41:28.889925 ens3  In  IP (tos 0x0, ttl 63, id 33334, offset 0, flags [DF], proto ICMP (1), length 84)
    10.1.0.6 > gra11-strongswan: ICMP echo request, id 5, seq 41, length 64
06:41:29.913912 ens3  In  IP (tos 0x0, ttl 63, id 33387, offset 0, flags [DF], proto ICMP (1), length 84)
    10.1.0.6 > gra11-strongswan: ICMP echo request, id 5, seq 42, length 64
06:41:30.937651 ens3  In  IP (tos 0x0, ttl 63, id 33398, offset 0, flags [DF], proto ICMP (1), length 84)
    10.1.0.6 > gra11-strongswan: ICMP echo request, id 5, seq 43, length 64
06:41:31.961861 ens3  In  IP (tos 0x0, ttl 63, id 33629, offset 0, flags [DF], proto ICMP (1), length 84)
    10.1.0.6 > gra11-strongswan: ICMP echo request, id 5, seq 44, length 64
06:41:32.985916 ens3  In  IP (tos 0x0, ttl 63, id 33704, offset 0, flags [DF], proto ICMP (1), length 84)
    10.1.0.6 > gra11-strongswan: ICMP echo request, id 5, seq 45, length 64
```

But the client never receive an answer:
```
root@bhs3-client:~# ping 10.2.0.4
PING 10.2.0.4 (10.2.0.4) 56(84) bytes of data.
^C
--- 10.2.0.4 ping statistics ---
143 packets transmitted, 0 received, 100% packet loss, time 145389ms
``` 
From the BHS3 GW, I can see the ping coming trough:

```
root@bhs3-strongwan:~# tcpdump -i any src 10.1.0.6
tcpdump: data link type LINUX_SLL2
tcpdump: verbose output suppressed, use -v[v]... for full protocol decode
listening on any, link-type LINUX_SLL2 (Linux cooked v2), snapshot length 262144 bytes
06:44:06.910126 ens4  In  IP 10.1.0.6 > 10.2.0.4: ICMP echo request, id 6, seq 1, length 64
06:44:07.920334 ens4  In  IP 10.1.0.6 > 10.2.0.4: ICMP echo request, id 6, seq 2, length 64
06:44:08.944362 ens4  In  IP 10.1.0.6 > 10.2.0.4: ICMP echo request, id 6, seq 3, length 64
06:44:09.968359 ens4  In  IP 10.1.0.6 > 10.2.0.4: ICMP echo request, id 6, seq 4, length 64
06:44:10.992436 ens4  In  IP 10.1.0.6 > 10.2.0.4: ICMP echo request, id 6, seq 5, length 64
06:44:12.016584 ens4  In  IP 10.1.0.6 > 10.2.0.4: ICMP echo request, id 6, seq 6, length 64
06:44:13.040466 ens4  In  IP 10.1.0.6 > 10.2.0.4: ICMP echo request, id 6, seq 7, length 64
```

```
BHS3 Client:
root@bhs3-client:~# tcpdump -i any icmp
tcpdump: data link type LINUX_SLL2
tcpdump: verbose output suppressed, use -v[v]... for full protocol decode
listening on any, link-type LINUX_SLL2 (Linux cooked v2), snapshot length 262144 bytes
07:08:28.175217 ens4  Out IP bhs3-client > 10.2.0.4: ICMP echo request, id 9, seq 1, length 64
07:08:29.202490 ens4  Out IP bhs3-client > 10.2.0.4: ICMP echo request, id 9, seq 2, length 64
07:08:30.226473 ens4  Out IP bhs3-client > 10.2.0.4: ICMP echo request, id 9, seq 3, length 64
```


From the documentation, I assume I'm in this scenario: 

**The virtual IPs are from a distinct subnet / In site-to-site scenarios**
If the VPN gateway is the default gateway of the accessed LAN nothing special has to be done. If this is not the case, either add a route on all hosts behind the gateway (manually or e.g. via [DHCP option 121](https://datatracker.ietf.org/doc/html/rfc3442)), telling them that the subnet from which virtual IP addresses are assigned to roadwarriors or remote subnets in site-to-site scenarios can be reached through the VPN gateway.

On the GRA11 client, looks like the route requested is set:

```
10.1.0.0/24 via 10.2.0.4 dev ens4 proto static
```

I know this is probably not a Strongswan issue anymore, but any help would be more than appreciate !!

Thanks !

**Reply by tobiasbrunner** [reply]
Question is what the GRA11 GW does with the packet. Possibly there is a firewall rule that does something (check nft as well, not only iptables).
