### DISCUSSION TITLE
Can't HA make work

### DISCUSSION THREAD

**Discussion by khramov86** [strongswan/strongswan#406] [Q&A] [answered]
Hi,

While trying to make HA configuration work - faced with several problems.
1. While connections up - there is no traffic between networks, same time association working well
2. `ip ro show table 220` shows that src address taken from interface address, not VIP even if leftsourceip specified:
```
172.16.0.0/24 via 83.229.25.1 dev eth1 proto static src 10.9.0.194
172.16.252.0/23 via 83.229.25.1 dev eth1 proto static src 10.9.0.194
```

3. On both hosts have such messages in tcpdump
```
09:26:54.237412 IP 10.9.0.194 > 10.9.0.72: ICMP 10.9.0.194 udp port 4510 unreachable, length 41
09:26:55.237556 IP 10.9.0.194 > 10.9.0.72: ICMP 10.9.0.194 udp port 4510 unreachable, length 41
09:26:56.237636 IP 10.9.0.194 > 10.9.0.72: ICMP 10.9.0.194 udp port 4510 unreachable, length 41
09:26:57.237779 IP 10.9.0.194 > 10.9.0.72: ICMP 10.9.0.194 udp port 4510 unreachable, length 41
09:26:58.237967 IP 10.9.0.194 > 10.9.0.72: ICMP 10.9.0.194 udp port 4510 unreachable, length 41
09:26:59.238053 IP 10.9.0.194 > 10.9.0.72: ICMP 10.9.0.194 udp port 4510 unreachable, length 41
```
`ss -tunlp |grep 4510` returns nothing

Thanks for help!

### My setup
```
             VM1                                 Strongswan HOST1                   VM3
(172.16.x.x subnets)  ==> vCloud  IPSEC   ===   | - HA (VIPs 128.0.5.13/10.9.0.162)        <==  (10.9.0.0/24 subnet)
             VM2                                 Strongswan HOST2                   VM4
```

#### On Strongswan HOST1 
iptables-save
```
# Generated by iptables-save v1.4.21 on Tue May 18 09:10:37 2021
*filter
:INPUT ACCEPT [3442:231259]
:FORWARD ACCEPT [1:412]
:OUTPUT ACCEPT [112769:8273382]
-A INPUT -p udp -j ACCEPT
-A INPUT -p icmp -j ACCEPT
-A INPUT -d 128.0.5.13/32 -i eth1 -j CLUSTERIP --new --hashmode sourceip --clustermac 01:00:C0:A8:00:05 --total-nodes 1 --local-node 0 --hash-init 0
-A INPUT -d 10.9.0.162/32 -i eth0 -j CLUSTERIP --new --hashmode sourceip --clustermac 01:00:0A:01:00:05 --total-nodes 1 --local-node 0 --hash-init 0
-A INPUT -p udp -m udp --sport 4510 --dport 4510 -j ACCEPT
-A INPUT -p icmp -m icmp --icmp-type 3 -j ACCEPT
-A INPUT -d 224.0.0.1/32 -p igmp -j ACCEPT
-A INPUT -p esp -j ACCEPT
-A FORWARD -s 10.9.0.0/24 -d 172.16.0.0/16 -j ACCEPT
-A FORWARD -s 172.16.0.0/16 -d 10.9.0.0/24 -j ACCEPT
-A FORWARD -p esp -j ACCEPT
-A OUTPUT -p udp -m udp --sport 4510 --dport 4510 -j ACCEPT
-A OUTPUT -s 224.0.0.1/32 -p igmp -j ACCEPT
-A OUTPUT -p esp -j ACCEPT
COMMIT
# Completed on Tue May 18 09:10:37 2021
```
ipsec.conf
```
config setup

conn %default
  dpdaction=clear
  dpddelay=35s
  dpdtimeout=300s
  reauth=no
  rekey=yes
  mobike=yes
  ike=aes128-sha256-modp1536!
  esp=aes128-sha256-modp1536!
  lifetime=1h
  ikelifetime=28800
  rekeymargin=3m
  lifebytes=0
  lifepackets=0
  keyingtries=20

conn test
  authby=secret
  auto=start
  leftid=128.0.5.13
  left=128.0.5.13
  leftsubnet=10.9.0.0/24
  rightid=128.0.6.10
  right=128.0.6.10
  rightsubnet=172.16.252.0/23
  ikelifetime=28800
  keyexchange=ikev2

conn test2
  also=test
  auto=route
  leftsubnet=10.9.0.0/24
  rightsubnet=172.16.0.0/24
```
strongswan.conf
```
charon {
        load_modular = yes
        plugins {
                include strongswan.d/charon/*.conf
        ha {
                local = 10.9.0.194
                remote = 10.9.0.72
                segment_count = 1
                fifo_interface = yes
                monitor = yes
        }
        }
        filelog {
                strongswan {
                path = /var/log/strongswan.log
                time_format = %Y-%m-%dT%T%z
                default = 1
                mgr = 0
                net = 1
                enc = 1
                asn = 1
                job = 1
                ike_name = yes
                append = no
                flush_line = yes

                }
        }

}
```
ip -4 a
```
1: lo: <LOOPBACK,UP,LOWER_UP> mtu 65536 qdisc noqueue state UNKNOWN group default qlen 1000
    inet 127.0.0.1/8 scope host lo
       valid_lft forever preferred_lft forever
2: eth0: <BROADCAST,MULTICAST,UP,LOWER_UP> mtu 1500 qdisc pfifo_fast state UP group default qlen 1000
    inet 10.9.0.194/24 brd 10.9.0.255 scope global noprefixroute dynamic eth0
       valid_lft 86371sec preferred_lft 86371sec
    inet 10.9.0.162/24 scope global secondary eth0
       valid_lft forever preferred_lft forever
3: eth1: <BROADCAST,MULTICAST,UP,LOWER_UP> mtu 1500 qdisc pfifo_fast state UP group default qlen 1000
    inet 128.0.5.14/24 brd 128.0.5.255 scope global noprefixroute dynamic eth1
       valid_lft 86371sec preferred_lft 86371sec
    inet 128.0.5.13/24 scope global secondary eth1
       valid_lft forever preferred_lft forever
```
ip ro show table all
```
172.16.0.0/24 via 128.0.5.1 dev eth1 table 220 proto static src 10.9.0.194
172.16.252.0/23 via 128.0.5.1 dev eth1 table 220 proto static src 10.9.0.194
default via 128.0.5.1 dev eth1 proto dhcp metric 50
default via 10.9.0.1 dev eth0 proto dhcp metric 101
10.9.0.0/24 dev eth0 proto kernel scope link src 10.9.0.194 metric 101
45.147.162.0/24 dev eth1 proto dhcp scope link metric 50
128.0.5.0/24 dev eth1 proto kernel scope link src 128.0.5.14 metric 50
169.254.169.254 via 128.0.5.11 dev eth1 proto dhcp metric 50
169.254.169.254 via 10.9.0.2 dev eth0 proto dhcp metric 101
broadcast 10.9.0.0 dev eth0 table local proto kernel scope link src 10.9.0.194
local 10.9.0.162 dev eth0 table local proto kernel scope host src 10.9.0.194
local 10.9.0.194 dev eth0 table local proto kernel scope host src 10.9.0.194
broadcast 10.9.0.255 dev eth0 table local proto kernel scope link src 10.9.0.194
broadcast 128.0.5.0 dev eth1 table local proto kernel scope link src 128.0.5.14
local 128.0.5.13 dev eth1 table local proto kernel scope host src 128.0.5.14
local 128.0.5.14 dev eth1 table local proto kernel scope host src 128.0.5.14
broadcast 128.0.5.255 dev eth1 table local proto kernel scope link src 128.0.5.14
broadcast 127.0.0.0 dev lo table local proto kernel scope link src 127.0.0.1
local 127.0.0.0/8 dev lo table local proto kernel scope host src 127.0.0.1
local 127.0.0.1 dev lo table local proto kernel scope host src 127.0.0.1
broadcast 127.255.255.255 dev lo table local proto kernel scope link src 127.0.0.1
unreachable default dev lo proto kernel metric 4294967295 error -101 pref medium
unreachable ::/96 dev lo metric 1024 error -113 pref medium
unreachable ::ffff:0.0.0.0/96 dev lo metric 1024 error -113 pref medium
unreachable 2002:a00::/24 dev lo metric 1024 error -113 pref medium
unreachable 2002:7f00::/24 dev lo metric 1024 error -113 pref medium
unreachable 2002:a9fe::/32 dev lo metric 1024 error -113 pref medium
unreachable 2002:ac10::/28 dev lo metric 1024 error -113 pref medium
unreachable 2002:c0a8::/32 dev lo metric 1024 error -113 pref medium
unreachable 2002:e000::/19 dev lo metric 1024 error -113 pref medium
unreachable 3ffe:ffff::/32 dev lo metric 1024 error -113 pref medium
fe80::/64 dev eth1 proto kernel metric 100 pref medium
fe80::/64 dev eth0 proto kernel metric 256 pref medium
unreachable default dev lo proto kernel metric 4294967295 error -101 pref medium
local ::1 dev lo table local proto unspec metric 0 pref medium
local fe80::bcaf:f193:407c:22f0 dev lo table local proto unspec metric 0 pref medium
local fe80::f816:3eff:fed9:584f dev lo table local proto unspec metric 0 pref medium
ff00::/8 dev eth1 table local metric 256 pref medium
ff00::/8 dev eth0 table local metric 256 pref medium
unreachable default dev lo proto kernel metric 4294967295 error -101 pref medium
```
#### On Strongswan HOST2
iptables-save
```
# Generated by iptables-save v1.4.21 on Tue May 18 09:18:25 2021
*filter
:INPUT ACCEPT [15456:9446548]
:FORWARD ACCEPT [4:1608]
:OUTPUT ACCEPT [11537:1413243]
-A INPUT -d 128.0.5.13/32 -i eth1 -j CLUSTERIP --new --hashmode sourceip --clustermac 01:00:C0:A8:00:05 --total-nodes 1 --local-node 0 --hash-init 0
-A INPUT -d 10.9.0.162/32 -i eth0 -j CLUSTERIP --new --hashmode sourceip --clustermac 01:00:0A:01:00:05 --total-nodes 1 --local-node 0 --hash-init 0
-A INPUT -p udp -m udp --sport 4510 --dport 4510 -j ACCEPT
-A INPUT -p icmp -m icmp --icmp-type 3 -j ACCEPT
-A INPUT -d 224.0.0.1/32 -p igmp -j ACCEPT
-A INPUT -p esp -j ACCEPT
-A FORWARD -s 10.9.0.0/24 -d 172.16.0.0/16 -j ACCEPT
-A FORWARD -s 172.16.0.0/16 -d 10.9.0.0/24 -j ACCEPT
-A FORWARD -p esp -j ACCEPT
-A OUTPUT -p udp -m udp --sport 4510 --dport 4510 -j ACCEPT
-A OUTPUT -s 224.0.0.1/32 -p igmp -j ACCEPT
-A OUTPUT -p esp -j ACCEPT
COMMIT
# Completed on Tue May 18 09:18:25 2021
```
ipsec.conf
```
config setup



conn %default
  dpdaction=clear
  dpddelay=30s
  dpdtimeout=300s
  reauth=no
  rekey=yes
  mobike=yes
  ike=aes128-sha256-modp1536!
  esp=aes128-sha256-modp1536!
  lifetime=1h
  ikelifetime=28800
  rekeymargin=10m
  lifebytes=0
  lifepackets=0
  keyingtries=20

conn test
  authby=secret
  auto=start
  leftid=128.0.5.13
  left=128.0.5.13

  leftsubnet=10.9.0.0/24
  rightid=128.0.6.10
  right=128.0.6.10
  rightsubnet=172.16.252.0/23
  ikelifetime=28800
  keyexchange=ikev2

conn test2
  also=test
  auto=route
  leftsubnet=10.9.0.0/24
  rightsubnet=172.16.0.0/24
```
strongswan.conf
```
charon {
        load_modular = yes
        plugins {
                include strongswan.d/charon/*.conf
        ha {
                local = 10.9.0.72
                remote = 10.9.0.194
                segment_count = 1
                fifo_interface = yes
                monitor = yes
        }
        }
        filelog {
                strongswan {
                path = /var/log/strongswan.log
                time_format = %Y-%m-%dT%T%z
                default = 1
                mgr = 0
                net = 1
                enc = 1
                asn = 1
                job = 1
                ike_name = yes
                append = no
                flush_line = yes

                }
        }

}
```
ip -4 a
```
1: lo: <LOOPBACK,UP,LOWER_UP> mtu 65536 qdisc noqueue state UNKNOWN group default qlen 1000
    inet 127.0.0.1/8 scope host lo
       valid_lft forever preferred_lft forever
2: eth0: <BROADCAST,MULTICAST,UP,LOWER_UP> mtu 1500 qdisc pfifo_fast state UP group default qlen 1000
    inet 10.9.0.72/24 brd 10.9.0.255 scope global noprefixroute dynamic eth0
       valid_lft 69540sec preferred_lft 69540sec
    inet 10.9.0.162/24 brd 10.9.0.255 scope global secondary noprefixroute eth0
       valid_lft forever preferred_lft forever
3: eth1: <BROADCAST,MULTICAST,UP,LOWER_UP> mtu 1500 qdisc pfifo_fast state UP group default qlen 1000
    inet 128.0.5.12/24 brd 128.0.5.255 scope global noprefixroute dynamic eth1
       valid_lft 60750sec preferred_lft 60750sec
    inet 128.0.5.13/24 brd 128.0.5.255 scope global secondary noprefixroute eth1
       valid_lft forever preferred_lft forever
```
ip ro show table all
```
172.16.0.0/24 dev ipsec0 table 220 proto static src 10.9.0.72
172.16.252.0/23 dev ipsec0 table 220 proto static src 10.9.0.72
default via 128.0.5.1 dev eth1 proto dhcp metric 50
default via 10.9.0.1 dev eth0 proto dhcp metric 101
10.9.0.0/24 dev eth0 proto kernel scope link src 10.9.0.162 metric 101
10.9.0.0/24 dev eth0 proto kernel scope link src 10.9.0.72 metric 101
45.147.162.0/24 dev eth1 proto dhcp scope link metric 50
128.0.5.0/24 dev eth1 proto kernel scope link src 128.0.5.13 metric 50
128.0.5.0/24 dev eth1 proto kernel scope link src 128.0.5.12 metric 50
169.254.169.254 via 128.0.5.11 dev eth1 proto dhcp metric 50
169.254.169.254 via 10.9.0.2 dev eth0 proto dhcp metric 101
broadcast 10.9.0.0 dev eth0 table local proto kernel scope link src 10.9.0.72
local 10.9.0.72 dev eth0 table local proto kernel scope host src 10.9.0.72
local 10.9.0.162 dev eth0 table local proto kernel scope host src 10.9.0.72
broadcast 10.9.0.255 dev eth0 table local proto kernel scope link src 10.9.0.72
broadcast 128.0.5.0 dev eth1 table local proto kernel scope link src 128.0.5.12
local 128.0.5.13 dev eth1 table local proto kernel scope host src 128.0.5.12
local 128.0.5.12 dev eth1 table local proto kernel scope host src 128.0.5.12
broadcast 128.0.5.255 dev eth1 table local proto kernel scope link src 128.0.5.12
broadcast 127.0.0.0 dev lo table local proto kernel scope link src 127.0.0.1
local 127.0.0.0/8 dev lo table local proto kernel scope host src 127.0.0.1
local 127.0.0.1 dev lo table local proto kernel scope host src 127.0.0.1
broadcast 127.255.255.255 dev lo table local proto kernel scope link src 127.0.0.1
unreachable default dev lo proto kernel metric 4294967295 error -101 pref medium
unreachable ::/96 dev lo metric 1024 error -113 pref medium
unreachable ::ffff:0.0.0.0/96 dev lo metric 1024 error -113 pref medium
unreachable 2002:a00::/24 dev lo metric 1024 error -113 pref medium
unreachable 2002:7f00::/24 dev lo metric 1024 error -113 pref medium
unreachable 2002:a9fe::/32 dev lo metric 1024 error -113 pref medium
unreachable 2002:ac10::/28 dev lo metric 1024 error -113 pref medium
unreachable 2002:c0a8::/32 dev lo metric 1024 error -113 pref medium
unreachable 2002:e000::/19 dev lo metric 1024 error -113 pref medium
unreachable 3ffe:ffff::/32 dev lo metric 1024 error -113 pref medium
fe80::/64 dev eth1 proto kernel metric 100 pref medium
fe80::/64 dev eth0 proto kernel metric 256 pref medium
fe80::/64 dev ipsec0 proto kernel metric 256 pref medium
unreachable default dev lo proto kernel metric 4294967295 error -101 pref medium
local ::1 dev lo table local proto unspec metric 0 pref medium
local fe80::b34e:391f:b605:4204 dev lo table local proto unspec metric 0 pref medium
local fe80::d3e1:db70:a6de:9883 dev lo table local proto unspec metric 0 pref medium
local fe80::f816:3eff:feb6:8758 dev lo table local proto unspec metric 0 pref medium
ff00::/8 dev eth1 table local metric 256 pref medium
ff00::/8 dev eth0 table local metric 256 pref medium
ff00::/8 dev ipsec0 table local metric 256 pref medium
unreachable default dev lo proto kernel metric 4294967295 error -101 pref medium
```
##### Log-files for both hosts
[host1.log](https://github.com/strongswan/strongswan/files/6498895/host1.log)
[host2.log](https://github.com/strongswan/strongswan/files/6498896/host2.log)

**Comment by tobiasbrunner** [comment, marked as answer]
Your hosts don't seem to be configured correctly. Host1 doesn't load the _ha_ plugin, while Host2 does but it also loads the _kernel-libipsec_ plugin that you don't want when using the _ha_ plugin.

> `ip ro show table 220` shows that src address taken from interface address, not VIP even if leftsourceip specified:

For each remote traffic selector a single route is installed and the source IP is one that's included in a local traffic selector for the installed policy. You can't really control this if you have multiple local traffic selectors and IPs (in particular, `leftsourceip` is used to negotiate virtual IPs, not to set a static local IP).

> On both hosts have such messages in tcpdump

No idea. But you do have firewall rules for that port, why?

**Reply by khramov86** [reply]
Hi, Tobias!

Thank you for response!
1. Fixed config (there were no load = yes in included ha.conf). Also removed kernel-libipsec.
2. Thank you. Is there any way to raise priority for second IP on interface to force strongswan use it.
3. About 4510 port - thought that is requirement for ha (igmp + 4510 UPD between hosts), according to this setup:
https://www.strongswan.org/testing/testresults/ha/active-passive/alice.iptables-save
Am I wrong? By the way, after plugin on host1 been loaded successfully - that error have gone.

Can you please check logs now?
[host2.log](https://github.com/strongswan/strongswan/files/6499914/host2.log)
[host1.log](https://github.com/strongswan/strongswan/files/6499915/host1.log)

P.S. If I flush clusterip rules from iptables on host1 - traffic start go between hosts, but of course  HA will not work in this configuration.

**Reply by tobiasbrunner** [reply]
>     Is there any way to raise priority for second IP on interface to force strongswan use it.

Not really. But in your case, with two CHILD_SAs, it will depend on the order in which they are established.

>     thought that is requirement for ha (igmp + 4510 UPD between hosts)

You're right, the synchronization messages are sent on that port.

Note that the _ha_ plugin is not intended to work on initiators, only responders (i.e. only use `auto=add`, never `auto=start` or `auto=route` and don't use `ipsec up` on the servers either). So try initiating from a client.

**Reply by khramov86** [reply]
Hi, Tobias.

Tryed to change `auto=start` to `auto=add` - nothing changed. Maybe there is error in my ClusterIP configuration?

**Reply by khramov86** [reply]
Also tried to build custom kernel and strongswan with kernel headers - same result. Until I delete it cluster ip rule from iptables - nothing works (weights in /proc/net/ipt_CLUSTERIP sets correctly) 
@tobiasbrunner can you help with this, please.

**Reply by tobiasbrunner** [reply]
No, sorry.

**Reply by Thermi** [reply]
@khramov86 
You configured --total-nodes 1 and --local-node 0 on the two hosts.
Configure --total-nodes 2, --local-node 0 on your first host, and --local-node 1 on your second host.

**Reply by khramov86** [reply]
Hi, Thermi!

Thank you for response!

Tryied out to change total nodes on second host - same results. 
Strange behaviour with Cluster IP, tryied to delete cluster ip record in iptables, than readd and than set weight
`echo "+1" > /proc/net/ipt_CLUSTERIP/128.0.5.13`
After that everything works fine for 2-3 minutes, after that time traffic does not pass through the clusterip rule.

**Reply by khramov86** [reply]
Sorry, guys. 
The problem was on cloud provider side (they provide virtual IP with some arp caching or anti spoofing).
Also faced with same problems as described here:
https://wiki.strongswan.org/issues/2086

Thank you so much for support!

**Comment by Thermi** [comment]
Catching?!
Please elaborate.

Am June 2, 2021 10:15:35 AM UTC schrieb khramov86 ***@***.***>:
>Sorry, guys. 
>The problem was on cloud provider side (they provide virtual IP with
>some caching).
>Thank you so much for support!
>
>-- 
>You are receiving this because you commented.
>Reply to this email directly or view it on GitHub:
>https://github.com/strongswan/strongswan/discussions/406#discussioncomment-815086

-- 
Sent from mobile

**Reply by khramov86** [reply]
Don't know what was on provider side (they said that they cache arp and that there is anti spoofing on their side), but after provider NATed external ip to internal VIP - Cluster IP began to work perfectly, and HA in strongswan too.

**Reply by Thermi** [reply]
Well if they don't treat the cluster IP specially anti spoofing will break the setup, evidently. but what's the relevance of the external IP? What was the setup before?

**Reply by khramov86** [reply]
Cloud provider has own implementation of VIP
So we had two external ips assigned to VMs (128.0.5.12 and 128.0.5.14 ) + VIP (128.0.5.13).
I've tryied to prototype another stand with 1 external IP + NAT to internal VIP and everything worked without problems. After that we requested from cloud provider to make same thing (NAT external IP to local VIP) and everything is working now.
Thank you once again Thermi!

**Reply by Thermi** [reply]
Huh. You're welcome.
