### DISCUSSION TITLE
xfrm ipsec interface and routing vrf

### DISCUSSION THREAD

**Discussion by iluffk** [strongswan/strongswan#2720] [Q&A] [answered]
Hi.
I have some problem with strongswan and VRF.

my-left-side-SRV# swanctl -v
strongSwan swanctl 6.0.0

my-left-side-SRV# uname -r
6.6.13+bpo-amd64

remote side ip outer 10.252.72.98 and inside tunnel 169.254.255.5
my side outer ip 10.252.2.101, inside tunnel 169.254.255.6

I have built 6.0.0 strongswan, configure it and now have this setup on my side:
```
connections {
    l7-lb {
        version = 2
        proposals = aes256-sha256-x25519, aes128-sha256-x25519, aes256-sha256-modp2048, aes128-sha256-modp2048,aes128gcm16-x25519-sha256-aes256gcm16-modp2048-aes256ccm16-chacha20poly1305-aes192gcm16,chacha20poly1305-sha512-curve25519-prfsha512,aes256gcm16-sha384-prfsha384-ecp384
        remote_addrs = 10.252.72.98
        local_addrs = 10.252.2.101

        remote {
            auth = psk
            id = 10.252.72.98
              }
        local {
            auth = psk
            id = 10.252.2.101
               }
        children {
             l7-lb {
                remote_ts = 0.0.0.0/0
                local_ts = 0.0.0.0/0 
				esp_proposals = aes128gcm16, aes256gcm16, aes128gcm128-x25519-esn, chacha20poly1305
                mode = tunnel #transport
                policies_fwd_out = yes
                start_action = start
               # hw_offload = yes/auto/full
                mark_in = 624
                mark_out = 624
		if_id_in = 624
		if_id_out = 624
#		set_mark_out = 624
#		set_mark_in = 624
#		mode = pass
                }            
            }
    }
}
secrets {
    ike-l7-lb {
        id = 10.252.72.98
        secret = AAAAAAAAAAAAAAA
    }
}
```

my-left-side-SRV# swanctl -L
```
l7-lb: IKEv2, no reauthentication, rekeying every 14400s
  local:  10.252.2.101
  remote: 10.252.72.98
  local pre-shared key authentication:
    id: 10.252.2.101
  remote pre-shared key authentication:
    id: 10.252.72.98
  l7-lb: TUNNEL, rekeying every 3600s
    local:  0.0.0.0/0
    remote: 0.0.0.0/0
```

my-left-side-SRV# swanctl -l
```
l7-lb: #1, ESTABLISHED, IKEv2, 70e837125b7c3722_i* 95c24532e4a126b4_r
  local  '10.252.2.101' @ 10.252.2.101[4500]
  remote '10.252.72.98' @ 10.252.72.98[4500]
  AES_CBC-256/HMAC_SHA2_256_128/PRF_HMAC_SHA2_256/CURVE_25519
  established 126s ago, rekeying in 14005s
  l7-lb: #1, reqid 1, INSTALLED, TUNNEL-in-UDP, ESP:AES_GCM_16-128
    installed 126s ago, rekeying in 3412s, expires in 3834s
    in  b13c6314 (0x00000270|0x00000270), 127596 bytes,  1519 packets,     0s ago
    out c879ab45 (0x00000270|0x00000270), 1060461 bytes,  7138 packets,     0s ago
    local  0.0.0.0/0
    remote 0.0.0.0/0
```

after I created interface xfrm instead of vti:

```
 ip link add xfrm624 type xfrm dev ipsec0 if_id 624
  ip a add 169.254.255.6/30 dev xfrm624
  ip l set xfrm624  up
```

and its ok, remote side can ping my side via tunnel

tcpdump:
root@avi-ix-ipsec01:~# tcpdump -niany host 10.252.72.98 or icmp 
```
tcpdump: data link type LINUX_SLL2
tcpdump: verbose output suppressed, use -v[v]... for full protocol decode
listening on any, link-type LINUX_SLL2 (Linux cooked v2), snapshot length 262144 bytes
19:22:43.179574 ens3f0np0 In  IP 10.252.72.98.4500 > 10.252.2.101.4500: UDP-encap: ESP(spi=0x1810f066,seq=0x20e), length 120
19:22:43.179591 ipsec0 In  IP 169.254.255.5 > 169.254.255.6: ICMP echo request, id 13562, seq 100, length 64
19:22:43.179594 ipsec0 Out IP 169.254.255.6 > 169.254.255.5: ICMP echo reply, id 13562, seq 100, length 64
19:22:43.179617 ens3f0np0 Out IP 10.252.2.101.4500 > 10.252.72.98.4500: UDP-encap: ESP(spi=0xc6f70b0f,seq=0x69), length 120
```

For me it is strange that I see traffic on ipsec0 interface (I didn't create it, probably it creates atomatically, but ok...)

my-left-side-SRV# ip rule
```
0:	from all lookup local
220:	from all lookup 220
1000:	from all lookup [l3mdev-table]
32766:	from all lookup main
32767:	from all lookup default
```

my-left-side-SRV# ip route show table 220
```
default dev ipsec0 proto static 
10.252.1.100/31 dev ipsec0 proto static src 10.252.1.101 
10.252.2.100/31 dev ipsec0 proto static src 10.252.2.101 
throw 10.252.72.98 proto static 
169.254.255.4/30 dev ipsec0 proto static src 169.254.255.6 
```

ip address:
```
6: ens3f0np0: <BROADCAST,MULTICAST,UP,LOWER_UP> mtu 1500 qdisc mq state UP group default qlen 5000
    link/ether a0:88:c2:30:96:a8 brd ff:ff:ff:ff:ff:ff
    altname enp177s0f0np0
    inet 10.252.2.101/31 brd 255.255.255.255 scope global ens3f0np0
       valid_lft forever preferred_lft forever
7: ens3f1np1: <BROADCAST,MULTICAST,UP,LOWER_UP> mtu 1500 qdisc mq state UP group default qlen 5000
    link/ether a0:88:c2:30:96:a9 brd ff:ff:ff:ff:ff:ff
    altname enp177s0f1np1
    inet 10.252.1.101/31 brd 255.255.255.255 scope global ens3f1np1
       valid_lft forever preferred_lft forever
22: ipsec0: <POINTOPOINT,MULTICAST,NOARP,UP,LOWER_UP> mtu 1400 qdisc fq_codel state UNKNOWN group default qlen 500
    link/none 
23: xfrm624@ipsec0: <NOARP,UP,LOWER_UP> mtu 1500 qdisc noqueue state UNKNOWN group default qlen 1000
    link/none 
    inet 169.254.255.6/30 scope global xfrm624
       valid_lft forever preferred_lft forever
```

ip xfrm empty:
```
my-left-side-SRV# 
my-left-side-SRV# ip xfrm policy 
my-left-side-SRV# ip xfrm state
my-left-side-SRV# 
```

But it all works... ok, I tried to move interface xfrm42  to custom vrf42:

```
ip link add dev vrf42 type vrf table 42
ip link set up dev vrf42
 ip link set xfrm624 master vrf42
```

 and pings stop (I see it from remote side) and tcpdump shows this on my-left-side-SRV:
```
 12:10:37.023180 ens3f0np0 In  IP 10.252.72.98.4500 > 10.252.2.101.4500: UDP-encap: ESP(spi=0xb13c6314,seq=0xb13), length 120
12:10:37.023199 ipsec0 In  IP 169.254.255.5 > 169.254.255.6: ICMP echo request, id 61839, seq 588, length 64
12:10:37.023201 ipsec0 Out IP 169.254.255.5 > 169.254.255.6: ICMP echo request, id 61839, seq 588, length 64
12:10:37.023229 ens3f0np0 Out IP 10.252.2.101.4500 > 10.252.72.98.4500: UDP-encap: ESP(spi=0xc879ab45,seq=0x6917), length 120
```

my-left-side-SRV# ip -br link show vrf vrf42
`xfrm624@ipsec0   UNKNOWN        <NOARP,UP,LOWER_UP> `

my-left-side-SRV# ip -br link show type vrf
`vrf42            UP             6e:0d:19:52:0c:e4 <NOARP,MASTER,UP,LOWER_UP> `

my-left-side-SRV# ip route show vrf vrf42
`169.254.255.4/30 dev xfrm624 proto kernel scope link src 169.254.255.6`

and routes in table  220
my-left-side-SRV# ip r show table 220
```
default dev ipsec0 proto static 
10.252.1.100/31 dev ipsec0 proto static src 10.252.1.101 
10.252.2.100/31 dev ipsec0 proto static src 10.252.2.101 
throw 10.252.72.98 proto static 
169.254.255.4/30 dev ipsec0 proto static src 169.254.255.6 
169.254.255.7 dev ipsec0 proto static 
```

I tried to remove all routes from table 220, and tcp dump shows this:
my-left-side-SRV# tcpdump -niany host 10.252.72.98 or icmp 
```
tcpdump: data link type LINUX_SLL2
tcpdump: verbose output suppressed, use -v[v]... for full protocol decode
listening on any, link-type LINUX_SLL2 (Linux cooked v2), snapshot length 262144 bytes
12:14:22.763632 ens3f0np0 In  IP 10.252.72.98.4500 > 10.252.2.101.4500: UDP-encap: ESP(spi=0xb13c6314,seq=0x24e6), length 120
12:14:22.763648 ipsec0 In  IP 169.254.255.5 > 169.254.255.6: ICMP echo request, id 61839, seq 813, length 64
12:14:22.763650 ens3f0np0 Out IP 169.254.255.5 > 169.254.255.6: ICMP echo request, id 61839, seq 813, length 64
12:14:23.787647 ens3f0np0 In  IP 10.252.72.98.4500 > 10.252.2.101.4500: UDP-encap: ESP(spi=0xb13c6314,seq=0x24e7), length 120
12:14:23.787675 ipsec0 In  IP 169.254.255.5 > 169.254.255.6: ICMP echo request, id 61839, seq 814, length 64
12:14:23.787678 ens3f0np0 Out IP 169.254.255.5 > 169.254.255.6: ICMP echo request, id 61839, seq 814, length 64
^C

```
no working.

No iptables.

Do I need some special configurations?

**Comment by tobiasbrunner** [comment, marked as answer]
> For me it is strange that I see traffic on ipsec0 interface (I didn't create it, probably it creates atomatically, but ok...)

You are using the wrong kernel interface. Only the [`kernel-libipsec`](https://docs.strongswan.org/docs/latest/plugins/kernel-libipsec.html) plugin creates an `ipsec0` TUN device automatically. That's not what you want, so disable that plugin and only use `kernel-netlink`. The XFRM interface then has to be created manually, see [the docs](https://docs.strongswan.org/docs/latest/features/routeBasedVpn.html) for details.

> mark_in = 624
>                 mark_out = 624

You also want to remove these options. XFRM interfaces don't require marks.

**Comment by iluffk** [comment]
omg. It seems to work, but I need to double check.
Thanks, Tobias

**Reply by iluffk** [reply]
Yeah, really works - no  interface ipsec0 and I just moved xfrm interface to vrf and it works without additional config.
Now Im going to test hw offloads.

@tobiasbrunner thank you!
