### DISCUSSION TITLE
problems with multiple subnets

### DISCUSSION THREAD

**Discussion by memitim901** [strongswan/strongswan#2368] [Q&A] [answered]
I have two different site to site ipsec VPN tunnels that I am using strongswan (Linux strongSwan U5.9.5/K6.5.0-1023-aws) for.  One is working perfect and the other isn't and I haven't been able to figure out why.  Both of the strongswan deployments are in AWS EC2 instances on Ubuntu 22.04 with nothing else running.  The other side of the tunnel is a Mikrotik router (running RouterOS 6.49.8).  I understand that the RouterOS endpoints do not support multiple subnets through a single SA and you have to create multiple policies, one for each subnet.  This works as expected in my first deployment:

\# ipsec.conf - strongSwan IPsec configuration file

config setup

conn %default
        ikelifetime=28800s
        keylife=3600s
        rekeymargin=3m
        keyintries=1
        authby=secret

conn s3203
        left=172.29.255.10
        leftid=\<censored>
        leftsubnet=172.29.0.0/16
        right=\<censored>
        rightsubnet=10.44.66.231/32
        ike=aes256-sha256-modp1536!
        esp=aes256-sha256!
        keyexchange=ikev2
        dpdaction=restart
        dpddelay=30s
        dpdtimeout=120s
        auto=route

conn s3203-additional
        also=s3203
        leftsubnet=10.192.0.0/14

Here is the config for the tunnel that isn't working as expected:

\# ipsec.conf - strongSwan IPsec configuration file

config setup

conn %default
        ikelifetime=28800s
        keylife=3600s
        rekeymargin=3m
        keyintries=1
        authby=secret

conn vpn14
        left=10.54.0.10
        leftid=\<censored>
        leftsubnet=10.54.0.0/20
        right=\<censored>
        rightsubnet=172.21.0.0/16
        ike=aes256-sha256-modp1536!
        esp=aes256-sha256!
        keyexchange=ikev2
        dpdaction=restart
        dpddelay=30s
        dpdtimeout=120s
        auto=route

conn vpn14-additional
        also=vpn14
        rightsubnet=10.160.0.0/11

I know one has an additional leftsubnet instead of a rightsubnet but that is the only real difference.  In the problematic configuration, if I remove the 'conn vpn14-additional' section it works as expected except it obviously doesn't have the additional subnet that I need.  When I run an ipsec statusall I get the following showing that the connections are established, and if I run a tcpdump I can see that the expected traffic is arriving as expected on the strongswan server but it just drops the traffic:

ubuntu@ip-10-54-0-10:~$ sudo ipsec statusall
Status of IKE charon daemon (strongSwan 5.9.5, Linux 6.5.0-1023-aws, x86_64):
  uptime: 44 seconds, since Jul 25 14:21:33 2024
  malloc: sbrk 2994176, mmap 0, used 1285584, free 1708592
  worker threads: 11 of 16 idle, 5/0/0/0 working, job queue: 0/0/0/0, scheduled: 4
  loaded plugins: charon aesni aes rc2 sha2 sha1 md5 mgf1 random nonce x509 revocation constraints pubkey pkcs1 pkcs7 pkcs8 pkcs12 pgp dnskey sshkey pem openssl fips-prf gmp agent xcbc hmac gcm drbg attr kernel-netlink resolve socket-default connmark stroke updown eap-mschapv2 xauth-generic counters
Listening IP addresses:
  10.54.0.10
Connections:
       vpn14:  10.54.0.10...\<censored>  IKEv2, dpddelay=30s
       vpn14:   local:  [\<censored>] uses pre-shared key authentication
       vpn14:   remote: [\<censored>] uses pre-shared key authentication
       vpn14:   child:  10.54.0.0/20 === 172.21.0.0/16 TUNNEL, dpdaction=restart
vpn14-additionalsub:   child:  10.54.0.0/20 === 10.160.0.0/11 TUNNEL, dpdaction=restart
Routed Connections:
vpn14-additionalsub{2}:  ROUTED, TUNNEL, reqid 2
vpn14-additionalsub{2}:   10.54.0.0/20 === 10.160.0.0/11
       vpn14{1}:  ROUTED, TUNNEL, reqid 1
       vpn14{1}:   10.54.0.0/20 === 172.21.0.0/16
Security Associations (1 up, 0 connecting):
       vpn14[1]: ESTABLISHED 43 seconds ago, 10.54.0.10[\<censored>]...\<censored>[\<censored>]
       vpn14[1]: IKEv2 SPIs: c2a89d0884c99278_i 307c427ecf8a36a5_r*, pre-shared key reauthentication in 7 hours
       vpn14[1]: IKE proposal: AES_CBC_256/HMAC_SHA2_256_128/PRF_HMAC_SHA2_256/MODP_1536
       vpn14{3}:  INSTALLED, TUNNEL, reqid 1, ESP in UDP SPIs: c7926d10_i 0b78752a_o
       vpn14{3}:  AES_CBC_256/HMAC_SHA2_256_128, 0 bytes_i (0 pkts, 14s ago), 0 bytes_o, rekeying in 53 minutes
       vpn14{3}:   10.54.0.0/20 === 172.21.0.0/16
vpn14-additionalsub{4}:  INSTALLED, TUNNEL, reqid 2, ESP in UDP SPIs: c54583e5_i 038f5337_o
vpn14-additionalsub{4}:  AES_CBC_256/HMAC_SHA2_256_128, 1176 bytes_i, 0 bytes_o, rekeying in 54 minutes
vpn14-additionalsub{4}:   10.54.0.0/20 === 10.160.0.0/11
  

I've been googling for days trying to figure out what I'm missing any help would be greatly appreciated, thanks!

**Comment by tobiasbrunner** [comment]
> and if I run a tcpdump I can see that the expected traffic is arriving as expected on the strongswan server but it just drops the traffic:

What exactly does that mean? What's the expected traffic? ESP? Plaintext? What do you actually see? Also, what about firewall rules (see #196)? It might also be worth checking the SA and policy stats (`ip -s xfrm state`, `ip -s xfrm policy`) and XFRM error counters in `/proc/net/xfrm_stat` (if available).

**Reply by memitim901** [reply]
I used the following filter for this capture:
sudo tcpdump port not 22 and host 10.54.0.10 -n
and then I manually removed the internet garbage entries (the random https connection attempts from bots and such)

Without the vpn14-additional section
15:23:46.619128 IP \<censored>.4500 > 10.54.0.10.4500: UDP-encap: ESP(spi=0xc671d837,seq=0x4e), length 136
15:23:46.619128 IP 172.21.3.48 > 10.54.0.10: ICMP echo request, id 1003, seq 1661, length 64
15:23:46.619196 IP 10.54.0.10.4500 > \<censored>.4500: UDP-encap: ESP(spi=0x07b636f0,seq=0x4e), length 136
15:23:48.524439 IP \<censored>.4500 > 10.54.0.10.4500: NONESP-encap: isakmp: child_sa  child_sa[I]
15:23:48.524880 IP 10.54.0.10.4500 > \<censored>.4500: NONESP-encap: isakmp: child_sa  child_sa[R]
15:23:49.622545 IP \<censored>.4500 > 10.54.0.10.4500: UDP-encap: ESP(spi=0xc671d837,seq=0x4f), length 136
15:23:49.622545 IP 172.21.3.48 > 10.54.0.10: ICMP echo request, id 1003, seq 1662, length 64
15:23:49.622613 IP 10.54.0.10.4500 > \<censored>.4500: UDP-encap: ESP(spi=0x07b636f0,seq=0x4f), length 136
15:23:49.893247 IP 10.54.0.10.68 > 10.54.0.1.67: BOOTP/DHCP, Request from 02:83:79:ca:74:f9, length 297
15:23:49.893312 IP 10.54.0.1.67 > 10.54.0.10.68: BOOTP/DHCP, Reply, length 548
15:23:52.626428 IP \<censored>.4500 > 10.54.0.10.4500: UDP-encap: ESP(spi=0xc671d837,seq=0x50), length 136
15:23:52.626428 IP 172.21.3.48 > 10.54.0.10: ICMP echo request, id 1003, seq 1663, length 64
15:23:52.626496 IP 10.54.0.10.4500 > \<censored>.4500: UDP-encap: ESP(spi=0x07b636f0,seq=0x50), length 136
15:23:53.543648 IP \<censored>.4500 > 10.54.0.10.4500: NONESP-encap: isakmp: child_sa  child_sa[I]
15:23:53.544091 IP 10.54.0.10.4500 > \<censored>.4500: NONESP-encap: isakmp: child_sa  child_sa[R]
15:23:55.314681 IP 172.206.139.15.55867 > 10.54.0.10.443: Flags [S], seq 4213193564, win 65535, length 0
15:23:55.630380 IP \<censored>.4500 > 10.54.0.10.4500: UDP-encap: ESP(spi=0xc671d837,seq=0x51), length 136
15:23:55.630380 IP 172.21.3.48 > 10.54.0.10: ICMP echo request, id 1003, seq 1664, length 64
15:23:55.630448 IP 10.54.0.10.4500 > \<censored>.4500: UDP-encap: ESP(spi=0x07b636f0,seq=0x51), length 136
15:23:58.559205 IP \<censored>.4500 > 10.54.0.10.4500: NONESP-encap: isakmp: child_sa  child_sa[I]
15:23:58.559642 IP 10.54.0.10.4500 > \<censored>.4500: NONESP-encap: isakmp: child_sa  child_sa[R]
15:23:58.633580 IP \<censored>.4500 > 10.54.0.10.4500: UDP-encap: ESP(spi=0xc671d837,seq=0x52), length 136
15:23:58.633580 IP 172.21.3.48 > 10.54.0.10: ICMP echo request, id 1003, seq 1665, length 64
15:23:58.633650 IP 10.54.0.10.4500 > \<censored>.4500: UDP-encap: ESP(spi=0x07b636f0,seq=0x52), length 136
15:24:01.638373 IP \<censored>.4500 > 10.54.0.10.4500: UDP-encap: ESP(spi=0xc671d837,seq=0x53), length 136
15:24:01.638373 IP 172.21.3.48 > 10.54.0.10: ICMP echo request, id 1003, seq 1666, length 64
15:24:01.638445 IP 10.54.0.10.4500 > \<censored>.4500: UDP-encap: ESP(spi=0x07b636f0,seq=0x53), length 136
15:24:03.579714 IP \<censored>.4500 > 10.54.0.10.4500: NONESP-encap: isakmp: child_sa  child_sa[I]
15:24:03.580198 IP 10.54.0.10.4500 > \<censored>.4500: NONESP-encap: isakmp: child_sa  child_sa[R]
15:24:04.642263 IP \<censored>.4500 > 10.54.0.10.4500: UDP-encap: ESP(spi=0xc671d837,seq=0x54), length 136
15:24:04.642263 IP 172.21.3.48 > 10.54.0.10: ICMP echo request, id 1003, seq 1667, length 64
15:24:04.642326 IP 10.54.0.10.4500 > \<censored>.4500: UDP-encap: ESP(spi=0x07b636f0,seq=0x54), length 136
15:24:05.143726 IP \<censored>.4500 > 10.54.0.10.4500: isakmp-nat-keep-alive
15:24:06.096897 IP 52.14.41.183.55986 > 10.54.0.10.12578: Flags [S], seq 1060168138, win 65535, length 0

with the vpn14-additional section
tcpdump: verbose output suppressed, use -v[v]... for full protocol decode
listening on ens5, link-type EN10MB (Ethernet), snapshot length 262144 bytes
15:24:55.816551 IP \<censored>.4500 > 10.54.0.10.4500: UDP-encap: ESP(spi=0xcd36df27,seq=0x2), length 136
15:24:55.816551 IP 172.21.3.48 > 10.54.0.10: ICMP echo request, id 1003, seq 1684, length 64
15:24:58.128562 ARP, Request who-has 10.54.0.2 tell 10.54.0.10, length 28
15:24:58.128616 ARP, Reply 10.54.0.2 is-at 02:c8:df:a5:b7:38, length 28
15:24:58.856357 IP \<censored>.4500 > 10.54.0.10.4500: UDP-encap: ESP(spi=0xcd36df27,seq=0x3), length 136
15:24:58.856357 IP 172.21.3.48 > 10.54.0.10: ICMP echo request, id 1003, seq 1685, length 64
15:25:01.896965 IP \<censored>.4500 > 10.54.0.10.4500: UDP-encap: ESP(spi=0xcd36df27,seq=0x4), length 136
15:25:01.896965 IP 172.21.3.48 > 10.54.0.10: ICMP echo request, id 1003, seq 1686, length 64
15:25:04.936411 IP \<censored>.4500 > 10.54.0.10.4500: UDP-encap: ESP(spi=0xcd36df27,seq=0x5), length 136
15:25:04.936411 IP 172.21.3.48 > 10.54.0.10: ICMP echo request, id 1003, seq 1687, length 64
15:25:05.142617 IP \<censored>.4500 > 10.54.0.10.4500: isakmp-nat-keep-alive
15:25:07.976519 IP \<censored>.4500 > 10.54.0.10.4500: UDP-encap: ESP(spi=0xcd36df27,seq=0x6), length 136
15:25:07.976519 IP 172.21.3.48 > 10.54.0.10: ICMP echo request, id 1003, seq 1688, length 64
15:25:09.719885 IP 10.54.0.10.4500 > \<censored>.4500: isakmp-nat-keep-alive
15:25:11.016877 IP \<censored>.4500 > 10.54.0.10.4500: UDP-encap: ESP(spi=0xcd36df27,seq=0x7), length 136
15:25:11.016877 IP 172.21.3.48 > 10.54.0.10: ICMP echo request, id 1003, seq 1689, length 64
15:25:13.568657 ARP, Request who-has 10.54.0.10 tell 10.54.0.1, length 28
15:25:13.568676 ARP, Reply 10.54.0.10 is-at 02:83:79:ca:74:f9, length 28
15:25:14.056853 IP \<censored>.4500 > 10.54.0.10.4500: UDP-encap: ESP(spi=0xcd36df27,seq=0x8), length 136
15:25:14.056853 IP 172.21.3.48 > 10.54.0.10: ICMP echo request, id 1003, seq 1690, length 64
15:25:17.096554 IP \<censored>.4500 > 10.54.0.10.4500: UDP-encap: ESP(spi=0xcd36df27,seq=0x9), length 136
15:25:17.096554 IP 172.21.3.48 > 10.54.0.10: ICMP echo request, id 1003, seq 1691, length 64
15:25:19.815115 IP \<censored>.4500 > 10.54.0.10.4500: NONESP-encap: isakmp: child_sa  inf2[I]
15:25:19.815524 IP 10.54.0.10.4500 > \<censored>.4500: NONESP-encap: isakmp: child_sa  inf2[R]
15:25:20.136566 IP \<censored>.4500 > 10.54.0.10.4500: UDP-encap: ESP(spi=0xcd36df27,seq=0xa), length 136
15:25:20.136566 IP 172.21.3.48 > 10.54.0.10: ICMP echo request, id 1003, seq 1692, length 64

The ICMP is still getting there from 172.21.3.48 regardless but with the vpn14-additional section, it never makes it back through the tunnel (monitoring encap/decap on Mikrotik)


Here is the state without vpn14-asdditional
sudo ip -s xfrm state
src 10.54.0.10 dst \<censored>
        proto esp spi 0x0c659a59(207985241) reqid 1(0x00000001) mode tunnel
        replay-window 0 seq 0x00000000 flag af-unspec (0x00100000)
        auth-trunc hmac(sha256) 0x1fea04632512b30a25363f1d6febfad1dc7ef65e10ff18192e540423a2351a11 (256 bits) 128
        enc cbc(aes) 0x51dd85dc5e495bc06f9069c2cd164cf4acfc5378aaddfd5f8c7d927db470ff19 (256 bits)
        encap type espinudp sport 4500 dport 4500 addr 0.0.0.0
        lastused 2024-07-25 15:35:57
        anti-replay context: seq 0x0, oseq 0xcf, bitmap 0x00000000
        lifetime config:
          limit: soft (INF)(bytes), hard (INF)(bytes)
          limit: soft (INF)(packets), hard (INF)(packets)
          expire add: soft 3367(sec), hard 3600(sec)
          expire use: soft 0(sec), hard 0(sec)
        lifetime current:
          17388(bytes), 207(packets)
          add 2024-07-25 15:25:36 use 2024-07-25 15:25:38
        stats:
          replay-window 0 replay 0 failed 0
src \<censored> dst 10.54.0.10
        proto esp spi 0xc144b088(3242504328) reqid 1(0x00000001) mode tunnel
        replay-window 32 seq 0x00000000 flag af-unspec (0x00100000)
        auth-trunc hmac(sha256) 0x47f5542081fade7726f5d3dd79bef9993699eaebcb4251e728160ac0bc19e5c1 (256 bits) 128
        enc cbc(aes) 0xc08fb0101e8588fc562ac1116040ccc9e1f2067d97864c1cd2d11414dabcf8fb (256 bits)
        encap type espinudp sport 4500 dport 4500 addr 0.0.0.0
        lastused 2024-07-25 15:35:57
        anti-replay context: seq 0xcf, oseq 0x0, bitmap 0xffffffff
        lifetime config:
          limit: soft (INF)(bytes), hard (INF)(bytes)
          limit: soft (INF)(packets), hard (INF)(packets)
          expire add: soft 3359(sec), hard 3600(sec)
          expire use: soft 0(sec), hard 0(sec)
        lifetime current:
          17388(bytes), 207(packets)
          add 2024-07-25 15:25:36 use 2024-07-25 15:25:38
        stats:
          replay-window 0 replay 0 failed 0


Here is the state with the vpn14-additional:

sudo ip -s xfrm state
src 10.54.0.10 dst \<censored>
        proto esp spi 0x06ad3385(112014213) reqid 2(0x00000002) mode tunnel
        replay-window 0 seq 0x00000000 flag af-unspec (0x00100000)
        auth-trunc hmac(sha256) 0xfe23a750599a7c34d5e4b64409ca0172703ccfd82af2b04d9029acdb40c790bf (256 bits) 128
        enc cbc(aes) 0xd5cac044d0fb7e3796389c22df030244c049705c143f1bc4602b627414126b9e (256 bits)
        encap type espinudp sport 4500 dport 4500 addr 0.0.0.0
        anti-replay context: seq 0x0, oseq 0x0, bitmap 0x00000000
        lifetime config:
          limit: soft (INF)(bytes), hard (INF)(bytes)
          limit: soft (INF)(packets), hard (INF)(packets)
          expire add: soft 3418(sec), hard 3600(sec)
          expire use: soft 0(sec), hard 0(sec)
        lifetime current:
          0(bytes), 0(packets)
          add 2024-07-25 15:37:53 use -
        stats:
          replay-window 0 replay 0 failed 0
src \<censored> dst 10.54.0.10
        proto esp spi 0xc9c1d0ee(3384922350) reqid 2(0x00000002) mode tunnel
        replay-window 32 seq 0x00000000 flag af-unspec (0x00100000)
        auth-trunc hmac(sha256) 0x9baa3e6d61bf5c290432034be125f1f15291c9492241ca4b9f9df5c4e54313e7 (256 bits) 128
        enc cbc(aes) 0xab32d85740d69939956ef06b1441126f7951464abb751dee115cb992a7a934ca (256 bits)
        encap type espinudp sport 4500 dport 4500 addr 0.0.0.0
        lastused 2024-07-25 15:39:07
        anti-replay context: seq 0x19, oseq 0x0, bitmap 0x01ffffff
        lifetime config:
          limit: soft (INF)(bytes), hard (INF)(bytes)
          limit: soft (INF)(packets), hard (INF)(packets)
          expire add: soft 3292(sec), hard 3600(sec)
          expire use: soft 0(sec), hard 0(sec)
        lifetime current:
          2100(bytes), 25(packets)
          add 2024-07-25 15:37:53 use 2024-07-25 15:37:54
        stats:
          replay-window 0 replay 0 failed 0
src 10.54.0.10 dst \<censored>
        proto esp spi 0x0b9345b2(194201010) reqid 1(0x00000001) mode tunnel
        replay-window 0 seq 0x00000000 flag af-unspec (0x00100000)
        auth-trunc hmac(sha256) 0xc4c3781c07f33bad9975df4bd740ffced70708bb40875a354aa32cbc2e094d89 (256 bits) 128
        enc cbc(aes) 0x46b813f19d37a47c53db7895c00cf949ba4a10577c5a941cdce072c63bf688ce (256 bits)
        encap type espinudp sport 4500 dport 4500 addr 0.0.0.0
        anti-replay context: seq 0x0, oseq 0x0, bitmap 0x00000000
        lifetime config:
          limit: soft (INF)(bytes), hard (INF)(bytes)
          limit: soft (INF)(packets), hard (INF)(packets)
          expire add: soft 3383(sec), hard 3600(sec)
          expire use: soft 0(sec), hard 0(sec)
        lifetime current:
          0(bytes), 0(packets)
          add 2024-07-25 15:37:53 use -
        stats:
          replay-window 0 replay 0 failed 0
src \<censored> dst 10.54.0.10
        proto esp spi 0xc52b1208(3307934216) reqid 1(0x00000001) mode tunnel
        replay-window 32 seq 0x00000000 flag af-unspec (0x00100000)
        auth-trunc hmac(sha256) 0x27212c0e0832a773db974eb46f065f5f839c278dde2afbab56304ec63af77421 (256 bits) 128
        enc cbc(aes) 0x2b5f3a32157bf8a1d2b8d88c595f65086b5629bfee0cb3dd5bf8ddb72adb4dee (256 bits)
        encap type espinudp sport 4500 dport 4500 addr 0.0.0.0
        anti-replay context: seq 0x0, oseq 0x0, bitmap 0x00000000
        lifetime config:
          limit: soft (INF)(bytes), hard (INF)(bytes)
          limit: soft (INF)(packets), hard (INF)(packets)
          expire add: soft 3293(sec), hard 3600(sec)
          expire use: soft 0(sec), hard 0(sec)
        lifetime current:
          0(bytes), 0(packets)
          add 2024-07-25 15:37:53 use -
        stats:
          replay-window 0 replay 0 failed 0


Here is the policy without the vpn14-additional

sudo ip -s xfrm policy
src 10.54.0.0/20 dst 172.21.0.0/16 uid 0
        dir out action allow index 2081 priority 381567 share any flag  (0x00000000)
        lifetime config:
          limit: soft (INF)(bytes), hard (INF)(bytes)
          limit: soft (INF)(packets), hard (INF)(packets)
          expire add: soft 0(sec), hard 0(sec)
          expire use: soft 0(sec), hard 0(sec)
        lifetime current:
          0(bytes), 0(packets)
          add 2024-07-25 15:40:55 use 2024-07-25 15:42:38
        tmpl src 10.54.0.10 dst \<censored>
                proto esp spi 0x07521f84(122822532) reqid 1(0x00000001) mode tunnel
                level required share any
                enc-mask ffffffff auth-mask ffffffff comp-mask ffffffff
src 172.21.0.0/16 dst 10.54.0.0/20 uid 0
        dir fwd action allow index 2074 priority 381567 share any flag  (0x00000000)
        lifetime config:
          limit: soft (INF)(bytes), hard (INF)(bytes)
          limit: soft (INF)(packets), hard (INF)(packets)
          expire add: soft 0(sec), hard 0(sec)
          expire use: soft 0(sec), hard 0(sec)
        lifetime current:
          0(bytes), 0(packets)
          add 2024-07-25 15:40:55 use -
        tmpl src \<censored> dst 10.54.0.10
                proto esp spi 0x00000000(0) reqid 1(0x00000001) mode tunnel
                level required share any
                enc-mask ffffffff auth-mask ffffffff comp-mask ffffffff
src 172.21.0.0/16 dst 10.54.0.0/20 uid 0
        dir in action allow index 2064 priority 381567 share any flag  (0x00000000)
        lifetime config:
          limit: soft (INF)(bytes), hard (INF)(bytes)
          limit: soft (INF)(packets), hard (INF)(packets)
          expire add: soft 0(sec), hard 0(sec)
          expire use: soft 0(sec), hard 0(sec)
        lifetime current:
          0(bytes), 0(packets)
          add 2024-07-25 15:40:55 use 2024-07-25 15:42:38
        tmpl src \<censored> dst 10.54.0.10
                proto esp spi 0x00000000(0) reqid 1(0x00000001) mode tunnel
                level required share any
                enc-mask ffffffff auth-mask ffffffff comp-mask ffffffff
src 0.0.0.0/0 dst 0.0.0.0/0 uid 0
        socket in action allow index 2059 priority 0 share any flag  (0x00000000)
        lifetime config:
          limit: soft 0(bytes), hard 0(bytes)
          limit: soft 0(packets), hard 0(packets)
          expire add: soft 0(sec), hard 0(sec)
          expire use: soft 0(sec), hard 0(sec)
        lifetime current:
          0(bytes), 0(packets)
          add 2024-07-25 15:40:54 use 2024-07-25 15:42:38
src 0.0.0.0/0 dst 0.0.0.0/0 uid 0
        socket out action allow index 2052 priority 0 share any flag  (0x00000000)
        lifetime config:
          limit: soft 0(bytes), hard 0(bytes)
          limit: soft 0(packets), hard 0(packets)
          expire add: soft 0(sec), hard 0(sec)
          expire use: soft 0(sec), hard 0(sec)
        lifetime current:
          0(bytes), 0(packets)
          add 2024-07-25 15:40:54 use 2024-07-25 15:42:36
src 0.0.0.0/0 dst 0.0.0.0/0 uid 0
        socket in action allow index 2043 priority 0 share any flag  (0x00000000)
        lifetime config:
          limit: soft 0(bytes), hard 0(bytes)
          limit: soft 0(packets), hard 0(packets)
          expire add: soft 0(sec), hard 0(sec)
          expire use: soft 0(sec), hard 0(sec)
        lifetime current:
          0(bytes), 0(packets)
          add 2024-07-25 15:40:54 use -
src 0.0.0.0/0 dst 0.0.0.0/0 uid 0
        socket out action allow index 2036 priority 0 share any flag  (0x00000000)
        lifetime config:
          limit: soft 0(bytes), hard 0(bytes)
          limit: soft 0(packets), hard 0(packets)
          expire add: soft 0(sec), hard 0(sec)
          expire use: soft 0(sec), hard 0(sec)
        lifetime current:
          0(bytes), 0(packets)
          add 2024-07-25 15:40:54 use -
src ::/0 dst ::/0 uid 0
        socket in action allow index 2027 priority 0 share any flag  (0x00000000)
        lifetime config:
          limit: soft 0(bytes), hard 0(bytes)
          limit: soft 0(packets), hard 0(packets)
          expire add: soft 0(sec), hard 0(sec)
          expire use: soft 0(sec), hard 0(sec)
        lifetime current:
          0(bytes), 0(packets)
          add 2024-07-25 15:40:54 use -
src ::/0 dst ::/0 uid 0
        socket out action allow index 2020 priority 0 share any flag  (0x00000000)
        lifetime config:
          limit: soft 0(bytes), hard 0(bytes)
          limit: soft 0(packets), hard 0(packets)
          expire add: soft 0(sec), hard 0(sec)
          expire use: soft 0(sec), hard 0(sec)
        lifetime current:
          0(bytes), 0(packets)
          add 2024-07-25 15:40:54 use -
src ::/0 dst ::/0 uid 0
        socket in action allow index 2011 priority 0 share any flag  (0x00000000)
        lifetime config:
          limit: soft 0(bytes), hard 0(bytes)
          limit: soft 0(packets), hard 0(packets)
          expire add: soft 0(sec), hard 0(sec)
          expire use: soft 0(sec), hard 0(sec)
        lifetime current:
          0(bytes), 0(packets)
          add 2024-07-25 15:40:54 use -
src ::/0 dst ::/0 uid 0
        socket out action allow index 2004 priority 0 share any flag  (0x00000000)
        lifetime config:
          limit: soft 0(bytes), hard 0(bytes)
          limit: soft 0(packets), hard 0(packets)
          expire add: soft 0(sec), hard 0(sec)
          expire use: soft 0(sec), hard 0(sec)
        lifetime current:
          0(bytes), 0(packets)
          add 2024-07-25 15:40:54 use -


Here is the policy with the vpn14-additional

sudo ip -s xfrm policy
src 10.54.0.0/20 dst 10.160.0.0/11 uid 0
        dir out action allow index 1993 priority 384127 share any flag  (0x00000000)
        lifetime config:
          limit: soft (INF)(bytes), hard (INF)(bytes)
          limit: soft (INF)(packets), hard (INF)(packets)
          expire add: soft 0(sec), hard 0(sec)
          expire use: soft 0(sec), hard 0(sec)
        lifetime current:
          0(bytes), 0(packets)
          add 2024-07-25 15:37:53 use -
        tmpl src 10.54.0.10 dst \<censored>
                proto esp spi 0x06ad3385(112014213) reqid 2(0x00000002) mode tunnel
                level required share any
                enc-mask ffffffff auth-mask ffffffff comp-mask ffffffff
src 10.160.0.0/11 dst 10.54.0.0/20 uid 0
        dir fwd action allow index 1986 priority 384127 share any flag  (0x00000000)
        lifetime config:
          limit: soft (INF)(bytes), hard (INF)(bytes)
          limit: soft (INF)(packets), hard (INF)(packets)
          expire add: soft 0(sec), hard 0(sec)
          expire use: soft 0(sec), hard 0(sec)
        lifetime current:
          0(bytes), 0(packets)
          add 2024-07-25 15:37:53 use -
        tmpl src \<censored> dst 10.54.0.10
                proto esp spi 0x00000000(0) reqid 2(0x00000002) mode tunnel
                level required share any
                enc-mask ffffffff auth-mask ffffffff comp-mask ffffffff
src 10.160.0.0/11 dst 10.54.0.0/20 uid 0
        dir in action allow index 1976 priority 384127 share any flag  (0x00000000)
        lifetime config:
          limit: soft (INF)(bytes), hard (INF)(bytes)
          limit: soft (INF)(packets), hard (INF)(packets)
          expire add: soft 0(sec), hard 0(sec)
          expire use: soft 0(sec), hard 0(sec)
        lifetime current:
          0(bytes), 0(packets)
          add 2024-07-25 15:37:53 use -
        tmpl src \<censored> dst 10.54.0.10
                proto esp spi 0x00000000(0) reqid 2(0x00000002) mode tunnel
                level required share any
                enc-mask ffffffff auth-mask ffffffff comp-mask ffffffff
src 10.54.0.0/20 dst 172.21.0.0/16 uid 0
        dir out action allow index 1969 priority 381567 share any flag  (0x00000000)
        lifetime config:
          limit: soft (INF)(bytes), hard (INF)(bytes)
          limit: soft (INF)(packets), hard (INF)(packets)
          expire add: soft 0(sec), hard 0(sec)
          expire use: soft 0(sec), hard 0(sec)
        lifetime current:
          0(bytes), 0(packets)
          add 2024-07-25 15:37:53 use -
        tmpl src 10.54.0.10 dst \<censored>
                proto esp spi 0x0b9345b2(194201010) reqid 1(0x00000001) mode tunnel
                level required share any
                enc-mask ffffffff auth-mask ffffffff comp-mask ffffffff
src 172.21.0.0/16 dst 10.54.0.0/20 uid 0
        dir fwd action allow index 1962 priority 381567 share any flag  (0x00000000)
        lifetime config:
          limit: soft (INF)(bytes), hard (INF)(bytes)
          limit: soft (INF)(packets), hard (INF)(packets)
          expire add: soft 0(sec), hard 0(sec)
          expire use: soft 0(sec), hard 0(sec)
        lifetime current:
          0(bytes), 0(packets)
          add 2024-07-25 15:37:53 use -
        tmpl src \<censored> dst 10.54.0.10
                proto esp spi 0x00000000(0) reqid 1(0x00000001) mode tunnel
                level required share any
                enc-mask ffffffff auth-mask ffffffff comp-mask ffffffff
src 172.21.0.0/16 dst 10.54.0.0/20 uid 0
        dir in action allow index 1952 priority 381567 share any flag  (0x00000000)
        lifetime config:
          limit: soft (INF)(bytes), hard (INF)(bytes)
          limit: soft (INF)(packets), hard (INF)(packets)
          expire add: soft 0(sec), hard 0(sec)
          expire use: soft 0(sec), hard 0(sec)
        lifetime current:
          0(bytes), 0(packets)
          add 2024-07-25 15:37:53 use 2024-07-25 15:40:01
        tmpl src \<censored> dst 10.54.0.10
                proto esp spi 0x00000000(0) reqid 1(0x00000001) mode tunnel
                level required share any
                enc-mask ffffffff auth-mask ffffffff comp-mask ffffffff
src 0.0.0.0/0 dst 0.0.0.0/0 uid 0
        socket in action allow index 1947 priority 0 share any flag  (0x00000000)
        lifetime config:
          limit: soft 0(bytes), hard 0(bytes)
          limit: soft 0(packets), hard 0(packets)
          expire add: soft 0(sec), hard 0(sec)
          expire use: soft 0(sec), hard 0(sec)
        lifetime current:
          0(bytes), 0(packets)
          add 2024-07-25 15:37:53 use 2024-07-25 15:40:01
src 0.0.0.0/0 dst 0.0.0.0/0 uid 0
        socket out action allow index 1940 priority 0 share any flag  (0x00000000)
        lifetime config:
          limit: soft 0(bytes), hard 0(bytes)
          limit: soft 0(packets), hard 0(packets)
          expire add: soft 0(sec), hard 0(sec)
          expire use: soft 0(sec), hard 0(sec)
        lifetime current:
          0(bytes), 0(packets)
          add 2024-07-25 15:37:53 use 2024-07-25 15:39:53
src 0.0.0.0/0 dst 0.0.0.0/0 uid 0
        socket in action allow index 1931 priority 0 share any flag  (0x00000000)
        lifetime config:
          limit: soft 0(bytes), hard 0(bytes)
          limit: soft 0(packets), hard 0(packets)
          expire add: soft 0(sec), hard 0(sec)
          expire use: soft 0(sec), hard 0(sec)
        lifetime current:
          0(bytes), 0(packets)
          add 2024-07-25 15:37:53 use -
src 0.0.0.0/0 dst 0.0.0.0/0 uid 0
        socket out action allow index 1924 priority 0 share any flag  (0x00000000)
        lifetime config:
          limit: soft 0(bytes), hard 0(bytes)
          limit: soft 0(packets), hard 0(packets)
          expire add: soft 0(sec), hard 0(sec)
          expire use: soft 0(sec), hard 0(sec)
        lifetime current:
          0(bytes), 0(packets)
          add 2024-07-25 15:37:53 use -
src ::/0 dst ::/0 uid 0
        socket in action allow index 1915 priority 0 share any flag  (0x00000000)
        lifetime config:
          limit: soft 0(bytes), hard 0(bytes)
          limit: soft 0(packets), hard 0(packets)
          expire add: soft 0(sec), hard 0(sec)
          expire use: soft 0(sec), hard 0(sec)
        lifetime current:
          0(bytes), 0(packets)
          add 2024-07-25 15:37:53 use -
src ::/0 dst ::/0 uid 0
        socket out action allow index 1908 priority 0 share any flag  (0x00000000)
        lifetime config:
          limit: soft 0(bytes), hard 0(bytes)
          limit: soft 0(packets), hard 0(packets)
          expire add: soft 0(sec), hard 0(sec)
          expire use: soft 0(sec), hard 0(sec)
        lifetime current:
          0(bytes), 0(packets)
          add 2024-07-25 15:37:53 use -
src ::/0 dst ::/0 uid 0
        socket in action allow index 1899 priority 0 share any flag  (0x00000000)
        lifetime config:
          limit: soft 0(bytes), hard 0(bytes)
          limit: soft 0(packets), hard 0(packets)
          expire add: soft 0(sec), hard 0(sec)
          expire use: soft 0(sec), hard 0(sec)
        lifetime current:
          0(bytes), 0(packets)
          add 2024-07-25 15:37:53 use -
src ::/0 dst ::/0 uid 0
        socket out action allow index 1892 priority 0 share any flag  (0x00000000)
        lifetime config:
          limit: soft 0(bytes), hard 0(bytes)
          limit: soft 0(packets), hard 0(packets)
          expire add: soft 0(sec), hard 0(sec)
          expire use: soft 0(sec), hard 0(sec)
        lifetime current:
          0(bytes), 0(packets)
          add 2024-07-25 15:37:53 use -

**Reply by memitim901** [reply]
I forgot to check the /proc/net/xfrm_stat counters. 

Without the vpn14-additional section there are no counters
with the vpn14-additional section it looks like the XfrmInTmplMismatch is slowly counting up

**Reply by tobiasbrunner** [reply]
> with the vpn14-additional section it looks like the XfrmInTmplMismatch is slowly counting up

Yeah, it looks like the peer sends the packets through the wrong SA. Looking at the states, the only SA that's used is this one:

```
src <censored> dst 10.54.0.10
proto esp spi 0xc9c1d0ee(3384922350) reqid 2(0x00000002) mode tunnel
replay-window 32 seq 0x00000000 flag af-unspec (0x00100000)
auth-trunc hmac(sha256) 0x9baa3e6d61bf5c290432034be125f1f15291c9492241ca4b9f9df5c4e54313e7 (256 bits) 128
enc cbc(aes) 0xab32d85740d69939956ef06b1441126f7951464abb751dee115cb992a7a934ca (256 bits)
encap type espinudp sport 4500 dport 4500 addr 0.0.0.0
lastused 2024-07-25 15:39:07
anti-replay context: seq 0x19, oseq 0x0, bitmap 0x01ffffff
lifetime config:
limit: soft (INF)(bytes), hard (INF)(bytes)
limit: soft (INF)(packets), hard (INF)(packets)
expire add: soft 3292(sec), hard 3600(sec)
expire use: soft 0(sec), hard 0(sec)
lifetime current:
2100(bytes), 25(packets)
add 2024-07-25 15:37:53 use 2024-07-25 15:37:54
```
You can see `reqid 2` there, indicating it was created with the second CHILD_SA (since you use trap policies that's not exactly true, it's basically the second trap policy that was installed, which should still be the second connection). And looking at the policies, you'll notice that the right policy for that inbound packet would be this one:
```
src 172.21.0.0/16 dst 10.54.0.0/20 uid 0
dir in action allow index 1952 priority 381567 share any flag (0x00000000)
lifetime config:
limit: soft (INF)(bytes), hard (INF)(bytes)
limit: soft (INF)(packets), hard (INF)(packets)
expire add: soft 0(sec), hard 0(sec)
expire use: soft 0(sec), hard 0(sec)
lifetime current:
0(bytes), 0(packets)
add 2024-07-25 15:37:53 use 2024-07-25 15:40:01
tmpl src <censored> dst 10.54.0.10
proto esp spi 0x00000000(0) reqid 1(0x00000001) mode tunnel
level required share any
enc-mask ffffffff auth-mask ffffffff comp-mask ffffffff
```
As you can see, it got matched (`use` time) but it has `reqid 1` assigned i.e. belongs to the inbound SA of the first CHILD_SA, not the second. So the packet is dropped because it was received on the wrong SA.

The peer might just send packets on the latest SA that was established, not using policies that were negotiated with the respective CHILD_SA to select the right SA. Which obviously breaks this scenario.

**Reply by memitim901** [reply]
I appreciate you identifying this, but I honestly don't know where to go next on how to address this.  I suppose I could disable the policy on the mikrotik peer and reapply it and retest from the 10.160.0.0/11 network to see if that resolves that particular issue but I'm uncertain why the exact same setup works perfectly fine with an additional leftsubnet instead of a rightsubnet.

**Reply by tobiasbrunner** [reply, marked as answer]
Maybe it does something like route-based VPN and can't select on the source selector. Because the destination subnet is the same for both CHILD_SAs (`10.54.0.0/20`), the routes will look the same and that of the first SA might get replace by that of the second (i.e. directing traffic to the second SA). Can you maybe change that setting (i.e. make it use policy-based VPN)? Or help the device in some other way to distinguish the traffic (something like marking packets from/to the different subnets on its side)? Depending on how you use this, it might also be possible to do some NAT to avoid the issue (e.g. pretend that your local subnet to reach `10.160.0.0/11` is not `10.54.0.0/20` but e.g. `10.54.16.0/20` via NETMAP based on the destination subnet). Splitting up `10.54.0.0/20` might also be an option if the hosts in the two remote subnets don't have to access the same hosts on your end.

**Reply by memitim901** [reply]
using packet markers in the Mikrotik to select the traffic was the key to getting this to function as expected.  Very frustrating that another problem is chalked up to the Mikrotik doing Mikrotik things but I am very grateful for the help!

**Reply by hgshoggins** [reply]
@memitim901, would you mind sharing your packet marking config? I've ran into the same problem and @tobiasbrunner was kind enough to direct me here from #2604.

**Reply by hgshoggins** [reply]
Replying to myself because I finally commented on #2604, the solution was to select the `unique` level for each IPSec policy on RouterOS instead of the default `require`, and let RouterOS do the rest.
