### DISCUSSION TITLE
IKEv2 PSK - Roadwarrior unable to reach local network.

### DISCUSSION THREAD

**Discussion by ilgiznurgaliev** [strongswan/strongswan#2519] [General]
I have the following configuration:
![image](https://github.com/user-attachments/assets/d4ebae9c-0ac0-41d2-8288-d318bb8dd0a3)

Android device connects to Strongswan server using built-in VPN client and takes IP address from DHCP. At this phase no any issues.

The problem is that from Android device no any resources in LAN network (10.16.0.0/24) are reachable, i.e. I'm unable to ping from Android device VPN server (10.16.0.4), laptop (10.16.0.10) or router (10.16.0.6). And the same for backward connections, i.e. I'm unable to ping android device from VPN server or laptop.

However traffic goes perfectly between Android device and subnet (10.16.4.0/24) which is  behind VPN server, i.e. I'm unable to ping each IP camera from Android device and Android device is also pingable from 10.16.4.0/24 subnet.

**Log**:
```
Fri, 2024-11-01, 11:53:27 00[DMN] Starting charon-systemd IKE daemon (strongSwan 5.9.14, Linux 6.11.5-arch1-1, x86_64)
Fri, 2024-11-01, 11:53:27 00[LIB] plugin 'ldap': loaded successfully
Fri, 2024-11-01, 11:53:27 00[CFG] PKCS11 module '<name>' lacks library path
Fri, 2024-11-01, 11:53:27 00[LIB] plugin 'pkcs11': loaded successfully
Fri, 2024-11-01, 11:53:27 00[LIB] plugin 'aesni': loaded successfully
Fri, 2024-11-01, 11:53:27 00[LIB] plugin 'aes': loaded successfully
Fri, 2024-11-01, 11:53:27 00[LIB] plugin 'des': loaded successfully
Fri, 2024-11-01, 11:53:27 00[LIB] plugin 'rc2': loaded successfully
Fri, 2024-11-01, 11:53:27 00[LIB] plugin 'sha2': loaded successfully
Fri, 2024-11-01, 11:53:27 00[LIB] plugin 'sha3': loaded successfully
Fri, 2024-11-01, 11:53:27 00[LIB] plugin 'sha1': loaded successfully
Fri, 2024-11-01, 11:53:27 00[LIB] plugin 'md5': loaded successfully
Fri, 2024-11-01, 11:53:27 00[LIB] plugin 'mgf1': loaded successfully
Fri, 2024-11-01, 11:53:27 00[LIB] plugin 'random': loaded successfully
Fri, 2024-11-01, 11:53:27 00[LIB] plugin 'nonce': loaded successfully
Fri, 2024-11-01, 11:53:27 00[LIB] plugin 'x509': loaded successfully
Fri, 2024-11-01, 11:53:27 00[LIB] plugin 'revocation': loaded successfully
Fri, 2024-11-01, 11:53:27 00[LIB] plugin 'constraints': loaded successfully
Fri, 2024-11-01, 11:53:27 00[LIB] plugin 'pubkey': loaded successfully
Fri, 2024-11-01, 11:53:27 00[LIB] plugin 'pkcs1': loaded successfully
Fri, 2024-11-01, 11:53:27 00[LIB] plugin 'pkcs7': loaded successfully
Fri, 2024-11-01, 11:53:27 00[LIB] plugin 'pkcs12': loaded successfully
Fri, 2024-11-01, 11:53:27 00[LIB] plugin 'pgp': loaded successfully
Fri, 2024-11-01, 11:53:27 00[LIB] plugin 'dnskey': loaded successfully
Fri, 2024-11-01, 11:53:27 00[LIB] plugin 'sshkey': loaded successfully
Fri, 2024-11-01, 11:53:27 00[LIB] plugin 'dnscert': loaded successfully
Fri, 2024-11-01, 11:53:27 00[LIB] plugin 'pem': loaded successfully
Fri, 2024-11-01, 11:53:27 00[LIB] providers loaded by OpenSSL: legacy default
Fri, 2024-11-01, 11:53:27 00[LIB] plugin 'openssl': loaded successfully
Fri, 2024-11-01, 11:53:27 00[LIB] plugin 'pkcs8': loaded successfully
Fri, 2024-11-01, 11:53:27 00[LIB] plugin 'fips-prf': loaded successfully
Fri, 2024-11-01, 11:53:27 00[LIB] plugin 'gmp': loaded successfully
Fri, 2024-11-01, 11:53:27 00[LIB] plugin 'curve25519': loaded successfully
Fri, 2024-11-01, 11:53:27 00[LIB] plugin 'agent': loaded successfully
Fri, 2024-11-01, 11:53:27 00[LIB] plugin 'chapoly': loaded successfully
Fri, 2024-11-01, 11:53:27 00[LIB] plugin 'xcbc': loaded successfully
Fri, 2024-11-01, 11:53:27 00[LIB] plugin 'cmac': loaded successfully
Fri, 2024-11-01, 11:53:27 00[LIB] plugin 'hmac': loaded successfully
Fri, 2024-11-01, 11:53:27 00[LIB] plugin 'kdf': loaded successfully
Fri, 2024-11-01, 11:53:27 00[LIB] plugin 'gcm': loaded successfully
Fri, 2024-11-01, 11:53:27 00[LIB] plugin 'ntru': loaded successfully
Fri, 2024-11-01, 11:53:27 00[LIB] plugin 'drbg': loaded successfully
Fri, 2024-11-01, 11:53:27 00[LIB] plugin 'newhope': loaded successfully
Fri, 2024-11-01, 11:53:27 00[LIB] plugin 'bliss': loaded successfully
Fri, 2024-11-01, 11:53:27 00[LIB] available TLS backends in libcurl: openssl
Fri, 2024-11-01, 11:53:27 00[LIB] plugin 'curl': loaded successfully
Fri, 2024-11-01, 11:53:27 00[LIB] plugin 'mysql' failed to load: libmariadb.so.3: cannot open shared object file: No such file or directory
Fri, 2024-11-01, 11:53:27 00[LIB] using SQLite 3.46.1, thread safety 1
Fri, 2024-11-01, 11:53:27 00[LIB] plugin 'sqlite': loaded successfully
Fri, 2024-11-01, 11:53:27 00[LIB] plugin 'attr': loaded successfully
Fri, 2024-11-01, 11:53:27 00[LIB] plugin 'attr-sql': loaded successfully
Fri, 2024-11-01, 11:53:27 00[LIB] plugin 'kernel-netlink': loaded successfully
Fri, 2024-11-01, 11:53:27 00[CFG] install DNS servers in '/etc/resolv.conf'
Fri, 2024-11-01, 11:53:27 00[LIB] plugin 'resolve': loaded successfully
Fri, 2024-11-01, 11:53:27 00[LIB] plugin 'socket-default': loaded successfully
Fri, 2024-11-01, 11:53:27 00[LIB] plugin 'bypass-lan': loaded successfully
Fri, 2024-11-01, 11:53:27 00[LIB] plugin 'connmark': loaded successfully
Fri, 2024-11-01, 11:53:27 00[LIB] plugin 'forecast': loaded successfully
Fri, 2024-11-01, 11:53:27 00[LIB] plugin 'farp': loaded successfully
Fri, 2024-11-01, 11:53:27 00[LIB] plugin 'stroke': loaded successfully
Fri, 2024-11-01, 11:53:27 00[LIB] plugin 'vici': loaded successfully
Fri, 2024-11-01, 11:53:27 00[LIB] plugin 'sql': loaded successfully
Fri, 2024-11-01, 11:53:27 00[LIB] plugin 'updown': loaded successfully
Fri, 2024-11-01, 11:53:27 00[LIB] plugin 'eap-identity': loaded successfully
Fri, 2024-11-01, 11:53:27 00[LIB] plugin 'eap-sim': loaded successfully
Fri, 2024-11-01, 11:53:27 00[LIB] plugin 'eap-sim-file': loaded successfully
Fri, 2024-11-01, 11:53:27 00[LIB] plugin 'eap-aka': loaded successfully
Fri, 2024-11-01, 11:53:27 00[LIB] plugin 'eap-aka-3gpp2': loaded successfully
Fri, 2024-11-01, 11:53:27 00[LIB] plugin 'eap-simaka-pseudonym': loaded successfully
Fri, 2024-11-01, 11:53:27 00[LIB] plugin 'eap-simaka-reauth': loaded successfully
Fri, 2024-11-01, 11:53:27 00[LIB] plugin 'eap-md5': loaded successfully
Fri, 2024-11-01, 11:53:27 00[LIB] plugin 'eap-gtc': loaded successfully
Fri, 2024-11-01, 11:53:27 00[LIB] plugin 'eap-mschapv2': loaded successfully
Fri, 2024-11-01, 11:53:27 00[LIB] plugin 'eap-dynamic': loaded successfully
Fri, 2024-11-01, 11:53:27 00[LIB] plugin 'eap-radius': loaded successfully
Fri, 2024-11-01, 11:53:27 00[LIB] plugin 'eap-tls': loaded successfully
Fri, 2024-11-01, 11:53:27 00[LIB] plugin 'eap-ttls': loaded successfully
Fri, 2024-11-01, 11:53:27 00[LIB] plugin 'eap-peap': loaded successfully
Fri, 2024-11-01, 11:53:27 00[LIB] plugin 'xauth-generic': loaded successfully
Fri, 2024-11-01, 11:53:27 00[LIB] plugin 'xauth-eap': loaded successfully
Fri, 2024-11-01, 11:53:27 00[LIB] plugin 'xauth-pam': loaded successfully
Fri, 2024-11-01, 11:53:27 00[LIB] plugin 'xauth-noauth': loaded successfully
Fri, 2024-11-01, 11:53:27 00[LIB] plugin 'dhcp': loaded successfully
Fri, 2024-11-01, 11:53:27 00[LIB] plugin 'ha': loaded successfully
Fri, 2024-11-01, 11:53:27 00[LIB] plugin 'ext-auth': loaded successfully
Fri, 2024-11-01, 11:53:27 00[LIB] plugin 'radattr': loaded successfully
Fri, 2024-11-01, 11:53:27 00[LIB] plugin 'unity': loaded successfully
Fri, 2024-11-01, 11:53:27 00[LIB] plugin 'counters': loaded successfully
Fri, 2024-11-01, 11:53:27 00[KNL] XFRM interfaces supported by kernel
Fri, 2024-11-01, 11:53:27 00[KNL] known interfaces and IP addresses:
Fri, 2024-11-01, 11:53:27 00[KNL]   lo
Fri, 2024-11-01, 11:53:27 00[KNL]     127.0.0.1
Fri, 2024-11-01, 11:53:27 00[KNL]     ::1
Fri, 2024-11-01, 11:53:27 00[KNL]   lan
Fri, 2024-11-01, 11:53:27 00[KNL]     fe80::aaa1:59ff:feaa:dddf
Fri, 2024-11-01, 11:53:27 00[KNL]   lan.2
Fri, 2024-11-01, 11:53:27 00[KNL]     10.16.0.4
Fri, 2024-11-01, 11:53:27 00[KNL]     fe80::aaa1:59ff:feaa:dddf
Fri, 2024-11-01, 11:53:27 00[KNL]   lan.4
Fri, 2024-11-01, 11:53:27 00[KNL]     10.16.4.4
Fri, 2024-11-01, 11:53:27 00[KNL]     fe80::aaa1:59ff:feaa:dddf
Fri, 2024-11-01, 11:53:27 00[LIB] feature PUBKEY:DSA in plugin 'pem' has unmet dependency: PUBKEY:DSA
Fri, 2024-11-01, 11:53:27 00[LIB] feature CUSTOM:dnscert in plugin 'dnscert' has unmet dependency: RESOLVER
Fri, 2024-11-01, 11:53:27 00[LIB] feature PRIVKEY:DSA in plugin 'pem' has unmet dependency: PRIVKEY:DSA
Fri, 2024-11-01, 11:53:27 00[CFG] attr-sql plugin: database URI not set
Fri, 2024-11-01, 11:53:27 00[LIB] feature CUSTOM:attr-sql in plugin 'attr-sql' failed to load
Fri, 2024-11-01, 11:53:27 00[NET] using forecast interface lan.2
Fri, 2024-11-01, 11:53:27 00[CFG] joining forecast multicast groups: 224.0.0.1,224.0.0.22,224.0.0.251,224.0.0.252,239.255.255.250
Fri, 2024-11-01, 11:53:27 00[CFG] loading ca certificates from '/etc/ipsec.d/cacerts'
Fri, 2024-11-01, 11:53:27 00[CFG] loading aa certificates from '/etc/ipsec.d/aacerts'
Fri, 2024-11-01, 11:53:27 00[CFG] loading ocsp signer certificates from '/etc/ipsec.d/ocspcerts'
Fri, 2024-11-01, 11:53:27 00[CFG] loading attribute certificates from '/etc/ipsec.d/acerts'
Fri, 2024-11-01, 11:53:27 00[CFG] loading crls from '/etc/ipsec.d/crls'
Fri, 2024-11-01, 11:53:27 00[CFG] loading secrets from '/etc/ipsec.secrets'
Fri, 2024-11-01, 11:53:27 00[CFG] sql plugin: database URI not set
Fri, 2024-11-01, 11:53:27 00[LIB] feature CUSTOM:sql in plugin 'sql' failed to load
Fri, 2024-11-01, 11:53:27 00[CFG] opening triplet file /etc/ipsec.d/triplets.dat failed: No such file or directory
Fri, 2024-11-01, 11:53:27 00[LIB] feature CUSTOM:eap-sim-file-triplets in plugin 'eap-sim-file' failed to load
Fri, 2024-11-01, 11:53:27 00[LIB] feature CUSTOM:sim-card in plugin 'eap-sim-file' has unmet dependency: CUSTOM:eap-sim-file-triplets
Fri, 2024-11-01, 11:53:27 00[LIB] feature CUSTOM:sim-provider in plugin 'eap-sim-file' has unmet dependency: CUSTOM:eap-sim-file-triplets
Fri, 2024-11-01, 11:53:27 00[CFG] loaded 0 RADIUS server configurations
Fri, 2024-11-01, 11:53:27 00[CFG] HA config misses local/remote address
Fri, 2024-11-01, 11:53:27 00[LIB] feature CUSTOM:ha in plugin 'ha' failed to load
Fri, 2024-11-01, 11:53:27 00[CFG] no script for ext-auth script defined, disabled
Fri, 2024-11-01, 11:53:27 00[LIB] feature CUSTOM:ext_auth in plugin 'ext-auth' failed to load
Fri, 2024-11-01, 11:53:27 00[LIB] unloading plugin 'dnscert' without loaded features
Fri, 2024-11-01, 11:53:27 00[LIB] unloading plugin 'attr-sql' without loaded features
Fri, 2024-11-01, 11:53:27 00[LIB] unloading plugin 'sql' without loaded features
Fri, 2024-11-01, 11:53:27 00[LIB] unloading plugin 'eap-sim-file' without loaded features
Fri, 2024-11-01, 11:53:27 00[LIB] unloading plugin 'ha' without loaded features
Fri, 2024-11-01, 11:53:27 00[LIB] unloading plugin 'ext-auth' without loaded features
Fri, 2024-11-01, 11:53:27 00[LIB] loaded plugins: charon-systemd ldap pkcs11 aesni aes des rc2 sha2 sha3 sha1 md5 mgf1 random nonce x509 revocation constraints pubkey pkcs1 pkcs7 pkcs12 pgp dnskey sshkey pem openssl pkcs8 fips-prf gmp curve25519 agent chapoly xcbc cmac hmac kdf gcm ntru drbg newhope bliss curl sqlite attr kernel-netlink resolve socket-default bypass-lan connmark forecast farp stroke vici updown eap-identity eap-sim eap-aka eap-aka-3gpp2 eap-simaka-pseudonym eap-simaka-reauth eap-md5 eap-gtc eap-mschapv2 eap-dynamic eap-radius eap-tls eap-ttls eap-peap xauth-generic xauth-eap xauth-pam xauth-noauth dhcp radattr unity counters
Fri, 2024-11-01, 11:53:27 00[LIB] unable to load 10 plugin features (5 due to unmet dependencies)
Fri, 2024-11-01, 11:53:27 00[LIB] dropped capabilities, running as uid 0, gid 0
Fri, 2024-11-01, 11:53:27 00[JOB] spawning 16 worker threads
Fri, 2024-11-01, 11:53:27 01[LIB] created thread 01 [781]
Fri, 2024-11-01, 11:53:27 02[LIB] created thread 02 [782]
Fri, 2024-11-01, 11:53:27 03[LIB] created thread 03 [783]
Fri, 2024-11-01, 11:53:27 04[LIB] created thread 04 [784]
Fri, 2024-11-01, 11:53:27 05[LIB] created thread 05 [785]
Fri, 2024-11-01, 11:53:27 06[LIB] created thread 06 [786]
Fri, 2024-11-01, 11:53:27 07[LIB] created thread 07 [787]
Fri, 2024-11-01, 11:53:27 08[LIB] created thread 08 [788]
Fri, 2024-11-01, 11:53:27 09[LIB] created thread 09 [789]
Fri, 2024-11-01, 11:53:27 10[LIB] created thread 10 [791]
Fri, 2024-11-01, 11:53:27 11[LIB] created thread 11 [790]
Fri, 2024-11-01, 11:53:27 12[LIB] created thread 12 [792]
Fri, 2024-11-01, 11:53:27 14[LIB] created thread 14 [794]
Fri, 2024-11-01, 11:53:27 13[LIB] created thread 13 [793]
Fri, 2024-11-01, 11:53:27 15[LIB] created thread 15 [795]
Fri, 2024-11-01, 11:53:27 16[LIB] created thread 16 [796]
Fri, 2024-11-01, 11:53:27 05[KNL] adding policy 10.16.0.0/24 === 10.16.0.0/24 out [priority 175423, refcount 1]
Fri, 2024-11-01, 11:53:27 05[KNL] getting a local address in traffic selector 10.16.0.0/24
Fri, 2024-11-01, 11:53:27 05[KNL] using host 10.16.0.4
Fri, 2024-11-01, 11:53:27 05[KNL] getting iface name for index 3
Fri, 2024-11-01, 11:53:27 05[KNL] no nexthop found to reach 10.16.0.0/24
Fri, 2024-11-01, 11:53:27 05[KNL] installing route: 10.16.0.0/24 via (null) src 10.16.0.4 dev lan.2
Fri, 2024-11-01, 11:53:27 05[KNL] adding policy 10.16.0.0/24 === 10.16.0.0/24 in [priority 175423, refcount 1]
Fri, 2024-11-01, 11:53:27 05[KNL] adding policy 10.16.0.0/24 === 10.16.0.0/24 fwd [priority 175423, refcount 1]
Fri, 2024-11-01, 11:53:27 05[IKE] installed bypass policy for 10.16.0.0/24
Fri, 2024-11-01, 11:53:27 05[KNL] adding policy 10.16.4.0/24 === 10.16.4.0/24 out [priority 175423, refcount 1]
Fri, 2024-11-01, 11:53:27 05[KNL] getting a local address in traffic selector 10.16.4.0/24
Fri, 2024-11-01, 11:53:27 05[KNL] using host 10.16.4.4
Fri, 2024-11-01, 11:53:27 05[KNL] getting iface name for index 4
Fri, 2024-11-01, 11:53:27 05[KNL] no nexthop found to reach 10.16.4.0/24
Fri, 2024-11-01, 11:53:27 05[KNL] installing route: 10.16.4.0/24 via (null) src 10.16.4.4 dev lan.4
Fri, 2024-11-01, 11:53:27 05[KNL] adding policy 10.16.4.0/24 === 10.16.4.0/24 in [priority 175423, refcount 1]
Fri, 2024-11-01, 11:53:27 05[KNL] adding policy 10.16.4.0/24 === 10.16.4.0/24 fwd [priority 175423, refcount 1]
Fri, 2024-11-01, 11:53:27 05[IKE] installed bypass policy for 10.16.4.0/24
Fri, 2024-11-01, 11:53:27 05[KNL] adding policy fe80::/64 === fe80::/64 out [priority 134463, refcount 1]
Fri, 2024-11-01, 11:53:27 05[KNL] getting a local address in traffic selector fe80::/64
Fri, 2024-11-01, 11:53:27 05[KNL] no local address found in traffic selector fe80::/64
Fri, 2024-11-01, 11:53:27 05[KNL] getting iface name for index 2
Fri, 2024-11-01, 11:53:27 05[KNL] no nexthop found to reach fe80::/64
Fri, 2024-11-01, 11:53:27 05[KNL] installing route: fe80::/64 via (null) src %any6 dev lan
Fri, 2024-11-01, 11:53:27 05[KNL] adding policy fe80::/64 === fe80::/64 in [priority 134463, refcount 1]
Fri, 2024-11-01, 11:53:27 05[KNL] adding policy fe80::/64 === fe80::/64 fwd [priority 134463, refcount 1]
Fri, 2024-11-01, 11:53:27 05[IKE] installed bypass policy for fe80::/64
Fri, 2024-11-01, 11:53:27 05[IKE] interface change for bypass policy for fe80::/64 (from lan to lan.4)
Fri, 2024-11-01, 11:53:27 05[KNL] deleting policy fe80::/64 === fe80::/64 out
Fri, 2024-11-01, 11:53:27 05[KNL] deleting policy fe80::/64 === fe80::/64 in
Fri, 2024-11-01, 11:53:27 05[KNL] deleting policy fe80::/64 === fe80::/64 fwd
Fri, 2024-11-01, 11:53:27 05[KNL] adding policy fe80::/64 === fe80::/64 out [priority 134463, refcount 1]
Fri, 2024-11-01, 11:53:27 05[KNL] getting a local address in traffic selector fe80::/64
Fri, 2024-11-01, 11:53:27 05[KNL] no local address found in traffic selector fe80::/64
Fri, 2024-11-01, 11:53:27 05[KNL] getting iface name for index 2
Fri, 2024-11-01, 11:53:27 05[KNL] no nexthop found to reach fe80::/64
Fri, 2024-11-01, 11:53:27 05[KNL] installing route: fe80::/64 via (null) src %any6 dev lan
Fri, 2024-11-01, 11:53:27 05[KNL] adding policy fe80::/64 === fe80::/64 in [priority 134463, refcount 1]
Fri, 2024-11-01, 11:53:27 05[KNL] adding policy fe80::/64 === fe80::/64 fwd [priority 134463, refcount 1]
Fri, 2024-11-01, 11:53:27 15[CFG] vici client 1 connected
Fri, 2024-11-01, 11:53:27 07[CFG] vici client 1 requests: get-keys
Fri, 2024-11-01, 11:53:27 05[CFG] vici client 1 requests: get-shared
Fri, 2024-11-01, 11:53:27 14[CFG] vici client 1 requests: load-shared
Fri, 2024-11-01, 11:53:27 14[CFG] loaded IKE shared key with id 'ike-casper' for: 'casper'
Fri, 2024-11-01, 11:53:27 08[CFG] vici client 1 requests: get-authorities
Fri, 2024-11-01, 11:53:27 05[CFG] vici client 1 requests: get-pools
Fri, 2024-11-01, 11:53:27 13[CFG] vici client 1 requests: get-conns
Fri, 2024-11-01, 11:53:27 07[CFG] vici client 1 requests: load-conn
Fri, 2024-11-01, 11:53:27 07[CFG]  conn psk:
Fri, 2024-11-01, 11:53:27 07[CFG]   child psk:
Fri, 2024-11-01, 11:53:27 07[CFG]    rekey_time = 3600
Fri, 2024-11-01, 11:53:27 07[CFG]    life_time = 3960
Fri, 2024-11-01, 11:53:27 07[CFG]    rand_time = 360
Fri, 2024-11-01, 11:53:27 07[CFG]    rekey_bytes = 0
Fri, 2024-11-01, 11:53:27 07[CFG]    life_bytes = 0
Fri, 2024-11-01, 11:53:27 07[CFG]    rand_bytes = 0
Fri, 2024-11-01, 11:53:27 07[CFG]    rekey_packets = 0
Fri, 2024-11-01, 11:53:27 07[CFG]    life_packets = 0
Fri, 2024-11-01, 11:53:27 07[CFG]    rand_packets = 0
Fri, 2024-11-01, 11:53:27 07[CFG]    updown = (null)
Fri, 2024-11-01, 11:53:27 07[CFG]    hostaccess = 0
Fri, 2024-11-01, 11:53:27 07[CFG]    ipcomp = 0
Fri, 2024-11-01, 11:53:27 07[CFG]    mode = TUNNEL
Fri, 2024-11-01, 11:53:27 07[CFG]    policies = 1
Fri, 2024-11-01, 11:53:27 07[CFG]    policies_fwd_out = 0
Fri, 2024-11-01, 11:53:27 07[CFG]    dpd_action = none
Fri, 2024-11-01, 11:53:27 07[CFG]    start_action = none
Fri, 2024-11-01, 11:53:27 07[CFG]    close_action = none
Fri, 2024-11-01, 11:53:27 07[CFG]    reqid = 0
Fri, 2024-11-01, 11:53:27 07[CFG]    tfc = 0
Fri, 2024-11-01, 11:53:27 07[CFG]    priority = 0
Fri, 2024-11-01, 11:53:27 07[CFG]    interface = (null)
Fri, 2024-11-01, 11:53:27 07[CFG]    if_id_in = 0
Fri, 2024-11-01, 11:53:27 07[CFG]    if_id_out = 0
Fri, 2024-11-01, 11:53:27 07[CFG]    mark_in = 0/0
Fri, 2024-11-01, 11:53:27 07[CFG]    mark_in_sa = 0
Fri, 2024-11-01, 11:53:27 07[CFG]    mark_out = 0/0
Fri, 2024-11-01, 11:53:27 07[CFG]    set_mark_in = 0/0
Fri, 2024-11-01, 11:53:27 07[CFG]    set_mark_out = 0/0
Fri, 2024-11-01, 11:53:27 07[CFG]    label = (null)
Fri, 2024-11-01, 11:53:27 07[CFG]    label_mode = system
Fri, 2024-11-01, 11:53:27 07[CFG]    inactivity = 0
Fri, 2024-11-01, 11:53:27 07[CFG]    proposals = ESP:AES_GCM_16_128/AES_GCM_16_192/AES_GCM_16_256/NO_EXT_SEQ, ESP:AES_CBC_128/AES_CBC_192/AES_CBC_256/HMAC_SHA2_256_128/HMAC_SHA2_384_192/HMAC_SHA2_512_256/HMAC_SHA1_96/AES_XCBC_96/NO_EXT_SEQ
Fri, 2024-11-01, 11:53:27 07[CFG]    local_ts = 0.0.0.0/0
Fri, 2024-11-01, 11:53:27 07[CFG]    remote_ts = dynamic
Fri, 2024-11-01, 11:53:27 07[CFG]    hw_offload = no
Fri, 2024-11-01, 11:53:27 07[CFG]    sha256_96 = 0
Fri, 2024-11-01, 11:53:27 07[CFG]    copy_df = 1
Fri, 2024-11-01, 11:53:27 07[CFG]    copy_ecn = 1
Fri, 2024-11-01, 11:53:27 07[CFG]    copy_dscp = out
Fri, 2024-11-01, 11:53:27 07[CFG]   version = 2
Fri, 2024-11-01, 11:53:27 07[CFG]   local_addrs = %any
Fri, 2024-11-01, 11:53:27 07[CFG]   remote_addrs = %any
Fri, 2024-11-01, 11:53:27 07[CFG]   local_port = 500
Fri, 2024-11-01, 11:53:27 07[CFG]   remote_port = 500
Fri, 2024-11-01, 11:53:27 07[CFG]   send_certreq = 1
Fri, 2024-11-01, 11:53:27 07[CFG]   send_cert = CERT_SEND_IF_ASKED
Fri, 2024-11-01, 11:53:27 07[CFG]   ocsp = OCSP_SEND_REPLY
Fri, 2024-11-01, 11:53:27 07[CFG]   ppk_id = (null)
Fri, 2024-11-01, 11:53:27 07[CFG]   ppk_required = 0
Fri, 2024-11-01, 11:53:27 07[CFG]   mobike = 1
Fri, 2024-11-01, 11:53:27 07[CFG]   aggressive = 0
Fri, 2024-11-01, 11:53:27 07[CFG]   dscp = 0x00
Fri, 2024-11-01, 11:53:27 07[CFG]   encap = 0
Fri, 2024-11-01, 11:53:27 07[CFG]   dpd_delay = 0
Fri, 2024-11-01, 11:53:27 07[CFG]   dpd_timeout = 0
Fri, 2024-11-01, 11:53:27 07[CFG]   fragmentation = 2
Fri, 2024-11-01, 11:53:27 07[CFG]   childless = 0
Fri, 2024-11-01, 11:53:27 07[CFG]   unique = UNIQUE_NO
Fri, 2024-11-01, 11:53:27 07[CFG]   keyingtries = 1
Fri, 2024-11-01, 11:53:27 07[CFG]   reauth_time = 0
Fri, 2024-11-01, 11:53:27 07[CFG]   rekey_time = 14400
Fri, 2024-11-01, 11:53:27 07[CFG]   over_time = 1440
Fri, 2024-11-01, 11:53:27 07[CFG]   rand_time = 1440
Fri, 2024-11-01, 11:53:27 07[CFG]   proposals = IKE:AES_CBC_128/AES_CBC_192/AES_CBC_256/AES_CTR_128/AES_CTR_192/AES_CTR_256/CAMELLIA_CBC_128/CAMELLIA_CBC_192/CAMELLIA_CBC_256/CAMELLIA_CTR_128/CAMELLIA_CTR_192/CAMELLIA_CTR_256/3DES_CBC/HMAC_SHA2_256_128/HMAC_SHA2_384_192/HMAC_SHA2_512_256/AES_XCBC_96/AES_CMAC_96/HMAC_SHA1_96/PRF_HMAC_SHA2_256/PRF_HMAC_SHA2_384/PRF_HMAC_SHA2_512/PRF_AES128_XCBC/PRF_AES128_CMAC/PRF_HMAC_SHA1/ECP_256/ECP_384/ECP_521/ECP_256_BP/ECP_384_BP/ECP_512_BP/CURVE_25519/CURVE_448/NTRU_128/NTRU_192/NTRU_256/NEWHOPE_128/MODP_3072/MODP_4096/MODP_6144/MODP_8192/MODP_2048, IKE:AES_CCM_16_128/AES_CCM_16_192/AES_CCM_16_256/AES_GCM_16_128/AES_GCM_16_192/AES_GCM_16_256/CHACHA20_POLY1305/AES_CCM_8_128/AES_CCM_8_192/AES_CCM_8_256/AES_CCM_12_128/AES_CCM_12_192/AES_CCM_12_256/AES_GCM_8_128/AES_GCM_8_192/AES_GCM_8_256/AES_GCM_12_128/AES_GCM_12_192/AES_GCM_12_256/PRF_HMAC_SHA2_256/PRF_HMAC_SHA2_384/PRF_HMAC_SHA2_512/PRF_AES128_XCBC/PRF_AES128_CMAC/PRF_HMAC_SHA1/ECP_256/ECP_384/ECP_521/ECP_256_BP/ECP_384_BP/ECP_512_BP/CURVE_25519/CURVE_448/NTRU_128/NTRU_192/NTRU_256/NEWHOPE_128/MODP_3072/MODP_4096/MODP_6144/MODP_8192/MODP_2048
Fri, 2024-11-01, 11:53:27 07[CFG]   if_id_in = 0
Fri, 2024-11-01, 11:53:27 07[CFG]   if_id_out = 0
Fri, 2024-11-01, 11:53:27 07[CFG]   local:
Fri, 2024-11-01, 11:53:27 07[CFG]    id = 178.205.XXX.XXX
Fri, 2024-11-01, 11:53:27 07[CFG]    class = pre-shared key
Fri, 2024-11-01, 11:53:27 07[CFG]   remote:
Fri, 2024-11-01, 11:53:27 07[CFG]    class = pre-shared key
Fri, 2024-11-01, 11:53:27 07[CFG] added vici connection: psk
Fri, 2024-11-01, 11:53:27 12[CFG] vici client 1 disconnected
Fri, 2024-11-01, 11:53:37 15[MGR] checkout IKEv2 SA by message with SPIs dbf9b2f69b8c2909_i 0000000000000000_r
Fri, 2024-11-01, 11:53:37 15[MGR] created IKE_SA (unnamed)[1]
Fri, 2024-11-01, 11:53:37 15[NET] <1> received packet: from 178.176.84.33[4205] to 10.16.0.4[500] (1072 bytes)
Fri, 2024-11-01, 11:53:37 15[ENC] <1> parsed IKE_SA_INIT request 0 [ SA KE No N(NATD_S_IP) N(NATD_D_IP) N(FRAG_SUP) N(HASH_ALG) ]
Fri, 2024-11-01, 11:53:37 15[CFG] <1> looking for an IKEv2 config for 10.16.0.4...178.176.84.33
Fri, 2024-11-01, 11:53:37 15[CFG] <1>   candidate: %any...%any, prio 28
Fri, 2024-11-01, 11:53:37 15[CFG] <1> found matching ike config: %any...%any with prio 28
Fri, 2024-11-01, 11:53:37 15[IKE] <1> local endpoint changed from 0.0.0.0[500] to 10.16.0.4[500]
Fri, 2024-11-01, 11:53:37 15[IKE] <1> remote endpoint changed from 0.0.0.0 to 178.176.84.33[4205]
Fri, 2024-11-01, 11:53:37 15[IKE] <1> 178.176.84.33 is initiating an IKE_SA
Fri, 2024-11-01, 11:53:37 15[IKE] <1> IKE_SA (unnamed)[1] state change: CREATED => CONNECTING
Fri, 2024-11-01, 11:53:37 15[CFG] <1> selecting proposal:
Fri, 2024-11-01, 11:53:37 15[CFG] <1>   proposal matches
Fri, 2024-11-01, 11:53:37 15[CFG] <1> received proposals: IKE:AES_CTR_256/AES_CBC_256/AES_CTR_192/AES_CBC_192/AES_CTR_128/AES_CBC_128/HMAC_SHA2_512_256/HMAC_SHA2_384_192/HMAC_SHA2_256_128/AES_XCBC_96/AES_CMAC_96/PRF_HMAC_SHA1/PRF_AES128_XCBC/PRF_HMAC_SHA2_256/PRF_HMAC_SHA2_384/PRF_HMAC_SHA2_512/PRF_AES128_CMAC/MODP_4096/CURVE_25519/MODP_3072/MODP_2048, IKE:CHACHA20_POLY1305/AES_GCM_16_256/AES_GCM_12_256/AES_GCM_8_256/AES_GCM_16_192/AES_GCM_12_192/AES_GCM_8_192/AES_GCM_16_128/AES_GCM_12_128/AES_GCM_8_128/PRF_HMAC_SHA1/PRF_AES128_XCBC/PRF_HMAC_SHA2_256/PRF_HMAC_SHA2_384/PRF_HMAC_SHA2_512/PRF_AES128_CMAC/MODP_4096/CURVE_25519/MODP_3072/MODP_2048
Fri, 2024-11-01, 11:53:37 15[CFG] <1> configured proposals: IKE:AES_CBC_128/AES_CBC_192/AES_CBC_256/AES_CTR_128/AES_CTR_192/AES_CTR_256/CAMELLIA_CBC_128/CAMELLIA_CBC_192/CAMELLIA_CBC_256/CAMELLIA_CTR_128/CAMELLIA_CTR_192/CAMELLIA_CTR_256/3DES_CBC/HMAC_SHA2_256_128/HMAC_SHA2_384_192/HMAC_SHA2_512_256/AES_XCBC_96/AES_CMAC_96/HMAC_SHA1_96/PRF_HMAC_SHA2_256/PRF_HMAC_SHA2_384/PRF_HMAC_SHA2_512/PRF_AES128_XCBC/PRF_AES128_CMAC/PRF_HMAC_SHA1/ECP_256/ECP_384/ECP_521/ECP_256_BP/ECP_384_BP/ECP_512_BP/CURVE_25519/CURVE_448/NTRU_128/NTRU_192/NTRU_256/NEWHOPE_128/MODP_3072/MODP_4096/MODP_6144/MODP_8192/MODP_2048, IKE:AES_CCM_16_128/AES_CCM_16_192/AES_CCM_16_256/AES_GCM_16_128/AES_GCM_16_192/AES_GCM_16_256/CHACHA20_POLY1305/AES_CCM_8_128/AES_CCM_8_192/AES_CCM_8_256/AES_CCM_12_128/AES_CCM_12_192/AES_CCM_12_256/AES_GCM_8_128/AES_GCM_8_192/AES_GCM_8_256/AES_GCM_12_128/AES_GCM_12_192/AES_GCM_12_256/PRF_HMAC_SHA2_256/PRF_HMAC_SHA2_384/PRF_HMAC_SHA2_512/PRF_AES128_XCBC/PRF_AES128_CMAC/PRF_HMAC_SHA1/ECP_256/ECP_384/ECP_521/ECP_256_BP/ECP_384_BP/ECP_512_BP/CURVE_25519/CURVE_448/NTRU_128/NTRU_192/NTRU_256/NEWHOPE_128/MODP_3072/MODP_4096/MODP_6144/MODP_8192/MODP_2048
Fri, 2024-11-01, 11:53:37 15[CFG] <1> selected proposal: IKE:AES_CBC_128/HMAC_SHA2_256_128/PRF_HMAC_SHA2_256/CURVE_25519
Fri, 2024-11-01, 11:53:37 15[CFG] <1> received supported signature hash algorithms: sha256 sha384 sha512
Fri, 2024-11-01, 11:53:37 15[IKE] <1> local host is behind NAT, sending keep alives
Fri, 2024-11-01, 11:53:37 15[IKE] <1> remote host is behind NAT
Fri, 2024-11-01, 11:53:37 15[IKE] <1> DH group MODP_4096 unacceptable, requesting CURVE_25519
Fri, 2024-11-01, 11:53:37 15[ENC] <1> generating IKE_SA_INIT response 0 [ N(INVAL_KE) ]
Fri, 2024-11-01, 11:53:37 15[NET] <1> sending packet: from 10.16.0.4[500] to 178.176.84.33[4205] (38 bytes)
Fri, 2024-11-01, 11:53:37 15[MGR] <1> checkin and destroy IKE_SA (unnamed)[1]
Fri, 2024-11-01, 11:53:37 15[IKE] <1> IKE_SA (unnamed)[1] state change: CONNECTING => DESTROYING
Fri, 2024-11-01, 11:53:37 15[MGR] checkin and destroy of IKE_SA successful
Fri, 2024-11-01, 11:53:37 08[MGR] checkout IKEv2 SA by message with SPIs 86f88d49d964dda4_i 0000000000000000_r
Fri, 2024-11-01, 11:53:37 08[MGR] created IKE_SA (unnamed)[2]
Fri, 2024-11-01, 11:53:37 08[NET] <2> received packet: from 178.176.84.33[39939] to 10.16.0.4[500] (592 bytes)
Fri, 2024-11-01, 11:53:37 08[ENC] <2> parsed IKE_SA_INIT request 0 [ SA KE No N(NATD_S_IP) N(NATD_D_IP) N(FRAG_SUP) N(HASH_ALG) ]
Fri, 2024-11-01, 11:53:37 08[CFG] <2> looking for an IKEv2 config for 10.16.0.4...178.176.84.33
Fri, 2024-11-01, 11:53:37 08[CFG] <2>   candidate: %any...%any, prio 28
Fri, 2024-11-01, 11:53:37 08[CFG] <2> found matching ike config: %any...%any with prio 28
Fri, 2024-11-01, 11:53:37 08[IKE] <2> local endpoint changed from 0.0.0.0[500] to 10.16.0.4[500]
Fri, 2024-11-01, 11:53:37 08[IKE] <2> remote endpoint changed from 0.0.0.0 to 178.176.84.33[39939]
Fri, 2024-11-01, 11:53:37 08[IKE] <2> 178.176.84.33 is initiating an IKE_SA
Fri, 2024-11-01, 11:53:37 08[IKE] <2> IKE_SA (unnamed)[2] state change: CREATED => CONNECTING
Fri, 2024-11-01, 11:53:37 08[CFG] <2> selecting proposal:
Fri, 2024-11-01, 11:53:37 08[CFG] <2>   proposal matches
Fri, 2024-11-01, 11:53:37 08[CFG] <2> received proposals: IKE:AES_CTR_256/AES_CBC_256/AES_CTR_192/AES_CBC_192/AES_CTR_128/AES_CBC_128/HMAC_SHA2_512_256/HMAC_SHA2_384_192/HMAC_SHA2_256_128/AES_XCBC_96/AES_CMAC_96/PRF_HMAC_SHA1/PRF_AES128_XCBC/PRF_HMAC_SHA2_256/PRF_HMAC_SHA2_384/PRF_HMAC_SHA2_512/PRF_AES128_CMAC/MODP_4096/CURVE_25519/MODP_3072/MODP_2048, IKE:CHACHA20_POLY1305/AES_GCM_16_256/AES_GCM_12_256/AES_GCM_8_256/AES_GCM_16_192/AES_GCM_12_192/AES_GCM_8_192/AES_GCM_16_128/AES_GCM_12_128/AES_GCM_8_128/PRF_HMAC_SHA1/PRF_AES128_XCBC/PRF_HMAC_SHA2_256/PRF_HMAC_SHA2_384/PRF_HMAC_SHA2_512/PRF_AES128_CMAC/MODP_4096/CURVE_25519/MODP_3072/MODP_2048
Fri, 2024-11-01, 11:53:37 08[CFG] <2> configured proposals: IKE:AES_CBC_128/AES_CBC_192/AES_CBC_256/AES_CTR_128/AES_CTR_192/AES_CTR_256/CAMELLIA_CBC_128/CAMELLIA_CBC_192/CAMELLIA_CBC_256/CAMELLIA_CTR_128/CAMELLIA_CTR_192/CAMELLIA_CTR_256/3DES_CBC/HMAC_SHA2_256_128/HMAC_SHA2_384_192/HMAC_SHA2_512_256/AES_XCBC_96/AES_CMAC_96/HMAC_SHA1_96/PRF_HMAC_SHA2_256/PRF_HMAC_SHA2_384/PRF_HMAC_SHA2_512/PRF_AES128_XCBC/PRF_AES128_CMAC/PRF_HMAC_SHA1/ECP_256/ECP_384/ECP_521/ECP_256_BP/ECP_384_BP/ECP_512_BP/CURVE_25519/CURVE_448/NTRU_128/NTRU_192/NTRU_256/NEWHOPE_128/MODP_3072/MODP_4096/MODP_6144/MODP_8192/MODP_2048, IKE:AES_CCM_16_128/AES_CCM_16_192/AES_CCM_16_256/AES_GCM_16_128/AES_GCM_16_192/AES_GCM_16_256/CHACHA20_POLY1305/AES_CCM_8_128/AES_CCM_8_192/AES_CCM_8_256/AES_CCM_12_128/AES_CCM_12_192/AES_CCM_12_256/AES_GCM_8_128/AES_GCM_8_192/AES_GCM_8_256/AES_GCM_12_128/AES_GCM_12_192/AES_GCM_12_256/PRF_HMAC_SHA2_256/PRF_HMAC_SHA2_384/PRF_HMAC_SHA2_512/PRF_AES128_XCBC/PRF_AES128_CMAC/PRF_HMAC_SHA1/ECP_256/ECP_384/ECP_521/ECP_256_BP/ECP_384_BP/ECP_512_BP/CURVE_25519/CURVE_448/NTRU_128/NTRU_192/NTRU_256/NEWHOPE_128/MODP_3072/MODP_4096/MODP_6144/MODP_8192/MODP_2048
Fri, 2024-11-01, 11:53:37 08[CFG] <2> selected proposal: IKE:AES_CBC_128/HMAC_SHA2_256_128/PRF_HMAC_SHA2_256/CURVE_25519
Fri, 2024-11-01, 11:53:37 08[CFG] <2> received supported signature hash algorithms: sha256 sha384 sha512
Fri, 2024-11-01, 11:53:37 08[IKE] <2> local host is behind NAT, sending keep alives
Fri, 2024-11-01, 11:53:37 08[IKE] <2> remote host is behind NAT
Fri, 2024-11-01, 11:53:37 08[CFG] <2> sending supported signature hash algorithms: sha256 sha384 sha512 identity
Fri, 2024-11-01, 11:53:37 08[ENC] <2> generating IKE_SA_INIT response 0 [ SA KE No N(NATD_S_IP) N(NATD_D_IP) N(FRAG_SUP) N(HASH_ALG) N(CHDLESS_SUP) N(MULT_AUTH) ]
Fri, 2024-11-01, 11:53:37 08[NET] <2> sending packet: from 10.16.0.4[500] to 178.176.84.33[39939] (248 bytes)
Fri, 2024-11-01, 11:53:37 08[MGR] <2> checkin IKEv2 SA (unnamed)[2] with SPIs 86f88d49d964dda4_i 10d07fcbfb325c78_r
Fri, 2024-11-01, 11:53:37 08[MGR] <2> checkin of IKE_SA successful
Fri, 2024-11-01, 11:53:37 07[MGR] checkout IKEv2 SA by message with SPIs 86f88d49d964dda4_i 10d07fcbfb325c78_r
Fri, 2024-11-01, 11:53:37 07[MGR] IKE_SA (unnamed)[2] successfully checked out
Fri, 2024-11-01, 11:53:37 07[NET] <2> received packet: from 178.176.84.33[15465] to 10.16.0.4[4500] (512 bytes)
Fri, 2024-11-01, 11:53:37 07[ENC] <2> parsed IKE_AUTH request 1 [ IDi IDr AUTH SA TSi TSr CPRQ(ADDR ADDR6 DNS DNS6 MASK VER) ]
Fri, 2024-11-01, 11:53:37 07[IKE] <2> local endpoint changed from 10.16.0.4[500] to 10.16.0.4[4500]
Fri, 2024-11-01, 11:53:37 07[IKE] <2> remote endpoint changed from 178.176.84.33[39939] to 178.176.84.33[15465]
Fri, 2024-11-01, 11:53:37 07[CFG] <2> looking for peer configs matching 10.16.0.4[178.205.XXX.XXX]...178.176.84.33[casper]
Fri, 2024-11-01, 11:53:37 07[CFG] <2>   candidate "psk", match: 20/1/28 (me/other/ike)
Fri, 2024-11-01, 11:53:37 07[CFG] <psk|2> selected peer config 'psk'
Fri, 2024-11-01, 11:53:37 07[IKE] <psk|2> authentication of 'casper' with pre-shared key successful
Fri, 2024-11-01, 11:53:37 07[IKE] <psk|2> processing INTERNAL_IP4_ADDRESS attribute
Fri, 2024-11-01, 11:53:37 07[IKE] <psk|2> processing INTERNAL_IP6_ADDRESS attribute
Fri, 2024-11-01, 11:53:37 07[IKE] <psk|2> processing INTERNAL_IP4_DNS attribute
Fri, 2024-11-01, 11:53:37 07[IKE] <psk|2> processing INTERNAL_IP6_DNS attribute
Fri, 2024-11-01, 11:53:37 07[IKE] <psk|2> processing INTERNAL_IP4_NETMASK attribute
Fri, 2024-11-01, 11:53:37 07[IKE] <psk|2> processing APPLICATION_VERSION attribute
Fri, 2024-11-01, 11:53:37 07[IKE] <psk|2> authentication of '178.205.XXX.XXX' (myself) with pre-shared key
Fri, 2024-11-01, 11:53:37 07[IKE] <psk|2> successfully created shared key MAC
Fri, 2024-11-01, 11:53:37 07[IKE] <psk|2> peer requested virtual IP %any
Fri, 2024-11-01, 11:53:37 07[CFG] <psk|2> sending DHCP DISCOVER for 7a:a7:8d:ad:12:87 to 255.255.255.255
Fri, 2024-11-01, 11:53:38 12[MGR] checkout IKEv2 SA by message with SPIs 86f88d49d964dda4_i 10d07fcbfb325c78_r
Fri, 2024-11-01, 11:53:38 12[MGR] ignoring request with ID 1, already processing
Fri, 2024-11-01, 11:53:38 12[MGR] IKE_SA checkout not successful
Fri, 2024-11-01, 11:53:38 07[CFG] <psk|2> sending DHCP DISCOVER for 7a:a7:8d:ad:12:87 to 255.255.255.255
Fri, 2024-11-01, 11:53:39 14[MGR] checkout IKEv2 SA by message with SPIs 86f88d49d964dda4_i 10d07fcbfb325c78_r
Fri, 2024-11-01, 11:53:39 14[MGR] ignoring request with ID 1, already processing
Fri, 2024-11-01, 11:53:39 14[MGR] IKE_SA checkout not successful
Fri, 2024-11-01, 11:53:40 07[CFG] <psk|2> sending DHCP DISCOVER for 7a:a7:8d:ad:12:87 to 255.255.255.255
Fri, 2024-11-01, 11:53:41 07[CFG] <psk|2> received DHCP OFFER 10.16.0.73 from 10.16.0.6
Fri, 2024-11-01, 11:53:41 07[CFG] <psk|2> sending DHCP REQUEST for 10.16.0.73 to 10.16.0.6
Fri, 2024-11-01, 11:53:41 07[CFG] <psk|2> received DHCP ACK for 10.16.0.73
Fri, 2024-11-01, 11:53:41 07[IKE] <psk|2> assigning virtual IP 10.16.0.73 to peer 'casper'
Fri, 2024-11-01, 11:53:41 07[IKE] <psk|2> peer requested virtual IP %any6
Fri, 2024-11-01, 11:53:41 07[IKE] <psk|2> no virtual IP found for %any6 requested by 'casper'
Fri, 2024-11-01, 11:53:41 07[IKE] <psk|2> building INTERNAL_IP4_DNS attribute
Fri, 2024-11-01, 11:53:41 07[IKE] <psk|2> building INTERNAL_IP4_DNS attribute
Fri, 2024-11-01, 11:53:41 07[IKE] <psk|2> IKE_SA psk[2] established between 10.16.0.4[178.205.XXX.XXX]...178.176.84.33[casper]
Fri, 2024-11-01, 11:53:41 07[IKE] <psk|2> IKE_SA psk[2] state change: CONNECTING => ESTABLISHED
Fri, 2024-11-01, 11:53:41 07[IKE] <psk|2> scheduling rekeying in 13536s
Fri, 2024-11-01, 11:53:41 07[IKE] <psk|2> maximum IKE_SA lifetime 14976s
Fri, 2024-11-01, 11:53:41 07[CFG] <psk|2> looking for a child config for 0.0.0.0/0 ::/0 === 0.0.0.0/0 ::/0
Fri, 2024-11-01, 11:53:41 07[CFG] <psk|2> proposing traffic selectors for us:
Fri, 2024-11-01, 11:53:41 07[CFG] <psk|2>  0.0.0.0/0
Fri, 2024-11-01, 11:53:41 07[CFG] <psk|2> proposing traffic selectors for other:
Fri, 2024-11-01, 11:53:41 07[CFG] <psk|2>  10.16.0.73/32
Fri, 2024-11-01, 11:53:41 07[CFG] <psk|2>   candidate "psk" with prio 10+2
Fri, 2024-11-01, 11:53:41 07[CFG] <psk|2> found matching child config "psk" with prio 12
Fri, 2024-11-01, 11:53:41 07[CFG] <psk|2> selecting proposal:
Fri, 2024-11-01, 11:53:41 07[CFG] <psk|2>   no acceptable ENCRYPTION_ALGORITHM found
Fri, 2024-11-01, 11:53:41 07[CFG] <psk|2> selecting proposal:
Fri, 2024-11-01, 11:53:41 07[CFG] <psk|2>   proposal matches
Fri, 2024-11-01, 11:53:41 07[CFG] <psk|2> received proposals: ESP:AES_CBC_256/AES_CBC_192/AES_CBC_128/HMAC_SHA2_512_256/HMAC_SHA2_384_192/HMAC_SHA2_256_128/NO_EXT_SEQ, ESP:AES_GCM_16_256/AES_GCM_12_256/AES_GCM_8_256/AES_GCM_16_192/AES_GCM_12_192/AES_GCM_8_192/AES_GCM_16_128/AES_GCM_12_128/AES_GCM_8_128/NO_EXT_SEQ
Fri, 2024-11-01, 11:53:41 07[CFG] <psk|2> configured proposals: ESP:AES_GCM_16_128/AES_GCM_16_192/AES_GCM_16_256/NO_EXT_SEQ, ESP:AES_CBC_128/AES_CBC_192/AES_CBC_256/HMAC_SHA2_256_128/HMAC_SHA2_384_192/HMAC_SHA2_512_256/HMAC_SHA1_96/AES_XCBC_96/NO_EXT_SEQ
Fri, 2024-11-01, 11:53:41 07[CFG] <psk|2> selected proposal: ESP:AES_GCM_16_128/NO_EXT_SEQ
Fri, 2024-11-01, 11:53:41 07[KNL] <psk|2> got SPI c9a3cdd7
Fri, 2024-11-01, 11:53:41 07[CFG] <psk|2> selecting traffic selectors for us:
Fri, 2024-11-01, 11:53:41 07[CFG] <psk|2>  config: 0.0.0.0/0, received: 0.0.0.0/0 => match: 0.0.0.0/0
Fri, 2024-11-01, 11:53:41 07[CFG] <psk|2>  config: 0.0.0.0/0, received: ::/0 => no match
Fri, 2024-11-01, 11:53:41 07[CFG] <psk|2> selecting traffic selectors for other:
Fri, 2024-11-01, 11:53:41 07[CFG] <psk|2>  config: 10.16.0.73/32, received: 0.0.0.0/0 => match: 10.16.0.73/32
Fri, 2024-11-01, 11:53:41 07[CFG] <psk|2>  config: 10.16.0.73/32, received: ::/0 => no match
Fri, 2024-11-01, 11:53:41 07[CHD] <psk|2> CHILD_SA psk{1} state change: CREATED => INSTALLING
Fri, 2024-11-01, 11:53:41 07[CHD] <psk|2>   using AES_GCM_16 for encryption
Fri, 2024-11-01, 11:53:41 07[CHD] <psk|2> adding inbound ESP SA
Fri, 2024-11-01, 11:53:41 07[CHD] <psk|2>   SPI 0xc9a3cdd7, src 178.176.84.33 dst 10.16.0.4
Fri, 2024-11-01, 11:53:41 07[KNL] <psk|2> adding SAD entry with SPI c9a3cdd7 and reqid {1}
Fri, 2024-11-01, 11:53:41 07[KNL] <psk|2>   using encryption algorithm AES_GCM_16 with key size 160
Fri, 2024-11-01, 11:53:41 07[KNL] <psk|2>   using replay window of 32 packets
Fri, 2024-11-01, 11:53:41 07[KNL] <psk|2>   HW offload: no
Fri, 2024-11-01, 11:53:41 07[CHD] <psk|2> adding outbound ESP SA
Fri, 2024-11-01, 11:53:41 07[CHD] <psk|2>   SPI 0x2eac10bc, src 10.16.0.4 dst 178.176.84.33
Fri, 2024-11-01, 11:53:41 07[KNL] <psk|2> adding SAD entry with SPI 2eac10bc and reqid {1}
Fri, 2024-11-01, 11:53:41 07[KNL] <psk|2>   using encryption algorithm AES_GCM_16 with key size 160
Fri, 2024-11-01, 11:53:41 07[KNL] <psk|2>   using replay window of 0 packets
Fri, 2024-11-01, 11:53:41 07[KNL] <psk|2>   HW offload: no
Fri, 2024-11-01, 11:53:41 07[KNL] <psk|2> adding policy 10.16.0.73/32 === 0.0.0.0/0 in [priority 383615, refcount 1]
Fri, 2024-11-01, 11:53:41 07[KNL] <psk|2> adding policy 10.16.0.73/32 === 0.0.0.0/0 fwd [priority 383615, refcount 1]
Fri, 2024-11-01, 11:53:41 07[KNL] <psk|2> adding policy 0.0.0.0/0 === 10.16.0.73/32 out [priority 383615, refcount 1]
Fri, 2024-11-01, 11:53:41 07[KNL] <psk|2> getting a local address in traffic selector 0.0.0.0/0
Fri, 2024-11-01, 11:53:41 07[KNL] <psk|2> using host %any
Fri, 2024-11-01, 11:53:41 07[KNL] <psk|2> getting iface name for index 3
Fri, 2024-11-01, 11:53:41 07[KNL] <psk|2> using 10.16.0.6 as nexthop and lan.2 as dev to reach 178.176.84.33/32
Fri, 2024-11-01, 11:53:41 07[KNL] <psk|2> installing route: 10.16.0.73/32 via 10.16.0.6 src %any dev lan.2
Fri, 2024-11-01, 11:53:41 07[KNL] <psk|2> getting iface index for lan.2
Fri, 2024-11-01, 11:53:41 07[IKE] <psk|2> CHILD_SA psk{1} established with SPIs c9a3cdd7_i 2eac10bc_o and TS 0.0.0.0/0 === 10.16.0.73/32
Fri, 2024-11-01, 11:53:41 07[CHD] <psk|2> CHILD_SA psk{1} state change: INSTALLING => INSTALLED
Fri, 2024-11-01, 11:53:41 07[ENC] <psk|2> generating IKE_AUTH response 1 [ IDr AUTH CPRP(ADDR DNS DNS) SA TSi TSr ]
Fri, 2024-11-01, 11:53:41 07[NET] <psk|2> sending packet: from 10.16.0.4[4500] to 178.176.84.33[15465] (240 bytes)
Fri, 2024-11-01, 11:53:41 07[MGR] <psk|2> checkin IKEv2 SA psk[2] with SPIs 86f88d49d964dda4_i 10d07fcbfb325c78_r
Fri, 2024-11-01, 11:53:41 07[MGR] <psk|2> checkin of IKE_SA successful
Fri, 2024-11-01, 11:53:41 14[MGR] checkout IKEv2 SA by message with SPIs 86f88d49d964dda4_i 10d07fcbfb325c78_r
Fri, 2024-11-01, 11:53:41 14[MGR] IKE_SA psk[2] successfully checked out
Fri, 2024-11-01, 11:53:41 14[NET] <psk|2> received packet: from 178.176.84.33[15465] to 10.16.0.4[4500] (512 bytes)
Fri, 2024-11-01, 11:53:41 14[IKE] <psk|2> received retransmit of request with ID 1, retransmitting response
Fri, 2024-11-01, 11:53:41 14[NET] <psk|2> sending packet: from 10.16.0.4[4500] to 178.176.84.33[15465] (240 bytes)
Fri, 2024-11-01, 11:53:41 14[MGR] <psk|2> checkin IKEv2 SA psk[2] with SPIs 86f88d49d964dda4_i 10d07fcbfb325c78_r
Fri, 2024-11-01, 11:53:41 14[MGR] <psk|2> checkin of IKE_SA successful
Fri, 2024-11-01, 11:53:57 09[MGR] checkout IKEv2 SA with SPIs dbf9b2f69b8c2909_i dce889793a0dd3b5_r
Fri, 2024-11-01, 11:53:57 09[MGR] IKE_SA checkout not successful
Fri, 2024-11-01, 11:53:57 05[MGR] checkout IKEv2 SA with SPIs 86f88d49d964dda4_i 10d07fcbfb325c78_r
Fri, 2024-11-01, 11:53:57 05[MGR] IKE_SA psk[2] successfully checked out
Fri, 2024-11-01, 11:53:57 05[MGR] <psk|2> checkin IKEv2 SA psk[2] with SPIs 86f88d49d964dda4_i 10d07fcbfb325c78_r
Fri, 2024-11-01, 11:53:57 05[MGR] <psk|2> checkin of IKE_SA successful
Fri, 2024-11-01, 11:54:07 15[MGR] checkout IKEv2 SA with SPIs 86f88d49d964dda4_i 10d07fcbfb325c78_r
Fri, 2024-11-01, 11:54:07 15[MGR] IKE_SA psk[2] successfully checked out
Fri, 2024-11-01, 11:54:07 15[MGR] <psk|2> checkin IKEv2 SA psk[2] with SPIs 86f88d49d964dda4_i 10d07fcbfb325c78_r
Fri, 2024-11-01, 11:54:07 15[MGR] <psk|2> checkin of IKE_SA successful
Fri, 2024-11-01, 11:54:12 12[MGR] checkout IKEv2 SA with SPIs 86f88d49d964dda4_i 10d07fcbfb325c78_r
Fri, 2024-11-01, 11:54:12 12[MGR] IKE_SA psk[2] successfully checked out
Fri, 2024-11-01, 11:54:12 12[MGR] <psk|2> checkin IKEv2 SA psk[2] with SPIs 86f88d49d964dda4_i 10d07fcbfb325c78_r
Fri, 2024-11-01, 11:54:12 12[MGR] <psk|2> checkin of IKE_SA successful
```

**Config**:
```
# swanctl.conf

connections {

  psk {
    pools = dhcp

    local {
      auth = psk
      id = 178.205.XXX.XXX
    }

    remote {
      auth = psk
    }

    children {
      psk {
        local_ts = 0.0.0.0/0
      }
    }

    version = 2
  }
}

secrets {
  ike-casper {
    id = casper
    secret = N3HbwtSHXXXXXXXXXXXXXXXXXXXXXXXXXXXXX
  }
}
```
 
**Status**:
```
# swanctl -L
plugin 'mysql' failed to load: libmariadb.so.3: cannot open shared object file: No such file or directory
psk: IKEv2, no reauthentication, rekeying every 14400s
  local:  %any
  remote: %any
  local pre-shared key authentication:
    id: 178.205.XXX.XXX
  remote pre-shared key authentication:
  psk: TUNNEL, rekeying every 3600s
    local:  0.0.0.0/0
    remote: dynamic

# swanctl -l
plugin 'mysql' failed to load: libmariadb.so.3: cannot open shared object file: No such file or directory
psk: #2, ESTABLISHED, IKEv2, 86f88d49d964dda4_i 10d07fcbfb325c78_r*
  local  '178.205.XXX.XXX' @ 10.16.0.4[4500]
  remote 'casper' @ 178.176.84.33[15465] [10.16.0.73]
  AES_CBC-128/HMAC_SHA2_256_128/PRF_HMAC_SHA2_256/CURVE_25519
  established 143s ago, rekeying in 13393s
  psk: #1, reqid 1, INSTALLED, TUNNEL-in-UDP, ESP:AES_GCM_16-128
    installed 143s ago, rekeying in 3178s, expires in 3817s
    in  c9a3cdd7,  19147 bytes,   282 packets,    23s ago
    out 2eac10bc,   6973 bytes,    98 packets,   107s ago
    local  0.0.0.0/0
    remote 10.16.0.73/32
```

**Firewall**:
```
# iptables-save
*filter
:INPUT ACCEPT [2206:440575]
:FORWARD ACCEPT [2343:444155]
:OUTPUT ACCEPT [954:584801]
COMMIT

*nat
:PREROUTING ACCEPT [0:0]
:INPUT ACCEPT [0:0]
:OUTPUT ACCEPT [0:0]
:POSTROUTING ACCEPT [0:0]
COMMIT
```

**Routing tables**:
```
# ip route show table all
throw 10.16.0.0/24 table 220 proto static
10.16.0.73 via 10.16.0.6 dev lan.2 table 220 proto static
throw 10.16.4.0/24 table 220 proto static
default via 10.16.0.6 dev lan.2 proto static
10.16.0.0/24 dev lan.2 proto kernel scope link src 10.16.0.4
10.16.4.0/24 dev lan.4 proto kernel scope link src 10.16.4.4
local 10.16.0.4 dev lan.2 table local proto kernel scope host src 10.16.0.4
broadcast 10.16.0.255 dev lan.2 table local proto kernel scope link src 10.16.0.4
local 10.16.4.4 dev lan.4 table local proto kernel scope host src 10.16.4.4
broadcast 10.16.4.255 dev lan.4 table local proto kernel scope link src 10.16.4.4
local 127.0.0.0/8 dev lo table local proto kernel scope host src 127.0.0.1
local 127.0.0.1 dev lo table local proto kernel scope host src 127.0.0.1
broadcast 127.255.255.255 dev lo table local proto kernel scope link src 127.0.0.1
throw fe80::/64 dev lo table 220 proto static metric 1024 pref medium
fe80::/64 dev lan proto kernel metric 256 pref medium
fe80::/64 dev lan.2 proto kernel metric 256 pref medium
fe80::/64 dev lan.4 proto kernel metric 256 pref medium
local ::1 dev lo table local proto kernel metric 0 pref medium
local fe80::aaa1:59ff:feaa:dddf dev lan.4 table local proto kernel metric 0 pref medium
local fe80::aaa1:59ff:feaa:dddf dev lan.2 table local proto kernel metric 0 pref medium
local fe80::aaa1:59ff:feaa:dddf dev lan table local proto kernel metric 0 pref medium
multicast ff00::/8 dev lan table local proto kernel metric 256 pref medium
multicast ff00::/8 dev lan.2 table local proto kernel metric 256 pref medium
multicast ff00::/8 dev lan.4 table local proto kernel metric 256 pref medium
```

**IP configuration**:
```
# ip address
1: lo: <LOOPBACK,UP,LOWER_UP> mtu 65536 qdisc noqueue state UNKNOWN group default qlen 1000
    link/loopback 00:00:00:00:00:00 brd 00:00:00:00:00:00
    inet 127.0.0.1/8 scope host lo
       valid_lft forever preferred_lft forever
    inet6 ::1/128 scope host noprefixroute
       valid_lft forever preferred_lft forever
2: lan: <BROADCAST,MULTICAST,UP,LOWER_UP> mtu 1500 qdisc fq_codel state UP group default qlen 1000
    link/ether a8:a1:59:aa:dd:df brd ff:ff:ff:ff:ff:ff
    altname eno1
    altname enp3s0
    inet6 fe80::aaa1:59ff:feaa:dddf/64 scope link proto kernel_ll
       valid_lft forever preferred_lft forever
3: lan.2@lan: <BROADCAST,MULTICAST,UP,LOWER_UP> mtu 1500 qdisc noqueue state UP group default qlen 1000
    link/ether a8:a1:59:aa:dd:df brd ff:ff:ff:ff:ff:ff
    inet 10.16.0.4/24 brd 10.16.0.255 scope global lan.2
       valid_lft forever preferred_lft forever
    inet6 fe80::aaa1:59ff:feaa:dddf/64 scope link proto kernel_ll
       valid_lft forever preferred_lft forever
4: lan.4@lan: <BROADCAST,MULTICAST,UP,LOWER_UP> mtu 1500 qdisc noqueue state UP group default qlen 1000
    link/ether a8:a1:59:aa:dd:df brd ff:ff:ff:ff:ff:ff
    inet 10.16.4.4/24 brd 10.16.4.255 scope global lan.4
       valid_lft forever preferred_lft forever
    inet6 fe80::aaa1:59ff:feaa:dddf/64 scope link proto kernel_ll
       valid_lft forever preferred_lft forever
```

Could anyone pls help? What I'm missing?

**Comment by ilgiznurgaliev** [comment]
When using virtual ip from external subnet (not dhcp) everything works fine in both direction. But this is not what I want actually, would be create if android device will fully act as client on local LAN.

**Reply by tobiasbrunner** [reply]
Maybe there is an issue with the `farp` plugin. Try capturing traffic to see if ARP responses are correctly generated for requests for the virtual IPs.

**Reply by ilgiznurgaliev** [reply]
@tobiasbrunner thank you for your response. ARP responses look correct:
```
10:59:14.992646 lan   B   ARP, Request who-has 10.16.0.115 tell 10.16.0.10, length 46
10:59:14.992646 lan.2 B   ARP, Request who-has 10.16.0.115 tell 10.16.0.10, length 46
10:59:14.992862 lan.2 Out ARP, Reply 10.16.0.115 is-at a8:a1:59:aa:dd:df, length 28
10:59:14.992864 lan   Out ARP, Reply 10.16.0.115 is-at a8:a1:59:aa:dd:df, length 28
```
Where 10.16.0.115 is IP that the android devices received from DHCP.

Changed `local_ts` in `swanctl` config to the following:
```
local_ts = 10.16.0.0/24, 10.16.4.0/24
```
And now I'm able to ping android device from VPN server:
```
# ping 10.16.0.115
PING 10.16.0.115 (10.16.0.115) 56(84) bytes of data.
64 bytes from 10.16.0.115: icmp_seq=1 ttl=64 time=56.3 ms
64 bytes from 10.16.0.115: icmp_seq=2 ttl=64 time=82.6 ms
64 bytes from 10.16.0.115: icmp_seq=3 ttl=64 time=83.8 ms
^C
--- 10.16.0.115 ping statistics ---
3 packets transmitted, 3 received, 0% packet loss, time 2003ms
rtt min/avg/max/mdev = 56.313/74.229/83.824/12.679 ms
```
And that is only change. I'm still unable to ping anything from 10.16.0.0/24 subnet from android.

By listening traffic on VPN server I can see that it receives ICMP requests from android device, but for some reason unable to respond:
```
# tcpdump -i any -nn icmp
tcpdump: WARNING: any: That device doesn't support promiscuous mode
(Promiscuous mode not supported on the "any" device)
tcpdump: verbose output suppressed, use -v[v]... for full protocol decode
listening on any, link-type LINUX_SLL2 (Linux cooked v2), snapshot length 262144 bytes

11:10:24.145425 lan.2 In  IP 10.16.0.115 > 10.16.0.4: ICMP echo request, id 21666, seq 1, length 64
11:10:25.154445 lan.2 In  IP 10.16.0.115 > 10.16.0.4: ICMP echo request, id 21666, seq 2, length 64
11:10:26.184443 lan.2 In  IP 10.16.0.115 > 10.16.0.4: ICMP echo request, id 21666, seq 3, length 64
11:10:27.206340 lan.2 In  IP 10.16.0.115 > 10.16.0.4: ICMP echo request, id 21666, seq 4, length 64
```

**Reply by tobiasbrunner** [reply]
Oh, I just noticed that you have the [`bypass-lan` plugin](https://docs.strongswan.org/docs/5.9/plugins/bypass-lan.html) active. That's obviously not ideal if you want to actually protect traffic to IP addresses of your local subnet. You should disable that plugin.

**Reply by ilgiznurgaliev** [reply]
After disabling `bypass-lan` plugin everything started to work perfectly, in both directions. Thank you very much for your help.
