### DISCUSSION TITLE
Problems after rekeying

### DISCUSSION THREAD

**Discussion by lurcio** [strongswan/strongswan#336] [Q&A] [answered]
Hello!

I'm trying to configure an IPSEC VPN between a single EC2 instance and an AWS site-to-site VPN. Using the configuration below everything appears to go well, traffic is routed where I expect it and I'm very happy. At some point, I think after rekeying, the connection breaks. The tunnels remain up, and pinging from EC2->AWS VPN with the [traffic capture advice](https://wiki.strongswan.org/projects/strongswan/wiki/CorrectTrafficDump) shows traffic traversing the tunnel:

```
tcpdump -s 0 -n -i nflog:5
tcpdump: verbose output suppressed, use -v or -vv for full protocol decode
listening on nflog:5, link-type NFLOG (Linux netfilter log messages), capture size 262144 bytes
16:57:21.859701 IP 10.145.1.100 > 10.1.1.140: ICMP echo request, id 217, seq 1, length 64
16:57:21.859876 IP 10.1.1.140 > 10.145.1.100: ICMP echo reply, id 217, seq 1, length 64
16:57:52.899389 IP 10.145.1.100 > 10.1.1.140: ICMP echo request, id 218, seq 1, length 64
16:57:52.899427 IP 10.1.1.140 > 10.145.1.100: ICMP echo reply, id 218, seq 1, length 64
```

...but the ping command doesn't seem to see the reply:

```
ping -c1 -w1 10.1.1.140
PING 10.1.1.140 (10.1.1.140) 56(84) bytes of data.

--- 10.1.1.140 ping statistics ---
1 packets transmitted, 0 received, 100% packet loss, time 0ms
```

Sometimes running `ipsec restart` will bring the connection back to life.

I have included my configuration below. Any help would be most appreciated.

`/etc/ipsec.conf:`

```
config setup
    charondebug="ike 1, knl 1, cfg 0"

conn %default
  leftauth=psk
  rightauth=psk
  ike=aes256-sha256-prfsha256-ecp256!
  ikelifetime=28800s
  aggressive=no
  esp=aes256-sha256-prfsha256-ecp256!
  lifetime=3600s
  type=tunnel
  dpddelay=10s
  dpdtimeout=30s
  keyexchange=ikev2
  rekey=yes
  reauth=yes
  rekeyfuzz=100%
  keyingtries=%forever
  replay_window=32
  dpdaction=restart
  closeaction=restart
  installpolicy=yes
  compress=no
  mobike=no

conn vpn-tunnel-0
  auto=start
  left=10.145.1.100
  leftid=52.45.7.46
  leftsubnet=10.145.1.0/24
  right=3.90.117.235
  rightid=3.90.117.235
  rightsubnet=10.1.0.0/16

conn vpn-tunnel-1
  auto=start
  left=10.145.1.100
  leftid=52.45.7.46
  leftsubnet=10.145.1.0/24
  right=52.55.48.110
  rightid=52.55.48.110
  rightsubnet=10.1.0.0/16
```

`ipsec statusall:`

```
Status of IKE charon daemon (strongSwan 5.8.2, Linux 5.4.0-1043-aws, x86_64):
  uptime: 90 minutes, since Apr 19 15:07:50 2021
  malloc: sbrk 2568192, mmap 0, used 818624, free 1749568
  worker threads: 11 of 16 idle, 5/0/0/0 working, job queue: 0/0/0/0, scheduled: 8
  loaded plugins: charon aesni aes rc2 sha2 sha1 md5 mgf1 random nonce x509 revocation constraints pubkey pkcs1 pkcs7 pkcs8 pkcs12 pgp dnskey sshkey pem openssl fips-prf gmp agent xcbc hmac gcm drbg attr kernel-netlink resolve socket-default connmark stroke updown eap-mschapv2 xauth-generic counters
Listening IP addresses:
  10.145.1.100
Connections:
vpn-tunnel-0:  10.145.1.100...3.90.117.235  IKEv2, dpddelay=10s
vpn-tunnel-0:   local:  [52.45.7.46] uses pre-shared key authentication
vpn-tunnel-0:   remote: [3.90.117.235] uses pre-shared key authentication
vpn-tunnel-0:   child:  10.145.1.0/24 === 10.1.0.0/16 TUNNEL, dpdaction=restart
vpn-tunnel-1:  10.145.1.100...52.55.48.110  IKEv2, dpddelay=10s
vpn-tunnel-1:   local:  [52.45.7.46] uses pre-shared key authentication
vpn-tunnel-1:   remote: [52.55.48.110] uses pre-shared key authentication
vpn-tunnel-1:   child:  10.145.1.0/24 === 10.1.0.0/16 TUNNEL, dpdaction=restart
Security Associations (2 up, 0 connecting):
vpn-tunnel-1[2]: ESTABLISHED 90 minutes ago, 10.145.1.100[52.45.7.46]...52.55.48.110[52.55.48.110]
vpn-tunnel-1[2]: IKEv2 SPIs: dd9b1627ed0cba4f_i* d2e0e9fddf0119cc_r, pre-shared key reauthentication in 6 hours
vpn-tunnel-1[2]: IKE proposal: AES_CBC_256/HMAC_SHA2_256_128/PRF_HMAC_SHA2_256/ECP_256
vpn-tunnel-1{5}:  INSTALLED, TUNNEL, reqid 1, ESP in UDP SPIs: c9e4f235_i c8ba0aee_o
vpn-tunnel-1{5}:  AES_CBC_256/HMAC_SHA2_256_128/ECP_256, 420 bytes_i (5 pkts, 20s ago), 168 bytes_o (2 pkts, 20s ago), rekeying in 42 minutes
vpn-tunnel-1{5}:   10.145.1.0/24 === 10.1.0.0/16
vpn-tunnel-0[1]: ESTABLISHED 90 minutes ago, 10.145.1.100[52.45.7.46]...3.90.117.235[3.90.117.235]
vpn-tunnel-0[1]: IKEv2 SPIs: b3a4ea3eaf8212a2_i* 55d8c63f48022c7c_r, pre-shared key reauthentication in 6 hours
vpn-tunnel-0[1]: IKE proposal: AES_CBC_256/HMAC_SHA2_256_128/PRF_HMAC_SHA2_256/ECP_256
vpn-tunnel-0{6}:  INSTALLED, TUNNEL, reqid 1, ESP in UDP SPIs: c9066abe_i cec346d4_o
vpn-tunnel-0{6}:  AES_CBC_256/HMAC_SHA2_256_128/ECP_256, 0 bytes_i (0 pkts, 20s ago), 252 bytes_o (3 pkts, 20s ago), rekeying in 42 minutes
vpn-tunnel-0{6}:   10.145.1.0/24 === 10.1.0.0/16
```

`iptables-save:`

```
# Generated by iptables-save v1.8.4 on Mon Apr 19 16:38:16 2021
*filter
:INPUT DROP [0:0]
:FORWARD DROP [0:0]
:OUTPUT ACCEPT [0:0]
:ufw-after-forward - [0:0]
:ufw-after-input - [0:0]
:ufw-after-logging-forward - [0:0]
:ufw-after-logging-input - [0:0]
:ufw-after-logging-output - [0:0]
:ufw-after-output - [0:0]
:ufw-before-forward - [0:0]
:ufw-before-input - [0:0]
:ufw-before-logging-forward - [0:0]
:ufw-before-logging-input - [0:0]
:ufw-before-logging-output - [0:0]
:ufw-before-output - [0:0]
:ufw-logging-allow - [0:0]
:ufw-logging-deny - [0:0]
:ufw-not-local - [0:0]
:ufw-reject-forward - [0:0]
:ufw-reject-input - [0:0]
:ufw-reject-output - [0:0]
:ufw-skip-to-policy-forward - [0:0]
:ufw-skip-to-policy-input - [0:0]
:ufw-skip-to-policy-output - [0:0]
:ufw-track-forward - [0:0]
:ufw-track-input - [0:0]
:ufw-track-output - [0:0]
:ufw-user-forward - [0:0]
:ufw-user-input - [0:0]
:ufw-user-limit - [0:0]
:ufw-user-limit-accept - [0:0]
:ufw-user-logging-forward - [0:0]
:ufw-user-logging-input - [0:0]
:ufw-user-logging-output - [0:0]
:ufw-user-output - [0:0]
-A INPUT -j ufw-before-logging-input
-A INPUT -j ufw-before-input
-A INPUT -j ufw-after-input
-A INPUT -j ufw-after-logging-input
-A INPUT -j ufw-reject-input
-A INPUT -j ufw-track-input
-A FORWARD -j ufw-before-logging-forward
-A FORWARD -j ufw-before-forward
-A FORWARD -j ufw-after-forward
-A FORWARD -j ufw-after-logging-forward
-A FORWARD -j ufw-reject-forward
-A FORWARD -j ufw-track-forward
-A OUTPUT -j ufw-before-logging-output
-A OUTPUT -j ufw-before-output
-A OUTPUT -j ufw-after-output
-A OUTPUT -j ufw-after-logging-output
-A OUTPUT -j ufw-reject-output
-A OUTPUT -j ufw-track-output
-A ufw-after-input -p udp -m udp --dport 137 -j ufw-skip-to-policy-input
-A ufw-after-input -p udp -m udp --dport 138 -j ufw-skip-to-policy-input
-A ufw-after-input -p tcp -m tcp --dport 139 -j ufw-skip-to-policy-input
-A ufw-after-input -p tcp -m tcp --dport 445 -j ufw-skip-to-policy-input
-A ufw-after-input -p udp -m udp --dport 67 -j ufw-skip-to-policy-input
-A ufw-after-input -p udp -m udp --dport 68 -j ufw-skip-to-policy-input
-A ufw-after-input -m addrtype --dst-type BROADCAST -j ufw-skip-to-policy-input
-A ufw-after-logging-forward -m limit --limit 3/min --limit-burst 10 -j LOG --log-prefix "[UFW BLOCK] "
-A ufw-after-logging-input -m limit --limit 3/min --limit-burst 10 -j LOG --log-prefix "[UFW BLOCK] "
-A ufw-before-forward -m conntrack --ctstate RELATED,ESTABLISHED -j ACCEPT
-A ufw-before-forward -p icmp -m icmp --icmp-type 3 -j ACCEPT
-A ufw-before-forward -p icmp -m icmp --icmp-type 11 -j ACCEPT
-A ufw-before-forward -p icmp -m icmp --icmp-type 12 -j ACCEPT
-A ufw-before-forward -p icmp -m icmp --icmp-type 8 -j ACCEPT
-A ufw-before-forward -j ufw-user-forward
-A ufw-before-input -i lo -j ACCEPT
-A ufw-before-input -m conntrack --ctstate RELATED,ESTABLISHED -j ACCEPT
-A ufw-before-input -m conntrack --ctstate INVALID -j ufw-logging-deny
-A ufw-before-input -m conntrack --ctstate INVALID -j DROP
-A ufw-before-input -p icmp -m icmp --icmp-type 3 -j ACCEPT
-A ufw-before-input -p icmp -m icmp --icmp-type 11 -j ACCEPT
-A ufw-before-input -p icmp -m icmp --icmp-type 12 -j ACCEPT
-A ufw-before-input -p icmp -m icmp --icmp-type 8 -j ACCEPT
-A ufw-before-input -p udp -m udp --sport 67 --dport 68 -j ACCEPT
-A ufw-before-input -j ufw-not-local
-A ufw-before-input -d 224.0.0.251/32 -p udp -m udp --dport 5353 -j ACCEPT
-A ufw-before-input -d 239.255.255.250/32 -p udp -m udp --dport 1900 -j ACCEPT
-A ufw-before-input -j ufw-user-input
-A ufw-before-output -o lo -j ACCEPT
-A ufw-before-output -m conntrack --ctstate RELATED,ESTABLISHED -j ACCEPT
-A ufw-before-output -j ufw-user-output
-A ufw-logging-allow -m limit --limit 3/min --limit-burst 10 -j LOG --log-prefix "[UFW ALLOW] "
-A ufw-logging-deny -m conntrack --ctstate INVALID -m limit --limit 3/min --limit-burst 10 -j RETURN
-A ufw-logging-deny -m limit --limit 3/min --limit-burst 10 -j LOG --log-prefix "[UFW BLOCK] "
-A ufw-not-local -m addrtype --dst-type LOCAL -j RETURN
-A ufw-not-local -m addrtype --dst-type MULTICAST -j RETURN
-A ufw-not-local -m addrtype --dst-type BROADCAST -j RETURN
-A ufw-not-local -m limit --limit 3/min --limit-burst 10 -j ufw-logging-deny
-A ufw-not-local -j DROP
-A ufw-skip-to-policy-forward -j DROP
-A ufw-skip-to-policy-input -j DROP
-A ufw-skip-to-policy-output -j ACCEPT
-A ufw-track-output -p tcp -m conntrack --ctstate NEW -j ACCEPT
-A ufw-track-output -p udp -m conntrack --ctstate NEW -j ACCEPT
-A ufw-user-input -s 10.56.0.0/14 -p tcp -m tcp --dport 22 -j ACCEPT
-A ufw-user-input -s 78.143.195.31/32 -p tcp -m tcp --dport 22 -j ACCEPT
-A ufw-user-input -s 3.90.117.235/32 -p udp -m udp --dport 500 -j ACCEPT
-A ufw-user-input -s 3.90.117.235/32 -p udp -m udp --dport 4500 -j ACCEPT
-A ufw-user-input -s 52.55.48.110/32 -p udp -m udp --dport 500 -j ACCEPT
-A ufw-user-input -s 52.55.48.110/32 -p udp -m udp --dport 4500 -j ACCEPT
-A ufw-user-input -s 10.145.0.2/32 -p tcp -m tcp --sport 53 -j ACCEPT
-A ufw-user-input -s 10.145.0.2/32 -p udp -m udp --sport 53 -j ACCEPT
-A ufw-user-limit -m limit --limit 3/min -j LOG --log-prefix "[UFW LIMIT BLOCK] "
-A ufw-user-limit -j REJECT --reject-with icmp-port-unreachable
-A ufw-user-limit-accept -j ACCEPT
-A ufw-user-output -d 3.90.117.235/32 -p udp -m udp --dport 500 -j ACCEPT
-A ufw-user-output -d 3.90.117.235/32 -p udp -m udp --dport 4500 -j ACCEPT
-A ufw-user-output -d 52.55.48.110/32 -p udp -m udp --dport 500 -j ACCEPT
-A ufw-user-output -d 52.55.48.110/32 -p udp -m udp --dport 4500 -j ACCEPT
-A ufw-user-output -d 10.145.0.2/32 -p tcp -m tcp --dport 53 -j ACCEPT
-A ufw-user-output -d 10.145.0.2/32 -p udp -m udp --dport 53 -j ACCEPT
-A ufw-user-output -p udp -m udp --dport 123 -j ACCEPT
-A ufw-user-output -d 10.56.0.0/14 -p tcp -m tcp --dport 22 -j ACCEPT
-A ufw-user-output -d 78.143.195.31/32 -p tcp -m tcp --dport 22 -j ACCEPT
-A ufw-user-output -d 169.254.169.254/32 -p tcp -m tcp --dport 80 -j ACCEPT
-A ufw-user-output -d 10.145.1.140/32 -p tcp -m tcp --dport 443 -j ACCEPT
-A ufw-user-output -d 10.1.0.0/16 -j ACCEPT
-A ufw-user-output -j DROP
COMMIT
# Completed on Mon Apr 19 16:38:16 2021
```

`iptables6-save:`

```
# Generated by ip6tables-save v1.8.4 on Mon Apr 19 16:38:36 2021
*filter
:INPUT DROP [0:0]
:FORWARD DROP [0:0]
:OUTPUT ACCEPT [0:0]
:ufw6-after-forward - [0:0]
:ufw6-after-input - [0:0]
:ufw6-after-logging-forward - [0:0]
:ufw6-after-logging-input - [0:0]
:ufw6-after-logging-output - [0:0]
:ufw6-after-output - [0:0]
:ufw6-before-forward - [0:0]
:ufw6-before-input - [0:0]
:ufw6-before-logging-forward - [0:0]
:ufw6-before-logging-input - [0:0]
:ufw6-before-logging-output - [0:0]
:ufw6-before-output - [0:0]
:ufw6-logging-allow - [0:0]
:ufw6-logging-deny - [0:0]
:ufw6-reject-forward - [0:0]
:ufw6-reject-input - [0:0]
:ufw6-reject-output - [0:0]
:ufw6-skip-to-policy-forward - [0:0]
:ufw6-skip-to-policy-input - [0:0]
:ufw6-skip-to-policy-output - [0:0]
:ufw6-track-forward - [0:0]
:ufw6-track-input - [0:0]
:ufw6-track-output - [0:0]
:ufw6-user-forward - [0:0]
:ufw6-user-input - [0:0]
:ufw6-user-limit - [0:0]
:ufw6-user-limit-accept - [0:0]
:ufw6-user-logging-forward - [0:0]
:ufw6-user-logging-input - [0:0]
:ufw6-user-logging-output - [0:0]
:ufw6-user-output - [0:0]
-A INPUT -j ufw6-before-logging-input
-A INPUT -j ufw6-before-input
-A INPUT -j ufw6-after-input
-A INPUT -j ufw6-after-logging-input
-A INPUT -j ufw6-reject-input
-A INPUT -j ufw6-track-input
-A FORWARD -j ufw6-before-logging-forward
-A FORWARD -j ufw6-before-forward
-A FORWARD -j ufw6-after-forward
-A FORWARD -j ufw6-after-logging-forward
-A FORWARD -j ufw6-reject-forward
-A FORWARD -j ufw6-track-forward
-A OUTPUT -j ufw6-before-logging-output
-A OUTPUT -j ufw6-before-output
-A OUTPUT -j ufw6-after-output
-A OUTPUT -j ufw6-after-logging-output
-A OUTPUT -j ufw6-reject-output
-A OUTPUT -j ufw6-track-output
-A ufw6-after-input -p udp -m udp --dport 137 -j ufw6-skip-to-policy-input
-A ufw6-after-input -p udp -m udp --dport 138 -j ufw6-skip-to-policy-input
-A ufw6-after-input -p tcp -m tcp --dport 139 -j ufw6-skip-to-policy-input
-A ufw6-after-input -p tcp -m tcp --dport 445 -j ufw6-skip-to-policy-input
-A ufw6-after-input -p udp -m udp --dport 546 -j ufw6-skip-to-policy-input
-A ufw6-after-input -p udp -m udp --dport 547 -j ufw6-skip-to-policy-input
-A ufw6-after-logging-forward -m limit --limit 3/min --limit-burst 10 -j LOG --log-prefix "[UFW BLOCK] "
-A ufw6-after-logging-input -m limit --limit 3/min --limit-burst 10 -j LOG --log-prefix "[UFW BLOCK] "
-A ufw6-before-forward -m rt --rt-type 0 -j DROP
-A ufw6-before-forward -m conntrack --ctstate RELATED,ESTABLISHED -j ACCEPT
-A ufw6-before-forward -p ipv6-icmp -m icmp6 --icmpv6-type 1 -j ACCEPT
-A ufw6-before-forward -p ipv6-icmp -m icmp6 --icmpv6-type 2 -j ACCEPT
-A ufw6-before-forward -p ipv6-icmp -m icmp6 --icmpv6-type 3 -j ACCEPT
-A ufw6-before-forward -p ipv6-icmp -m icmp6 --icmpv6-type 4 -j ACCEPT
-A ufw6-before-forward -p ipv6-icmp -m icmp6 --icmpv6-type 128 -j ACCEPT
-A ufw6-before-forward -p ipv6-icmp -m icmp6 --icmpv6-type 129 -j ACCEPT
-A ufw6-before-forward -j ufw6-user-forward
-A ufw6-before-input -i lo -j ACCEPT
-A ufw6-before-input -m rt --rt-type 0 -j DROP
-A ufw6-before-input -m conntrack --ctstate RELATED,ESTABLISHED -j ACCEPT
-A ufw6-before-input -p ipv6-icmp -m icmp6 --icmpv6-type 129 -j ACCEPT
-A ufw6-before-input -m conntrack --ctstate INVALID -j ufw6-logging-deny
-A ufw6-before-input -m conntrack --ctstate INVALID -j DROP
-A ufw6-before-input -p ipv6-icmp -m icmp6 --icmpv6-type 1 -j ACCEPT
-A ufw6-before-input -p ipv6-icmp -m icmp6 --icmpv6-type 2 -j ACCEPT
-A ufw6-before-input -p ipv6-icmp -m icmp6 --icmpv6-type 3 -j ACCEPT
-A ufw6-before-input -p ipv6-icmp -m icmp6 --icmpv6-type 4 -j ACCEPT
-A ufw6-before-input -p ipv6-icmp -m icmp6 --icmpv6-type 128 -j ACCEPT
-A ufw6-before-input -p ipv6-icmp -m icmp6 --icmpv6-type 133 -m hl --hl-eq 255 -j ACCEPT
-A ufw6-before-input -p ipv6-icmp -m icmp6 --icmpv6-type 134 -m hl --hl-eq 255 -j ACCEPT
-A ufw6-before-input -p ipv6-icmp -m icmp6 --icmpv6-type 135 -m hl --hl-eq 255 -j ACCEPT
-A ufw6-before-input -p ipv6-icmp -m icmp6 --icmpv6-type 136 -m hl --hl-eq 255 -j ACCEPT
-A ufw6-before-input -p ipv6-icmp -m icmp6 --icmpv6-type 141 -m hl --hl-eq 255 -j ACCEPT
-A ufw6-before-input -p ipv6-icmp -m icmp6 --icmpv6-type 142 -m hl --hl-eq 255 -j ACCEPT
-A ufw6-before-input -s fe80::/10 -p ipv6-icmp -m icmp6 --icmpv6-type 130 -j ACCEPT
-A ufw6-before-input -s fe80::/10 -p ipv6-icmp -m icmp6 --icmpv6-type 131 -j ACCEPT
-A ufw6-before-input -s fe80::/10 -p ipv6-icmp -m icmp6 --icmpv6-type 132 -j ACCEPT
-A ufw6-before-input -s fe80::/10 -p ipv6-icmp -m icmp6 --icmpv6-type 143 -j ACCEPT
-A ufw6-before-input -p ipv6-icmp -m icmp6 --icmpv6-type 148 -m hl --hl-eq 255 -j ACCEPT
-A ufw6-before-input -p ipv6-icmp -m icmp6 --icmpv6-type 149 -m hl --hl-eq 255 -j ACCEPT
-A ufw6-before-input -s fe80::/10 -p ipv6-icmp -m icmp6 --icmpv6-type 151 -m hl --hl-eq 1 -j ACCEPT
-A ufw6-before-input -s fe80::/10 -p ipv6-icmp -m icmp6 --icmpv6-type 152 -m hl --hl-eq 1 -j ACCEPT
-A ufw6-before-input -s fe80::/10 -p ipv6-icmp -m icmp6 --icmpv6-type 153 -m hl --hl-eq 1 -j ACCEPT
-A ufw6-before-input -p ipv6-icmp -m icmp6 --icmpv6-type 144 -j ACCEPT
-A ufw6-before-input -p ipv6-icmp -m icmp6 --icmpv6-type 145 -j ACCEPT
-A ufw6-before-input -p ipv6-icmp -m icmp6 --icmpv6-type 146 -j ACCEPT
-A ufw6-before-input -p ipv6-icmp -m icmp6 --icmpv6-type 147 -j ACCEPT
-A ufw6-before-input -s fe80::/10 -d fe80::/10 -p udp -m udp --sport 547 --dport 546 -j ACCEPT
-A ufw6-before-input -d ff02::fb/128 -p udp -m udp --dport 5353 -j ACCEPT
-A ufw6-before-input -d ff02::f/128 -p udp -m udp --dport 1900 -j ACCEPT
-A ufw6-before-input -j ufw6-user-input
-A ufw6-before-output -o lo -j ACCEPT
-A ufw6-before-output -m rt --rt-type 0 -j DROP
-A ufw6-before-output -m conntrack --ctstate RELATED,ESTABLISHED -j ACCEPT
-A ufw6-before-output -p ipv6-icmp -m icmp6 --icmpv6-type 1 -j ACCEPT
-A ufw6-before-output -p ipv6-icmp -m icmp6 --icmpv6-type 2 -j ACCEPT
-A ufw6-before-output -p ipv6-icmp -m icmp6 --icmpv6-type 3 -j ACCEPT
-A ufw6-before-output -p ipv6-icmp -m icmp6 --icmpv6-type 4 -j ACCEPT
-A ufw6-before-output -p ipv6-icmp -m icmp6 --icmpv6-type 128 -j ACCEPT
-A ufw6-before-output -p ipv6-icmp -m icmp6 --icmpv6-type 129 -j ACCEPT
-A ufw6-before-output -p ipv6-icmp -m icmp6 --icmpv6-type 133 -m hl --hl-eq 255 -j ACCEPT
-A ufw6-before-output -p ipv6-icmp -m icmp6 --icmpv6-type 136 -m hl --hl-eq 255 -j ACCEPT
-A ufw6-before-output -p ipv6-icmp -m icmp6 --icmpv6-type 135 -m hl --hl-eq 255 -j ACCEPT
-A ufw6-before-output -p ipv6-icmp -m icmp6 --icmpv6-type 134 -m hl --hl-eq 255 -j ACCEPT
-A ufw6-before-output -p ipv6-icmp -m icmp6 --icmpv6-type 141 -m hl --hl-eq 255 -j ACCEPT
-A ufw6-before-output -p ipv6-icmp -m icmp6 --icmpv6-type 142 -m hl --hl-eq 255 -j ACCEPT
-A ufw6-before-output -s fe80::/10 -p ipv6-icmp -m icmp6 --icmpv6-type 130 -j ACCEPT
-A ufw6-before-output -s fe80::/10 -p ipv6-icmp -m icmp6 --icmpv6-type 131 -j ACCEPT
-A ufw6-before-output -s fe80::/10 -p ipv6-icmp -m icmp6 --icmpv6-type 132 -j ACCEPT
-A ufw6-before-output -s fe80::/10 -p ipv6-icmp -m icmp6 --icmpv6-type 143 -j ACCEPT
-A ufw6-before-output -p ipv6-icmp -m icmp6 --icmpv6-type 148 -m hl --hl-eq 255 -j ACCEPT
-A ufw6-before-output -p ipv6-icmp -m icmp6 --icmpv6-type 149 -m hl --hl-eq 255 -j ACCEPT
-A ufw6-before-output -s fe80::/10 -p ipv6-icmp -m icmp6 --icmpv6-type 151 -m hl --hl-eq 1 -j ACCEPT
-A ufw6-before-output -s fe80::/10 -p ipv6-icmp -m icmp6 --icmpv6-type 152 -m hl --hl-eq 1 -j ACCEPT
-A ufw6-before-output -s fe80::/10 -p ipv6-icmp -m icmp6 --icmpv6-type 153 -m hl --hl-eq 1 -j ACCEPT
-A ufw6-before-output -j ufw6-user-output
-A ufw6-logging-allow -m limit --limit 3/min --limit-burst 10 -j LOG --log-prefix "[UFW ALLOW] "
-A ufw6-logging-deny -m conntrack --ctstate INVALID -m limit --limit 3/min --limit-burst 10 -j RETURN
-A ufw6-logging-deny -m limit --limit 3/min --limit-burst 10 -j LOG --log-prefix "[UFW BLOCK] "
-A ufw6-skip-to-policy-forward -j DROP
-A ufw6-skip-to-policy-input -j DROP
-A ufw6-skip-to-policy-output -j ACCEPT
-A ufw6-track-output -p tcp -m conntrack --ctstate NEW -j ACCEPT
-A ufw6-track-output -p udp -m conntrack --ctstate NEW -j ACCEPT
-A ufw6-user-limit -m limit --limit 3/min -j LOG --log-prefix "[UFW LIMIT BLOCK] "
-A ufw6-user-limit -j REJECT --reject-with icmp6-port-unreachable
-A ufw6-user-limit-accept -j ACCEPT
-A ufw6-user-output -p udp -m udp --dport 123 -j ACCEPT
-A ufw6-user-output -j DROP
COMMIT
# Completed on Mon Apr 19 16:38:36 2021
```

`ip route:`

```
10.1.0.0/16 via 10.145.1.1 dev ens5 table 220 proto static src 10.145.1.100 
default via 10.145.1.1 dev ens5 proto dhcp src 10.145.1.100 metric 100 
10.145.1.0/24 dev ens5 proto kernel scope link src 10.145.1.100 
10.145.1.1 dev ens5 proto dhcp scope link src 10.145.1.100 metric 100 
broadcast 10.145.1.0 dev ens5 table local proto kernel scope link src 10.145.1.100 
local 10.145.1.100 dev ens5 table local proto kernel scope host src 10.145.1.100 
broadcast 10.145.1.255 dev ens5 table local proto kernel scope link src 10.145.1.100 
broadcast 127.0.0.0 dev lo table local proto kernel scope link src 127.0.0.1 
local 127.0.0.0/8 dev lo table local proto kernel scope host src 127.0.0.1 
local 127.0.0.1 dev lo table local proto kernel scope host src 127.0.0.1 
broadcast 127.255.255.255 dev lo table local proto kernel scope link src 127.0.0.1 
::1 dev lo proto kernel metric 256 pref medium
fe80::/64 dev ens5 proto kernel metric 256 pref medium
local ::1 dev lo table local proto kernel metric 0 pref medium
local fe80::dc:35ff:fe9b:7881 dev ens5 table local proto kernel metric 0 pref medium
multicast ff00::/8 dev ens5 table local proto kernel metric 256 pref medium
```

`ip address:`

```
1: lo: <LOOPBACK,UP,LOWER_UP> mtu 65536 qdisc noqueue state UNKNOWN group default qlen 1000
    link/loopback 00:00:00:00:00:00 brd 00:00:00:00:00:00
    inet 127.0.0.1/8 scope host lo
       valid_lft forever preferred_lft forever
    inet6 ::1/128 scope host 
       valid_lft forever preferred_lft forever
2: ens5: <BROADCAST,MULTICAST,UP,LOWER_UP> mtu 9001 qdisc mq state UP group default qlen 1000
    link/ether 02:dc:35:9b:78:81 brd ff:ff:ff:ff:ff:ff
    inet 10.145.1.100/24 brd 10.145.1.255 scope global dynamic ens5
       valid_lft 1261sec preferred_lft 1261sec
    inet6 fe80::dc:35ff:fe9b:7881/64 scope link 
       valid_lft forever preferred_lft forever
```

`/var/log/syslog` (this was large so I attached it):
[syslog.gz](https://github.com/strongswan/strongswan/files/6337739/syslog.gz)

`ip xfr state:`

```
src 10.145.1.100 dst 3.90.117.235
	proto esp spi 0xcec346d4 reqid 1 mode tunnel
	replay-window 0 flag af-unspec
	auth-trunc hmac(sha256) 0x1968955ee21dc7ab181e7587e203cb7c1cf01f1e38aaa894be74ebefd44e424f 128
	enc cbc(aes) 0x99a2faaf21f319a9641db04393991fcf70212e673a8691a42e145d8e0c72f068
	encap type espinudp sport 4500 dport 4500 addr 0.0.0.0
	anti-replay context: seq 0x0, oseq 0x45, bitmap 0x00000000
src 3.90.117.235 dst 10.145.1.100
	proto esp spi 0xc9066abe reqid 1 mode tunnel
	replay-window 32 flag af-unspec
	auth-trunc hmac(sha256) 0xa9f074357bb09ade860a9632fb26f2b4bfdef3426239b429e640158fc8d5c232 128
	enc cbc(aes) 0xe3cab55e8bd9b547c53852323ee9337e14a2d1907850b6216001ed69b262d68c
	encap type espinudp sport 4500 dport 4500 addr 0.0.0.0
	anti-replay context: seq 0x0, oseq 0x0, bitmap 0x00000000
src 10.145.1.100 dst 52.55.48.110
	proto esp spi 0xc8ba0aee reqid 1 mode tunnel
	replay-window 0 flag af-unspec
	auth-trunc hmac(sha256) 0xea81e88dcec6e375a0dba12736f5b5a30b9736dd6051eefcd9ee736d5ff6524e 128
	enc cbc(aes) 0x931c5d5b6e53cfd3a3bd4eb65b939f368a9da8e6def6fe340e5c73156ed4cb93
	encap type espinudp sport 4500 dport 4500 addr 0.0.0.0
	anti-replay context: seq 0x0, oseq 0x2, bitmap 0x00000000
src 52.55.48.110 dst 10.145.1.100
	proto esp spi 0xc9e4f235 reqid 1 mode tunnel
	replay-window 32 flag af-unspec
	auth-trunc hmac(sha256) 0xf3796d85a7afce43ce575dd221dea9023ecb80e9be2d2d57e509a2e8b75d8e67 128
	enc cbc(aes) 0x8e364c9c81d1b5c1bbe8a35cd84fa8e70229fb096041bac82c4c87a21881ba2d
	encap type espinudp sport 4500 dport 4500 addr 0.0.0.0
	anti-replay context: seq 0x47, oseq 0x0, bitmap 0xffffffff
```

`ip xfr policy:`

```
src 10.145.1.0/24 dst 10.1.0.0/16
	dir out priority 379519
	tmpl src 10.145.1.100 dst 3.90.117.235
		proto esp spi 0xcec346d4 reqid 1 mode tunnel
src 10.1.0.0/16 dst 10.145.1.0/24
	dir fwd priority 379519
	tmpl src 3.90.117.235 dst 10.145.1.100
		proto esp reqid 1 mode tunnel
src 10.1.0.0/16 dst 10.145.1.0/24
	dir in priority 379519
	tmpl src 3.90.117.235 dst 10.145.1.100
		proto esp reqid 1 mode tunnel
src 0.0.0.0/0 dst 0.0.0.0/0
	socket in priority 0
src 0.0.0.0/0 dst 0.0.0.0/0
	socket out priority 0
src 0.0.0.0/0 dst 0.0.0.0/0
	socket in priority 0
src 0.0.0.0/0 dst 0.0.0.0/0
	socket out priority 0
src ::/0 dst ::/0
	socket in priority 0
src ::/0 dst ::/0
	socket out priority 0
src ::/0 dst ::/0
	socket in priority 0
src ::/0 dst ::/0
	socket out priority 0
```

**Comment by Thermi** [comment, marked as answer]
Such a setup is not something I have tested, so I advise to use route based tunnels instead of policy based ones for site-to-site tunnels. The issue here, in your particular setup, is first to figure out if packets actually come back, and second if the one set of policies, but the two states somehow cause the issue (e.g. packet is received by SA 1, but the policies you have are all bound to SA2).

**Reply by lurcio** [reply]
@Thermi Thank you so much for your help. I have converted the connection to route based tunnels and things look much better now.
