### DISCUSSION TITLE
Road Warrior traffic not redirected through site-to-site VPN with partner

### DISCUSSION THREAD

**Discussion by yelhouti** [strongswan/strongswan#2197] [Q&A]
I have the following config with two connection

```
connections {
    mycompany-vpn {
        local_addrs = 196.32.221.78
        version = 2
        pools = mycompany-vpn-pool
        proposals = aes256-sha256-modp2048
        local {
            auth = pubkey
            certs = mycompany-vpn-cert.pem
            id = 196.32.221.78
        }
        remote {
            auth = eap-mschapv2
        }
        children {
            mycompany-vpn {
                local_ts = 0.0.0.0/0
                esp_proposals = aes256-sha256-modp2048
                ah_proposals = aes256-sha256-modp2048
                mode = tunnel
                start_action = start
                updown = /usr/libexec/strongswan/_updown iptables
            }
        }
    }

    
    mycompany-partner {
        version = 2
        mobike = no
        proposals = aes256-sha256-ecp384
        local_addrs = 196.32.221.78 # Replace with your local IP
        remote_addrs = 41.87.129.1 # Replace with remote IP
        pools = mycompany-vpn-pool
        local {
            auth = psk
        }
        remote {
            auth = psk
        }
        children {
            mycompany-partner-prod {
                remote_ts = 172.25.1.142/32
                local_ts = 172.23.127.0/24
                updown = /usr/libexec/strongswan/_updown iptables
                start_action = start
                ah_proposals = aes256-sha256-ecp384
                esp_proposals = aes256-sha256-ecp384
                dpd_action = restart
            }
            
            mycompany-partner-pprod {
                remote_ts = 172.25.1.143/32
                local_ts = 172.23.127.0/24
                updown = /usr/libexec/strongswan/_updown iptables
                start_action = start
                ah_proposals = aes256-sha256-ecp384
                esp_proposals = aes256-sha256-ecp384
                dpd_action = restart
            }
        }
    }
}

pools {
    mycompany-vpn-pool {
        addrs = 172.23.127.2/24
        dns = 8.8.8.8
    }
}
secrets {
ike-mycompany-partner {
    id = <PARTNER_IP>
    secret = <PSK>
  }
  ike-mycompany-partner {
    id = <MY_COMPANY_IP>
    secret = <PSK>
  }
}
```

The partner is able to connect to the road warrior (for testing purposes).
And I can see traffic on the server when I tcpdump with isakmp packets and ESP packets.

but when I try to reach him from my RW, the dump only contains isakmp, this suggests to me that my requests are not routed correctly.

Any idea on what might be the issue ?

Also, later on, I would like to be able to run apps on the same machine as the VPN and have it use the VPN connection. Any idea on how to assign a private IP for the pool to the VPN machine ?

EDIT: updated with IPS.

**Comment by tobiasbrunner** [comment]
First, you should provide logs and status output etc. as instructed by #196.

> The partner is able to connect to the road warrior (for testing purposes).

What does that mean? Connect how?

> but when I try to reach him from my RW, the dump only contains isakmp, this suggests to me that my requests are not routed correctly.

What exactly are you trying to do? What IPs and protocols are involved? What's the client?

 

> Any idea on how to assign a private IP for the pool to the VPN machine ?

Just assign it e.g. the first one in the pool's subnet, then configure the pool with an offset (e.g. `addrs = 192.168.42.2/24` allows you to assign `192.168.42.1` to the server).

**Comment by yelhouti** [comment]
@tobiasbrunner thanks a lot for taking the time.
Indeed I missed the big "Please read this before posting" Maybe add a lot of these :exclamation:  on both ends :smile: .

<details>
<summary>Server config</summary>

```
connections {
    mycompany-vpn {
        local_addrs = 196.32.221.78
        version = 2
        pools = mycompany-vpn-pool
        proposals = aes256-sha256-modp2048
        local {
            auth = pubkey
            certs = mycompany-vpn-cert.pem
            id = 196.32.221.78
        }
        remote {
            auth = eap-mschapv2
        }
        children {
            mycompany-vpn {
                local_ts = 0.0.0.0/0
                esp_proposals = aes256-sha256-modp2048
                ah_proposals = aes256-sha256-modp2048
                mode = tunnel
                start_action = start
                updown = /usr/libexec/strongswan/_updown iptables
            }
        }
    }

    
    mycompany-partner {
        version = 2
        mobike = no
        proposals = aes256-sha256-ecp384
        local_addrs = 196.32.221.78 # Replace with your local IP
        remote_addrs = 41.87.129.1 # Replace with remote IP
        pools = mycompany-vpn-pool
        local {
            auth = psk
        }
        remote {
            auth = psk
        }
        children {
            mycompany-partner-prod {
                remote_ts = 172.25.1.142/32
                local_ts = 172.23.127.0/24
                updown = /usr/libexec/strongswan/_updown iptables
                start_action = start
                ah_proposals = aes256-sha256-ecp384
                esp_proposals = aes256-sha256-ecp384
                dpd_action = restart
            }
            
            mycompany-partner-pprod {
                remote_ts = 172.25.1.143/32
                local_ts = 172.23.127.0/24
                updown = /usr/libexec/strongswan/_updown iptables
                start_action = start
                ah_proposals = aes256-sha256-ecp384
                esp_proposals = aes256-sha256-ecp384
                dpd_action = restart
            }
        }
    }
}

pools {
    mycompany-vpn-pool {
        addrs = 172.23.127.2/24
        dns = 8.8.8.8
    }
}

secrets {
    eap-mschapv2 {
        id = yelhouti
        password = <STRONG_SECRET>
    }
  
    ike-mycompany-partner {
        id = 41.87.129.1
        secret = <SHARED_SECRET>
    }
  
    ike-partner-mycompany {
        id = 196.32.221.78
        secret = <SHARED_SECRET>
    }
}

include conf.d/*.conf
```
</details>

<details>
<summary>Laptop config:</summary>

```
connections {

   mycompany-vpn {
      remote_addrs = 196.32.221.78
      vips = 0.0.0.0
      local {
         auth = eap-mschapv2
         id = yelhouti
      }
      remote {
         auth = pubkey
         id = 196.32.221.78
         certs = mycompany-vpn-cert.pem
      }
      children {
         mycompany-vpn {
            remote_ts = 0.0.0.0/0
            updown = /usr/libexec/strongswan/_updown iptables
            esp_proposals = aes256-sha256-modp2048
            ah_proposals = aes256-sha256-modp2048
            start_action = start
         }
      }
      version = 2
      proposals = aes256-sha256-modp2048
   }
}
```

</details>

<details>
<summary>Logs:</summary>

Thu, 2024-04-04, 03:54:27 00[CFG] PKCS11 module '<name>' lacks library path
Thu, 2024-04-04, 03:54:27 00[LIB] plugin 'pkcs11': loaded successfully
Thu, 2024-04-04, 03:54:27 00[PTS] TPM 2.0 - "/dev/tpmrm0" in-kernel resource manager is not present
Thu, 2024-04-04, 03:54:27 00[PTS] TPM 2.0 - "libtss2-tcti-tabrmd.so.0" successfully loaded
Thu, 2024-04-04, 03:54:27 00[LIB] plugin 'tpm': loaded successfully
Thu, 2024-04-04, 03:54:27 00[LIB] plugin 'aesni': loaded successfully
Thu, 2024-04-04, 03:54:27 00[LIB] plugin 'aes': loaded successfully
Thu, 2024-04-04, 03:54:27 00[LIB] plugin 'des': loaded successfully
Thu, 2024-04-04, 03:54:27 00[LIB] plugin 'rc2': loaded successfully
Thu, 2024-04-04, 03:54:27 00[LIB] plugin 'sha2': loaded successfully
Thu, 2024-04-04, 03:54:27 00[LIB] plugin 'sha1': loaded successfully
Thu, 2024-04-04, 03:54:27 00[LIB] plugin 'md4': loaded successfully
Thu, 2024-04-04, 03:54:27 00[LIB] plugin 'md5': loaded successfully
Thu, 2024-04-04, 03:54:27 00[LIB] plugin 'mgf1': loaded successfully
Thu, 2024-04-04, 03:54:27 00[LIB] plugin 'random': loaded successfully
Thu, 2024-04-04, 03:54:27 00[LIB] plugin 'nonce': loaded successfully
Thu, 2024-04-04, 03:54:27 00[LIB] plugin 'x509': loaded successfully
Thu, 2024-04-04, 03:54:27 00[LIB] plugin 'revocation': loaded successfully
Thu, 2024-04-04, 03:54:27 00[LIB] plugin 'constraints': loaded successfully
Thu, 2024-04-04, 03:54:27 00[LIB] plugin 'acert': loaded successfully
Thu, 2024-04-04, 03:54:27 00[LIB] plugin 'pubkey': loaded successfully
Thu, 2024-04-04, 03:54:27 00[LIB] plugin 'pkcs1': loaded successfully
Thu, 2024-04-04, 03:54:27 00[LIB] plugin 'pkcs7': loaded successfully
Thu, 2024-04-04, 03:54:27 00[LIB] plugin 'pkcs12': loaded successfully
Thu, 2024-04-04, 03:54:27 00[LIB] plugin 'pgp': loaded successfully
Thu, 2024-04-04, 03:54:27 00[LIB] plugin 'dnskey': loaded successfully
Thu, 2024-04-04, 03:54:27 00[LIB] plugin 'sshkey': loaded successfully
Thu, 2024-04-04, 03:54:27 00[LIB] plugin 'ipseckey': loaded successfully
Thu, 2024-04-04, 03:54:27 00[LIB] plugin 'pem': loaded successfully
Thu, 2024-04-04, 03:54:27 00[LIB] providers loaded by OpenSSL: default legacy
Thu, 2024-04-04, 03:54:27 00[LIB] plugin 'openssl': loaded successfully
Thu, 2024-04-04, 03:54:27 00[LIB] plugin 'gcrypt': loaded successfully
Thu, 2024-04-04, 03:54:27 00[LIB] plugin 'pkcs8': loaded successfully
Thu, 2024-04-04, 03:54:27 00[LIB] plugin 'fips-prf': loaded successfully
Thu, 2024-04-04, 03:54:27 00[LIB] plugin 'gmp': loaded successfully
Thu, 2024-04-04, 03:54:27 00[LIB] plugin 'curve25519': loaded successfully
Thu, 2024-04-04, 03:54:27 00[LIB] plugin 'chapoly': loaded successfully
Thu, 2024-04-04, 03:54:27 00[LIB] plugin 'xcbc': loaded successfully
Thu, 2024-04-04, 03:54:27 00[LIB] plugin 'cmac': loaded successfully
Thu, 2024-04-04, 03:54:27 00[LIB] plugin 'hmac': loaded successfully
Thu, 2024-04-04, 03:54:27 00[LIB] plugin 'kdf': loaded successfully
Thu, 2024-04-04, 03:54:27 00[LIB] plugin 'ctr': loaded successfully
Thu, 2024-04-04, 03:54:27 00[LIB] plugin 'ccm': loaded successfully
Thu, 2024-04-04, 03:54:27 00[LIB] plugin 'gcm': loaded successfully
Thu, 2024-04-04, 03:54:27 00[LIB] plugin 'drbg': loaded successfully
Thu, 2024-04-04, 03:54:27 00[LIB] plugin 'newhope': loaded successfully
Thu, 2024-04-04, 03:54:27 00[LIB] available TLS backends in libcurl: openssl
Thu, 2024-04-04, 03:54:27 00[LIB] plugin 'curl': loaded successfully
Thu, 2024-04-04, 03:54:27 00[LIB] plugin 'sqlite': failed to load - sqlite_plugin_create not found and no plugin file available
Thu, 2024-04-04, 03:54:27 00[CFG] loaded legacy entry attribute INTERNAL_IP4_DNS: 08:08:08:08
Thu, 2024-04-04, 03:54:27 00[LIB] plugin 'attr': loaded successfully
Thu, 2024-04-04, 03:54:27 00[LIB] plugin 'kernel-libipsec': failed to load - kernel_libipsec_plugin_create not found and no plugin file available
Thu, 2024-04-04, 03:54:27 00[LIB] plugin 'kernel-netlink': loaded successfully
Thu, 2024-04-04, 03:54:27 00[CFG] using '/sbin/resolvconf' to install DNS servers
Thu, 2024-04-04, 03:54:27 00[LIB] plugin 'resolve': loaded successfully
Thu, 2024-04-04, 03:54:27 00[LIB] plugin 'socket-default': loaded successfully
Thu, 2024-04-04, 03:54:27 00[LIB] plugin 'farp': loaded successfully
Thu, 2024-04-04, 03:54:27 00[LIB] plugin 'stroke': loaded successfully
Thu, 2024-04-04, 03:54:27 00[LIB] plugin 'vici': loaded successfully
Thu, 2024-04-04, 03:54:27 00[LIB] plugin 'sql': loaded successfully
Thu, 2024-04-04, 03:54:27 00[LIB] plugin 'updown': loaded successfully
Thu, 2024-04-04, 03:54:27 00[LIB] plugin 'eap-identity': loaded successfully
Thu, 2024-04-04, 03:54:27 00[LIB] plugin 'eap-sim': loaded successfully
Thu, 2024-04-04, 03:54:27 00[LIB] plugin 'eap-sim-file': loaded successfully
Thu, 2024-04-04, 03:54:27 00[LIB] plugin 'eap-aka': loaded successfully
Thu, 2024-04-04, 03:54:27 00[LIB] plugin 'eap-aka-3gpp': loaded successfully
Thu, 2024-04-04, 03:54:27 00[LIB] plugin 'eap-aka-3gpp2': loaded successfully
Thu, 2024-04-04, 03:54:27 00[LIB] plugin 'eap-md5': loaded successfully
Thu, 2024-04-04, 03:54:27 00[LIB] plugin 'eap-gtc': loaded successfully
Thu, 2024-04-04, 03:54:27 00[LIB] plugin 'eap-mschapv2': loaded successfully
Thu, 2024-04-04, 03:54:27 00[LIB] plugin 'eap-dynamic': loaded successfully
Thu, 2024-04-04, 03:54:27 00[LIB] plugin 'eap-radius': loaded successfully
Thu, 2024-04-04, 03:54:27 00[LIB] plugin 'eap-tls': loaded successfully
Thu, 2024-04-04, 03:54:27 00[LIB] plugin 'eap-ttls': loaded successfully
Thu, 2024-04-04, 03:54:27 00[LIB] plugin 'eap-peap': loaded successfully
Thu, 2024-04-04, 03:54:27 00[LIB] plugin 'eap-tnc': failed to load - eap_tnc_plugin_create not found and no plugin file available
Thu, 2024-04-04, 03:54:27 00[LIB] plugin 'xauth-generic': loaded successfully
Thu, 2024-04-04, 03:54:27 00[LIB] plugin 'xauth-eap': loaded successfully
Thu, 2024-04-04, 03:54:27 00[LIB] plugin 'xauth-pam': loaded successfully
Thu, 2024-04-04, 03:54:27 00[LIB] plugin 'xauth-noauth': loaded successfully
Thu, 2024-04-04, 03:54:27 00[LIB] plugin 'tnc-ifmap': failed to load - tnc_ifmap_plugin_create not found and no plugin file available
Thu, 2024-04-04, 03:54:27 00[LIB] plugin 'tnc-pdp': failed to load - tnc_pdp_plugin_create not found and no plugin file available
Thu, 2024-04-04, 03:54:27 00[LIB] plugin 'tnc-imc': failed to load - tnc_imc_plugin_create not found and no plugin file available
Thu, 2024-04-04, 03:54:27 00[LIB] plugin 'tnc-imv': failed to load - tnc_imv_plugin_create not found and no plugin file available
Thu, 2024-04-04, 03:54:27 00[LIB] plugin 'tnc-tnccs': failed to load - tnc_tnccs_plugin_create not found and no plugin file available
Thu, 2024-04-04, 03:54:27 00[LIB] plugin 'tnccs-20': failed to load - tnccs_20_plugin_create not found and no plugin file available
Thu, 2024-04-04, 03:54:27 00[LIB] plugin 'tnccs-11': failed to load - tnccs_11_plugin_create not found and no plugin file available
Thu, 2024-04-04, 03:54:27 00[LIB] plugin 'tnccs-dynamic': failed to load - tnccs_dynamic_plugin_create not found and no plugin file available
Thu, 2024-04-04, 03:54:27 00[LIB] plugin 'dhcp': loaded successfully
Thu, 2024-04-04, 03:54:27 00[LIB] plugin 'ha': loaded successfully
Thu, 2024-04-04, 03:54:27 00[LIB] plugin 'ext-auth': loaded successfully
Thu, 2024-04-04, 03:54:27 00[LIB] plugin 'led': loaded successfully
Thu, 2024-04-04, 03:54:27 00[LIB] plugin 'duplicheck': loaded successfully
Thu, 2024-04-04, 03:54:27 00[LIB] plugin 'unity': loaded successfully
Thu, 2024-04-04, 03:54:27 00[LIB] plugin 'counters': loaded successfully
Thu, 2024-04-04, 03:54:27 00[KNL] XFRM interfaces supported by kernel
Thu, 2024-04-04, 03:54:27 00[KNL] known interfaces and IP addresses:
Thu, 2024-04-04, 03:54:27 00[KNL]   lo
Thu, 2024-04-04, 03:54:27 00[KNL]     127.0.0.1
Thu, 2024-04-04, 03:54:27 00[KNL]     ::1
Thu, 2024-04-04, 03:54:27 00[KNL]   eth0
Thu, 2024-04-04, 03:54:27 00[KNL]     196.32.221.78
Thu, 2024-04-04, 03:54:27 00[KNL]     172.23.127.1
Thu, 2024-04-04, 03:54:27 00[KNL]     fe80::216:3eff:fe5f:24a7
Thu, 2024-04-04, 03:54:27 00[KNL]   docker0
Thu, 2024-04-04, 03:54:27 00[KNL]     172.17.0.1
Thu, 2024-04-04, 03:54:27 00[LIB] feature PUBKEY:BLISS in plugin 'pem' has unmet dependency: PUBKEY:BLISS
Thu, 2024-04-04, 03:54:27 00[LIB] feature PUBKEY:DSA in plugin 'pem' has unmet dependency: PUBKEY:DSA
Thu, 2024-04-04, 03:54:27 00[LIB] feature CUSTOM:ipseckey in plugin 'ipseckey' has unmet dependency: RESOLVER
Thu, 2024-04-04, 03:54:27 00[LIB] feature PRIVKEY:DSA in plugin 'pem' has unmet dependency: PRIVKEY:DSA
Thu, 2024-04-04, 03:54:27 00[LIB] feature PRIVKEY:BLISS in plugin 'pem' has unmet dependency: PRIVKEY:BLISS
Thu, 2024-04-04, 03:54:27 00[LIB] feature CERT_DECODE:OCSP_REQUEST in plugin 'pem' has unmet dependency: CERT_DECODE:OCSP_REQUEST
Thu, 2024-04-04, 03:54:27 00[CFG] loading ca certificates from '/etc/strongswan/ipsec.d/cacerts'
Thu, 2024-04-04, 03:54:27 00[CFG] loading aa certificates from '/etc/strongswan/ipsec.d/aacerts'
Thu, 2024-04-04, 03:54:27 00[CFG] loading ocsp signer certificates from '/etc/strongswan/ipsec.d/ocspcerts'
Thu, 2024-04-04, 03:54:27 00[CFG] loading attribute certificates from '/etc/strongswan/ipsec.d/acerts'
Thu, 2024-04-04, 03:54:27 00[CFG] loading crls from '/etc/strongswan/ipsec.d/crls'
Thu, 2024-04-04, 03:54:27 00[CFG] loading secrets from '/etc/strongswan/ipsec.secrets'
Thu, 2024-04-04, 03:54:27 00[LIB] feature CUSTOM:sql in plugin 'sql' has unmet dependency: DATABASE:any
Thu, 2024-04-04, 03:54:27 00[CFG] opening triplet file /etc/strongswan/ipsec.d/triplets.dat failed: No such file or directory
Thu, 2024-04-04, 03:54:27 00[LIB] feature CUSTOM:eap-sim-file-triplets in plugin 'eap-sim-file' failed to load
Thu, 2024-04-04, 03:54:27 00[LIB] feature CUSTOM:sim-card in plugin 'eap-sim-file' has unmet dependency: CUSTOM:eap-sim-file-triplets
Thu, 2024-04-04, 03:54:27 00[LIB] feature CUSTOM:sim-provider in plugin 'eap-sim-file' has unmet dependency: CUSTOM:eap-sim-file-triplets
Thu, 2024-04-04, 03:54:27 00[CFG] loaded 0 RADIUS server configurations
Thu, 2024-04-04, 03:54:27 00[CFG] HA config misses local/remote address
Thu, 2024-04-04, 03:54:27 00[LIB] feature CUSTOM:ha in plugin 'ha' failed to load
Thu, 2024-04-04, 03:54:27 00[CFG] no script for ext-auth script defined, disabled
Thu, 2024-04-04, 03:54:27 00[LIB] feature CUSTOM:ext_auth in plugin 'ext-auth' failed to load
Thu, 2024-04-04, 03:54:27 00[LIB] unloading plugin 'ipseckey' without loaded features
Thu, 2024-04-04, 03:54:27 00[LIB] unloading plugin 'sql' without loaded features
Thu, 2024-04-04, 03:54:27 00[LIB] unloading plugin 'eap-sim-file' without loaded features
Thu, 2024-04-04, 03:54:27 00[LIB] unloading plugin 'ha' without loaded features
Thu, 2024-04-04, 03:54:27 00[LIB] unloading plugin 'ext-auth' without loaded features
Thu, 2024-04-04, 03:54:27 00[LIB] loaded plugins: charon-systemd pkcs11 tpm aesni aes des rc2 sha2 sha1 md4 md5 mgf1 random nonce x509 revocation constraints acert pubkey pkcs1 pkcs7 pkcs12 pgp dnskey sshkey pem openssl gcrypt pkcs8 fips-prf gmp curve25519 chapoly xcbc cmac hmac kdf ctr ccm gcm drbg newhope curl attr kernel-netlink resolve socket-default farp stroke vici updown eap-identity eap-sim eap-aka eap-aka-3gpp eap-aka-3gpp2 eap-md5 eap-gtc eap-mschapv2 eap-dynamic eap-radius eap-tls eap-ttls eap-peap xauth-generic xauth-eap xauth-pam xauth-noauth dhcp led duplicheck unity counters
Thu, 2024-04-04, 03:54:27 00[LIB] unable to load 12 plugin features (9 due to unmet dependencies)
Thu, 2024-04-04, 03:54:27 00[LIB] dropped capabilities, running as uid 0, gid 0
Thu, 2024-04-04, 03:54:27 00[JOB] spawning 16 worker threads
Thu, 2024-04-04, 03:54:27 01[LIB] created thread 01 [154596]
Thu, 2024-04-04, 03:54:27 02[LIB] created thread 02 [154597]
Thu, 2024-04-04, 03:54:27 03[LIB] created thread 03 [154598]
Thu, 2024-04-04, 03:54:27 04[LIB] created thread 04 [154599]
Thu, 2024-04-04, 03:54:27 05[LIB] created thread 05 [154600]
Thu, 2024-04-04, 03:54:27 06[LIB] created thread 06 [154595]
Thu, 2024-04-04, 03:54:27 07[LIB] created thread 07 [154601]
Thu, 2024-04-04, 03:54:27 08[LIB] created thread 08 [154602]
Thu, 2024-04-04, 03:54:27 09[LIB] created thread 09 [154603]
Thu, 2024-04-04, 03:54:27 11[LIB] created thread 11 [154605]
Thu, 2024-04-04, 03:54:27 10[LIB] created thread 10 [154604]
Thu, 2024-04-04, 03:54:27 12[LIB] created thread 12 [154606]
Thu, 2024-04-04, 03:54:27 13[LIB] created thread 13 [154607]
Thu, 2024-04-04, 03:54:27 14[LIB] created thread 14 [154608]
Thu, 2024-04-04, 03:54:27 15[LIB] created thread 15 [154609]
Thu, 2024-04-04, 03:54:27 16[LIB] created thread 16 [154594]
Thu, 2024-04-04, 03:54:27 09[CFG] vici client 1 connected
Thu, 2024-04-04, 03:54:27 14[CFG] vici client 1 requests: get-keys
Thu, 2024-04-04, 03:54:27 09[CFG] vici client 1 requests: get-shared
Thu, 2024-04-04, 03:54:27 03[CFG] vici client 1 requests: load-cert
Thu, 2024-04-04, 03:54:27 03[LIB] builder L0 CRED_CERTIFICATE - X509 of plugin 'x509'
Thu, 2024-04-04, 03:54:27 03[LIB] builder L0 CRED_CERTIFICATE - X509 of plugin 'openssl'
Thu, 2024-04-04, 03:54:27 03[LIB] builder L0 CRED_CERTIFICATE - X509 of plugin 'pem'
Thu, 2024-04-04, 03:54:27 03[LIB] builder L1 CRED_CERTIFICATE - X509 of plugin 'x509'
Thu, 2024-04-04, 03:54:27 03[LIB] builder L2 CRED_PUBLIC_KEY - ANY of plugin 'pkcs1'
Thu, 2024-04-04, 03:54:27 03[LIB] builder L3 CRED_PUBLIC_KEY - RSA of plugin 'pkcs1'
Thu, 2024-04-04, 03:54:27 03[LIB] builder L4 CRED_PUBLIC_KEY - RSA of plugin 'pkcs1'
Thu, 2024-04-04, 03:54:27 03[LIB] builder L4 CRED_PUBLIC_KEY - RSA of plugin 'pgp'
Thu, 2024-04-04, 03:54:27 03[LIB] builder L4 CRED_PUBLIC_KEY - RSA of plugin 'dnskey'
Thu, 2024-04-04, 03:54:27 03[LIB] builder L4 CRED_PUBLIC_KEY - RSA of plugin 'openssl'
Thu, 2024-04-04, 03:54:27 03[CFG] loaded certificate 'CN=vpn.mycompany.ma'
Thu, 2024-04-04, 03:54:27 14[CFG] vici client 1 requests: load-key
Thu, 2024-04-04, 03:54:27 14[LIB] builder L0 CRED_PRIVATE_KEY - RSA of plugin 'pkcs1'
Thu, 2024-04-04, 03:54:27 14[LIB] builder L0 CRED_PRIVATE_KEY - RSA of plugin 'pgp'
Thu, 2024-04-04, 03:54:27 14[LIB] builder L0 CRED_PRIVATE_KEY - RSA of plugin 'openssl'
Thu, 2024-04-04, 03:54:27 14[LIB] builder L0 CRED_PRIVATE_KEY - RSA of plugin 'gcrypt'
Thu, 2024-04-04, 03:54:27 14[LIB] builder L0 CRED_PRIVATE_KEY - RSA of plugin 'pkcs8'
Thu, 2024-04-04, 03:54:27 14[LIB] builder L0 CRED_PRIVATE_KEY - RSA of plugin 'gmp'
Thu, 2024-04-04, 03:54:27 14[LIB] builder L0 CRED_PRIVATE_KEY - RSA of plugin 'pem'
Thu, 2024-04-04, 03:54:27 14[LIB] builder L1 CRED_PRIVATE_KEY - RSA of plugin 'pkcs1'
Thu, 2024-04-04, 03:54:27 14[LIB] builder L2 CRED_PRIVATE_KEY - RSA of plugin 'pkcs1'
Thu, 2024-04-04, 03:54:27 14[LIB] builder L2 CRED_PRIVATE_KEY - RSA of plugin 'pgp'
Thu, 2024-04-04, 03:54:27 14[LIB] builder L2 CRED_PRIVATE_KEY - RSA of plugin 'openssl'
Thu, 2024-04-04, 03:54:27 14[CFG] loaded RSA private key
Thu, 2024-04-04, 03:54:27 11[CFG] vici client 1 requests: load-shared
Thu, 2024-04-04, 03:54:27 11[CFG] loaded EAP shared key with id 'eap-yelhouti' for: 'yelhouti'
Thu, 2024-04-04, 03:54:27 07[CFG] vici client 1 requests: load-shared
Thu, 2024-04-04, 03:54:27 07[CFG] loaded IKE shared key with id 'ike-mycompany-partner' for: '196.32.221.78'
Thu, 2024-04-04, 03:54:27 13[CFG] vici client 1 requests: get-authorities
Thu, 2024-04-04, 03:54:27 09[CFG] vici client 1 requests: get-pools
Thu, 2024-04-04, 03:54:27 06[CFG] vici client 1 requests: load-pool
Thu, 2024-04-04, 03:54:27 06[CFG] added vici pool mycompany-vpn-pool: 172.23.127.2, 253 entries
Thu, 2024-04-04, 03:54:27 12[CFG] vici client 1 requests: get-conns
Thu, 2024-04-04, 03:54:27 09[CFG] vici client 1 requests: load-conn
Thu, 2024-04-04, 03:54:27 09[CFG]  conn mycompany-vpn:
Thu, 2024-04-04, 03:54:27 09[LIB] builder L0 CRED_CERTIFICATE - X509 of plugin 'x509'
Thu, 2024-04-04, 03:54:27 09[LIB] builder L0 CRED_CERTIFICATE - X509 of plugin 'openssl'
Thu, 2024-04-04, 03:54:27 09[LIB] builder L0 CRED_CERTIFICATE - X509 of plugin 'pem'
Thu, 2024-04-04, 03:54:27 09[LIB] builder L1 CRED_CERTIFICATE - X509 of plugin 'x509'
Thu, 2024-04-04, 03:54:27 09[LIB] builder L2 CRED_PUBLIC_KEY - ANY of plugin 'pkcs1'
Thu, 2024-04-04, 03:54:27 09[LIB] builder L3 CRED_PUBLIC_KEY - RSA of plugin 'pkcs1'
Thu, 2024-04-04, 03:54:27 09[LIB] builder L4 CRED_PUBLIC_KEY - RSA of plugin 'pkcs1'
Thu, 2024-04-04, 03:54:27 09[LIB] builder L4 CRED_PUBLIC_KEY - RSA of plugin 'pgp'
Thu, 2024-04-04, 03:54:27 09[LIB] builder L4 CRED_PUBLIC_KEY - RSA of plugin 'dnskey'
Thu, 2024-04-04, 03:54:27 09[LIB] builder L4 CRED_PUBLIC_KEY - RSA of plugin 'openssl'
Thu, 2024-04-04, 03:54:27 09[CFG]   child mycompany-vpn:
Thu, 2024-04-04, 03:54:27 09[CFG]    rekey_time = 3600
Thu, 2024-04-04, 03:54:27 09[CFG]    life_time = 3960
Thu, 2024-04-04, 03:54:27 09[CFG]    rand_time = 360
Thu, 2024-04-04, 03:54:27 09[CFG]    rekey_bytes = 0
Thu, 2024-04-04, 03:54:27 09[CFG]    life_bytes = 0
Thu, 2024-04-04, 03:54:27 09[CFG]    rand_bytes = 0
Thu, 2024-04-04, 03:54:27 09[CFG]    rekey_packets = 0
Thu, 2024-04-04, 03:54:27 09[CFG]    life_packets = 0
Thu, 2024-04-04, 03:54:27 09[CFG]    rand_packets = 0
Thu, 2024-04-04, 03:54:27 09[CFG]    updown = /usr/libexec/strongswan/_updown iptables
Thu, 2024-04-04, 03:54:27 09[CFG]    hostaccess = 0
Thu, 2024-04-04, 03:54:27 09[CFG]    ipcomp = 0
Thu, 2024-04-04, 03:54:27 09[CFG]    mode = TUNNEL
Thu, 2024-04-04, 03:54:27 09[CFG]    policies = 1
Thu, 2024-04-04, 03:54:27 09[CFG]    policies_fwd_out = 0
Thu, 2024-04-04, 03:54:27 09[CFG]    dpd_action = none
Thu, 2024-04-04, 03:54:27 09[CFG]    start_action = start
Thu, 2024-04-04, 03:54:27 09[CFG]    close_action = none
Thu, 2024-04-04, 03:54:27 09[CFG]    reqid = 0
Thu, 2024-04-04, 03:54:27 09[CFG]    tfc = 0
Thu, 2024-04-04, 03:54:27 09[CFG]    priority = 0
Thu, 2024-04-04, 03:54:27 09[CFG]    interface = (null)
Thu, 2024-04-04, 03:54:27 09[CFG]    if_id_in = 0
Thu, 2024-04-04, 03:54:27 09[CFG]    if_id_out = 0
Thu, 2024-04-04, 03:54:27 09[CFG]    mark_in = 0/0
Thu, 2024-04-04, 03:54:27 09[CFG]    mark_in_sa = 0
Thu, 2024-04-04, 03:54:27 09[CFG]    mark_out = 0/0
Thu, 2024-04-04, 03:54:27 09[CFG]    set_mark_in = 0/0
Thu, 2024-04-04, 03:54:27 09[CFG]    set_mark_out = 0/0
Thu, 2024-04-04, 03:54:27 09[CFG]    label = (null)
Thu, 2024-04-04, 03:54:27 09[CFG]    label_mode = system
Thu, 2024-04-04, 03:54:27 09[CFG]    inactivity = 0
Thu, 2024-04-04, 03:54:27 09[CFG]    proposals = ESP:AES_CBC_256/HMAC_SHA2_256_128/MODP_2048/NO_EXT_SEQ, AH:HMAC_SHA2_256_128/MODP_2048/NO_EXT_SEQ
Thu, 2024-04-04, 03:54:27 09[CFG]    local_ts = 0.0.0.0/0
Thu, 2024-04-04, 03:54:27 09[CFG]    remote_ts = dynamic
Thu, 2024-04-04, 03:54:27 09[CFG]    hw_offload = no
Thu, 2024-04-04, 03:54:27 09[CFG]    sha256_96 = 0
Thu, 2024-04-04, 03:54:27 09[CFG]    copy_df = 1
Thu, 2024-04-04, 03:54:27 09[CFG]    copy_ecn = 1
Thu, 2024-04-04, 03:54:27 09[CFG]    copy_dscp = out
Thu, 2024-04-04, 03:54:27 09[CFG]   version = 2
Thu, 2024-04-04, 03:54:27 09[CFG]   local_addrs = 196.32.221.78
Thu, 2024-04-04, 03:54:27 09[CFG]   remote_addrs = %any
Thu, 2024-04-04, 03:54:27 09[CFG]   local_port = 500
Thu, 2024-04-04, 03:54:27 09[CFG]   remote_port = 500
Thu, 2024-04-04, 03:54:27 09[CFG]   send_certreq = 1
Thu, 2024-04-04, 03:54:27 09[CFG]   send_cert = CERT_SEND_IF_ASKED
Thu, 2024-04-04, 03:54:27 09[CFG]   ppk_id = (null)
Thu, 2024-04-04, 03:54:27 09[CFG]   ppk_required = 0
Thu, 2024-04-04, 03:54:27 09[CFG]   mobike = 1
Thu, 2024-04-04, 03:54:27 09[CFG]   aggressive = 0
Thu, 2024-04-04, 03:54:27 09[CFG]   dscp = 0x00
Thu, 2024-04-04, 03:54:27 09[CFG]   encap = 0
Thu, 2024-04-04, 03:54:27 09[CFG]   dpd_delay = 0
Thu, 2024-04-04, 03:54:27 09[CFG]   dpd_timeout = 0
Thu, 2024-04-04, 03:54:27 09[CFG]   fragmentation = 2
Thu, 2024-04-04, 03:54:27 09[CFG]   childless = 0
Thu, 2024-04-04, 03:54:27 09[CFG]   unique = UNIQUE_NO
Thu, 2024-04-04, 03:54:27 09[CFG]   keyingtries = 1
Thu, 2024-04-04, 03:54:27 09[CFG]   reauth_time = 0
Thu, 2024-04-04, 03:54:27 09[CFG]   rekey_time = 14400
Thu, 2024-04-04, 03:54:27 09[CFG]   over_time = 1440
Thu, 2024-04-04, 03:54:27 09[CFG]   rand_time = 1440
Thu, 2024-04-04, 03:54:27 09[CFG]   proposals = IKE:AES_CBC_256/HMAC_SHA2_256_128/PRF_HMAC_SHA2_256/MODP_2048
Thu, 2024-04-04, 03:54:27 09[CFG]   if_id_in = 0
Thu, 2024-04-04, 03:54:27 09[CFG]   if_id_out = 0
Thu, 2024-04-04, 03:54:27 09[CFG]   vips:
Thu, 2024-04-04, 03:54:27 09[CFG]    %any
Thu, 2024-04-04, 03:54:27 09[CFG]   local:
Thu, 2024-04-04, 03:54:27 09[CFG]    id = 196.32.221.78
Thu, 2024-04-04, 03:54:27 09[CFG]    class = public key
Thu, 2024-04-04, 03:54:27 09[CFG]    cert = CN=vpn.mycompany.ma
Thu, 2024-04-04, 03:54:27 09[CFG]   remote:
Thu, 2024-04-04, 03:54:27 09[CFG]    id = %any
Thu, 2024-04-04, 03:54:27 09[CFG]    eap-type = EAP_MSCHAPV2
Thu, 2024-04-04, 03:54:27 09[CFG]    class = EAP
Thu, 2024-04-04, 03:54:27 09[CFG] added vici connection: mycompany-vpn
Thu, 2024-04-04, 03:54:27 09[CFG] initiating 'mycompany-vpn'
Thu, 2024-04-04, 03:54:27 09[MGR] checkout IKE_SA by config
Thu, 2024-04-04, 03:54:27 09[MGR] created IKE_SA (unnamed)[1]
Thu, 2024-04-04, 03:54:27 09[IKE] <mycompany-vpn|1> unable to resolve %any, initiate aborted
Thu, 2024-04-04, 03:54:27 09[MGR] <mycompany-vpn|1> checkin and destroy IKE_SA mycompany-vpn[1]
Thu, 2024-04-04, 03:54:27 09[IKE] <mycompany-vpn|1> IKE_SA mycompany-vpn[1] state change: CREATED => DESTROYING
Thu, 2024-04-04, 03:54:27 09[MGR] checkin and destroy of IKE_SA successful
Thu, 2024-04-04, 03:54:27 16[CFG] vici client 1 requests: load-conn
Thu, 2024-04-04, 03:54:27 16[CFG]  conn mycompany-partner:
Thu, 2024-04-04, 03:54:27 16[CFG]   child mycompany-partner-prod:
Thu, 2024-04-04, 03:54:27 16[CFG]    rekey_time = 3600
Thu, 2024-04-04, 03:54:27 16[CFG]    life_time = 3960
Thu, 2024-04-04, 03:54:27 16[CFG]    rand_time = 360
Thu, 2024-04-04, 03:54:27 16[CFG]    rekey_bytes = 0
Thu, 2024-04-04, 03:54:27 16[CFG]    life_bytes = 0
Thu, 2024-04-04, 03:54:27 16[CFG]    rand_bytes = 0
Thu, 2024-04-04, 03:54:27 16[CFG]    rekey_packets = 0
Thu, 2024-04-04, 03:54:27 16[CFG]    life_packets = 0
Thu, 2024-04-04, 03:54:27 16[CFG]    rand_packets = 0
Thu, 2024-04-04, 03:54:27 16[CFG]    updown = (null)
Thu, 2024-04-04, 03:54:27 16[CFG]    hostaccess = 0
Thu, 2024-04-04, 03:54:27 16[CFG]    ipcomp = 0
Thu, 2024-04-04, 03:54:27 16[CFG]    mode = TUNNEL
Thu, 2024-04-04, 03:54:27 16[CFG]    policies = 1
Thu, 2024-04-04, 03:54:27 16[CFG]    policies_fwd_out = 0
Thu, 2024-04-04, 03:54:27 16[CFG]    dpd_action = start
Thu, 2024-04-04, 03:54:27 16[CFG]    start_action = start
Thu, 2024-04-04, 03:54:27 16[CFG]    close_action = none
Thu, 2024-04-04, 03:54:27 16[CFG]    reqid = 0
Thu, 2024-04-04, 03:54:27 16[CFG]    tfc = 0
Thu, 2024-04-04, 03:54:27 16[CFG]    priority = 0
Thu, 2024-04-04, 03:54:27 16[CFG]    interface = (null)
Thu, 2024-04-04, 03:54:27 16[CFG]    if_id_in = 0
Thu, 2024-04-04, 03:54:27 16[CFG]    if_id_out = 0
Thu, 2024-04-04, 03:54:27 16[CFG]    mark_in = 0/0
Thu, 2024-04-04, 03:54:27 16[CFG]    mark_in_sa = 0
Thu, 2024-04-04, 03:54:27 16[CFG]    mark_out = 0/0
Thu, 2024-04-04, 03:54:27 16[CFG]    set_mark_in = 0/0
Thu, 2024-04-04, 03:54:27 16[CFG]    set_mark_out = 0/0
Thu, 2024-04-04, 03:54:27 16[CFG]    label = (null)
Thu, 2024-04-04, 03:54:27 16[CFG]    label_mode = system
Thu, 2024-04-04, 03:54:27 16[CFG]    inactivity = 0
Thu, 2024-04-04, 03:54:27 16[CFG]    proposals = AH:HMAC_SHA2_256_128/ECP_384/NO_EXT_SEQ, ESP:AES_CBC_256/HMAC_SHA2_256_128/ECP_384/NO_EXT_SEQ
Thu, 2024-04-04, 03:54:27 16[CFG]    local_ts = 172.23.127.0/24
Thu, 2024-04-04, 03:54:27 16[CFG]    remote_ts = 172.25.1.142/32
Thu, 2024-04-04, 03:54:27 16[CFG]    hw_offload = no
Thu, 2024-04-04, 03:54:27 16[CFG]    sha256_96 = 0
Thu, 2024-04-04, 03:54:27 16[CFG]    copy_df = 1
Thu, 2024-04-04, 03:54:27 16[CFG]    copy_ecn = 1
Thu, 2024-04-04, 03:54:27 16[CFG]    copy_dscp = out
Thu, 2024-04-04, 03:54:27 16[CFG]   child mycompany-partner-pprod:
Thu, 2024-04-04, 03:54:27 16[CFG]    rekey_time = 3600
Thu, 2024-04-04, 03:54:27 16[CFG]    life_time = 3960
Thu, 2024-04-04, 03:54:27 16[CFG]    rand_time = 360
Thu, 2024-04-04, 03:54:27 16[CFG]    rekey_bytes = 0
Thu, 2024-04-04, 03:54:27 16[CFG]    life_bytes = 0
Thu, 2024-04-04, 03:54:27 16[CFG]    rand_bytes = 0
Thu, 2024-04-04, 03:54:27 16[CFG]    rekey_packets = 0
Thu, 2024-04-04, 03:54:27 16[CFG]    life_packets = 0
Thu, 2024-04-04, 03:54:27 16[CFG]    rand_packets = 0
Thu, 2024-04-04, 03:54:27 16[CFG]    updown = (null)
Thu, 2024-04-04, 03:54:27 16[CFG]    hostaccess = 0
Thu, 2024-04-04, 03:54:27 16[CFG]    ipcomp = 0
Thu, 2024-04-04, 03:54:27 16[CFG]    mode = TUNNEL
Thu, 2024-04-04, 03:54:27 16[CFG]    policies = 1
Thu, 2024-04-04, 03:54:27 16[CFG]    policies_fwd_out = 0
Thu, 2024-04-04, 03:54:27 16[CFG]    dpd_action = start
Thu, 2024-04-04, 03:54:27 16[CFG]    start_action = start
Thu, 2024-04-04, 03:54:27 16[CFG]    close_action = none
Thu, 2024-04-04, 03:54:27 16[CFG]    reqid = 0
Thu, 2024-04-04, 03:54:27 16[CFG]    tfc = 0
Thu, 2024-04-04, 03:54:27 16[CFG]    priority = 0
Thu, 2024-04-04, 03:54:27 16[CFG]    interface = (null)
Thu, 2024-04-04, 03:54:27 16[CFG]    if_id_in = 0
Thu, 2024-04-04, 03:54:27 16[CFG]    if_id_out = 0
Thu, 2024-04-04, 03:54:27 16[CFG]    mark_in = 0/0
Thu, 2024-04-04, 03:54:27 16[CFG]    mark_in_sa = 0
Thu, 2024-04-04, 03:54:27 16[CFG]    mark_out = 0/0
Thu, 2024-04-04, 03:54:27 16[CFG]    set_mark_in = 0/0
Thu, 2024-04-04, 03:54:27 16[CFG]    set_mark_out = 0/0
Thu, 2024-04-04, 03:54:27 16[CFG]    label = (null)
Thu, 2024-04-04, 03:54:27 16[CFG]    label_mode = system
Thu, 2024-04-04, 03:54:27 16[CFG]    inactivity = 0
Thu, 2024-04-04, 03:54:27 16[CFG]    proposals = AH:HMAC_SHA2_256_128/ECP_384/NO_EXT_SEQ, ESP:AES_CBC_256/HMAC_SHA2_256_128/ECP_384/NO_EXT_SEQ
Thu, 2024-04-04, 03:54:27 16[CFG]    local_ts = 172.23.127.0/24
Thu, 2024-04-04, 03:54:27 16[CFG]    remote_ts = 172.25.1.143/32
Thu, 2024-04-04, 03:54:27 16[CFG]    hw_offload = no
Thu, 2024-04-04, 03:54:27 16[CFG]    sha256_96 = 0
Thu, 2024-04-04, 03:54:27 16[CFG]    copy_df = 1
Thu, 2024-04-04, 03:54:27 16[CFG]    copy_ecn = 1
Thu, 2024-04-04, 03:54:27 16[CFG]    copy_dscp = out
Thu, 2024-04-04, 03:54:27 16[CFG]   version = 2
Thu, 2024-04-04, 03:54:27 16[CFG]   local_addrs = 196.32.221.78
Thu, 2024-04-04, 03:54:27 16[CFG]   remote_addrs = 41.87.129.1
Thu, 2024-04-04, 03:54:27 16[CFG]   local_port = 500
Thu, 2024-04-04, 03:54:27 16[CFG]   remote_port = 500
Thu, 2024-04-04, 03:54:27 16[CFG]   send_certreq = 1
Thu, 2024-04-04, 03:54:27 16[CFG]   send_cert = CERT_SEND_IF_ASKED
Thu, 2024-04-04, 03:54:27 16[CFG]   ppk_id = (null)
Thu, 2024-04-04, 03:54:27 16[CFG]   ppk_required = 0
Thu, 2024-04-04, 03:54:27 16[CFG]   mobike = 0
Thu, 2024-04-04, 03:54:27 16[CFG]   aggressive = 0
Thu, 2024-04-04, 03:54:27 16[CFG]   dscp = 0x00
Thu, 2024-04-04, 03:54:27 16[CFG]   encap = 0
Thu, 2024-04-04, 03:54:27 16[CFG]   dpd_delay = 0
Thu, 2024-04-04, 03:54:27 16[CFG]   dpd_timeout = 0
Thu, 2024-04-04, 03:54:27 16[CFG]   fragmentation = 2
Thu, 2024-04-04, 03:54:27 16[CFG]   childless = 0
Thu, 2024-04-04, 03:54:27 16[CFG]   unique = UNIQUE_NO
Thu, 2024-04-04, 03:54:27 16[CFG]   keyingtries = 1
Thu, 2024-04-04, 03:54:27 16[CFG]   reauth_time = 0
Thu, 2024-04-04, 03:54:27 16[CFG]   rekey_time = 14400
Thu, 2024-04-04, 03:54:27 16[CFG]   over_time = 1440
Thu, 2024-04-04, 03:54:27 16[CFG]   rand_time = 1440
Thu, 2024-04-04, 03:54:27 16[CFG]   proposals = IKE:AES_CBC_256/HMAC_SHA2_256_128/PRF_HMAC_SHA2_256/ECP_384
Thu, 2024-04-04, 03:54:27 16[CFG]   if_id_in = 0
Thu, 2024-04-04, 03:54:27 16[CFG]   if_id_out = 0
Thu, 2024-04-04, 03:54:27 16[CFG]   local:
Thu, 2024-04-04, 03:54:27 16[CFG]    class = pre-shared key
Thu, 2024-04-04, 03:54:27 16[CFG]   remote:
Thu, 2024-04-04, 03:54:27 16[CFG]    class = pre-shared key
Thu, 2024-04-04, 03:54:27 16[CFG] added vici connection: mycompany-partner
Thu, 2024-04-04, 03:54:27 16[CFG] initiating 'mycompany-partner-prod'
Thu, 2024-04-04, 03:54:27 16[MGR] checkout IKE_SA by config
Thu, 2024-04-04, 03:54:27 16[MGR] created IKE_SA (unnamed)[2]
Thu, 2024-04-04, 03:54:27 16[IKE] <mycompany-partner|2> queueing IKE_VENDOR task
Thu, 2024-04-04, 03:54:27 16[IKE] <mycompany-partner|2> queueing IKE_INIT task
Thu, 2024-04-04, 03:54:27 16[IKE] <mycompany-partner|2> queueing IKE_NATD task
Thu, 2024-04-04, 03:54:27 16[IKE] <mycompany-partner|2> queueing IKE_CERT_PRE task
Thu, 2024-04-04, 03:54:27 16[IKE] <mycompany-partner|2> queueing IKE_AUTH task
Thu, 2024-04-04, 03:54:27 16[IKE] <mycompany-partner|2> queueing IKE_CERT_POST task
Thu, 2024-04-04, 03:54:27 16[IKE] <mycompany-partner|2> queueing IKE_CONFIG task
Thu, 2024-04-04, 03:54:27 16[IKE] <mycompany-partner|2> queueing IKE_AUTH_LIFETIME task
Thu, 2024-04-04, 03:54:27 16[IKE] <mycompany-partner|2> queueing IKE_ESTABLISH task
Thu, 2024-04-04, 03:54:27 16[IKE] <mycompany-partner|2> queueing CHILD_CREATE task
Thu, 2024-04-04, 03:54:27 16[IKE] <mycompany-partner|2> activating new tasks
Thu, 2024-04-04, 03:54:27 16[IKE] <mycompany-partner|2>   activating IKE_VENDOR task
Thu, 2024-04-04, 03:54:27 16[IKE] <mycompany-partner|2>   activating IKE_INIT task
Thu, 2024-04-04, 03:54:27 16[IKE] <mycompany-partner|2>   activating IKE_NATD task
Thu, 2024-04-04, 03:54:27 16[IKE] <mycompany-partner|2>   activating IKE_CERT_PRE task
Thu, 2024-04-04, 03:54:27 16[IKE] <mycompany-partner|2>   activating IKE_AUTH task
Thu, 2024-04-04, 03:54:27 16[IKE] <mycompany-partner|2>   activating IKE_CERT_POST task
Thu, 2024-04-04, 03:54:27 16[IKE] <mycompany-partner|2>   activating IKE_CONFIG task
Thu, 2024-04-04, 03:54:27 16[IKE] <mycompany-partner|2>   activating IKE_AUTH_LIFETIME task
Thu, 2024-04-04, 03:54:27 16[IKE] <mycompany-partner|2>   activating IKE_ESTABLISH task
Thu, 2024-04-04, 03:54:27 16[IKE] <mycompany-partner|2>   activating CHILD_CREATE task
Thu, 2024-04-04, 03:54:27 16[IKE] <mycompany-partner|2> initiating IKE_SA mycompany-partner[2] to 41.87.129.1
Thu, 2024-04-04, 03:54:27 16[IKE] <mycompany-partner|2> IKE_SA mycompany-partner[2] state change: CREATED => CONNECTING
Thu, 2024-04-04, 03:54:27 16[CFG] <mycompany-partner|2> configured proposals: IKE:AES_CBC_256/HMAC_SHA2_256_128/PRF_HMAC_SHA2_256/ECP_384
Thu, 2024-04-04, 03:54:27 16[CFG] <mycompany-partner|2> sending supported signature hash algorithms: sha256 sha384 sha512 identity
Thu, 2024-04-04, 03:54:27 16[ENC] <mycompany-partner|2> generating IKE_SA_INIT request 0 [ SA KE No N(NATD_S_IP) N(NATD_D_IP) N(FRAG_SUP) N(HASH_ALG) N(REDIR_SUP) ]
Thu, 2024-04-04, 03:54:27 16[NET] <mycompany-partner|2> sending packet: from 196.32.221.78[500] to 41.87.129.1[500] (304 bytes)
Thu, 2024-04-04, 03:54:27 16[MGR] <mycompany-partner|2> checkin IKEv2 SA mycompany-partner[2] with SPIs c6e9d36c2cd61938_i 0000000000000000_r
Thu, 2024-04-04, 03:54:27 16[MGR] <mycompany-partner|2> checkin of IKE_SA successful
Thu, 2024-04-04, 03:54:27 16[CFG] initiating 'mycompany-partner-pprod'
Thu, 2024-04-04, 03:54:27 16[MGR] checkout IKE_SA by config
Thu, 2024-04-04, 03:54:27 16[MGR] found existing IKE_SA 2 with config 'mycompany-partner'
Thu, 2024-04-04, 03:54:27 16[IKE] <mycompany-partner|2> queueing CHILD_CREATE task
Thu, 2024-04-04, 03:54:27 16[IKE] <mycompany-partner|2> delaying task initiation, IKE_SA_INIT exchange in progress
Thu, 2024-04-04, 03:54:27 16[MGR] <mycompany-partner|2> checkin IKEv2 SA mycompany-partner[2] with SPIs c6e9d36c2cd61938_i 0000000000000000_r
Thu, 2024-04-04, 03:54:27 16[MGR] <mycompany-partner|2> checkin of IKE_SA successful
Thu, 2024-04-04, 03:54:27 14[CFG] vici client 1 disconnected
Thu, 2024-04-04, 03:54:27 11[MGR] checkout IKEv2 SA by message with SPIs c6e9d36c2cd61938_i 8deb1e4f081dcc1c_r
Thu, 2024-04-04, 03:54:27 11[MGR] IKE_SA mycompany-partner[2] successfully checked out
Thu, 2024-04-04, 03:54:27 11[NET] <mycompany-partner|2> received packet: from 41.87.129.1[500] to 196.32.221.78[500] (272 bytes)
Thu, 2024-04-04, 03:54:27 11[ENC] <mycompany-partner|2> parsed IKE_SA_INIT response 0 [ SA KE No N(NATD_S_IP) N(NATD_D_IP) ]
Thu, 2024-04-04, 03:54:27 11[CFG] <mycompany-partner|2> selecting proposal:
Thu, 2024-04-04, 03:54:27 11[CFG] <mycompany-partner|2>   proposal matches
Thu, 2024-04-04, 03:54:27 11[CFG] <mycompany-partner|2> received proposals: IKE:AES_CBC_256/HMAC_SHA2_256_128/PRF_HMAC_SHA2_256/ECP_384
Thu, 2024-04-04, 03:54:27 11[CFG] <mycompany-partner|2> configured proposals: IKE:AES_CBC_256/HMAC_SHA2_256_128/PRF_HMAC_SHA2_256/ECP_384
Thu, 2024-04-04, 03:54:27 11[CFG] <mycompany-partner|2> selected proposal: IKE:AES_CBC_256/HMAC_SHA2_256_128/PRF_HMAC_SHA2_256/ECP_384
Thu, 2024-04-04, 03:54:27 11[IKE] <mycompany-partner|2> reinitiating already active tasks
Thu, 2024-04-04, 03:54:27 11[IKE] <mycompany-partner|2>   IKE_CERT_PRE task
Thu, 2024-04-04, 03:54:27 11[IKE] <mycompany-partner|2>   IKE_AUTH task
Thu, 2024-04-04, 03:54:27 11[CFG] <mycompany-partner|2> no IDi configured, fall back on IP address
Thu, 2024-04-04, 03:54:27 11[IKE] <mycompany-partner|2> authentication of '196.32.221.78' (myself) with pre-shared key
Thu, 2024-04-04, 03:54:27 11[IKE] <mycompany-partner|2> successfully created shared key MAC
Thu, 2024-04-04, 03:54:27 11[CFG] <mycompany-partner|2> proposing traffic selectors for us:
Thu, 2024-04-04, 03:54:27 11[CFG] <mycompany-partner|2>  172.23.127.0/24
Thu, 2024-04-04, 03:54:27 11[CFG] <mycompany-partner|2> proposing traffic selectors for other:
Thu, 2024-04-04, 03:54:27 11[CFG] <mycompany-partner|2>  172.25.1.142/32
Thu, 2024-04-04, 03:54:27 11[CFG] <mycompany-partner|2> configured proposals: AH:HMAC_SHA2_256_128/NO_EXT_SEQ, ESP:AES_CBC_256/HMAC_SHA2_256_128/NO_EXT_SEQ
Thu, 2024-04-04, 03:54:27 11[IKE] <mycompany-partner|2> establishing CHILD_SA mycompany-partner-prod{1}
Thu, 2024-04-04, 03:54:27 11[KNL] <mycompany-partner|2> got SPI c491bebe
Thu, 2024-04-04, 03:54:27 11[ENC] <mycompany-partner|2> generating IKE_AUTH request 1 [ IDi AUTH SA TSi TSr N(EAP_ONLY) N(MSG_ID_SYN_SUP) ]
Thu, 2024-04-04, 03:54:27 11[NET] <mycompany-partner|2> sending packet: from 196.32.221.78[500] to 41.87.129.1[500] (256 bytes)
Thu, 2024-04-04, 03:54:27 11[MGR] <mycompany-partner|2> checkin IKEv2 SA mycompany-partner[2] with SPIs c6e9d36c2cd61938_i 8deb1e4f081dcc1c_r
Thu, 2024-04-04, 03:54:27 11[MGR] <mycompany-partner|2> checkin of IKE_SA successful
Thu, 2024-04-04, 03:54:27 09[MGR] checkout IKEv2 SA by message with SPIs c6e9d36c2cd61938_i 8deb1e4f081dcc1c_r
Thu, 2024-04-04, 03:54:27 09[MGR] IKE_SA mycompany-partner[2] successfully checked out
Thu, 2024-04-04, 03:54:27 09[NET] <mycompany-partner|2> received packet: from 41.87.129.1[500] to 196.32.221.78[500] (224 bytes)
Thu, 2024-04-04, 03:54:27 09[ENC] <mycompany-partner|2> parsed IKE_AUTH response 1 [ IDr AUTH N(ESP_TFC_PAD_N) SA TSi TSr ]
Thu, 2024-04-04, 03:54:27 09[IKE] <mycompany-partner|2> received ESP_TFC_PADDING_NOT_SUPPORTED notify
Thu, 2024-04-04, 03:54:27 09[IKE] <mycompany-partner|2> authentication of '41.87.129.1' with pre-shared key successful
Thu, 2024-04-04, 03:54:27 09[IKE] <mycompany-partner|2> IKE_SA mycompany-partner[2] established between 196.32.221.78[196.32.221.78]...41.87.129.1[41.87.129.1]
Thu, 2024-04-04, 03:54:27 09[IKE] <mycompany-partner|2> IKE_SA mycompany-partner[2] state change: CONNECTING => ESTABLISHED
Thu, 2024-04-04, 03:54:27 09[IKE] <mycompany-partner|2> scheduling rekeying in 14322s
Thu, 2024-04-04, 03:54:27 09[IKE] <mycompany-partner|2> maximum IKE_SA lifetime 15762s
Thu, 2024-04-04, 03:54:27 09[IKE] <mycompany-partner|2> received ESP_TFC_PADDING_NOT_SUPPORTED, not using ESPv3 TFC padding
Thu, 2024-04-04, 03:54:27 09[CFG] <mycompany-partner|2> selecting proposal:
Thu, 2024-04-04, 03:54:27 09[CFG] <mycompany-partner|2>   protocol mismatch, skipping
Thu, 2024-04-04, 03:54:27 09[CFG] <mycompany-partner|2> selecting proposal:
Thu, 2024-04-04, 03:54:27 09[CFG] <mycompany-partner|2>   proposal matches
Thu, 2024-04-04, 03:54:27 09[CFG] <mycompany-partner|2> received proposals: ESP:AES_CBC_256/HMAC_SHA2_256_128/NO_EXT_SEQ
Thu, 2024-04-04, 03:54:27 09[CFG] <mycompany-partner|2> configured proposals: AH:HMAC_SHA2_256_128/ECP_384/NO_EXT_SEQ, ESP:AES_CBC_256/HMAC_SHA2_256_128/ECP_384/NO_EXT_SEQ
Thu, 2024-04-04, 03:54:27 09[CFG] <mycompany-partner|2> selected proposal: ESP:AES_CBC_256/HMAC_SHA2_256_128/NO_EXT_SEQ
Thu, 2024-04-04, 03:54:27 09[CFG] <mycompany-partner|2> selecting traffic selectors for us:
Thu, 2024-04-04, 03:54:27 09[CFG] <mycompany-partner|2>  config: 172.23.127.0/24, received: 172.23.127.0/24 => match: 172.23.127.0/24
Thu, 2024-04-04, 03:54:27 09[CFG] <mycompany-partner|2> selecting traffic selectors for other:
Thu, 2024-04-04, 03:54:27 09[CFG] <mycompany-partner|2>  config: 172.25.1.142/32, received: 172.25.1.142/32 => match: 172.25.1.142/32
Thu, 2024-04-04, 03:54:27 09[CHD] <mycompany-partner|2> CHILD_SA mycompany-partner-prod{1} state change: CREATED => INSTALLING
Thu, 2024-04-04, 03:54:27 09[CHD] <mycompany-partner|2>   using AES_CBC for encryption
Thu, 2024-04-04, 03:54:27 09[CHD] <mycompany-partner|2>   using HMAC_SHA2_256_128 for integrity
Thu, 2024-04-04, 03:54:27 09[CHD] <mycompany-partner|2> adding inbound ESP SA
Thu, 2024-04-04, 03:54:27 09[CHD] <mycompany-partner|2>   SPI 0xc491bebe, src 41.87.129.1 dst 196.32.221.78
Thu, 2024-04-04, 03:54:27 09[KNL] <mycompany-partner|2> adding SAD entry with SPI c491bebe and reqid {1}
Thu, 2024-04-04, 03:54:27 09[KNL] <mycompany-partner|2>   using encryption algorithm AES_CBC with key size 256
Thu, 2024-04-04, 03:54:27 09[KNL] <mycompany-partner|2>   using integrity algorithm HMAC_SHA2_256_128 with key size 256
Thu, 2024-04-04, 03:54:27 09[KNL] <mycompany-partner|2>   using replay window of 32 packets
Thu, 2024-04-04, 03:54:27 09[KNL] <mycompany-partner|2>   HW offload: no
Thu, 2024-04-04, 03:54:27 09[KNL] <mycompany-partner|2> allocated SPI not found anymore, try to add SAD entry
Thu, 2024-04-04, 03:54:27 09[CHD] <mycompany-partner|2> adding outbound ESP SA
Thu, 2024-04-04, 03:54:27 09[CHD] <mycompany-partner|2>   SPI 0xf6583c93, src 196.32.221.78 dst 41.87.129.1
Thu, 2024-04-04, 03:54:27 09[KNL] <mycompany-partner|2> adding SAD entry with SPI f6583c93 and reqid {1}
Thu, 2024-04-04, 03:54:27 09[KNL] <mycompany-partner|2>   using encryption algorithm AES_CBC with key size 256
Thu, 2024-04-04, 03:54:27 09[KNL] <mycompany-partner|2>   using integrity algorithm HMAC_SHA2_256_128 with key size 256
Thu, 2024-04-04, 03:54:27 09[KNL] <mycompany-partner|2>   using replay window of 0 packets
Thu, 2024-04-04, 03:54:27 09[KNL] <mycompany-partner|2>   HW offload: no
Thu, 2024-04-04, 03:54:27 09[KNL] <mycompany-partner|2> adding policy 172.25.1.142/32 === 172.23.127.0/24 in [priority 371327, refcount 1]
Thu, 2024-04-04, 03:54:27 09[KNL] <mycompany-partner|2> adding policy 172.25.1.142/32 === 172.23.127.0/24 fwd [priority 371327, refcount 1]
Thu, 2024-04-04, 03:54:27 09[KNL] <mycompany-partner|2> adding policy 172.23.127.0/24 === 172.25.1.142/32 out [priority 371327, refcount 1]
Thu, 2024-04-04, 03:54:27 09[KNL] <mycompany-partner|2> getting a local address in traffic selector 172.23.127.0/24
Thu, 2024-04-04, 03:54:27 09[KNL] <mycompany-partner|2> using host 172.23.127.1
Thu, 2024-04-04, 03:54:27 09[KNL] <mycompany-partner|2> getting iface name for index 2
Thu, 2024-04-04, 03:54:27 09[KNL] <mycompany-partner|2> using 196.32.221.65 as nexthop and eth0 as dev to reach 41.87.129.1/32
Thu, 2024-04-04, 03:54:27 09[KNL] <mycompany-partner|2> installing route: 172.25.1.142/32 via 196.32.221.65 src 172.23.127.1 dev eth0
Thu, 2024-04-04, 03:54:27 09[KNL] <mycompany-partner|2> getting iface index for eth0
Thu, 2024-04-04, 03:54:27 09[IKE] <mycompany-partner|2> CHILD_SA mycompany-partner-prod{1} established with SPIs c491bebe_i f6583c93_o and TS 172.23.127.0/24 === 172.25.1.142/32
Thu, 2024-04-04, 03:54:27 09[CHD] <mycompany-partner|2> CHILD_SA mycompany-partner-prod{1} state change: INSTALLING => INSTALLED
Thu, 2024-04-04, 03:54:27 09[IKE] <mycompany-partner|2> activating new tasks
Thu, 2024-04-04, 03:54:27 09[IKE] <mycompany-partner|2>   activating CHILD_CREATE task
Thu, 2024-04-04, 03:54:27 09[CFG] <mycompany-partner|2> proposing traffic selectors for us:
Thu, 2024-04-04, 03:54:27 09[CFG] <mycompany-partner|2>  172.23.127.0/24
Thu, 2024-04-04, 03:54:27 09[CFG] <mycompany-partner|2> proposing traffic selectors for other:
Thu, 2024-04-04, 03:54:27 09[CFG] <mycompany-partner|2>  172.25.1.143/32
Thu, 2024-04-04, 03:54:27 09[CFG] <mycompany-partner|2> configured proposals: AH:HMAC_SHA2_256_128/ECP_384/NO_EXT_SEQ, ESP:AES_CBC_256/HMAC_SHA2_256_128/ECP_384/NO_EXT_SEQ
Thu, 2024-04-04, 03:54:27 09[IKE] <mycompany-partner|2> establishing CHILD_SA mycompany-partner-pprod{2}
Thu, 2024-04-04, 03:54:27 09[KNL] <mycompany-partner|2> got SPI c1ed271a
Thu, 2024-04-04, 03:54:27 09[ENC] <mycompany-partner|2> generating CREATE_CHILD_SA request 2 [ SA No KE TSi TSr ]
Thu, 2024-04-04, 03:54:27 09[NET] <mycompany-partner|2> sending packet: from 196.32.221.78[500] to 41.87.129.1[500] (352 bytes)
Thu, 2024-04-04, 03:54:27 09[MGR] <mycompany-partner|2> checkin IKEv2 SA mycompany-partner[2] with SPIs c6e9d36c2cd61938_i 8deb1e4f081dcc1c_r
Thu, 2024-04-04, 03:54:27 09[MGR] <mycompany-partner|2> checkin of IKE_SA successful
Thu, 2024-04-04, 03:54:27 12[MGR] checkout IKEv2 SA by message with SPIs c6e9d36c2cd61938_i 8deb1e4f081dcc1c_r
Thu, 2024-04-04, 03:54:27 12[MGR] IKE_SA mycompany-partner[2] successfully checked out
Thu, 2024-04-04, 03:54:27 12[NET] <mycompany-partner|2> received packet: from 41.87.129.1[500] to 196.32.221.78[500] (320 bytes)
Thu, 2024-04-04, 03:54:27 12[ENC] <mycompany-partner|2> parsed CREATE_CHILD_SA response 2 [ N(ESP_TFC_PAD_N) SA No KE TSi TSr ]
Thu, 2024-04-04, 03:54:27 12[IKE] <mycompany-partner|2> received ESP_TFC_PADDING_NOT_SUPPORTED notify
Thu, 2024-04-04, 03:54:27 12[IKE] <mycompany-partner|2> received ESP_TFC_PADDING_NOT_SUPPORTED, not using ESPv3 TFC padding
Thu, 2024-04-04, 03:54:27 12[CFG] <mycompany-partner|2> selecting proposal:
Thu, 2024-04-04, 03:54:27 12[CFG] <mycompany-partner|2>   protocol mismatch, skipping
Thu, 2024-04-04, 03:54:27 12[CFG] <mycompany-partner|2> selecting proposal:
Thu, 2024-04-04, 03:54:27 12[CFG] <mycompany-partner|2>   proposal matches
Thu, 2024-04-04, 03:54:27 12[CFG] <mycompany-partner|2> received proposals: ESP:AES_CBC_256/HMAC_SHA2_256_128/ECP_384/NO_EXT_SEQ
Thu, 2024-04-04, 03:54:27 12[CFG] <mycompany-partner|2> configured proposals: AH:HMAC_SHA2_256_128/ECP_384/NO_EXT_SEQ, ESP:AES_CBC_256/HMAC_SHA2_256_128/ECP_384/NO_EXT_SEQ
Thu, 2024-04-04, 03:54:27 12[CFG] <mycompany-partner|2> selected proposal: ESP:AES_CBC_256/HMAC_SHA2_256_128/ECP_384/NO_EXT_SEQ
Thu, 2024-04-04, 03:54:27 12[CFG] <mycompany-partner|2> selecting traffic selectors for us:
Thu, 2024-04-04, 03:54:27 12[CFG] <mycompany-partner|2>  config: 172.23.127.0/24, received: 172.23.127.0/24 => match: 172.23.127.0/24
Thu, 2024-04-04, 03:54:27 12[CFG] <mycompany-partner|2> selecting traffic selectors for other:
Thu, 2024-04-04, 03:54:27 12[CFG] <mycompany-partner|2>  config: 172.25.1.143/32, received: 172.25.1.143/32 => match: 172.25.1.143/32
Thu, 2024-04-04, 03:54:27 12[CHD] <mycompany-partner|2> CHILD_SA mycompany-partner-pprod{2} state change: CREATED => INSTALLING
Thu, 2024-04-04, 03:54:27 12[CHD] <mycompany-partner|2>   using AES_CBC for encryption
Thu, 2024-04-04, 03:54:27 12[CHD] <mycompany-partner|2>   using HMAC_SHA2_256_128 for integrity
Thu, 2024-04-04, 03:54:27 12[CHD] <mycompany-partner|2> adding inbound ESP SA
Thu, 2024-04-04, 03:54:27 12[CHD] <mycompany-partner|2>   SPI 0xc1ed271a, src 41.87.129.1 dst 196.32.221.78
Thu, 2024-04-04, 03:54:27 12[KNL] <mycompany-partner|2> adding SAD entry with SPI c1ed271a and reqid {2}
Thu, 2024-04-04, 03:54:27 12[KNL] <mycompany-partner|2>   using encryption algorithm AES_CBC with key size 256
Thu, 2024-04-04, 03:54:27 12[KNL] <mycompany-partner|2>   using integrity algorithm HMAC_SHA2_256_128 with key size 256
Thu, 2024-04-04, 03:54:27 12[KNL] <mycompany-partner|2>   using replay window of 32 packets
Thu, 2024-04-04, 03:54:27 12[KNL] <mycompany-partner|2>   HW offload: no
Thu, 2024-04-04, 03:54:27 12[KNL] <mycompany-partner|2> allocated SPI not found anymore, try to add SAD entry
Thu, 2024-04-04, 03:54:27 12[CHD] <mycompany-partner|2> adding outbound ESP SA
Thu, 2024-04-04, 03:54:27 12[CHD] <mycompany-partner|2>   SPI 0x9ac8d6ac, src 196.32.221.78 dst 41.87.129.1
Thu, 2024-04-04, 03:54:27 12[KNL] <mycompany-partner|2> adding SAD entry with SPI 9ac8d6ac and reqid {2}
Thu, 2024-04-04, 03:54:27 12[KNL] <mycompany-partner|2>   using encryption algorithm AES_CBC with key size 256
Thu, 2024-04-04, 03:54:27 12[KNL] <mycompany-partner|2>   using integrity algorithm HMAC_SHA2_256_128 with key size 256
Thu, 2024-04-04, 03:54:27 12[KNL] <mycompany-partner|2>   using replay window of 0 packets
Thu, 2024-04-04, 03:54:27 12[KNL] <mycompany-partner|2>   HW offload: no
Thu, 2024-04-04, 03:54:27 12[KNL] <mycompany-partner|2> adding policy 172.25.1.143/32 === 172.23.127.0/24 in [priority 371327, refcount 1]
Thu, 2024-04-04, 03:54:27 12[KNL] <mycompany-partner|2> adding policy 172.25.1.143/32 === 172.23.127.0/24 fwd [priority 371327, refcount 1]
Thu, 2024-04-04, 03:54:27 12[KNL] <mycompany-partner|2> adding policy 172.23.127.0/24 === 172.25.1.143/32 out [priority 371327, refcount 1]
Thu, 2024-04-04, 03:54:27 12[KNL] <mycompany-partner|2> getting a local address in traffic selector 172.23.127.0/24
Thu, 2024-04-04, 03:54:27 12[KNL] <mycompany-partner|2> using host 172.23.127.1
Thu, 2024-04-04, 03:54:27 12[KNL] <mycompany-partner|2> getting iface name for index 2
Thu, 2024-04-04, 03:54:27 12[KNL] <mycompany-partner|2> using 196.32.221.65 as nexthop and eth0 as dev to reach 41.87.129.1/32
Thu, 2024-04-04, 03:54:27 12[KNL] <mycompany-partner|2> installing route: 172.25.1.143/32 via 196.32.221.65 src 172.23.127.1 dev eth0
Thu, 2024-04-04, 03:54:27 12[KNL] <mycompany-partner|2> getting iface index for eth0
Thu, 2024-04-04, 03:54:27 12[IKE] <mycompany-partner|2> CHILD_SA mycompany-partner-pprod{2} established with SPIs c1ed271a_i 9ac8d6ac_o and TS 172.23.127.0/24 === 172.25.1.143/32
Thu, 2024-04-04, 03:54:27 12[CHD] <mycompany-partner|2> CHILD_SA mycompany-partner-pprod{2} state change: INSTALLING => INSTALLED
Thu, 2024-04-04, 03:54:27 12[IKE] <mycompany-partner|2> activating new tasks
Thu, 2024-04-04, 03:54:27 12[IKE] <mycompany-partner|2> nothing to initiate
Thu, 2024-04-04, 03:54:27 12[MGR] <mycompany-partner|2> checkin IKEv2 SA mycompany-partner[2] with SPIs c6e9d36c2cd61938_i 8deb1e4f081dcc1c_r
Thu, 2024-04-04, 03:54:27 12[MGR] <mycompany-partner|2> checkin of IKE_SA successful
Thu, 2024-04-04, 03:54:31 15[MGR] checkout IKEv2 SA with SPIs c6e9d36c2cd61938_i 0000000000000000_r
Thu, 2024-04-04, 03:54:31 15[MGR] IKE_SA mycompany-partner[2] successfully checked out
Thu, 2024-04-04, 03:54:31 15[MGR] <mycompany-partner|2> checkin IKEv2 SA mycompany-partner[2] with SPIs c6e9d36c2cd61938_i 8deb1e4f081dcc1c_r
Thu, 2024-04-04, 03:54:31 15[MGR] <mycompany-partner|2> checkin of IKE_SA successful
Thu, 2024-04-04, 03:54:31 03[MGR] checkout IKEv2 SA with SPIs c6e9d36c2cd61938_i 8deb1e4f081dcc1c_r
Thu, 2024-04-04, 03:54:31 03[MGR] IKE_SA mycompany-partner[2] successfully checked out
Thu, 2024-04-04, 03:54:31 03[MGR] <mycompany-partner|2> checkin IKEv2 SA mycompany-partner[2] with SPIs c6e9d36c2cd61938_i 8deb1e4f081dcc1c_r
Thu, 2024-04-04, 03:54:31 03[MGR] <mycompany-partner|2> checkin of IKE_SA successful
Thu, 2024-04-04, 03:54:31 12[MGR] checkout IKEv2 SA with SPIs c6e9d36c2cd61938_i 8deb1e4f081dcc1c_r
Thu, 2024-04-04, 03:54:31 12[MGR] IKE_SA mycompany-partner[2] successfully checked out
Thu, 2024-04-04, 03:54:31 12[MGR] <mycompany-partner|2> checkin IKEv2 SA mycompany-partner[2] with SPIs c6e9d36c2cd61938_i 8deb1e4f081dcc1c_r
Thu, 2024-04-04, 03:54:31 12[MGR] <mycompany-partner|2> checkin of IKE_SA successful
Thu, 2024-04-04, 03:54:32 15[MGR] checkout IKEv2 SA by message with SPIs c6e9d36c2cd61938_i 8deb1e4f081dcc1c_r
Thu, 2024-04-04, 03:54:32 15[MGR] IKE_SA mycompany-partner[2] successfully checked out
Thu, 2024-04-04, 03:54:32 15[NET] <mycompany-partner|2> received packet: from 41.87.129.1[500] to 196.32.221.78[500] (80 bytes)
Thu, 2024-04-04, 03:54:32 15[ENC] <mycompany-partner|2> parsed INFORMATIONAL request 0 [ ]
Thu, 2024-04-04, 03:54:32 15[ENC] <mycompany-partner|2> generating INFORMATIONAL response 0 [ ]
Thu, 2024-04-04, 03:54:32 15[NET] <mycompany-partner|2> sending packet: from 196.32.221.78[500] to 41.87.129.1[500] (80 bytes)
Thu, 2024-04-04, 03:54:32 15[MGR] <mycompany-partner|2> checkin IKEv2 SA mycompany-partner[2] with SPIs c6e9d36c2cd61938_i 8deb1e4f081dcc1c_r
Thu, 2024-04-04, 03:54:32 15[MGR] <mycompany-partner|2> checkin of IKE_SA successful
Thu, 2024-04-04, 03:54:37 15[MGR] checkout IKEv2 SA by message with SPIs c6e9d36c2cd61938_i 8deb1e4f081dcc1c_r
Thu, 2024-04-04, 03:54:37 15[MGR] IKE_SA mycompany-partner[2] successfully checked out
Thu, 2024-04-04, 03:54:37 15[NET] <mycompany-partner|2> received packet: from 41.87.129.1[500] to 196.32.221.78[500] (80 bytes)
Thu, 2024-04-04, 03:54:37 15[ENC] <mycompany-partner|2> parsed INFORMATIONAL request 1 [ ]
Thu, 2024-04-04, 03:54:37 15[ENC] <mycompany-partner|2> generating INFORMATIONAL response 1 [ ]
Thu, 2024-04-04, 03:54:37 15[NET] <mycompany-partner|2> sending packet: from 196.32.221.78[500] to 41.87.129.1[500] (80 bytes)
Thu, 2024-04-04, 03:54:37 15[MGR] <mycompany-partner|2> checkin IKEv2 SA mycompany-partner[2] with SPIs c6e9d36c2cd61938_i 8deb1e4f081dcc1c_r
Thu, 2024-04-04, 03:54:37 15[MGR] <mycompany-partner|2> checkin of IKE_SA successful
Thu, 2024-04-04, 03:54:42 11[MGR] checkout IKEv2 SA by message with SPIs c6e9d36c2cd61938_i 8deb1e4f081dcc1c_r
Thu, 2024-04-04, 03:54:42 11[MGR] IKE_SA mycompany-partner[2] successfully checked out
Thu, 2024-04-04, 03:54:42 11[NET] <mycompany-partner|2> received packet: from 41.87.129.1[500] to 196.32.221.78[500] (80 bytes)
Thu, 2024-04-04, 03:54:42 11[ENC] <mycompany-partner|2> parsed INFORMATIONAL request 2 [ ]
Thu, 2024-04-04, 03:54:42 11[ENC] <mycompany-partner|2> generating INFORMATIONAL response 2 [ ]
Thu, 2024-04-04, 03:54:42 11[NET] <mycompany-partner|2> sending packet: from 196.32.221.78[500] to 41.87.129.1[500] (80 bytes)
Thu, 2024-04-04, 03:54:42 11[MGR] <mycompany-partner|2> checkin IKEv2 SA mycompany-partner[2] with SPIs c6e9d36c2cd61938_i 8deb1e4f081dcc1c_r
Thu, 2024-04-04, 03:54:42 11[MGR] <mycompany-partner|2> checkin of IKE_SA successful
Thu, 2024-04-04, 03:54:47 15[MGR] checkout IKEv2 SA by message with SPIs c6e9d36c2cd61938_i 8deb1e4f081dcc1c_r
Thu, 2024-04-04, 03:54:47 15[MGR] IKE_SA mycompany-partner[2] successfully checked out
Thu, 2024-04-04, 03:54:47 15[NET] <mycompany-partner|2> received packet: from 41.87.129.1[500] to 196.32.221.78[500] (80 bytes)
Thu, 2024-04-04, 03:54:47 15[ENC] <mycompany-partner|2> parsed INFORMATIONAL request 3 [ ]
Thu, 2024-04-04, 03:54:47 15[ENC] <mycompany-partner|2> generating INFORMATIONAL response 3 [ ]
Thu, 2024-04-04, 03:54:47 15[NET] <mycompany-partner|2> sending packet: from 196.32.221.78[500] to 41.87.129.1[500] (80 bytes)
Thu, 2024-04-04, 03:54:47 15[MGR] <mycompany-partner|2> checkin IKEv2 SA mycompany-partner[2] with SPIs c6e9d36c2cd61938_i 8deb1e4f081dcc1c_r
Thu, 2024-04-04, 03:54:47 15[MGR] <mycompany-partner|2> checkin of IKE_SA successful
Thu, 2024-04-04, 03:54:52 14[MGR] checkout IKEv2 SA by message with SPIs 544836bd91ce9f7d_i 0000000000000000_r
Thu, 2024-04-04, 03:54:52 14[MGR] created IKE_SA (unnamed)[3]
Thu, 2024-04-04, 03:54:52 14[NET] <3> received packet: from 105.158.173.127[500] to 196.32.221.78[500] (464 bytes)
Thu, 2024-04-04, 03:54:52 14[ENC] <3> parsed IKE_SA_INIT request 0 [ SA KE No N(NATD_S_IP) N(NATD_D_IP) N(FRAG_SUP) N(HASH_ALG) N(REDIR_SUP) ]
Thu, 2024-04-04, 03:54:52 14[CFG] <3> looking for an IKEv2 config for 196.32.221.78...105.158.173.127
Thu, 2024-04-04, 03:54:52 14[CFG] <3>   candidate: 196.32.221.78...%any, prio 1052
Thu, 2024-04-04, 03:54:52 14[CFG] <3> found matching ike config: 196.32.221.78...%any with prio 1052
Thu, 2024-04-04, 03:54:52 14[IKE] <3> local endpoint changed from 0.0.0.0[500] to 196.32.221.78[500]
Thu, 2024-04-04, 03:54:52 14[IKE] <3> remote endpoint changed from 0.0.0.0 to 105.158.173.127[500]
Thu, 2024-04-04, 03:54:52 14[IKE] <3> 105.158.173.127 is initiating an IKE_SA
Thu, 2024-04-04, 03:54:52 14[IKE] <3> IKE_SA (unnamed)[3] state change: CREATED => CONNECTING
Thu, 2024-04-04, 03:54:52 14[CFG] <3> selecting proposal:
Thu, 2024-04-04, 03:54:52 14[CFG] <3>   proposal matches
Thu, 2024-04-04, 03:54:52 14[CFG] <3> received proposals: IKE:AES_CBC_256/HMAC_SHA2_256_128/PRF_HMAC_SHA2_256/MODP_2048
Thu, 2024-04-04, 03:54:52 14[CFG] <3> configured proposals: IKE:AES_CBC_256/HMAC_SHA2_256_128/PRF_HMAC_SHA2_256/MODP_2048
Thu, 2024-04-04, 03:54:52 14[CFG] <3> selected proposal: IKE:AES_CBC_256/HMAC_SHA2_256_128/PRF_HMAC_SHA2_256/MODP_2048
Thu, 2024-04-04, 03:54:52 14[CFG] <3> received supported signature hash algorithms: sha256 sha384 sha512 identity
Thu, 2024-04-04, 03:54:52 14[IKE] <3> remote host is behind NAT
Thu, 2024-04-04, 03:54:52 14[CFG] <3> sending supported signature hash algorithms: sha256 sha384 sha512 identity
Thu, 2024-04-04, 03:54:52 14[ENC] <3> generating IKE_SA_INIT response 0 [ SA KE No N(NATD_S_IP) N(NATD_D_IP) N(FRAG_SUP) N(HASH_ALG) N(CHDLESS_SUP) N(MULT_AUTH) ]
Thu, 2024-04-04, 03:54:52 14[NET] <3> sending packet: from 196.32.221.78[500] to 105.158.173.127[500] (472 bytes)
Thu, 2024-04-04, 03:54:52 14[MGR] <3> checkin IKEv2 SA (unnamed)[3] with SPIs 544836bd91ce9f7d_i dd15d4ccda0c0ebf_r
Thu, 2024-04-04, 03:54:52 14[MGR] <3> checkin of IKE_SA successful
Thu, 2024-04-04, 03:54:52 16[MGR] checkout IKEv2 SA by message with SPIs 544836bd91ce9f7d_i dd15d4ccda0c0ebf_r
Thu, 2024-04-04, 03:54:52 16[MGR] IKE_SA (unnamed)[3] successfully checked out
Thu, 2024-04-04, 03:54:52 16[NET] <3> received packet: from 105.158.173.127[4500] to 196.32.221.78[4500] (320 bytes)
Thu, 2024-04-04, 03:54:52 16[ENC] <3> parsed IKE_AUTH request 1 [ IDi N(INIT_CONTACT) IDr CPRQ(ADDR DNS) SA TSi TSr N(MOBIKE_SUP) N(ADD_4_ADDR) N(ADD_4_ADDR) N(ADD_4_ADDR) N(MULT_AUTH) N(EAP_ONLY) N(MSG_ID_SYN_SUP) ]
Thu, 2024-04-04, 03:54:52 16[IKE] <3> local endpoint changed from 196.32.221.78[500] to 196.32.221.78[4500]
Thu, 2024-04-04, 03:54:52 16[IKE] <3> remote endpoint changed from 105.158.173.127[500] to 105.158.173.127[4500]
Thu, 2024-04-04, 03:54:52 16[CFG] <3> looking for peer configs matching 196.32.221.78[196.32.221.78]...105.158.173.127[yelhouti]
Thu, 2024-04-04, 03:54:52 16[CFG] <3>   candidate "mycompany-vpn", match: 20/1/1052 (me/other/ike)
Thu, 2024-04-04, 03:54:52 16[CFG] <mycompany-vpn|3> selected peer config 'mycompany-vpn'
Thu, 2024-04-04, 03:54:52 16[IKE] <mycompany-vpn|3> initiating EAP_MSCHAPV2 method (id 0x8A)
Thu, 2024-04-04, 03:54:52 16[IKE] <mycompany-vpn|3> processing INTERNAL_IP4_ADDRESS attribute
Thu, 2024-04-04, 03:54:52 16[IKE] <mycompany-vpn|3> processing INTERNAL_IP4_DNS attribute
Thu, 2024-04-04, 03:54:52 16[IKE] <mycompany-vpn|3> peer supports MOBIKE
Thu, 2024-04-04, 03:54:52 16[IKE] <mycompany-vpn|3> got additional MOBIKE peer address: 192.168.122.1
Thu, 2024-04-04, 03:54:52 16[IKE] <mycompany-vpn|3> got additional MOBIKE peer address: 172.17.0.1
Thu, 2024-04-04, 03:54:52 16[IKE] <mycompany-vpn|3> got additional MOBIKE peer address: 172.18.0.1
Thu, 2024-04-04, 03:54:52 16[IKE] <mycompany-vpn|3> authentication of '196.32.221.78' (myself) with RSA_EMSA_PKCS1_SHA2_384 successful
Thu, 2024-04-04, 03:54:52 16[ENC] <mycompany-vpn|3> generating IKE_AUTH response 1 [ IDr AUTH EAP/REQ/MSCHAPV2 ]
Thu, 2024-04-04, 03:54:52 16[NET] <mycompany-vpn|3> sending packet: from 196.32.221.78[4500] to 105.158.173.127[4500] (656 bytes)
Thu, 2024-04-04, 03:54:52 16[MGR] <mycompany-vpn|3> checkin IKEv2 SA mycompany-vpn[3] with SPIs 544836bd91ce9f7d_i dd15d4ccda0c0ebf_r
Thu, 2024-04-04, 03:54:52 16[MGR] <mycompany-vpn|3> checkin of IKE_SA successful
Thu, 2024-04-04, 03:54:52 11[MGR] checkout IKEv2 SA by message with SPIs 544836bd91ce9f7d_i dd15d4ccda0c0ebf_r
Thu, 2024-04-04, 03:54:52 11[MGR] IKE_SA mycompany-vpn[3] successfully checked out
Thu, 2024-04-04, 03:54:52 11[NET] <mycompany-vpn|3> received packet: from 105.158.173.127[4500] to 196.32.221.78[4500] (144 bytes)
Thu, 2024-04-04, 03:54:52 11[ENC] <mycompany-vpn|3> parsed IKE_AUTH request 2 [ EAP/RES/MSCHAPV2 ]
Thu, 2024-04-04, 03:54:52 11[ENC] <mycompany-vpn|3> generating IKE_AUTH response 2 [ EAP/REQ/MSCHAPV2 ]
Thu, 2024-04-04, 03:54:52 11[NET] <mycompany-vpn|3> sending packet: from 196.32.221.78[4500] to 105.158.173.127[4500] (144 bytes)
Thu, 2024-04-04, 03:54:52 11[MGR] <mycompany-vpn|3> checkin IKEv2 SA mycompany-vpn[3] with SPIs 544836bd91ce9f7d_i dd15d4ccda0c0ebf_r
Thu, 2024-04-04, 03:54:52 11[MGR] <mycompany-vpn|3> checkin of IKE_SA successful
Thu, 2024-04-04, 03:54:52 13[MGR] checkout IKEv2 SA by message with SPIs 544836bd91ce9f7d_i dd15d4ccda0c0ebf_r
Thu, 2024-04-04, 03:54:52 13[MGR] IKE_SA mycompany-vpn[3] successfully checked out
Thu, 2024-04-04, 03:54:52 13[NET] <mycompany-vpn|3> received packet: from 105.158.173.127[4500] to 196.32.221.78[4500] (80 bytes)
Thu, 2024-04-04, 03:54:52 13[ENC] <mycompany-vpn|3> parsed IKE_AUTH request 3 [ EAP/RES/MSCHAPV2 ]
Thu, 2024-04-04, 03:54:52 13[IKE] <mycompany-vpn|3> EAP method EAP_MSCHAPV2 succeeded, MSK established
Thu, 2024-04-04, 03:54:52 13[ENC] <mycompany-vpn|3> generating IKE_AUTH response 3 [ EAP/SUCC ]
Thu, 2024-04-04, 03:54:52 13[NET] <mycompany-vpn|3> sending packet: from 196.32.221.78[4500] to 105.158.173.127[4500] (80 bytes)
Thu, 2024-04-04, 03:54:52 13[MGR] <mycompany-vpn|3> checkin IKEv2 SA mycompany-vpn[3] with SPIs 544836bd91ce9f7d_i dd15d4ccda0c0ebf_r
Thu, 2024-04-04, 03:54:52 13[MGR] <mycompany-vpn|3> checkin of IKE_SA successful
Thu, 2024-04-04, 03:54:52 15[MGR] checkout IKEv2 SA by message with SPIs 544836bd91ce9f7d_i dd15d4ccda0c0ebf_r
Thu, 2024-04-04, 03:54:52 15[MGR] IKE_SA mycompany-vpn[3] successfully checked out
Thu, 2024-04-04, 03:54:52 15[NET] <mycompany-vpn|3> received packet: from 105.158.173.127[4500] to 196.32.221.78[4500] (112 bytes)
Thu, 2024-04-04, 03:54:52 15[ENC] <mycompany-vpn|3> parsed IKE_AUTH request 4 [ AUTH ]
Thu, 2024-04-04, 03:54:52 15[IKE] <mycompany-vpn|3> authentication of 'yelhouti' with EAP successful
Thu, 2024-04-04, 03:54:52 15[IKE] <mycompany-vpn|3> authentication of '196.32.221.78' (myself) with EAP
Thu, 2024-04-04, 03:54:52 15[IKE] <mycompany-vpn|3> peer requested virtual IP %any
Thu, 2024-04-04, 03:54:52 15[CFG] <mycompany-vpn|3> assigning new lease to 'yelhouti'
Thu, 2024-04-04, 03:54:52 15[IKE] <mycompany-vpn|3> assigning virtual IP 172.23.127.2 to peer 'yelhouti'
Thu, 2024-04-04, 03:54:52 15[IKE] <mycompany-vpn|3> building INTERNAL_IP4_DNS attribute
Thu, 2024-04-04, 03:54:52 15[IKE] <mycompany-vpn|3> building INTERNAL_IP4_DNS attribute
Thu, 2024-04-04, 03:54:52 15[IKE] <mycompany-vpn|3> IKE_SA mycompany-vpn[3] established between 196.32.221.78[196.32.221.78]...105.158.173.127[yelhouti]
Thu, 2024-04-04, 03:54:52 15[IKE] <mycompany-vpn|3> IKE_SA mycompany-vpn[3] state change: CONNECTING => ESTABLISHED
Thu, 2024-04-04, 03:54:52 15[IKE] <mycompany-vpn|3> scheduling rekeying in 13167s
Thu, 2024-04-04, 03:54:52 15[IKE] <mycompany-vpn|3> maximum IKE_SA lifetime 14607s
Thu, 2024-04-04, 03:54:52 15[CFG] <mycompany-vpn|3> looking for a child config for 0.0.0.0/0 === 0.0.0.0/0
Thu, 2024-04-04, 03:54:52 15[CFG] <mycompany-vpn|3> proposing traffic selectors for us:
Thu, 2024-04-04, 03:54:52 15[CFG] <mycompany-vpn|3>  0.0.0.0/0
Thu, 2024-04-04, 03:54:52 15[CFG] <mycompany-vpn|3> proposing traffic selectors for other:
Thu, 2024-04-04, 03:54:52 15[CFG] <mycompany-vpn|3>  172.23.127.2/32
Thu, 2024-04-04, 03:54:52 15[CFG] <mycompany-vpn|3>   candidate "mycompany-vpn" with prio 5+1
Thu, 2024-04-04, 03:54:52 15[CFG] <mycompany-vpn|3> found matching child config "mycompany-vpn" with prio 6
Thu, 2024-04-04, 03:54:52 15[CFG] <mycompany-vpn|3> selecting proposal:
Thu, 2024-04-04, 03:54:52 15[CFG] <mycompany-vpn|3>   proposal matches
Thu, 2024-04-04, 03:54:52 15[CFG] <mycompany-vpn|3> received proposals: ESP:AES_CBC_256/HMAC_SHA2_256_128/NO_EXT_SEQ, AH:HMAC_SHA2_256_128/NO_EXT_SEQ
Thu, 2024-04-04, 03:54:52 15[CFG] <mycompany-vpn|3> configured proposals: ESP:AES_CBC_256/HMAC_SHA2_256_128/MODP_2048/NO_EXT_SEQ, AH:HMAC_SHA2_256_128/MODP_2048/NO_EXT_SEQ
Thu, 2024-04-04, 03:54:52 15[CFG] <mycompany-vpn|3> selected proposal: ESP:AES_CBC_256/HMAC_SHA2_256_128/NO_EXT_SEQ
Thu, 2024-04-04, 03:54:52 15[KNL] <mycompany-vpn|3> got SPI c91502ab
Thu, 2024-04-04, 03:54:52 15[CFG] <mycompany-vpn|3> selecting traffic selectors for us:
Thu, 2024-04-04, 03:54:52 15[CFG] <mycompany-vpn|3>  config: 0.0.0.0/0, received: 0.0.0.0/0 => match: 0.0.0.0/0
Thu, 2024-04-04, 03:54:52 15[CFG] <mycompany-vpn|3> selecting traffic selectors for other:
Thu, 2024-04-04, 03:54:52 15[CFG] <mycompany-vpn|3>  config: 172.23.127.2/32, received: 0.0.0.0/0 => match: 172.23.127.2/32
Thu, 2024-04-04, 03:54:52 15[CHD] <mycompany-vpn|3> CHILD_SA mycompany-vpn{3} state change: CREATED => INSTALLING
Thu, 2024-04-04, 03:54:52 15[CHD] <mycompany-vpn|3>   using AES_CBC for encryption
Thu, 2024-04-04, 03:54:52 15[CHD] <mycompany-vpn|3>   using HMAC_SHA2_256_128 for integrity
Thu, 2024-04-04, 03:54:52 15[CHD] <mycompany-vpn|3> adding inbound ESP SA
Thu, 2024-04-04, 03:54:52 15[CHD] <mycompany-vpn|3>   SPI 0xc91502ab, src 105.158.173.127 dst 196.32.221.78
Thu, 2024-04-04, 03:54:52 15[KNL] <mycompany-vpn|3> adding SAD entry with SPI c91502ab and reqid {3}
Thu, 2024-04-04, 03:54:52 15[KNL] <mycompany-vpn|3>   using encryption algorithm AES_CBC with key size 256
Thu, 2024-04-04, 03:54:52 15[KNL] <mycompany-vpn|3>   using integrity algorithm HMAC_SHA2_256_128 with key size 256
Thu, 2024-04-04, 03:54:52 15[KNL] <mycompany-vpn|3>   using replay window of 32 packets
Thu, 2024-04-04, 03:54:52 15[KNL] <mycompany-vpn|3>   HW offload: no
Thu, 2024-04-04, 03:54:52 15[CHD] <mycompany-vpn|3> adding outbound ESP SA
Thu, 2024-04-04, 03:54:52 15[CHD] <mycompany-vpn|3>   SPI 0xc32447cb, src 196.32.221.78 dst 105.158.173.127
Thu, 2024-04-04, 03:54:52 15[KNL] <mycompany-vpn|3> adding SAD entry with SPI c32447cb and reqid {3}
Thu, 2024-04-04, 03:54:52 15[KNL] <mycompany-vpn|3>   using encryption algorithm AES_CBC with key size 256
Thu, 2024-04-04, 03:54:52 15[KNL] <mycompany-vpn|3>   using integrity algorithm HMAC_SHA2_256_128 with key size 256
Thu, 2024-04-04, 03:54:52 15[KNL] <mycompany-vpn|3>   using replay window of 0 packets
Thu, 2024-04-04, 03:54:52 15[KNL] <mycompany-vpn|3>   HW offload: no
Thu, 2024-04-04, 03:54:52 15[KNL] <mycompany-vpn|3> adding policy 172.23.127.2/32 === 0.0.0.0/0 in [priority 383615, refcount 1]
Thu, 2024-04-04, 03:54:52 15[KNL] <mycompany-vpn|3> adding policy 172.23.127.2/32 === 0.0.0.0/0 fwd [priority 383615, refcount 1]
Thu, 2024-04-04, 03:54:52 15[KNL] <mycompany-vpn|3> adding policy 0.0.0.0/0 === 172.23.127.2/32 out [priority 383615, refcount 1]
Thu, 2024-04-04, 03:54:52 15[KNL] <mycompany-vpn|3> getting a local address in traffic selector 0.0.0.0/0
Thu, 2024-04-04, 03:54:52 15[KNL] <mycompany-vpn|3> using host %any
Thu, 2024-04-04, 03:54:52 15[KNL] <mycompany-vpn|3> getting iface name for index 2
Thu, 2024-04-04, 03:54:52 15[KNL] <mycompany-vpn|3> using 196.32.221.65 as nexthop and eth0 as dev to reach 105.158.173.127/32
Thu, 2024-04-04, 03:54:52 15[KNL] <mycompany-vpn|3> installing route: 172.23.127.2/32 via 196.32.221.65 src %any dev eth0
Thu, 2024-04-04, 03:54:52 15[KNL] <mycompany-vpn|3> getting iface index for eth0
Thu, 2024-04-04, 03:54:52 15[IKE] <mycompany-vpn|3> CHILD_SA mycompany-vpn{3} established with SPIs c91502ab_i c32447cb_o and TS 0.0.0.0/0 === 172.23.127.2/32
Thu, 2024-04-04, 03:54:52 15[CHD] <mycompany-vpn|3> CHILD_SA mycompany-vpn{3} state change: INSTALLING => INSTALLED
Thu, 2024-04-04, 03:54:52 15[KNL] <mycompany-vpn|3> getting iface name for index 2
Thu, 2024-04-04, 03:54:52 15[KNL] <mycompany-vpn|3> using 196.32.221.65 as nexthop and eth0 as dev to reach 105.158.173.127/32
Thu, 2024-04-04, 03:54:52 15[ENC] <mycompany-vpn|3> generating IKE_AUTH response 4 [ AUTH CPRP(ADDR DNS DNS) SA TSi TSr N(MOBIKE_SUP) N(ADD_4_ADDR) N(ADD_4_ADDR) ]
Thu, 2024-04-04, 03:54:52 15[NET] <mycompany-vpn|3> sending packet: from 196.32.221.78[4500] to 105.158.173.127[4500] (272 bytes)
Thu, 2024-04-04, 03:54:52 15[MGR] <mycompany-vpn|3> checkin IKEv2 SA mycompany-vpn[3] with SPIs 544836bd91ce9f7d_i dd15d4ccda0c0ebf_r
Thu, 2024-04-04, 03:54:52 15[MGR] <mycompany-vpn|3> checkin of IKE_SA successful
Thu, 2024-04-04, 03:54:52 16[MGR] checkout IKEv2 SA by message with SPIs c6e9d36c2cd61938_i 8deb1e4f081dcc1c_r
Thu, 2024-04-04, 03:54:52 16[MGR] IKE_SA mycompany-partner[2] successfully checked out
Thu, 2024-04-04, 03:54:52 16[NET] <mycompany-partner|2> received packet: from 41.87.129.1[500] to 196.32.221.78[500] (80 bytes)
Thu, 2024-04-04, 03:54:52 16[ENC] <mycompany-partner|2> parsed INFORMATIONAL request 4 [ ]
Thu, 2024-04-04, 03:54:52 16[ENC] <mycompany-partner|2> generating INFORMATIONAL response 4 [ ]
Thu, 2024-04-04, 03:54:52 16[NET] <mycompany-partner|2> sending packet: from 196.32.221.78[500] to 41.87.129.1[500] (80 bytes)
Thu, 2024-04-04, 03:54:52 16[MGR] <mycompany-partner|2> checkin IKEv2 SA mycompany-partner[2] with SPIs c6e9d36c2cd61938_i 8deb1e4f081dcc1c_r
Thu, 2024-04-04, 03:54:52 16[MGR] <mycompany-partner|2> checkin of IKE_SA successful
Thu, 2024-04-04, 03:54:57 13[MGR] checkout IKEv2 SA by message with SPIs c6e9d36c2cd61938_i 8deb1e4f081dcc1c_r
Thu, 2024-04-04, 03:54:57 13[MGR] IKE_SA mycompany-partner[2] successfully checked out
Thu, 2024-04-04, 03:54:57 13[NET] <mycompany-partner|2> received packet: from 41.87.129.1[500] to 196.32.221.78[500] (80 bytes)
Thu, 2024-04-04, 03:54:57 13[ENC] <mycompany-partner|2> parsed INFORMATIONAL request 5 [ ]
Thu, 2024-04-04, 03:54:57 13[ENC] <mycompany-partner|2> generating INFORMATIONAL response 5 [ ]
Thu, 2024-04-04, 03:54:57 13[NET] <mycompany-partner|2> sending packet: from 196.32.221.78[500] to 41.87.129.1[500] (80 bytes)
Thu, 2024-04-04, 03:54:57 13[MGR] <mycompany-partner|2> checkin IKEv2 SA mycompany-partner[2] with SPIs c6e9d36c2cd61938_i 8deb1e4f081dcc1c_r
Thu, 2024-04-04, 03:54:57 13[MGR] <mycompany-partner|2> checkin of IKE_SA successful
Thu, 2024-04-04, 03:55:02 09[MGR] checkout IKEv2 SA by message with SPIs c6e9d36c2cd61938_i 8deb1e4f081dcc1c_r
Thu, 2024-04-04, 03:55:02 09[MGR] IKE_SA mycompany-partner[2] successfully checked out
Thu, 2024-04-04, 03:55:02 09[NET] <mycompany-partner|2> received packet: from 41.87.129.1[500] to 196.32.221.78[500] (80 bytes)
Thu, 2024-04-04, 03:55:02 09[ENC] <mycompany-partner|2> parsed INFORMATIONAL request 6 [ ]
Thu, 2024-04-04, 03:55:02 09[ENC] <mycompany-partner|2> generating INFORMATIONAL response 6 [ ]
Thu, 2024-04-04, 03:55:02 09[NET] <mycompany-partner|2> sending packet: from 196.32.221.78[500] to 41.87.129.1[500] (80 bytes)
Thu, 2024-04-04, 03:55:02 09[MGR] <mycompany-partner|2> checkin IKEv2 SA mycompany-partner[2] with SPIs c6e9d36c2cd61938_i 8deb1e4f081dcc1c_r
Thu, 2024-04-04, 03:55:02 09[MGR] <mycompany-partner|2> checkin of IKE_SA successful
Thu, 2024-04-04, 03:55:07 06[MGR] checkout IKEv2 SA by message with SPIs c6e9d36c2cd61938_i 8deb1e4f081dcc1c_r
Thu, 2024-04-04, 03:55:07 06[MGR] IKE_SA mycompany-partner[2] successfully checked out
Thu, 2024-04-04, 03:55:07 06[NET] <mycompany-partner|2> received packet: from 41.87.129.1[500] to 196.32.221.78[500] (80 bytes)
Thu, 2024-04-04, 03:55:07 06[ENC] <mycompany-partner|2> parsed INFORMATIONAL request 7 [ ]
Thu, 2024-04-04, 03:55:07 06[ENC] <mycompany-partner|2> generating INFORMATIONAL response 7 [ ]
Thu, 2024-04-04, 03:55:07 06[NET] <mycompany-partner|2> sending packet: from 196.32.221.78[500] to 41.87.129.1[500] (80 bytes)
Thu, 2024-04-04, 03:55:07 06[MGR] <mycompany-partner|2> checkin IKEv2 SA mycompany-partner[2] with SPIs c6e9d36c2cd61938_i 8deb1e4f081dcc1c_r
Thu, 2024-04-04, 03:55:07 06[MGR] <mycompany-partner|2> checkin of IKE_SA successful
Thu, 2024-04-04, 03:55:12 06[MGR] checkout IKEv2 SA by message with SPIs c6e9d36c2cd61938_i 8deb1e4f081dcc1c_r
Thu, 2024-04-04, 03:55:12 06[MGR] IKE_SA mycompany-partner[2] successfully checked out
Thu, 2024-04-04, 03:55:12 06[NET] <mycompany-partner|2> received packet: from 41.87.129.1[500] to 196.32.221.78[500] (80 bytes)
Thu, 2024-04-04, 03:55:12 06[ENC] <mycompany-partner|2> parsed INFORMATIONAL request 8 [ ]
Thu, 2024-04-04, 03:55:12 06[ENC] <mycompany-partner|2> generating INFORMATIONAL response 8 [ ]
Thu, 2024-04-04, 03:55:12 06[NET] <mycompany-partner|2> sending packet: from 196.32.221.78[500] to 41.87.129.1[500] (80 bytes)
Thu, 2024-04-04, 03:55:12 06[MGR] <mycompany-partner|2> checkin IKEv2 SA mycompany-partner[2] with SPIs c6e9d36c2cd61938_i 8deb1e4f081dcc1c_r
Thu, 2024-04-04, 03:55:12 06[MGR] <mycompany-partner|2> checkin of IKE_SA successful
Thu, 2024-04-04, 03:55:17 15[MGR] checkout IKEv2 SA by message with SPIs c6e9d36c2cd61938_i 8deb1e4f081dcc1c_r
Thu, 2024-04-04, 03:55:17 15[MGR] IKE_SA mycompany-partner[2] successfully checked out
Thu, 2024-04-04, 03:55:17 15[NET] <mycompany-partner|2> received packet: from 41.87.129.1[500] to 196.32.221.78[500] (80 bytes)
Thu, 2024-04-04, 03:55:17 15[ENC] <mycompany-partner|2> parsed INFORMATIONAL request 9 [ ]
Thu, 2024-04-04, 03:55:17 15[ENC] <mycompany-partner|2> generating INFORMATIONAL response 9 [ ]
Thu, 2024-04-04, 03:55:17 15[NET] <mycompany-partner|2> sending packet: from 196.32.221.78[500] to 41.87.129.1[500] (80 bytes)
Thu, 2024-04-04, 03:55:17 15[MGR] <mycompany-partner|2> checkin IKEv2 SA mycompany-partner[2] with SPIs c6e9d36c2cd61938_i 8deb1e4f081dcc1c_r
Thu, 2024-04-04, 03:55:17 15[MGR] <mycompany-partner|2> checkin of IKE_SA successful
Thu, 2024-04-04, 03:55:22 11[MGR] checkout IKEv2 SA with SPIs 544836bd91ce9f7d_i dd15d4ccda0c0ebf_r
Thu, 2024-04-04, 03:55:22 11[MGR] IKE_SA mycompany-vpn[3] successfully checked out
Thu, 2024-04-04, 03:55:22 11[MGR] <mycompany-vpn|3> checkin IKEv2 SA mycompany-vpn[3] with SPIs 544836bd91ce9f7d_i dd15d4ccda0c0ebf_r
Thu, 2024-04-04, 03:55:22 11[MGR] <mycompany-vpn|3> checkin of IKE_SA successful
Thu, 2024-04-04, 03:55:22 16[MGR] checkout IKEv2 SA by message with SPIs c6e9d36c2cd61938_i 8deb1e4f081dcc1c_r
Thu, 2024-04-04, 03:55:22 16[MGR] IKE_SA mycompany-partner[2] successfully checked out
Thu, 2024-04-04, 03:55:22 16[NET] <mycompany-partner|2> received packet: from 41.87.129.1[500] to 196.32.221.78[500] (80 bytes)
Thu, 2024-04-04, 03:55:22 16[ENC] <mycompany-partner|2> parsed INFORMATIONAL request 10 [ ]
Thu, 2024-04-04, 03:55:22 16[ENC] <mycompany-partner|2> generating INFORMATIONAL response 10 [ ]
Thu, 2024-04-04, 03:55:22 16[NET] <mycompany-partner|2> sending packet: from 196.32.221.78[500] to 41.87.129.1[500] (80 bytes)
Thu, 2024-04-04, 03:55:22 16[MGR] <mycompany-partner|2> checkin IKEv2 SA mycompany-partner[2] with SPIs c6e9d36c2cd61938_i 8deb1e4f081dcc1c_r
Thu, 2024-04-04, 03:55:22 16[MGR] <mycompany-partner|2> checkin of IKE_SA successful
Thu, 2024-04-04, 03:55:27 12[MGR] checkout IKEv2 SA by message with SPIs c6e9d36c2cd61938_i 8deb1e4f081dcc1c_r
Thu, 2024-04-04, 03:55:27 12[MGR] IKE_SA mycompany-partner[2] successfully checked out
Thu, 2024-04-04, 03:55:27 12[NET] <mycompany-partner|2> received packet: from 41.87.129.1[500] to 196.32.221.78[500] (80 bytes)
Thu, 2024-04-04, 03:55:27 12[ENC] <mycompany-partner|2> parsed INFORMATIONAL request 11 [ ]
Thu, 2024-04-04, 03:55:27 12[ENC] <mycompany-partner|2> generating INFORMATIONAL response 11 [ ]
Thu, 2024-04-04, 03:55:27 12[NET] <mycompany-partner|2> sending packet: from 196.32.221.78[500] to 41.87.129.1[500] (80 bytes)
Thu, 2024-04-04, 03:55:27 12[MGR] <mycompany-partner|2> checkin IKEv2 SA mycompany-partner[2] with SPIs c6e9d36c2cd61938_i 8deb1e4f081dcc1c_r
Thu, 2024-04-04, 03:55:27 12[MGR] <mycompany-partner|2> checkin of IKE_SA successful
Thu, 2024-04-04, 03:55:32 16[MGR] checkout IKEv2 SA by message with SPIs c6e9d36c2cd61938_i 8deb1e4f081dcc1c_r
Thu, 2024-04-04, 03:55:32 16[MGR] IKE_SA mycompany-partner[2] successfully checked out
Thu, 2024-04-04, 03:55:32 16[NET] <mycompany-partner|2> received packet: from 41.87.129.1[500] to 196.32.221.78[500] (80 bytes)
Thu, 2024-04-04, 03:55:32 16[ENC] <mycompany-partner|2> parsed INFORMATIONAL request 12 [ ]
Thu, 2024-04-04, 03:55:32 16[ENC] <mycompany-partner|2> generating INFORMATIONAL response 12 [ ]
Thu, 2024-04-04, 03:55:32 16[NET] <mycompany-partner|2> sending packet: from 196.32.221.78[500] to 41.87.129.1[500] (80 bytes)
Thu, 2024-04-04, 03:55:32 16[MGR] <mycompany-partner|2> checkin IKEv2 SA mycompany-partner[2] with SPIs c6e9d36c2cd61938_i 8deb1e4f081dcc1c_r
Thu, 2024-04-04, 03:55:32 16[MGR] <mycompany-partner|2> checkin of IKE_SA successful
Thu, 2024-04-04, 03:55:37 14[MGR] checkout IKEv2 SA by message with SPIs c6e9d36c2cd61938_i 8deb1e4f081dcc1c_r
Thu, 2024-04-04, 03:55:37 14[MGR] IKE_SA mycompany-partner[2] successfully checked out
Thu, 2024-04-04, 03:55:37 14[NET] <mycompany-partner|2> received packet: from 41.87.129.1[500] to 196.32.221.78[500] (80 bytes)
Thu, 2024-04-04, 03:55:37 14[ENC] <mycompany-partner|2> parsed INFORMATIONAL request 13 [ ]
Thu, 2024-04-04, 03:55:37 14[ENC] <mycompany-partner|2> generating INFORMATIONAL response 13 [ ]
Thu, 2024-04-04, 03:55:37 14[NET] <mycompany-partner|2> sending packet: from 196.32.221.78[500] to 41.87.129.1[500] (80 bytes)
Thu, 2024-04-04, 03:55:37 14[MGR] <mycompany-partner|2> checkin IKEv2 SA mycompany-partner[2] with SPIs c6e9d36c2cd61938_i 8deb1e4f081dcc1c_r
Thu, 2024-04-04, 03:55:37 14[MGR] <mycompany-partner|2> checkin of IKE_SA successful
Thu, 2024-04-04, 03:55:42 11[MGR] checkout IKEv2 SA by message with SPIs c6e9d36c2cd61938_i 8deb1e4f081dcc1c_r
Thu, 2024-04-04, 03:55:42 11[MGR] IKE_SA mycompany-partner[2] successfully checked out
Thu, 2024-04-04, 03:55:42 11[NET] <mycompany-partner|2> received packet: from 41.87.129.1[500] to 196.32.221.78[500] (80 bytes)
Thu, 2024-04-04, 03:55:42 11[ENC] <mycompany-partner|2> parsed INFORMATIONAL request 14 [ ]
Thu, 2024-04-04, 03:55:42 11[ENC] <mycompany-partner|2> generating INFORMATIONAL response 14 [ ]
Thu, 2024-04-04, 03:55:42 11[NET] <mycompany-partner|2> sending packet: from 196.32.221.78[500] to 41.87.129.1[500] (80 bytes)
Thu, 2024-04-04, 03:55:42 11[MGR] <mycompany-partner|2> checkin IKEv2 SA mycompany-partner[2] with SPIs c6e9d36c2cd61938_i 8deb1e4f081dcc1c_r
Thu, 2024-04-04, 03:55:42 11[MGR] <mycompany-partner|2> checkin of IKE_SA successful
Thu, 2024-04-04, 03:55:47 15[MGR] checkout IKEv2 SA by message with SPIs c6e9d36c2cd61938_i 8deb1e4f081dcc1c_r
Thu, 2024-04-04, 03:55:47 15[MGR] IKE_SA mycompany-partner[2] successfully checked out
Thu, 2024-04-04, 03:55:47 15[NET] <mycompany-partner|2> received packet: from 41.87.129.1[500] to 196.32.221.78[500] (80 bytes)
Thu, 2024-04-04, 03:55:47 15[ENC] <mycompany-partner|2> parsed INFORMATIONAL request 15 [ ]
Thu, 2024-04-04, 03:55:47 15[ENC] <mycompany-partner|2> generating INFORMATIONAL response 15 [ ]
Thu, 2024-04-04, 03:55:47 15[NET] <mycompany-partner|2> sending packet: from 196.32.221.78[500] to 41.87.129.1[500] (80 bytes)
Thu, 2024-04-04, 03:55:47 15[MGR] <mycompany-partner|2> checkin IKEv2 SA mycompany-partner[2] with SPIs c6e9d36c2cd61938_i 8deb1e4f081dcc1c_r
Thu, 2024-04-04, 03:55:47 15[MGR] <mycompany-partner|2> checkin of IKE_SA successful
Thu, 2024-04-04, 03:55:52 07[MGR] checkout IKEv2 SA by message with SPIs c6e9d36c2cd61938_i 8deb1e4f081dcc1c_r
Thu, 2024-04-04, 03:55:52 07[MGR] IKE_SA mycompany-partner[2] successfully checked out
Thu, 2024-04-04, 03:55:52 07[NET] <mycompany-partner|2> received packet: from 41.87.129.1[500] to 196.32.221.78[500] (80 bytes)
Thu, 2024-04-04, 03:55:52 07[ENC] <mycompany-partner|2> parsed INFORMATIONAL request 16 [ ]
Thu, 2024-04-04, 03:55:52 07[ENC] <mycompany-partner|2> generating INFORMATIONAL response 16 [ ]
Thu, 2024-04-04, 03:55:52 07[NET] <mycompany-partner|2> sending packet: from 196.32.221.78[500] to 41.87.129.1[500] (80 bytes)
Thu, 2024-04-04, 03:55:52 07[MGR] <mycompany-partner|2> checkin IKEv2 SA mycompany-partner[2] with SPIs c6e9d36c2cd61938_i 8deb1e4f081dcc1c_r
Thu, 2024-04-04, 03:55:52 07[MGR] <mycompany-partner|2> checkin of IKE_SA successful
Thu, 2024-04-04, 03:55:57 10[MGR] checkout IKEv2 SA by message with SPIs c6e9d36c2cd61938_i 8deb1e4f081dcc1c_r
Thu, 2024-04-04, 03:55:57 10[MGR] IKE_SA mycompany-partner[2] successfully checked out
Thu, 2024-04-04, 03:55:57 10[NET] <mycompany-partner|2> received packet: from 41.87.129.1[500] to 196.32.221.78[500] (80 bytes)
Thu, 2024-04-04, 03:55:57 10[ENC] <mycompany-partner|2> parsed INFORMATIONAL request 17 [ ]
Thu, 2024-04-04, 03:55:57 10[ENC] <mycompany-partner|2> generating INFORMATIONAL response 17 [ ]
Thu, 2024-04-04, 03:55:57 10[NET] <mycompany-partner|2> sending packet: from 196.32.221.78[500] to 41.87.129.1[500] (80 bytes)
Thu, 2024-04-04, 03:55:57 10[MGR] <mycompany-partner|2> checkin IKEv2 SA mycompany-partner[2] with SPIs c6e9d36c2cd61938_i 8deb1e4f081dcc1c_r
Thu, 2024-04-04, 03:55:57 10[MGR] <mycompany-partner|2> checkin of IKE_SA successful
</details>

<details>
<summary>swanctl -L</summary>

plugin 'sqlite': failed to load - sqlite_plugin_create not found and no plugin file available
mycompany-vpn: IKEv2, no reauthentication, rekeying every 14400s
  local:  196.32.221.78
  remote: %any
  local public key authentication:
    id: 196.32.221.78
    certs: CN=vpn.mycompany.ma
  remote EAP_MSCHAPV2 authentication:
    id: %any
  mycompany-vpn: TUNNEL, rekeying every 3600s
    local:  0.0.0.0/0
    remote: dynamic
mycompany-partner: IKEv2, no reauthentication, rekeying every 14400s
  local:  196.32.221.78
  remote: 41.87.129.1
  local pre-shared key authentication:
  remote pre-shared key authentication:
  mycompany-partner-prod: TUNNEL, rekeying every 3600s
    local:  172.23.127.0/24
    remote: 172.25.1.142/32
  mycompany-partner-pprod: TUNNEL, rekeying every 3600s
    local:  172.23.127.0/24
    remote: 172.25.1.143/32
</details>

<details>
<summary>swanctl -l</summary>

plugin 'sqlite': failed to load - sqlite_plugin_create not found and no plugin file available
mycompany-vpn: #3, ESTABLISHED, IKEv2, 544836bd91ce9f7d_i dd15d4ccda0c0ebf_r*
  local  '196.32.221.78' @ 196.32.221.78[4500]
  remote 'yelhouti' @ 105.158.173.127[4500] [172.23.127.2]
  AES_CBC-256/HMAC_SHA2_256_128/PRF_HMAC_SHA2_256/MODP_2048
  established 617s ago, rekeying in 12550s
  mycompany-vpn: #3, reqid 3, INSTALLED, TUNNEL-in-UDP, ESP:AES_CBC-256/HMAC_SHA2_256_128
    installed 617s ago, rekeying in 2665s, expires in 3343s
    in  c91502ab, 1861501 bytes,  5806 packets,     0s ago
    out c32447cb, 12868439 bytes, 12016 packets,     0s ago
    local  0.0.0.0/0
    remote 172.23.127.2/32
mycompany-partner: #2, ESTABLISHED, IKEv2, c6e9d36c2cd61938_i* 8deb1e4f081dcc1c_r
  local  '196.32.221.78' @ 196.32.221.78[500]
  remote '41.87.129.1' @ 41.87.129.1[500]
  AES_CBC-256/HMAC_SHA2_256_128/PRF_HMAC_SHA2_256/ECP_384
  established 642s ago, rekeying in 13680s
  mycompany-partner-prod: #1, reqid 1, INSTALLED, TUNNEL, ESP:AES_CBC-256/HMAC_SHA2_256_128
    installed 642s ago, rekeying in 2647s, expires in 3318s
    in  c491bebe,      0 bytes,     0 packets
    out f6583c93,      0 bytes,     0 packets
    local  172.23.127.0/24
    remote 172.25.1.142/32
  mycompany-partner-pprod: #2, reqid 2, INSTALLED, TUNNEL, ESP:AES_CBC-256/HMAC_SHA2_256_128/ECP_384
    installed 642s ago, rekeying in 2670s, expires in 3318s
    in  c1ed271a,      0 bytes,     0 packets
    out 9ac8d6ac,      0 bytes,     0 packets
    local  172.23.127.0/24
    remote 172.25.1.143/32
</details>

<details>
<summary>iptables-save</summary>

# Generated by iptables-save v1.8.8 (nf_tables) on Thu Apr  4 04:09:10 2024
*mangle
:PREROUTING ACCEPT [0:0]
:INPUT ACCEPT [0:0]
:FORWARD ACCEPT [0:0]
:OUTPUT ACCEPT [0:0]
:POSTROUTING ACCEPT [0:0]
COMMIT
# Completed on Thu Apr  4 04:09:10 2024
# Generated by iptables-save v1.8.8 (nf_tables) on Thu Apr  4 04:09:10 2024
*raw
:PREROUTING ACCEPT [0:0]
:OUTPUT ACCEPT [0:0]
COMMIT
# Completed on Thu Apr  4 04:09:10 2024
# Generated by iptables-save v1.8.8 (nf_tables) on Thu Apr  4 04:09:10 2024
*filter
:INPUT ACCEPT [0:0]
:FORWARD ACCEPT [0:0]
:OUTPUT ACCEPT [0:0]
:DOCKER - [0:0]
:DOCKER-ISOLATION-STAGE-1 - [0:0]
:DOCKER-ISOLATION-STAGE-2 - [0:0]
:DOCKER-USER - [0:0]
-A FORWARD -s 172.23.127.2/32 -i eth0 -m policy --dir in --pol ipsec --reqid 3 --proto esp -j ACCEPT
-A FORWARD -d 172.23.127.2/32 -o eth0 -m policy --dir out --pol ipsec --reqid 3 --proto esp -j ACCEPT
-A FORWARD -j DOCKER-USER
-A FORWARD -j DOCKER-ISOLATION-STAGE-1
-A FORWARD -o docker0 -m conntrack --ctstate RELATED,ESTABLISHED -j ACCEPT
-A FORWARD -o docker0 -j DOCKER
-A FORWARD -i docker0 ! -o docker0 -j ACCEPT
-A FORWARD -i docker0 -o docker0 -j ACCEPT
-A DOCKER-ISOLATION-STAGE-1 -i docker0 ! -o docker0 -j DOCKER-ISOLATION-STAGE-2
-A DOCKER-ISOLATION-STAGE-1 -j RETURN
-A DOCKER-ISOLATION-STAGE-2 -o docker0 -j DROP
-A DOCKER-ISOLATION-STAGE-2 -j RETURN
-A DOCKER-USER -j RETURN
COMMIT
# Completed on Thu Apr  4 04:09:10 2024
# Generated by iptables-save v1.8.8 (nf_tables) on Thu Apr  4 04:09:10 2024
*nat
:PREROUTING ACCEPT [0:0]
:INPUT ACCEPT [0:0]
:OUTPUT ACCEPT [0:0]
:POSTROUTING ACCEPT [0:0]
:DOCKER - [0:0]
-A PREROUTING -m addrtype --dst-type LOCAL -j DOCKER
-A OUTPUT ! -d 127.0.0.0/8 -m addrtype --dst-type LOCAL -j DOCKER
-A POSTROUTING -s 172.17.0.0/16 ! -o docker0 -j MASQUERADE
-A DOCKER -i docker0 -j RETURN
COMMIT
# Completed on Thu Apr  4 04:09:10 2024

</details>

<details>
<summary>ip route show table all</summary>

172.23.127.2 via 196.32.221.65 dev eth0 table 220 proto static 
172.25.1.142 via 196.32.221.65 dev eth0 table 220 proto static src 172.23.127.1 
172.25.1.143 via 196.32.221.65 dev eth0 table 220 proto static src 172.23.127.1 
default via 196.32.221.65 dev eth0 proto static metric 100 
172.17.0.0/16 dev docker0 proto kernel scope link src 172.17.0.1 linkdown 
196.32.221.64/28 dev eth0 proto kernel scope link src 196.32.221.78 metric 100 
local 127.0.0.0/8 dev lo table local proto kernel scope host src 127.0.0.1 
local 127.0.0.1 dev lo table local proto kernel scope host src 127.0.0.1 
broadcast 127.255.255.255 dev lo table local proto kernel scope link src 127.0.0.1 
local 172.17.0.1 dev docker0 table local proto kernel scope host src 172.17.0.1 
broadcast 172.17.255.255 dev docker0 table local proto kernel scope link src 172.17.0.1 linkdown 
local 172.23.127.1 dev eth0 table local proto kernel scope host src 172.23.127.1 
local 196.32.221.78 dev eth0 table local proto kernel scope host src 196.32.221.78 
broadcast 196.32.221.79 dev eth0 table local proto kernel scope link src 196.32.221.78 
::1 dev lo proto kernel metric 256 pref medium
fe80::/64 dev eth0 proto kernel metric 256 pref medium
local ::1 dev lo table local proto kernel metric 0 pref medium
anycast fe80:: dev eth0 table local proto kernel metric 0 pref medium
local fe80::216:3eff:fe5f:24a7 dev eth0 table local proto kernel metric 0 pref medium
multicast ff00::/8 dev eth0 table local proto kernel metric 256 pref medium

</details>

<details>
<summary>ip address</summary>

1: lo: <LOOPBACK,UP,LOWER_UP> mtu 65536 qdisc noqueue state UNKNOWN group default qlen 1000
    link/loopback 00:00:00:00:00:00 brd 00:00:00:00:00:00
    inet 127.0.0.1/8 scope host lo
       valid_lft forever preferred_lft forever
    inet6 ::1/128 scope host 
       valid_lft forever preferred_lft forever
2: eth0: <BROADCAST,MULTICAST,UP,LOWER_UP> mtu 1500 qdisc fq_codel state UP group default qlen 1000
    link/ether 00:16:3e:5f:24:a7 brd ff:ff:ff:ff:ff:ff
    altname enp0s3
    altname ens3
    inet 196.32.221.78/28 brd 196.32.221.79 scope global noprefixroute eth0
       valid_lft forever preferred_lft forever
    inet 172.23.127.1/32 scope global eth0
       valid_lft forever preferred_lft forever
    inet6 fe80::216:3eff:fe5f:24a7/64 scope link 
       valid_lft forever preferred_lft forever
179: docker0: <NO-CARRIER,BROADCAST,MULTICAST,UP> mtu 1500 qdisc noqueue state DOWN group default 
    link/ether 02:42:8b:c8:69:45 brd ff:ff:ff:ff:ff:ff
    inet 172.17.0.1/16 brd 172.17.255.255 scope global docker0
       valid_lft forever preferred_lft forever

</details>


> What does that mean? Connect how?
They can access a server port 9000 open on my server
```
telnet 172.23.127.2 9000 
curl http://172.23.127.2:9000
``` 

> What exactly are you trying to do? What IPs and protocols are involved? What's the client?

I m trying to connect to a host at 172.25.1.143 behind the partner's VPN gateway over https from my laptop (and also later from my VPN gateway).

My laptop private ip now is: 172.23.127.2
My laptop public IP is: 105.158.173.127
My VPN public IP is: 196.32.221.78
Partner's VPN ip is:  41.87.129.1
Partner's host ip is: 172.25.1.143

As you can see in the logs, both tunnel seems to be up and running.

**Reply by tobiasbrunner** [reply]
> I m trying to connect to a host at 172.25.1.143 behind the partner's VPN gateway

According to the status output there are SAs established to allow traffic from `172.23.127.2/32` to `172.25.1.143/32` (first via `mycompany-vpn` and then via `mycompany-partner-pprod`). But that only works if the client application uses `172.23.127.2` as source address to reach `172.25.1.143` and the forwarding on the VPN server is not impeded (e.g. due to a NAT or some other firewall rule).

**Reply by yelhouti** [reply]
can you please config that traffic is allowd from `172.23.127.2/24` and not /32 ? 
Also now that i have `172.23.127.1` on the server. I am still not able to reach `172.25.1.143`.
When I TCP dump with `tcpdump -ni eth0 host 41.87.129.1`
I can only see multiple

> 04:27:37.989685 IP 41.87.129.1.isakmp > 196.32.221.78.isakmp: isakmp: child_sa  inf2
04:27:37.991554 IP 196.32.221.78.isakmp > 41.87.129.1.isakmp: isakmp: child_sa  inf2[IR]


and when i dump with:  `tcpdump -ni eth0 host 172.25.1.143` and ping from my VPN gateway `ping 172.25.1.143`
 source IP seems to be wrong:
 > listening on eth0, link-type EN10MB (Ethernet), snapshot length 262144 bytes
04:28:57.288244 IP 196.32.221.78 > 172.25.1.143: ICMP echo request, id 50, seq 1, length 64
04:28:58.335825 IP 196.32.221.78 > 172.25.1.143: ICMP echo request, id 50, seq 2, length 64
04:28:59.359793 IP 196.32.221.78 > 172.25.1.143: ICMP echo request, id 50, seq 3, length 64

Should I NAT or add a route on the server ?

FWI: this is a fresh install with no custom iptable rules (only allow ipsec protocol and ports)

**Reply by tobiasbrunner** [reply]
> can you please config that traffic is allowd from `172.23.127.2/24` and not /32 ?

For the connection to your partner that's already the case (see the status output). But each roadwarrior will only have a single virtual IP from that pool so `/32` is correct there.

> ping from my VPN gateway `ping 172.25.1.143` source IP seems to be wrong

That shouldn't be (at least once the SA is established) considering the route in table 220 explicitly specifies the correct source IP (you can check with `ip route get 172.25.1.143`):

```
172.25.1.143 via 196.32.221.65 dev eth0 table 220 proto static src 172.23.127.1
```

That is, unless there is a NAT involved that maps that IP to `196.32.221.78`, in which case it won't match the IPsec policy anymore. You generally want to exclude VPN traffic explicitly from NATs (see [the docs](https://docs.strongswan.org/docs/5.9/howtos/forwarding.html), however, blindly applying any rules probably won't help here as I don't see any NAT rules that match VPN traffic in the output you posted).


> FWI: this is a fresh install with no custom iptable rules (only allow ipsec protocol and ports)

What do you mean? I don't see any rules that allow these protocol/ports (not a problem since all chains are set to ACCEPT anyway). So where did you configure that?

**Reply by yelhouti** [reply]
@tobiasbrunner  thank you for taking the time I really appreciate it.

> But each roadwarrior will only have a single virtual IP from that pool so /32 is correct there.

Of course just wanted to make sure that I was understanding you correctly and that my config was correct. I didn't mean it like that, I really appreciate your help.

> ip route get 172.25.1.143

Indeed I already checked and it returns which seems correct.
> 172.25.1.143 via 196.32.221.65 dev eth0 table 220 src 172.23.127.1 uid 0

> What do you mean? I don't see any rules that allow these protocol/ports (not a problem since all chains are set to ACCEPT anyway). So where did you configure that?

I am using firewalld
> sudo firewall-cmd --list-all
public (active)
  target: default
  icmp-block-inversion: no
  interfaces: eth0
  sources: 
  services: cockpit dhcpv6-client ipsec ssh
  ports: 500/udp 4500/udp
  protocols: 
  forward: yes
  masquerade: yes
  forward-ports: 
  source-ports: 
  icmp-blocks: 
  rich rules: 

>  blindly applying any rules probably won't help here as I don't see any NAT rules that match VPN traffic in the output you posted)

Indeed I tried this from the docs before and again, it didn't help.
> iptables -t nat -I POSTROUTING -m policy --pol ipsec --dir out -j ACCEPT

Also I was suspecting that iptable rules where not applied correctly using updown script because of this. Can you please confirm that they seem to be working correctly ?

One last thing, could you please provide any other avenues I can dig into, I've been stuck for few days now, I'm getting desperate.

**Reply by tobiasbrunner** [reply]
> I am using firewalld

There you go:

> masquerade: yes

It apparently doesn't use iptables but nftables to configure Netfilter. So you won't see the firewall rules in `iptables-save`. Either don't use firewalld, make it use iptables (`FirewallBackend=iptables`), or try to get your modifications (to exclude VPN traffic from the NAT) in there somehow.

> Also I was suspecting that iptable rules where not applied correctly using updown script because of this. Can you please confirm that they seem to be working correctly ?

They are installed (you see them in the output you posted). However, they are only necessary if the FORWARD chain is set to block traffic and the interaction with the nftables rules is also unclear (but firewalld has `forward: yes` set, so forwarding probably isn't an issue).

**Comment by yelhouti** [comment]
@tobiasbrunner thanks a lot for the help, I can see ESP packets now, so traffic is routed through the tunnel it seems.
telnet is still timeout but I suspect the partner is at fault. I'll close once I am sure my issue is resolved. 

Hopefully two last questions, is there a reason why iptables are used instead of nftables (probably they didn't exist at the time of starting implementation) ? and are you planning to move to eftables ?
