### DISCUSSION TITLE
Incomming icmp package gets dropped (invalid conntrack state) by iptables when sent through bridged host-host tunnel

### DISCUSSION THREAD

**Discussion by bitshifter1** [strongswan/strongswan#1450] [Q&A]
Hi everybody,

I hope you can help me with the following problem. It only occurs when using a bridged interface on one side of the tunnel (or both). The connection is established, but my incoming icmp package gets dropped by the conntrack firewall rule because it has an invalid state. When removing the bridge, or the bridged netfilter, everything pings fine. I tested it with multiple strongswan versions and kernels v5.x/v6.x, including latest ubuntu 22.04 hosts. Thanks so much in advance.

Here are my configs.

Left:
```
connections {
     my-vpn {
         remote_addrs = 192.168.1.53
         local_addrs = 192.168.1.37
         version = 2
         reauth_time = 1440m
         proposals = aes256-sha256-modp2048
         local {
             auth = psk
             id = loc
         }
         remote {
             # id field here is inferred from the remote address
             auth = psk
             id = sec
         }
         children {
             my-vpn-1 {
                 local_ts = 10.8.1.0/24
                 remote_ts = 10.8.1.0/24
                 mode = tunnel
                 rekey_time = 60m
                 start_action = trap
                 dpd_action = restart
             }
         }
     }

}
secrets {
    ike-my-vpn-1 {
        id-1 = loc
        id-2 = sec
        secret = "My key comes here"
    }
}
```
charon log
```
root@host1:~ cat /var/log/charon_debug.log.1 
Thu, 2022-12-08, 08:08:12 00[DMN] Starting IKE charon daemon (strongSwan 5.9.8, Linux 6.0.5-rt13-00971-g24d360cbd2c8, armv7l)
Thu, 2022-12-08, 08:08:12 00[LIB] plugin 'aes': loaded successfully
Thu, 2022-12-08, 08:08:12 00[LIB] plugin 'counters': failed to load - counters_plugin_create not found and no plugin file available
Thu, 2022-12-08, 08:08:12 00[LIB] plugin 'stroke': loaded successfully
Thu, 2022-12-08, 08:08:12 00[LIB] plugin 'sha2': loaded successfully
Thu, 2022-12-08, 08:08:12 00[LIB] plugin 'sha1': loaded successfully
Thu, 2022-12-08, 08:08:12 00[LIB] plugin 'mgf1': failed to load - mgf1_plugin_create not found and no plugin file available
Thu, 2022-12-08, 08:08:12 00[LIB] plugin 'random': loaded successfully
Thu, 2022-12-08, 08:08:12 00[LIB] plugin 'nonce': loaded successfully
Thu, 2022-12-08, 08:08:12 00[LIB] plugin 'x509': loaded successfully
Thu, 2022-12-08, 08:08:12 00[LIB] plugin 'revocation': loaded successfully
Thu, 2022-12-08, 08:08:12 00[LIB] plugin 'constraints': loaded successfully
Thu, 2022-12-08, 08:08:12 00[LIB] plugin 'acert': failed to load - acert_plugin_create not found and no plugin file available
Thu, 2022-12-08, 08:08:12 00[LIB] plugin 'pubkey': loaded successfully
Thu, 2022-12-08, 08:08:12 00[LIB] plugin 'pkcs1': loaded successfully
Thu, 2022-12-08, 08:08:12 00[LIB] plugin 'pkcs7': loaded successfully
Thu, 2022-12-08, 08:08:12 00[LIB] plugin 'pgp': loaded successfully
Thu, 2022-12-08, 08:08:12 00[LIB] plugin 'dnskey': loaded successfully
Thu, 2022-12-08, 08:08:12 00[LIB] plugin 'pem': loaded successfully
Thu, 2022-12-08, 08:08:12 00[LIB] plugin 'openssl': loaded successfully
Thu, 2022-12-08, 08:08:12 00[LIB] plugin 'pkcs8': loaded successfully
Thu, 2022-12-08, 08:08:12 00[LIB] plugin 'af-alg': loaded successfully
Thu, 2022-12-08, 08:08:13 00[LIB] plugin 'fips-prf': loaded successfully
Thu, 2022-12-08, 08:08:13 00[LIB] plugin 'gmp': loaded successfully
Thu, 2022-12-08, 08:08:13 00[LIB] plugin 'xcbc': loaded successfully
Thu, 2022-12-08, 08:08:13 00[LIB] plugin 'cmac': loaded successfully
Thu, 2022-12-08, 08:08:13 00[LIB] plugin 'hmac': loaded successfully
Thu, 2022-12-08, 08:08:13 00[LIB] plugin 'kdf': loaded successfully
Thu, 2022-12-08, 08:08:13 00[LIB] plugin 'gcm': loaded successfully
Thu, 2022-12-08, 08:08:13 00[LIB] plugin 'curl': loaded successfully
Thu, 2022-12-08, 08:08:13 00[LIB] plugin 'attr': loaded successfully
Thu, 2022-12-08, 08:08:13 00[LIB] plugin 'kernel-netlink': loaded successfully
Thu, 2022-12-08, 08:08:13 00[LIB] plugin 'resolve': loaded successfully
Thu, 2022-12-08, 08:08:13 00[LIB] plugin 'socket-default': loaded successfully
Thu, 2022-12-08, 08:08:13 00[LIB] plugin 'vici': loaded successfully
Thu, 2022-12-08, 08:08:13 00[LIB] plugin 'updown': loaded successfully
Thu, 2022-12-08, 08:08:13 00[LIB] plugin 'xauth-generic': loaded successfully
Thu, 2022-12-08, 08:08:13 00[KNL] known interfaces and IP addresses:
Thu, 2022-12-08, 08:08:13 00[KNL]   lo
Thu, 2022-12-08, 08:08:13 00[KNL]     127.0.0.1
Thu, 2022-12-08, 08:08:13 00[KNL]   eth0
Thu, 2022-12-08, 08:08:13 00[KNL]   br0
Thu, 2022-12-08, 08:08:13 00[KNL]     192.168.1.37
Thu, 2022-12-08, 08:08:13 00[KNL]   dummy0
Thu, 2022-12-08, 08:08:13 00[KNL]     10.8.1.1
Thu, 2022-12-08, 08:08:13 00[LIB] feature PRIVKEY:DSA in plugin 'pem' has unmet dependency: PRIVKEY:DSA
Thu, 2022-12-08, 08:08:13 00[LIB] feature PRIVKEY:BLISS in plugin 'pem' has unmet dependency: PRIVKEY:BLISS
Thu, 2022-12-08, 08:08:13 00[LIB] feature PUBKEY:BLISS in plugin 'pem' has unmet dependency: PUBKEY:BLISS
Thu, 2022-12-08, 08:08:13 00[LIB] feature PUBKEY:DSA in plugin 'pem' has unmet dependency: PUBKEY:DSA
Thu, 2022-12-08, 08:08:13 00[CFG] loading ca certificates from '/etc/ipsec.d/cacerts'
Thu, 2022-12-08, 08:08:13 00[CFG] loading aa certificates from '/etc/ipsec.d/aacerts'
Thu, 2022-12-08, 08:08:13 00[CFG] loading ocsp signer certificates from '/etc/ipsec.d/ocspcerts'
Thu, 2022-12-08, 08:08:13 00[CFG] loading attribute certificates from '/etc/ipsec.d/acerts'
Thu, 2022-12-08, 08:08:13 00[CFG] loading crls from '/etc/ipsec.d/crls'
Thu, 2022-12-08, 08:08:13 00[CFG] loading secrets from '/etc/ipsec.secrets'
Thu, 2022-12-08, 08:08:13 00[CFG] opening secrets file '/etc/ipsec.secrets' failed: No such file or directory
Thu, 2022-12-08, 08:08:13 00[LIB] feature CERT_DECODE:OCSP_REQUEST in plugin 'pem' has unmet dependency: CERT_DECODE:OCSP_REQUEST
Thu, 2022-12-08, 08:08:13 00[LIB] loaded plugins: charon aes stroke sha2 sha1 random nonce x509 revocation constraints pubkey pkcs1 pkcs7 pgp dnskey pem openssl pkcs8 af-alg fips-prf gmp xcbc cmac hmac kdf gcm curl attr kernel-netlink resolve socket-default vici updown xauth-generic
Thu, 2022-12-08, 08:08:13 00[LIB] unable to load 5 plugin features (5 due to unmet dependencies)
Thu, 2022-12-08, 08:08:13 00[JOB] spawning 16 worker threads
Thu, 2022-12-08, 08:08:13 01[LIB] created thread 01 [2014]
Thu, 2022-12-08, 08:08:13 02[LIB] created thread 02 [2013]
Thu, 2022-12-08, 08:08:13 03[LIB] created thread 03 [2015]
Thu, 2022-12-08, 08:08:13 04[LIB] created thread 04 [2012]
Thu, 2022-12-08, 08:08:13 05[LIB] created thread 05 [2016]
Thu, 2022-12-08, 08:08:13 06[LIB] created thread 06 [2011]
Thu, 2022-12-08, 08:08:13 07[LIB] created thread 07 [2017]
Thu, 2022-12-08, 08:08:13 08[LIB] created thread 08 [2018]
Thu, 2022-12-08, 08:08:13 10[LIB] created thread 10 [2010]
Thu, 2022-12-08, 08:08:13 09[LIB] created thread 09 [2019]
Thu, 2022-12-08, 08:08:13 11[LIB] created thread 11 [2020]
Thu, 2022-12-08, 08:08:13 12[LIB] created thread 12 [2021]
Thu, 2022-12-08, 08:08:13 13[LIB] created thread 13 [2022]
Thu, 2022-12-08, 08:08:13 14[LIB] created thread 14 [2023]
Thu, 2022-12-08, 08:08:13 15[LIB] created thread 15 [2024]
Thu, 2022-12-08, 08:08:13 16[LIB] created thread 16 [2009]
Thu, 2022-12-08, 08:08:16 05[CFG] vici client 1 connected
Thu, 2022-12-08, 08:08:16 09[CFG] vici client 1 requests: get-keys
Thu, 2022-12-08, 08:08:16 06[CFG] vici client 1 requests: get-shared
Thu, 2022-12-08, 08:08:16 13[CFG] vici client 1 requests: load-shared
Thu, 2022-12-08, 08:08:16 13[CFG] loaded IKE shared key with id 'ike-my-vpn-1' for: 'loc', 'sec'
Thu, 2022-12-08, 08:08:16 10[CFG] vici client 1 requests: get-authorities
Thu, 2022-12-08, 08:08:16 15[CFG] vici client 1 requests: get-pools
Thu, 2022-12-08, 08:08:16 11[CFG] vici client 1 requests: get-conns
Thu, 2022-12-08, 08:08:16 07[CFG] vici client 1 requests: load-conn
Thu, 2022-12-08, 08:08:16 07[CFG]  conn my-vpn:
Thu, 2022-12-08, 08:08:16 07[CFG]   child my-vpn-1:
Thu, 2022-12-08, 08:08:16 07[CFG]    rekey_time = 3600
Thu, 2022-12-08, 08:08:16 07[CFG]    life_time = 3960
Thu, 2022-12-08, 08:08:16 07[CFG]    rand_time = 360
Thu, 2022-12-08, 08:08:16 07[CFG]    rekey_bytes = 0
Thu, 2022-12-08, 08:08:16 07[CFG]    life_bytes = 0
Thu, 2022-12-08, 08:08:16 07[CFG]    rand_bytes = 0
Thu, 2022-12-08, 08:08:16 07[CFG]    rekey_packets = 0
Thu, 2022-12-08, 08:08:16 07[CFG]    life_packets = 0
Thu, 2022-12-08, 08:08:16 07[CFG]    rand_packets = 0
Thu, 2022-12-08, 08:08:16 07[CFG]    updown = (null)
Thu, 2022-12-08, 08:08:16 07[CFG]    hostaccess = 0
Thu, 2022-12-08, 08:08:16 07[CFG]    ipcomp = 0
Thu, 2022-12-08, 08:08:16 07[CFG]    mode = TUNNEL
Thu, 2022-12-08, 08:08:16 07[CFG]    policies = 1
Thu, 2022-12-08, 08:08:16 07[CFG]    policies_fwd_out = 0
Thu, 2022-12-08, 08:08:16 07[CFG]    dpd_action = start
Thu, 2022-12-08, 08:08:16 07[CFG]    start_action = trap
Thu, 2022-12-08, 08:08:16 07[CFG]    close_action = none
Thu, 2022-12-08, 08:08:16 07[CFG]    reqid = 0
Thu, 2022-12-08, 08:08:16 07[CFG]    tfc = 0
Thu, 2022-12-08, 08:08:16 07[CFG]    priority = 0
Thu, 2022-12-08, 08:08:16 07[CFG]    interface = (null)
Thu, 2022-12-08, 08:08:16 07[CFG]    if_id_in = 0
Thu, 2022-12-08, 08:08:16 07[CFG]    if_id_out = 0
Thu, 2022-12-08, 08:08:16 07[CFG]    mark_in = 0/0
Thu, 2022-12-08, 08:08:16 07[CFG]    mark_in_sa = 0
Thu, 2022-12-08, 08:08:16 07[CFG]    mark_out = 0/0
Thu, 2022-12-08, 08:08:16 07[CFG]    set_mark_in = 0/0
Thu, 2022-12-08, 08:08:16 07[CFG]    set_mark_out = 0/0
Thu, 2022-12-08, 08:08:16 07[CFG]    label = (null)
Thu, 2022-12-08, 08:08:16 07[CFG]    label_mode = system
Thu, 2022-12-08, 08:08:16 07[CFG]    inactivity = 0
Thu, 2022-12-08, 08:08:16 07[CFG]    proposals = ESP:AES_GCM_16_128/AES_GCM_16_192/AES_GCM_16_256/NO_EXT_SEQ, ESP:AES_CBC_128/AES_CBC_192/AES_CBC_256/HMAC_SHA2_256_128/HMAC_SHA2_384_192/HMAC_SHA2_512_256/HMAC_SHA1_96/AES_XCBC_96/NO_EXT_SEQ
Thu, 2022-12-08, 08:08:16 07[CFG]    local_ts = 10.8.1.0/24
Thu, 2022-12-08, 08:08:16 07[CFG]    remote_ts = 10.8.1.0/24
Thu, 2022-12-08, 08:08:16 07[CFG]    hw_offload = no
Thu, 2022-12-08, 08:08:16 07[CFG]    sha256_96 = 0
Thu, 2022-12-08, 08:08:16 07[CFG]    copy_df = 1
Thu, 2022-12-08, 08:08:16 07[CFG]    copy_ecn = 1
Thu, 2022-12-08, 08:08:16 07[CFG]    copy_dscp = out
Thu, 2022-12-08, 08:08:16 07[CFG]   version = 2
Thu, 2022-12-08, 08:08:16 07[CFG]   local_addrs = 192.168.1.37
Thu, 2022-12-08, 08:08:16 07[CFG]   remote_addrs = 192.168.1.53
Thu, 2022-12-08, 08:08:16 07[CFG]   local_port = 500
Thu, 2022-12-08, 08:08:16 07[CFG]   remote_port = 500
Thu, 2022-12-08, 08:08:16 07[CFG]   send_certreq = 1
Thu, 2022-12-08, 08:08:16 07[CFG]   send_cert = CERT_SEND_IF_ASKED
Thu, 2022-12-08, 08:08:16 07[CFG]   ppk_id = (null)
Thu, 2022-12-08, 08:08:16 07[CFG]   ppk_required = 0
Thu, 2022-12-08, 08:08:16 07[CFG]   mobike = 1
Thu, 2022-12-08, 08:08:16 07[CFG]   aggressive = 0
Thu, 2022-12-08, 08:08:16 07[CFG]   dscp = 0x00
Thu, 2022-12-08, 08:08:16 07[CFG]   encap = 0
Thu, 2022-12-08, 08:08:16 07[CFG]   dpd_delay = 0
Thu, 2022-12-08, 08:08:16 07[CFG]   dpd_timeout = 0
Thu, 2022-12-08, 08:08:16 07[CFG]   fragmentation = 2
Thu, 2022-12-08, 08:08:16 07[CFG]   childless = 0
Thu, 2022-12-08, 08:08:16 07[CFG]   unique = UNIQUE_NO
Thu, 2022-12-08, 08:08:16 07[CFG]   keyingtries = 1
Thu, 2022-12-08, 08:08:16 07[CFG]   reauth_time = 86400
Thu, 2022-12-08, 08:08:16 07[CFG]   rekey_time = 0
Thu, 2022-12-08, 08:08:16 07[CFG]   over_time = 8640
Thu, 2022-12-08, 08:08:16 07[CFG]   rand_time = 8640
Thu, 2022-12-08, 08:08:16 07[CFG]   proposals = IKE:AES_CBC_256/HMAC_SHA2_256_128/PRF_HMAC_SHA2_256/MODP_2048
Thu, 2022-12-08, 08:08:16 07[CFG]   if_id_in = 0
Thu, 2022-12-08, 08:08:16 07[CFG]   if_id_out = 0
Thu, 2022-12-08, 08:08:16 07[CFG]   local:
Thu, 2022-12-08, 08:08:16 07[CFG]    id = loc
Thu, 2022-12-08, 08:08:16 07[CFG]    class = pre-shared key
Thu, 2022-12-08, 08:08:16 07[CFG]   remote:
Thu, 2022-12-08, 08:08:16 07[CFG]    id = sec
Thu, 2022-12-08, 08:08:16 07[CFG]    class = pre-shared key
Thu, 2022-12-08, 08:08:16 07[CFG] added vici connection: my-vpn
Thu, 2022-12-08, 08:08:16 07[CFG] installing 'my-vpn-1'
Thu, 2022-12-08, 08:08:16 07[CFG] configured proposals: ESP:AES_GCM_16_128/AES_GCM_16_192/AES_GCM_16_256/NO_EXT_SEQ, ESP:AES_CBC_128/AES_CBC_192/AES_CBC_256/HMAC_SHA2_256_128/HMAC_SHA2_384_192/HMAC_SHA2_512_256/HMAC_SHA1_96/AES_XCBC_96/NO_EXT_SEQ
Thu, 2022-12-08, 08:08:16 07[KNL] adding policy 10.8.1.0/24 === 10.8.1.0/24 in [priority 375424, refcount 1]
Thu, 2022-12-08, 08:08:16 07[KNL] adding policy 10.8.1.0/24 === 10.8.1.0/24 fwd [priority 375424, refcount 1]
Thu, 2022-12-08, 08:08:16 07[KNL] adding policy 10.8.1.0/24 === 10.8.1.0/24 out [priority 375424, refcount 1]
Thu, 2022-12-08, 08:08:16 07[KNL] getting a local address in traffic selector 10.8.1.0/24
Thu, 2022-12-08, 08:08:16 07[KNL] using host 10.8.1.1
Thu, 2022-12-08, 08:08:16 07[KNL] getting iface name for index 6
Thu, 2022-12-08, 08:08:16 07[KNL] using 192.168.1.53 as nexthop and br0 as dev to reach 192.168.1.53/32
Thu, 2022-12-08, 08:08:16 07[KNL] installing route: 10.8.1.0/24 via 192.168.1.53 src 10.8.1.1 dev br0
Thu, 2022-12-08, 08:08:16 07[KNL] getting iface index for br0
Thu, 2022-12-08, 08:08:16 07[CHD] CHILD_SA my-vpn-1{1} state change: CREATED => ROUTED
Thu, 2022-12-08, 08:08:16 11[CFG] vici client 1 disconnected
Thu, 2022-12-08, 08:08:21 14[CFG] vici client 2 connected
Thu, 2022-12-08, 08:08:21 15[CFG] vici client 2 registered for: control-log
Thu, 2022-12-08, 08:08:21 13[CFG] vici client 2 requests: initiate
Thu, 2022-12-08, 08:08:21 13[CFG] vici initiate CHILD_SA 'my-vpn-1'
Thu, 2022-12-08, 08:08:21 05[MGR] checkout IKE_SA by config
Thu, 2022-12-08, 08:08:21 05[MGR] created IKE_SA (unnamed)[1]
Thu, 2022-12-08, 08:08:21 05[IKE] <my-vpn|1> queueing IKE_VENDOR task
Thu, 2022-12-08, 08:08:21 05[IKE] <my-vpn|1> queueing IKE_INIT task
Thu, 2022-12-08, 08:08:21 05[IKE] <my-vpn|1> queueing IKE_NATD task
Thu, 2022-12-08, 08:08:21 05[IKE] <my-vpn|1> queueing IKE_CERT_PRE task
Thu, 2022-12-08, 08:08:21 05[IKE] <my-vpn|1> queueing IKE_AUTH task
Thu, 2022-12-08, 08:08:21 05[IKE] <my-vpn|1> queueing IKE_CERT_POST task
Thu, 2022-12-08, 08:08:21 05[IKE] <my-vpn|1> queueing IKE_CONFIG task
Thu, 2022-12-08, 08:08:21 05[IKE] <my-vpn|1> queueing IKE_AUTH_LIFETIME task
Thu, 2022-12-08, 08:08:21 05[IKE] <my-vpn|1> queueing IKE_MOBIKE task
Thu, 2022-12-08, 08:08:21 05[IKE] <my-vpn|1> queueing IKE_ESTABLISH task
Thu, 2022-12-08, 08:08:21 05[IKE] <my-vpn|1> queueing CHILD_CREATE task
Thu, 2022-12-08, 08:08:21 05[IKE] <my-vpn|1> activating new tasks
Thu, 2022-12-08, 08:08:21 05[IKE] <my-vpn|1>   activating IKE_VENDOR task
Thu, 2022-12-08, 08:08:21 05[IKE] <my-vpn|1>   activating IKE_INIT task
Thu, 2022-12-08, 08:08:21 05[IKE] <my-vpn|1>   activating IKE_NATD task
Thu, 2022-12-08, 08:08:21 05[IKE] <my-vpn|1>   activating IKE_CERT_PRE task
Thu, 2022-12-08, 08:08:21 05[IKE] <my-vpn|1>   activating IKE_AUTH task
Thu, 2022-12-08, 08:08:21 05[IKE] <my-vpn|1>   activating IKE_CERT_POST task
Thu, 2022-12-08, 08:08:21 05[IKE] <my-vpn|1>   activating IKE_CONFIG task
Thu, 2022-12-08, 08:08:21 05[IKE] <my-vpn|1>   activating IKE_AUTH_LIFETIME task
Thu, 2022-12-08, 08:08:21 05[IKE] <my-vpn|1>   activating IKE_MOBIKE task
Thu, 2022-12-08, 08:08:21 05[IKE] <my-vpn|1>   activating IKE_ESTABLISH task
Thu, 2022-12-08, 08:08:21 05[IKE] <my-vpn|1>   activating CHILD_CREATE task
Thu, 2022-12-08, 08:08:21 05[IKE] <my-vpn|1> initiating IKE_SA my-vpn[1] to 192.168.1.53
Thu, 2022-12-08, 08:08:21 05[IKE] <my-vpn|1> IKE_SA my-vpn[1] state change: CREATED => CONNECTING
Thu, 2022-12-08, 08:08:22 05[CFG] <my-vpn|1> configured proposals: IKE:AES_CBC_256/HMAC_SHA2_256_128/PRF_HMAC_SHA2_256/MODP_2048
Thu, 2022-12-08, 08:08:22 05[CFG] <my-vpn|1> sending supported signature hash algorithms: sha256 sha384 sha512 identity
Thu, 2022-12-08, 08:08:22 05[ENC] <my-vpn|1> generating IKE_SA_INIT request 0 [ SA KE No N(NATD_S_IP) N(NATD_D_IP) N(FRAG_SUP) N(HASH_ALG) N(REDIR_SUP) ]
Thu, 2022-12-08, 08:08:22 05[NET] <my-vpn|1> sending packet: from 192.168.1.37[500] to 192.168.1.53[500] (464 bytes)
Thu, 2022-12-08, 08:08:22 05[MGR] <my-vpn|1> checkin IKEv2 SA my-vpn[1] with SPIs ad8c6e6b7cfea837_i 0000000000000000_r
Thu, 2022-12-08, 08:08:22 05[MGR] <my-vpn|1> checkin of IKE_SA successful
Thu, 2022-12-08, 08:08:22 12[MGR] checkout IKEv2 SA by message with SPIs ad8c6e6b7cfea837_i 3f32beb410396b41_r
Thu, 2022-12-08, 08:08:22 12[MGR] IKE_SA my-vpn[1] successfully checked out
Thu, 2022-12-08, 08:08:22 12[NET] <my-vpn|1> received packet: from 192.168.1.53[500] to 192.168.1.37[500] (472 bytes)
Thu, 2022-12-08, 08:08:22 12[ENC] <my-vpn|1> parsed IKE_SA_INIT response 0 [ SA KE No N(NATD_S_IP) N(NATD_D_IP) N(FRAG_SUP) N(HASH_ALG) N(CHDLESS_SUP) N(MULT_AUTH) ]
Thu, 2022-12-08, 08:08:22 12[IKE] <my-vpn|1> received FRAGMENTATION_SUPPORTED notify
Thu, 2022-12-08, 08:08:22 12[IKE] <my-vpn|1> received SIGNATURE_HASH_ALGORITHMS notify
Thu, 2022-12-08, 08:08:22 12[IKE] <my-vpn|1> received CHILDLESS_IKEV2_SUPPORTED notify
Thu, 2022-12-08, 08:08:22 12[CFG] <my-vpn|1> selecting proposal:
Thu, 2022-12-08, 08:08:22 12[CFG] <my-vpn|1>   proposal matches
Thu, 2022-12-08, 08:08:22 12[CFG] <my-vpn|1> received proposals: IKE:AES_CBC_256/HMAC_SHA2_256_128/PRF_HMAC_SHA2_256/MODP_2048
Thu, 2022-12-08, 08:08:22 12[CFG] <my-vpn|1> configured proposals: IKE:AES_CBC_256/HMAC_SHA2_256_128/PRF_HMAC_SHA2_256/MODP_2048
Thu, 2022-12-08, 08:08:22 12[CFG] <my-vpn|1> selected proposal: IKE:AES_CBC_256/HMAC_SHA2_256_128/PRF_HMAC_SHA2_256/MODP_2048
Thu, 2022-12-08, 08:08:22 12[CFG] <my-vpn|1> received supported signature hash algorithms: sha256 sha384 sha512 identity
Thu, 2022-12-08, 08:08:22 12[IKE] <my-vpn|1> reinitiating already active tasks
Thu, 2022-12-08, 08:08:22 12[IKE] <my-vpn|1>   IKE_CERT_PRE task
Thu, 2022-12-08, 08:08:22 12[IKE] <my-vpn|1>   IKE_AUTH task
Thu, 2022-12-08, 08:08:22 12[IKE] <my-vpn|1> authentication of 'loc' (myself) with pre-shared key
Thu, 2022-12-08, 08:08:22 12[IKE] <my-vpn|1> successfully created shared key MAC
Thu, 2022-12-08, 08:08:22 12[CFG] <my-vpn|1> proposing traffic selectors for us:
Thu, 2022-12-08, 08:08:22 12[CFG] <my-vpn|1>  10.8.1.0/24
Thu, 2022-12-08, 08:08:22 12[CFG] <my-vpn|1> proposing traffic selectors for other:
Thu, 2022-12-08, 08:08:22 12[CFG] <my-vpn|1>  10.8.1.0/24
Thu, 2022-12-08, 08:08:22 12[CFG] <my-vpn|1> configured proposals: ESP:AES_GCM_16_128/AES_GCM_16_192/AES_GCM_16_256/NO_EXT_SEQ, ESP:AES_CBC_128/AES_CBC_192/AES_CBC_256/HMAC_SHA2_256_128/HMAC_SHA2_384_192/HMAC_SHA2_512_256/HMAC_SHA1_96/AES_XCBC_96/NO_EXT_SEQ
Thu, 2022-12-08, 08:08:22 12[IKE] <my-vpn|1> establishing CHILD_SA my-vpn-1{2}
Thu, 2022-12-08, 08:08:22 12[KNL] <my-vpn|1> got SPI c4a07f6e
Thu, 2022-12-08, 08:08:22 12[ENC] <my-vpn|1> generating IKE_AUTH request 1 [ IDi N(INIT_CONTACT) IDr AUTH SA TSi TSr N(MOBIKE_SUP) N(ADD_4_ADDR) N(MULT_AUTH) N(EAP_ONLY) N(MSG_ID_SYN_SUP) ]
Thu, 2022-12-08, 08:08:22 12[NET] <my-vpn|1> sending packet: from 192.168.1.37[4500] to 192.168.1.53[4500] (384 bytes)
Thu, 2022-12-08, 08:08:22 12[MGR] <my-vpn|1> checkin IKEv2 SA my-vpn[1] with SPIs ad8c6e6b7cfea837_i 3f32beb410396b41_r
Thu, 2022-12-08, 08:08:22 12[MGR] <my-vpn|1> checkin of IKE_SA successful
Thu, 2022-12-08, 08:08:22 08[MGR] checkout IKEv2 SA by message with SPIs ad8c6e6b7cfea837_i 3f32beb410396b41_r
Thu, 2022-12-08, 08:08:22 08[MGR] IKE_SA my-vpn[1] successfully checked out
Thu, 2022-12-08, 08:08:22 08[NET] <my-vpn|1> received packet: from 192.168.1.53[4500] to 192.168.1.37[4500] (224 bytes)
Thu, 2022-12-08, 08:08:22 08[ENC] <my-vpn|1> parsed IKE_AUTH response 1 [ IDr AUTH SA TSi TSr N(MOBIKE_SUP) N(ADD_4_ADDR) ]
Thu, 2022-12-08, 08:08:22 08[IKE] <my-vpn|1> authentication of 'sec' with pre-shared key successful
Thu, 2022-12-08, 08:08:22 08[IKE] <my-vpn|1> peer supports MOBIKE
Thu, 2022-12-08, 08:08:22 08[IKE] <my-vpn|1> got additional MOBIKE peer address: 10.8.1.2
Thu, 2022-12-08, 08:08:22 08[IKE] <my-vpn|1> IKE_SA my-vpn[1] established between 192.168.1.37[loc]...192.168.1.53[sec]
Thu, 2022-12-08, 08:08:22 08[IKE] <my-vpn|1> IKE_SA my-vpn[1] state change: CONNECTING => ESTABLISHED
Thu, 2022-12-08, 08:08:22 08[IKE] <my-vpn|1> scheduling reauthentication in 85815s
Thu, 2022-12-08, 08:08:22 08[IKE] <my-vpn|1> maximum IKE_SA lifetime 94455s
Thu, 2022-12-08, 08:08:22 08[CFG] <my-vpn|1> selecting proposal:
Thu, 2022-12-08, 08:08:22 08[CFG] <my-vpn|1>   proposal matches
Thu, 2022-12-08, 08:08:22 08[CFG] <my-vpn|1> received proposals: ESP:AES_GCM_16_128/NO_EXT_SEQ
Thu, 2022-12-08, 08:08:22 08[CFG] <my-vpn|1> configured proposals: ESP:AES_GCM_16_128/AES_GCM_16_192/AES_GCM_16_256/NO_EXT_SEQ, ESP:AES_CBC_128/AES_CBC_192/AES_CBC_256/HMAC_SHA2_256_128/HMAC_SHA2_384_192/HMAC_SHA2_512_256/HMAC_SHA1_96/AES_XCBC_96/NO_EXT_SEQ
Thu, 2022-12-08, 08:08:22 08[CFG] <my-vpn|1> selected proposal: ESP:AES_GCM_16_128/NO_EXT_SEQ
Thu, 2022-12-08, 08:08:22 08[CFG] <my-vpn|1> selecting traffic selectors for us:
Thu, 2022-12-08, 08:08:22 08[CFG] <my-vpn|1>  config: 10.8.1.0/24, received: 10.8.1.0/24 => match: 10.8.1.0/24
Thu, 2022-12-08, 08:08:22 08[CFG] <my-vpn|1> selecting traffic selectors for other:
Thu, 2022-12-08, 08:08:22 08[CFG] <my-vpn|1>  config: 10.8.1.0/24, received: 10.8.1.0/24 => match: 10.8.1.0/24
Thu, 2022-12-08, 08:08:22 08[CHD] <my-vpn|1> CHILD_SA my-vpn-1{2} state change: CREATED => INSTALLING
Thu, 2022-12-08, 08:08:22 08[CHD] <my-vpn|1>   using AES_GCM_16 for encryption
Thu, 2022-12-08, 08:08:22 08[CHD] <my-vpn|1> adding inbound ESP SA
Thu, 2022-12-08, 08:08:22 08[CHD] <my-vpn|1>   SPI 0xc4a07f6e, src 192.168.1.53 dst 192.168.1.37
Thu, 2022-12-08, 08:08:22 08[KNL] <my-vpn|1> adding SAD entry with SPI c4a07f6e and reqid {1}
Thu, 2022-12-08, 08:08:22 08[KNL] <my-vpn|1>   using encryption algorithm AES_GCM_16 with key size 160
Thu, 2022-12-08, 08:08:22 08[KNL] <my-vpn|1>   using replay window of 32 packets
Thu, 2022-12-08, 08:08:22 08[KNL] <my-vpn|1>   HW offload: no
Thu, 2022-12-08, 08:08:22 08[CHD] <my-vpn|1> adding outbound ESP SA
Thu, 2022-12-08, 08:08:22 08[CHD] <my-vpn|1>   SPI 0xc75ad861, src 192.168.1.37 dst 192.168.1.53
Thu, 2022-12-08, 08:08:22 08[KNL] <my-vpn|1> adding SAD entry with SPI c75ad861 and reqid {1}
Thu, 2022-12-08, 08:08:22 08[KNL] <my-vpn|1>   using encryption algorithm AES_GCM_16 with key size 160
Thu, 2022-12-08, 08:08:22 08[KNL] <my-vpn|1>   using replay window of 0 packets
Thu, 2022-12-08, 08:08:22 08[KNL] <my-vpn|1>   HW offload: no
Thu, 2022-12-08, 08:08:22 08[KNL] <my-vpn|1> policy 10.8.1.0/24 === 10.8.1.0/24 in already exists, increasing refcount
Thu, 2022-12-08, 08:08:22 08[KNL] <my-vpn|1> updating policy 10.8.1.0/24 === 10.8.1.0/24 in [priority 375423, refcount 2]
Thu, 2022-12-08, 08:08:22 08[KNL] <my-vpn|1> policy 10.8.1.0/24 === 10.8.1.0/24 fwd already exists, increasing refcount
Thu, 2022-12-08, 08:08:22 08[KNL] <my-vpn|1> updating policy 10.8.1.0/24 === 10.8.1.0/24 fwd [priority 375423, refcount 2]
Thu, 2022-12-08, 08:08:22 08[KNL] <my-vpn|1> policy 10.8.1.0/24 === 10.8.1.0/24 out already exists, increasing refcount
Thu, 2022-12-08, 08:08:22 08[KNL] <my-vpn|1> updating policy 10.8.1.0/24 === 10.8.1.0/24 out [priority 375423, refcount 2]
Thu, 2022-12-08, 08:08:22 08[KNL] <my-vpn|1> getting a local address in traffic selector 10.8.1.0/24
Thu, 2022-12-08, 08:08:22 08[KNL] <my-vpn|1> using host 10.8.1.1
Thu, 2022-12-08, 08:08:22 08[KNL] <my-vpn|1> getting iface name for index 6
Thu, 2022-12-08, 08:08:22 08[KNL] <my-vpn|1> using 192.168.1.53 as nexthop and br0 as dev to reach 192.168.1.53/32
Thu, 2022-12-08, 08:08:22 08[IKE] <my-vpn|1> CHILD_SA my-vpn-1{2} established with SPIs c4a07f6e_i c75ad861_o and TS 10.8.1.0/24 === 10.8.1.0/24
Thu, 2022-12-08, 08:08:22 08[CHD] <my-vpn|1> CHILD_SA my-vpn-1{2} state change: INSTALLING => INSTALLED
Thu, 2022-12-08, 08:08:22 15[CFG] vici client 2 disconnected
Thu, 2022-12-08, 08:08:22 08[IKE] <my-vpn|1> activating new tasks
Thu, 2022-12-08, 08:08:22 08[IKE] <my-vpn|1> nothing to initiate
Thu, 2022-12-08, 08:08:22 08[MGR] <my-vpn|1> checkin IKEv2 SA my-vpn[1] with SPIs ad8c6e6b7cfea837_i 3f32beb410396b41_r
Thu, 2022-12-08, 08:08:22 08[MGR] <my-vpn|1> checkin of IKE_SA successful
Thu, 2022-12-08, 08:08:26 09[MGR] checkout IKEv2 SA with SPIs ad8c6e6b7cfea837_i 0000000000000000_r
Thu, 2022-12-08, 08:08:26 09[MGR] IKE_SA my-vpn[1] successfully checked out
Thu, 2022-12-08, 08:08:26 09[MGR] <my-vpn|1> checkin IKEv2 SA my-vpn[1] with SPIs ad8c6e6b7cfea837_i 3f32beb410396b41_r
Thu, 2022-12-08, 08:08:26 09[MGR] <my-vpn|1> checkin of IKE_SA successful
Thu, 2022-12-08, 08:08:26 11[MGR] checkout IKEv2 SA with SPIs ad8c6e6b7cfea837_i 3f32beb410396b41_r
Thu, 2022-12-08, 08:08:26 11[MGR] IKE_SA my-vpn[1] successfully checked out
Thu, 2022-12-08, 08:08:26 11[MGR] <my-vpn|1> checkin IKEv2 SA my-vpn[1] with SPIs ad8c6e6b7cfea837_i 3f32beb410396b41_r
Thu, 2022-12-08, 08:08:26 11[MGR] <my-vpn|1> checkin of IKE_SA successful
Thu, 2022-12-08, 08:23:15 05[CFG] vici client 3 connected
Thu, 2022-12-08, 08:23:15 06[CFG] vici client 3 registered for: list-conn
Thu, 2022-12-08, 08:23:15 07[CFG] vici client 3 requests: list-conns
Thu, 2022-12-08, 08:23:15 13[CFG] vici client 3 disconnected
Thu, 2022-12-08, 08:23:20 12[CFG] vici client 4 connected
Thu, 2022-12-08, 08:23:20 11[CFG] vici client 4 registered for: list-sa
Thu, 2022-12-08, 08:23:20 12[CFG] vici client 4 requests: list-sas
Thu, 2022-12-08, 08:23:20 11[CFG] vici client 4 disconnected

```
swanctl -L/l
```
root@host1:~ swanctl -L                                                                                                                                                                                                                                            6:~ swanctl                                                                                              
plugin 'mgf1': failed to load - mgf1_plugin_create not found and no plugin file available
plugin 'acert': failed to load - acert_plugin_create not found and no plugin file available
my-vpn: IKEv2, reauthentication every 86400s, no rekeying
  local:  192.168.1.37
  remote: 192.168.1.53
  local pre-shared key authentication:
    id: loc
  remote pre-shared key authentication:
    id: sec
  my-vpn-1: TUNNEL, rekeying every 3600s
    local:  10.8.1.0/24
    remote: 10.8.1.0/24

root@host1:~ swanctl -l
plugin 'mgf1': failed to load - mgf1_plugin_create not found and no plugin file available
plugin 'acert': failed to load - acert_plugin_create not found and no plugin file available
my-vpn: #1, ESTABLISHED, IKEv2, ad8c6e6b7cfea837_i* 3f32beb410396b41_r
  local  'loc' @ 192.168.1.37[4500]
  remote 'sec' @ 192.168.1.53[4500]
  AES_CBC-256/HMAC_SHA2_256_128/PRF_HMAC_SHA2_256/MODP_2048
  established 897s ago, reauth in 84918s
  my-vpn-1: #2, reqid 1, INSTALLED, TUNNEL, ESP:AES_GCM_16-128
    installed 898s ago, rekeying in 2580s, expires in 3063s
    in  c4a07f6e,  65940 bytes,   785 packets,   699s ago
    out c75ad861,  65940 bytes,   785 packets,     0s ago
    local  10.8.1.0/24
    remote 10.8.1.0/24

```
tcpdump
```
08:52:56.855887 IP 192.168.1.37 > 192.168.1.53: ESP(spi=0xc75ad861,seq=0x7b0), length 120
08:52:56.856918 IP 192.168.1.53 > 192.168.1.37: ESP(spi=0xc4a07f6e,seq=0x7b0), length 120
08:52:56.857260 IP 10.8.1.2 > 10.8.1.1: ICMP echo reply, id 2503, seq 25, length 64
```

ip route
```
root@host1:~ ip route show table all
10.8.1.0/24 via 192.168.1.53 dev br0 table 220 proto static src 10.8.1.1 
10.8.1.0/24 dev dummy0 proto kernel scope link src 10.8.1.1 
192.168.1.0/24 dev br0 proto kernel scope link src 192.168.1.37 
224.0.0.0/3 dev br0 scope link 
local 10.8.1.1 dev dummy0 table local proto kernel scope host src 10.8.1.1 
broadcast 10.8.1.255 dev dummy0 table local proto kernel scope link src 10.8.1.1 
local 127.0.0.0/8 dev lo table local proto kernel scope host src 127.0.0.1 
local 127.0.0.1 dev lo table local proto kernel scope host src 127.0.0.1 
broadcast 127.255.255.255 dev lo table local proto kernel scope link src 127.0.0.1 
local 192.168.1.37 dev br0 table local proto kernel scope host src 192.168.1.37 
broadcast 192.168.1.255 dev br0 table local proto kernel scope link src 192.168.1.37

root@host1:~ route
Kernel IP routing table
Destination     Gateway         Genmask         Flags Metric Ref    Use Iface
10.8.1.0        *               255.255.255.0   U     0      0        0 dummy0
192.168.1.0     *               255.255.255.0   U     0      0        0 br0
224.0.0.0       *               224.0.0.0       U     0      0        0 br0

```

iptable Rules
```
iptables -A INPUT -m conntrack --ctstate INVALID -j DROP
```

iptables LOG

```
Dec  8 08:11:55 host1 kernel: [  562.882672] # NEW: IN= OUT=br0 SRC=10.8.1.1 DST=10.8.1.2 LEN=84 TOS=0x00 PREC=0x00 TTL=64 ID=57361 DF PROTO=ICMP TYPE=8 CODE=0 ID=2240 SEQ=8 
Dec  8 08:11:55 host1 kernel: [  562.882910]   ESTABLISHED: IN= OUT=br0 SRC=192.168.1.37 DST=192.168.1.53 LEN=140 TOS=0x00 PREC=0x00 TTL=64 ID=42286 DF PROTO=ESP SPI=0xc75ad861 
Dec  8 08:11:55 host1 kernel: [  562.884065]   ESTABLISHED: IN=br0 OUT= PHYSIN=eth0 MAC=00:30:de:00:02:16:00:30:de:00:02:2b:08:00 SRC=192.168.1.53 DST=192.168.1.37 LEN=140 TOS=0x00 PREC=0x00 TTL=64 ID=55874 PROTO=ESP SPI=0xc4a07f6e 
Dec  8 08:11:55 host1 kernel: [  562.884296]   INVALID: IN=br0 OUT= PHYSIN=eth0 MAC=00:30:de:00:02:16:00:30:de:00:02:2b:08:00 SRC=10.8.1.2 DST=10.8.1.1 LEN=84 TOS=0x00 PREC=0x00 TTL=64 ID=26845 PROTO=ICMP TYPE=0 CODE=0 ID=2240 SEQ=8
```

ip address

```
root@host1:~ ip addr
1: lo: <LOOPBACK,UP,LOWER_UP> mtu 65536 qdisc noqueue state UNKNOWN group default qlen 1000
    link/loopback 00:00:00:00:00:00 brd 00:00:00:00:00:00
    inet 127.0.0.1/8 scope host lo
       valid_lft forever preferred_lft forever
2: sit0@NONE: <NOARP> mtu 1480 qdisc noop state DOWN group default qlen 1000
    link/sit 0.0.0.0 brd 0.0.0.0
3: eth0: <BROADCAST,MULTICAST,UP,LOWER_UP> mtu 1500 qdisc mq master br0 state UP group default qlen 1000
    link/ether 00:30:de:00:02:16 brd ff:ff:ff:ff:ff:ff
5: wwan0: <BROADCAST,MULTICAST> mtu 1500 qdisc noop state DOWN group default qlen 1000
    link/ether da:29:9e:ad:3c:bd brd ff:ff:ff:ff:ff:ff
6: br0: <BROADCAST,MULTICAST,UP,LOWER_UP> mtu 1500 qdisc noqueue state UP group default qlen 1000
    link/ether 00:30:de:00:02:16 brd ff:ff:ff:ff:ff:ff
    inet 192.168.1.37/24 brd 192.168.1.255 scope global br0
       valid_lft forever preferred_lft forever
7: dummy0: <BROADCAST,NOARP,UP,LOWER_UP> mtu 1500 qdisc noqueue state UNKNOWN group default qlen 1000
    link/ether d6:bf:a3:bb:a0:d8 brd ff:ff:ff:ff:ff:ff
    inet 10.8.1.1/24 scope global dummy0
       valid_lft forever preferred_lft forever

```

strongswan.conf

```
# strongswan.conf - strongSwan configuration file
#
# Refer to the strongswan.conf(5) manpage for details
#
# Configuration changes should be made in the included files

charon {
        load_modular = yes
        plugins {
                include strongswan.d/charon/*.conf
        }
}

include strongswan.d/*.conf
```
Network setup
```
#!/bin/bash
ifconfig eth0 0.0.0.0
ip link add name br0 type bridge
ip link set dev br0 up
ip link set dev eth0 master br0
ifconfig br0 192.168.1.37
ip link add name dummy0 type dummy
ip addr add 10.8.1.1/24 dev dummy0
ip link set up dev dummy0

```

**Comment by Thermi** [comment]
can you provide your complete firewall rules please?

**Reply by bitshifter1** [reply]
@Thermi  It's the only rule, at least for reproducing the problem.

**Reply by Thermi** [reply]
Sometimes rules can cause packets to be marked as invalid (--ctstate just checks the state), please provide all rules

**Reply by bitshifter1** [reply]
> Sometimes rules can cause packets to be marked as invalid (--ctstate just checks the state), please provide all rules

Again, there are no other rules on the two systems I use for testing😊 Just the one above on the left system that initiates the ping. I am always doing an _iptables -F_ flush on both sides and then inserting the conntrack rule on the source system.

**Reply by Thermi** [reply]
OK I now understand you do not have any other rules.
Can you check the nftables rules?

**Reply by bitshifter1** [reply]
No nftable and ebtable rules either.

**Reply by Thermi** [reply]
For testing, can you restrict the local and remote ts to the corresponding addresses used for communication? (Just the /32s)

**Reply by bitshifter1** [reply]
Thanks @Thermi, changed it on both sides accordingly, but doesn't make a difference.

```
root@host1:~ cat /var/log/charon_debug.log                                                                                                                                                                                        
Sat, 2022-12-10, 13:49:57 00[DMN] Starting IKE charon daemon (strongSwan 5.9.8, Linux 6.0.5-rt13-00971-g24d360cbd2c8, armv7l)
Sat, 2022-12-10, 13:49:57 00[LIB] plugin 'aes': loaded successfully
Sat, 2022-12-10, 13:49:57 00[LIB] plugin 'counters': failed to load - counters_plugin_create not found and no plugin file available
Sat, 2022-12-10, 13:49:57 00[LIB] plugin 'stroke': loaded successfully
Sat, 2022-12-10, 13:49:57 00[LIB] plugin 'sha2': loaded successfully
Sat, 2022-12-10, 13:49:57 00[LIB] plugin 'sha1': loaded successfully
Sat, 2022-12-10, 13:49:57 00[LIB] plugin 'mgf1': failed to load - mgf1_plugin_create not found and no plugin file available
Sat, 2022-12-10, 13:49:57 00[LIB] plugin 'random': loaded successfully
Sat, 2022-12-10, 13:49:57 00[LIB] plugin 'nonce': loaded successfully
Sat, 2022-12-10, 13:49:57 00[LIB] plugin 'x509': loaded successfully
Sat, 2022-12-10, 13:49:57 00[LIB] plugin 'revocation': loaded successfully
Sat, 2022-12-10, 13:49:57 00[LIB] plugin 'constraints': loaded successfully
Sat, 2022-12-10, 13:49:57 00[LIB] plugin 'acert': failed to load - acert_plugin_create not found and no plugin file available
Sat, 2022-12-10, 13:49:57 00[LIB] plugin 'pubkey': loaded successfully
Sat, 2022-12-10, 13:49:57 00[LIB] plugin 'pkcs1': loaded successfully
Sat, 2022-12-10, 13:49:57 00[LIB] plugin 'pkcs7': loaded successfully
Sat, 2022-12-10, 13:49:57 00[LIB] plugin 'pgp': loaded successfully
Sat, 2022-12-10, 13:49:57 00[LIB] plugin 'dnskey': loaded successfully
Sat, 2022-12-10, 13:49:57 00[LIB] plugin 'pem': loaded successfully
Sat, 2022-12-10, 13:49:57 00[LIB] plugin 'openssl': loaded successfully
Sat, 2022-12-10, 13:49:57 00[LIB] plugin 'pkcs8': loaded successfully
Sat, 2022-12-10, 13:49:57 00[LIB] plugin 'af-alg': loaded successfully
Sat, 2022-12-10, 13:49:57 00[LIB] plugin 'fips-prf': loaded successfully
Sat, 2022-12-10, 13:49:57 00[LIB] plugin 'gmp': loaded successfully
Sat, 2022-12-10, 13:49:57 00[LIB] plugin 'xcbc': loaded successfully
Sat, 2022-12-10, 13:49:57 00[LIB] plugin 'cmac': loaded successfully
Sat, 2022-12-10, 13:49:57 00[LIB] plugin 'hmac': loaded successfully
Sat, 2022-12-10, 13:49:57 00[LIB] plugin 'kdf': loaded successfully
Sat, 2022-12-10, 13:49:57 00[LIB] plugin 'gcm': loaded successfully
Sat, 2022-12-10, 13:49:57 00[LIB] plugin 'curl': loaded successfully
Sat, 2022-12-10, 13:49:57 00[LIB] plugin 'attr': loaded successfully
Sat, 2022-12-10, 13:49:57 00[LIB] plugin 'kernel-netlink': loaded successfully
Sat, 2022-12-10, 13:49:57 00[LIB] plugin 'resolve': loaded successfully
Sat, 2022-12-10, 13:49:58 00[LIB] plugin 'socket-default': loaded successfully
Sat, 2022-12-10, 13:49:58 00[LIB] plugin 'vici': loaded successfully
Sat, 2022-12-10, 13:49:58 00[LIB] plugin 'updown': loaded successfully
Sat, 2022-12-10, 13:49:58 00[LIB] plugin 'xauth-generic': loaded successfully
Sat, 2022-12-10, 13:49:58 00[KNL] known interfaces and IP addresses:
Sat, 2022-12-10, 13:49:58 00[KNL]   lo
Sat, 2022-12-10, 13:49:58 00[KNL]     127.0.0.1
Sat, 2022-12-10, 13:49:58 00[KNL]   eth0
Sat, 2022-12-10, 13:49:58 00[KNL]   br0
Sat, 2022-12-10, 13:49:58 00[KNL]     192.168.1.37
Sat, 2022-12-10, 13:49:58 00[KNL]   dummy0
Sat, 2022-12-10, 13:49:58 00[KNL]     10.8.1.1
Sat, 2022-12-10, 13:49:58 00[LIB] feature PRIVKEY:DSA in plugin 'pem' has unmet dependency: PRIVKEY:DSA
Sat, 2022-12-10, 13:49:58 00[LIB] feature PRIVKEY:BLISS in plugin 'pem' has unmet dependency: PRIVKEY:BLISS
Sat, 2022-12-10, 13:49:58 00[LIB] feature PUBKEY:BLISS in plugin 'pem' has unmet dependency: PUBKEY:BLISS
Sat, 2022-12-10, 13:49:58 00[LIB] feature PUBKEY:DSA in plugin 'pem' has unmet dependency: PUBKEY:DSA
Sat, 2022-12-10, 13:49:58 00[CFG] loading ca certificates from '/etc/ipsec.d/cacerts'
Sat, 2022-12-10, 13:49:58 00[CFG] loading aa certificates from '/etc/ipsec.d/aacerts'
Sat, 2022-12-10, 13:49:58 00[CFG] loading ocsp signer certificates from '/etc/ipsec.d/ocspcerts'
Sat, 2022-12-10, 13:49:58 00[CFG] loading attribute certificates from '/etc/ipsec.d/acerts'
Sat, 2022-12-10, 13:49:58 00[CFG] loading crls from '/etc/ipsec.d/crls'
Sat, 2022-12-10, 13:49:58 00[CFG] loading secrets from '/etc/ipsec.secrets'
Sat, 2022-12-10, 13:49:58 00[CFG] opening secrets file '/etc/ipsec.secrets' failed: No such file or directory
Sat, 2022-12-10, 13:49:58 00[LIB] feature CERT_DECODE:OCSP_REQUEST in plugin 'pem' has unmet dependency: CERT_DECODE:OCSP_REQUEST
Sat, 2022-12-10, 13:49:58 00[LIB] loaded plugins: charon aes stroke sha2 sha1 random nonce x509 revocation constraints pubkey pkcs1 pkcs7 pgp dnskey pem openssl pkcs8 af-alg fips-prf gmp xcbc cmac hmac kdf gcm curl attr kernel-netlink resolve socket-default vici updown xauth-generic
Sat, 2022-12-10, 13:49:58 00[LIB] unable to load 5 plugin features (5 due to unmet dependencies)
Sat, 2022-12-10, 13:49:58 00[JOB] spawning 16 worker threads
Sat, 2022-12-10, 13:49:58 01[LIB] created thread 01 [6895]
Sat, 2022-12-10, 13:49:58 02[LIB] created thread 02 [6894]
Sat, 2022-12-10, 13:49:58 03[LIB] created thread 03 [6896]
Sat, 2022-12-10, 13:49:58 04[LIB] created thread 04 [6898]
Sat, 2022-12-10, 13:49:58 05[LIB] created thread 05 [6897]
Sat, 2022-12-10, 13:49:58 06[LIB] created thread 06 [6900]
Sat, 2022-12-10, 13:49:58 07[LIB] created thread 07 [6899]
Sat, 2022-12-10, 13:49:58 08[LIB] created thread 08 [6902]
Sat, 2022-12-10, 13:49:58 09[LIB] created thread 09 [6901]
Sat, 2022-12-10, 13:49:58 10[LIB] created thread 10 [6903]
Sat, 2022-12-10, 13:49:58 12[LIB] created thread 12 [6906]
Sat, 2022-12-10, 13:49:58 11[LIB] created thread 11 [6907]
Sat, 2022-12-10, 13:49:58 14[LIB] created thread 14 [6904]
Sat, 2022-12-10, 13:49:58 13[LIB] created thread 13 [6905]
Sat, 2022-12-10, 13:49:58 15[LIB] created thread 15 [6908]
Sat, 2022-12-10, 13:49:58 16[LIB] created thread 16 [6909]
Sat, 2022-12-10, 13:50:03 05[CFG] vici client 1 connected
Sat, 2022-12-10, 13:50:03 10[CFG] vici client 1 requests: get-keys
Sat, 2022-12-10, 13:50:03 06[CFG] vici client 1 requests: get-shared
Sat, 2022-12-10, 13:50:03 14[CFG] vici client 1 requests: load-shared
Sat, 2022-12-10, 13:50:03 14[CFG] loaded IKE shared key with id 'ike-my-vpn-1' for: 'loc', 'sec'
Sat, 2022-12-10, 13:50:03 08[CFG] vici client 1 requests: get-authorities
Sat, 2022-12-10, 13:50:03 16[CFG] vici client 1 requests: get-pools
Sat, 2022-12-10, 13:50:03 10[CFG] vici client 1 requests: get-conns
Sat, 2022-12-10, 13:50:03 05[CFG] vici client 1 requests: load-conn
Sat, 2022-12-10, 13:50:03 05[CFG]  conn my-vpn:
Sat, 2022-12-10, 13:50:03 05[CFG]   child my-vpn-1:
Sat, 2022-12-10, 13:50:03 05[CFG]    rekey_time = 3600
Sat, 2022-12-10, 13:50:03 05[CFG]    life_time = 3960
Sat, 2022-12-10, 13:50:03 05[CFG]    rand_time = 360
Sat, 2022-12-10, 13:50:03 05[CFG]    rekey_bytes = 0
Sat, 2022-12-10, 13:50:03 05[CFG]    life_bytes = 0
Sat, 2022-12-10, 13:50:03 05[CFG]    rand_bytes = 0
Sat, 2022-12-10, 13:50:03 05[CFG]    rekey_packets = 0
Sat, 2022-12-10, 13:50:03 05[CFG]    life_packets = 0
Sat, 2022-12-10, 13:50:03 05[CFG]    rand_packets = 0
Sat, 2022-12-10, 13:50:03 05[CFG]    updown = (null)
Sat, 2022-12-10, 13:50:03 05[CFG]    hostaccess = 0
Sat, 2022-12-10, 13:50:03 05[CFG]    ipcomp = 0
Sat, 2022-12-10, 13:50:03 05[CFG]    mode = TUNNEL
Sat, 2022-12-10, 13:50:03 05[CFG]    policies = 1
Sat, 2022-12-10, 13:50:03 05[CFG]    policies_fwd_out = 0
Sat, 2022-12-10, 13:50:03 05[CFG]    dpd_action = start
Sat, 2022-12-10, 13:50:03 05[CFG]    start_action = trap
Sat, 2022-12-10, 13:50:03 05[CFG]    close_action = none
Sat, 2022-12-10, 13:50:03 05[CFG]    reqid = 0
Sat, 2022-12-10, 13:50:03 05[CFG]    tfc = 0
Sat, 2022-12-10, 13:50:03 05[CFG]    priority = 0
Sat, 2022-12-10, 13:50:03 05[CFG]    interface = (null)
Sat, 2022-12-10, 13:50:03 05[CFG]    if_id_in = 0
Sat, 2022-12-10, 13:50:03 05[CFG]    if_id_out = 0
Sat, 2022-12-10, 13:50:03 05[CFG]    mark_in = 0/0
Sat, 2022-12-10, 13:50:03 05[CFG]    mark_in_sa = 0
Sat, 2022-12-10, 13:50:03 05[CFG]    mark_out = 0/0
Sat, 2022-12-10, 13:50:03 05[CFG]    set_mark_in = 0/0
Sat, 2022-12-10, 13:50:03 05[CFG]    set_mark_out = 0/0
Sat, 2022-12-10, 13:50:03 05[CFG]    label = (null)
Sat, 2022-12-10, 13:50:03 05[CFG]    label_mode = system
Sat, 2022-12-10, 13:50:03 05[CFG]    inactivity = 0
Sat, 2022-12-10, 13:50:03 05[CFG]    proposals = ESP:AES_GCM_16_128/AES_GCM_16_192/AES_GCM_16_256/NO_EXT_SEQ, ESP:AES_CBC_128/AES_CBC_192/AES_CBC_256/HMAC_SHA2_256_128/HMAC_SHA2_384_192/HMAC_SHA2_512_256/HMAC_SHA1_96/AES_XCBC_96/NO_EXT_SEQ
Sat, 2022-12-10, 13:50:03 05[CFG]    local_ts = 10.8.1.1/32
Sat, 2022-12-10, 13:50:03 05[CFG]    remote_ts = 10.8.1.2/32
Sat, 2022-12-10, 13:50:03 05[CFG]    hw_offload = no
Sat, 2022-12-10, 13:50:03 05[CFG]    sha256_96 = 0
Sat, 2022-12-10, 13:50:03 05[CFG]    copy_df = 1
Sat, 2022-12-10, 13:50:03 05[CFG]    copy_ecn = 1
Sat, 2022-12-10, 13:50:03 05[CFG]    copy_dscp = out
Sat, 2022-12-10, 13:50:03 05[CFG]   version = 2
Sat, 2022-12-10, 13:50:03 05[CFG]   local_addrs = 192.168.1.37
Sat, 2022-12-10, 13:50:03 05[CFG]   remote_addrs = 192.168.1.53
Sat, 2022-12-10, 13:50:03 05[CFG]   local_port = 500
Sat, 2022-12-10, 13:50:03 05[CFG]   remote_port = 500
Sat, 2022-12-10, 13:50:03 05[CFG]   send_certreq = 1
Sat, 2022-12-10, 13:50:03 05[CFG]   send_cert = CERT_SEND_IF_ASKED
Sat, 2022-12-10, 13:50:03 05[CFG]   ppk_id = (null)
Sat, 2022-12-10, 13:50:03 05[CFG]   ppk_required = 0
Sat, 2022-12-10, 13:50:03 05[CFG]   mobike = 1
Sat, 2022-12-10, 13:50:03 05[CFG]   aggressive = 0
Sat, 2022-12-10, 13:50:03 05[CFG]   dscp = 0x00
Sat, 2022-12-10, 13:50:03 05[CFG]   encap = 0
Sat, 2022-12-10, 13:50:03 05[CFG]   dpd_delay = 0
Sat, 2022-12-10, 13:50:03 05[CFG]   dpd_timeout = 0
Sat, 2022-12-10, 13:50:03 05[CFG]   fragmentation = 2
Sat, 2022-12-10, 13:50:03 05[CFG]   childless = 0
Sat, 2022-12-10, 13:50:03 05[CFG]   unique = UNIQUE_NO
Sat, 2022-12-10, 13:50:03 05[CFG]   keyingtries = 1
Sat, 2022-12-10, 13:50:03 05[CFG]   reauth_time = 86400
Sat, 2022-12-10, 13:50:03 05[CFG]   rekey_time = 0
Sat, 2022-12-10, 13:50:03 05[CFG]   over_time = 8640
Sat, 2022-12-10, 13:50:03 05[CFG]   rand_time = 8640
Sat, 2022-12-10, 13:50:03 05[CFG]   proposals = IKE:AES_CBC_256/HMAC_SHA2_256_128/PRF_HMAC_SHA2_256/MODP_2048
Sat, 2022-12-10, 13:50:03 05[CFG]   if_id_in = 0
Sat, 2022-12-10, 13:50:03 05[CFG]   if_id_out = 0
Sat, 2022-12-10, 13:50:03 05[CFG]   local:
Sat, 2022-12-10, 13:50:03 05[CFG]    id = loc
Sat, 2022-12-10, 13:50:03 05[CFG]    class = pre-shared key
Sat, 2022-12-10, 13:50:03 05[CFG]   remote:
Sat, 2022-12-10, 13:50:03 05[CFG]    id = sec
Sat, 2022-12-10, 13:50:03 05[CFG]    class = pre-shared key
Sat, 2022-12-10, 13:50:03 05[CFG] added vici connection: my-vpn
Sat, 2022-12-10, 13:50:03 05[CFG] installing 'my-vpn-1'
Sat, 2022-12-10, 13:50:03 05[CFG] configured proposals: ESP:AES_GCM_16_128/AES_GCM_16_192/AES_GCM_16_256/NO_EXT_SEQ, ESP:AES_CBC_128/AES_CBC_192/AES_CBC_256/HMAC_SHA2_256_128/HMAC_SHA2_384_192/HMAC_SHA2_512_256/HMAC_SHA1_96/AES_XCBC_96/NO_EXT_SEQ
Sat, 2022-12-10, 13:50:03 05[KNL] adding policy 10.8.1.2/32 === 10.8.1.1/32 in [priority 367232, refcount 1]
Sat, 2022-12-10, 13:50:03 05[KNL] adding policy 10.8.1.2/32 === 10.8.1.1/32 fwd [priority 367232, refcount 1]
Sat, 2022-12-10, 13:50:03 05[KNL] adding policy 10.8.1.1/32 === 10.8.1.2/32 out [priority 367232, refcount 1]
Sat, 2022-12-10, 13:50:03 05[KNL] getting a local address in traffic selector 10.8.1.1/32
Sat, 2022-12-10, 13:50:03 05[KNL] using host 10.8.1.1
Sat, 2022-12-10, 13:50:03 05[KNL] getting iface name for index 6
Sat, 2022-12-10, 13:50:03 05[KNL] using 192.168.1.53 as nexthop and br0 as dev to reach 192.168.1.53/32
Sat, 2022-12-10, 13:50:03 05[KNL] installing route: 10.8.1.2/32 via 192.168.1.53 src 10.8.1.1 dev br0
Sat, 2022-12-10, 13:50:03 05[KNL] getting iface index for br0
Sat, 2022-12-10, 13:50:03 05[CHD] CHILD_SA my-vpn-1{1} state change: CREATED => ROUTED
Sat, 2022-12-10, 13:50:03 10[CFG] vici client 1 disconnected
Sat, 2022-12-10, 13:50:10 13[CFG] vici client 2 connected
Sat, 2022-12-10, 13:50:10 07[CFG] vici client 2 registered for: control-log
Sat, 2022-12-10, 13:50:10 13[CFG] vici client 2 requests: initiate
Sat, 2022-12-10, 13:50:10 13[CFG] vici initiate CHILD_SA 'my-vpn-1'
Sat, 2022-12-10, 13:50:10 16[MGR] checkout IKE_SA by config
Sat, 2022-12-10, 13:50:10 16[MGR] created IKE_SA (unnamed)[1]
Sat, 2022-12-10, 13:50:10 16[IKE] <my-vpn|1> queueing IKE_VENDOR task
Sat, 2022-12-10, 13:50:10 16[IKE] <my-vpn|1> queueing IKE_INIT task
Sat, 2022-12-10, 13:50:10 16[IKE] <my-vpn|1> queueing IKE_NATD task
Sat, 2022-12-10, 13:50:10 16[IKE] <my-vpn|1> queueing IKE_CERT_PRE task
Sat, 2022-12-10, 13:50:10 16[IKE] <my-vpn|1> queueing IKE_AUTH task
Sat, 2022-12-10, 13:50:10 16[IKE] <my-vpn|1> queueing IKE_CERT_POST task
Sat, 2022-12-10, 13:50:10 16[IKE] <my-vpn|1> queueing IKE_CONFIG task
Sat, 2022-12-10, 13:50:10 16[IKE] <my-vpn|1> queueing IKE_AUTH_LIFETIME task
Sat, 2022-12-10, 13:50:10 16[IKE] <my-vpn|1> queueing IKE_MOBIKE task
Sat, 2022-12-10, 13:50:10 16[IKE] <my-vpn|1> queueing IKE_ESTABLISH task
Sat, 2022-12-10, 13:50:10 16[IKE] <my-vpn|1> queueing CHILD_CREATE task
Sat, 2022-12-10, 13:50:10 16[IKE] <my-vpn|1> activating new tasks
Sat, 2022-12-10, 13:50:10 16[IKE] <my-vpn|1>   activating IKE_VENDOR task
Sat, 2022-12-10, 13:50:10 16[IKE] <my-vpn|1>   activating IKE_INIT task
Sat, 2022-12-10, 13:50:10 16[IKE] <my-vpn|1>   activating IKE_NATD task
Sat, 2022-12-10, 13:50:10 16[IKE] <my-vpn|1>   activating IKE_CERT_PRE task
Sat, 2022-12-10, 13:50:10 16[IKE] <my-vpn|1>   activating IKE_AUTH task
Sat, 2022-12-10, 13:50:10 16[IKE] <my-vpn|1>   activating IKE_CERT_POST task
Sat, 2022-12-10, 13:50:10 16[IKE] <my-vpn|1>   activating IKE_CONFIG task
Sat, 2022-12-10, 13:50:10 16[IKE] <my-vpn|1>   activating IKE_AUTH_LIFETIME task
Sat, 2022-12-10, 13:50:10 16[IKE] <my-vpn|1>   activating IKE_MOBIKE task
Sat, 2022-12-10, 13:50:10 16[IKE] <my-vpn|1>   activating IKE_ESTABLISH task
Sat, 2022-12-10, 13:50:10 16[IKE] <my-vpn|1>   activating CHILD_CREATE task
Sat, 2022-12-10, 13:50:10 16[IKE] <my-vpn|1> initiating IKE_SA my-vpn[1] to 192.168.1.53
Sat, 2022-12-10, 13:50:10 16[IKE] <my-vpn|1> IKE_SA my-vpn[1] state change: CREATED => CONNECTING
Sat, 2022-12-10, 13:50:10 16[CFG] <my-vpn|1> configured proposals: IKE:AES_CBC_256/HMAC_SHA2_256_128/PRF_HMAC_SHA2_256/MODP_2048
Sat, 2022-12-10, 13:50:10 16[CFG] <my-vpn|1> sending supported signature hash algorithms: sha256 sha384 sha512 identity
Sat, 2022-12-10, 13:50:10 16[ENC] <my-vpn|1> generating IKE_SA_INIT request 0 [ SA KE No N(NATD_S_IP) N(NATD_D_IP) N(FRAG_SUP) N(HASH_ALG) N(REDIR_SUP) ]
Sat, 2022-12-10, 13:50:10 16[NET] <my-vpn|1> sending packet: from 192.168.1.37[500] to 192.168.1.53[500] (464 bytes)
Sat, 2022-12-10, 13:50:10 16[MGR] <my-vpn|1> checkin IKEv2 SA my-vpn[1] with SPIs 916530b01588f5af_i 0000000000000000_r
Sat, 2022-12-10, 13:50:10 16[MGR] <my-vpn|1> checkin of IKE_SA successful
Sat, 2022-12-10, 13:50:10 10[MGR] checkout IKEv2 SA by message with SPIs 916530b01588f5af_i a8d8ab9a2654dcfb_r
Sat, 2022-12-10, 13:50:10 10[MGR] IKE_SA my-vpn[1] successfully checked out
Sat, 2022-12-10, 13:50:10 10[NET] <my-vpn|1> received packet: from 192.168.1.53[500] to 192.168.1.37[500] (472 bytes)
Sat, 2022-12-10, 13:50:10 10[ENC] <my-vpn|1> parsed IKE_SA_INIT response 0 [ SA KE No N(NATD_S_IP) N(NATD_D_IP) N(FRAG_SUP) N(HASH_ALG) N(CHDLESS_SUP) N(MULT_AUTH) ]
Sat, 2022-12-10, 13:50:10 10[IKE] <my-vpn|1> received FRAGMENTATION_SUPPORTED notify
Sat, 2022-12-10, 13:50:10 10[IKE] <my-vpn|1> received SIGNATURE_HASH_ALGORITHMS notify
Sat, 2022-12-10, 13:50:10 10[IKE] <my-vpn|1> received CHILDLESS_IKEV2_SUPPORTED notify
Sat, 2022-12-10, 13:50:10 10[CFG] <my-vpn|1> selecting proposal:
Sat, 2022-12-10, 13:50:10 10[CFG] <my-vpn|1>   proposal matches
Sat, 2022-12-10, 13:50:10 10[CFG] <my-vpn|1> received proposals: IKE:AES_CBC_256/HMAC_SHA2_256_128/PRF_HMAC_SHA2_256/MODP_2048
Sat, 2022-12-10, 13:50:10 10[CFG] <my-vpn|1> configured proposals: IKE:AES_CBC_256/HMAC_SHA2_256_128/PRF_HMAC_SHA2_256/MODP_2048
Sat, 2022-12-10, 13:50:10 10[CFG] <my-vpn|1> selected proposal: IKE:AES_CBC_256/HMAC_SHA2_256_128/PRF_HMAC_SHA2_256/MODP_2048
Sat, 2022-12-10, 13:50:10 10[CFG] <my-vpn|1> received supported signature hash algorithms: sha256 sha384 sha512 identity
Sat, 2022-12-10, 13:50:10 10[IKE] <my-vpn|1> reinitiating already active tasks
Sat, 2022-12-10, 13:50:10 10[IKE] <my-vpn|1>   IKE_CERT_PRE task
Sat, 2022-12-10, 13:50:10 10[IKE] <my-vpn|1>   IKE_AUTH task
Sat, 2022-12-10, 13:50:10 10[IKE] <my-vpn|1> authentication of 'loc' (myself) with pre-shared key
Sat, 2022-12-10, 13:50:10 10[IKE] <my-vpn|1> successfully created shared key MAC
Sat, 2022-12-10, 13:50:10 10[CFG] <my-vpn|1> proposing traffic selectors for us:
Sat, 2022-12-10, 13:50:10 10[CFG] <my-vpn|1>  10.8.1.1/32
Sat, 2022-12-10, 13:50:10 10[CFG] <my-vpn|1> proposing traffic selectors for other:
Sat, 2022-12-10, 13:50:10 10[CFG] <my-vpn|1>  10.8.1.2/32
Sat, 2022-12-10, 13:50:10 10[CFG] <my-vpn|1> configured proposals: ESP:AES_GCM_16_128/AES_GCM_16_192/AES_GCM_16_256/NO_EXT_SEQ, ESP:AES_CBC_128/AES_CBC_192/AES_CBC_256/HMAC_SHA2_256_128/HMAC_SHA2_384_192/HMAC_SHA2_512_256/HMAC_SHA1_96/AES_XCBC_96/NO_EXT_SEQ
Sat, 2022-12-10, 13:50:10 10[IKE] <my-vpn|1> establishing CHILD_SA my-vpn-1{2}
Sat, 2022-12-10, 13:50:10 10[KNL] <my-vpn|1> got SPI c458fbc4
Sat, 2022-12-10, 13:50:10 10[ENC] <my-vpn|1> generating IKE_AUTH request 1 [ IDi N(INIT_CONTACT) IDr AUTH SA TSi TSr N(MOBIKE_SUP) N(ADD_4_ADDR) N(MULT_AUTH) N(EAP_ONLY) N(MSG_ID_SYN_SUP) ]
Sat, 2022-12-10, 13:50:10 10[NET] <my-vpn|1> sending packet: from 192.168.1.37[4500] to 192.168.1.53[4500] (384 bytes)
Sat, 2022-12-10, 13:50:10 10[MGR] <my-vpn|1> checkin IKEv2 SA my-vpn[1] with SPIs 916530b01588f5af_i a8d8ab9a2654dcfb_r
Sat, 2022-12-10, 13:50:10 10[MGR] <my-vpn|1> checkin of IKE_SA successful
Sat, 2022-12-10, 13:50:10 09[MGR] checkout IKEv2 SA by message with SPIs 916530b01588f5af_i a8d8ab9a2654dcfb_r
Sat, 2022-12-10, 13:50:10 09[MGR] IKE_SA my-vpn[1] successfully checked out
Sat, 2022-12-10, 13:50:10 09[NET] <my-vpn|1> received packet: from 192.168.1.53[4500] to 192.168.1.37[4500] (224 bytes)
Sat, 2022-12-10, 13:50:10 09[ENC] <my-vpn|1> parsed IKE_AUTH response 1 [ IDr AUTH SA TSi TSr N(MOBIKE_SUP) N(ADD_4_ADDR) ]
Sat, 2022-12-10, 13:50:10 09[IKE] <my-vpn|1> authentication of 'sec' with pre-shared key successful
Sat, 2022-12-10, 13:50:10 09[IKE] <my-vpn|1> peer supports MOBIKE
Sat, 2022-12-10, 13:50:10 09[IKE] <my-vpn|1> got additional MOBIKE peer address: 10.8.1.2
Sat, 2022-12-10, 13:50:10 09[IKE] <my-vpn|1> IKE_SA my-vpn[1] established between 192.168.1.37[loc]...192.168.1.53[sec]
Sat, 2022-12-10, 13:50:10 09[IKE] <my-vpn|1> IKE_SA my-vpn[1] state change: CONNECTING => ESTABLISHED
Sat, 2022-12-10, 13:50:10 09[IKE] <my-vpn|1> scheduling reauthentication in 80151s
Sat, 2022-12-10, 13:50:10 09[IKE] <my-vpn|1> maximum IKE_SA lifetime 88791s
Sat, 2022-12-10, 13:50:10 09[CFG] <my-vpn|1> selecting proposal:
Sat, 2022-12-10, 13:50:10 09[CFG] <my-vpn|1>   proposal matches
Sat, 2022-12-10, 13:50:10 09[CFG] <my-vpn|1> received proposals: ESP:AES_GCM_16_128/NO_EXT_SEQ
Sat, 2022-12-10, 13:50:10 09[CFG] <my-vpn|1> configured proposals: ESP:AES_GCM_16_128/AES_GCM_16_192/AES_GCM_16_256/NO_EXT_SEQ, ESP:AES_CBC_128/AES_CBC_192/AES_CBC_256/HMAC_SHA2_256_128/HMAC_SHA2_384_192/HMAC_SHA2_512_256/HMAC_SHA1_96/AES_XCBC_96/NO_EXT_SEQ
Sat, 2022-12-10, 13:50:10 09[CFG] <my-vpn|1> selected proposal: ESP:AES_GCM_16_128/NO_EXT_SEQ
Sat, 2022-12-10, 13:50:10 09[CFG] <my-vpn|1> selecting traffic selectors for us:
Sat, 2022-12-10, 13:50:10 09[CFG] <my-vpn|1>  config: 10.8.1.1/32, received: 10.8.1.1/32 => match: 10.8.1.1/32
Sat, 2022-12-10, 13:50:10 09[CFG] <my-vpn|1> selecting traffic selectors for other:
Sat, 2022-12-10, 13:50:10 09[CFG] <my-vpn|1>  config: 10.8.1.2/32, received: 10.8.1.2/32 => match: 10.8.1.2/32
Sat, 2022-12-10, 13:50:10 09[CHD] <my-vpn|1> CHILD_SA my-vpn-1{2} state change: CREATED => INSTALLING
Sat, 2022-12-10, 13:50:10 09[CHD] <my-vpn|1>   using AES_GCM_16 for encryption
Sat, 2022-12-10, 13:50:10 09[CHD] <my-vpn|1> adding inbound ESP SA
Sat, 2022-12-10, 13:50:10 09[CHD] <my-vpn|1>   SPI 0xc458fbc4, src 192.168.1.53 dst 192.168.1.37
Sat, 2022-12-10, 13:50:10 09[KNL] <my-vpn|1> adding SAD entry with SPI c458fbc4 and reqid {1}
Sat, 2022-12-10, 13:50:10 09[KNL] <my-vpn|1>   using encryption algorithm AES_GCM_16 with key size 160
Sat, 2022-12-10, 13:50:10 09[KNL] <my-vpn|1>   using replay window of 32 packets
Sat, 2022-12-10, 13:50:10 09[KNL] <my-vpn|1>   HW offload: no
Sat, 2022-12-10, 13:50:10 09[CHD] <my-vpn|1> adding outbound ESP SA
Sat, 2022-12-10, 13:50:10 09[CHD] <my-vpn|1>   SPI 0xc4458310, src 192.168.1.37 dst 192.168.1.53
Sat, 2022-12-10, 13:50:10 09[KNL] <my-vpn|1> adding SAD entry with SPI c4458310 and reqid {1}
Sat, 2022-12-10, 13:50:10 09[KNL] <my-vpn|1>   using encryption algorithm AES_GCM_16 with key size 160
Sat, 2022-12-10, 13:50:10 09[KNL] <my-vpn|1>   using replay window of 0 packets
Sat, 2022-12-10, 13:50:10 09[KNL] <my-vpn|1>   HW offload: no
Sat, 2022-12-10, 13:50:10 09[KNL] <my-vpn|1> policy 10.8.1.2/32 === 10.8.1.1/32 in already exists, increasing refcount
Sat, 2022-12-10, 13:50:10 09[KNL] <my-vpn|1> updating policy 10.8.1.2/32 === 10.8.1.1/32 in [priority 367231, refcount 2]
Sat, 2022-12-10, 13:50:10 09[KNL] <my-vpn|1> policy 10.8.1.2/32 === 10.8.1.1/32 fwd already exists, increasing refcount
Sat, 2022-12-10, 13:50:10 09[KNL] <my-vpn|1> updating policy 10.8.1.2/32 === 10.8.1.1/32 fwd [priority 367231, refcount 2]
Sat, 2022-12-10, 13:50:10 09[KNL] <my-vpn|1> policy 10.8.1.1/32 === 10.8.1.2/32 out already exists, increasing refcount
Sat, 2022-12-10, 13:50:10 09[KNL] <my-vpn|1> updating policy 10.8.1.1/32 === 10.8.1.2/32 out [priority 367231, refcount 2]
Sat, 2022-12-10, 13:50:10 09[KNL] <my-vpn|1> getting a local address in traffic selector 10.8.1.1/32
Sat, 2022-12-10, 13:50:10 09[KNL] <my-vpn|1> using host 10.8.1.1
Sat, 2022-12-10, 13:50:10 09[KNL] <my-vpn|1> getting iface name for index 6
Sat, 2022-12-10, 13:50:10 09[KNL] <my-vpn|1> using 192.168.1.53 as nexthop and br0 as dev to reach 192.168.1.53/32
Sat, 2022-12-10, 13:50:10 09[IKE] <my-vpn|1> CHILD_SA my-vpn-1{2} established with SPIs c458fbc4_i c4458310_o and TS 10.8.1.1/32 === 10.8.1.2/32
Sat, 2022-12-10, 13:50:10 09[CHD] <my-vpn|1> CHILD_SA my-vpn-1{2} state change: INSTALLING => INSTALLED
Sat, 2022-12-10, 13:50:10 07[CFG] vici client 2 disconnected
Sat, 2022-12-10, 13:50:10 09[IKE] <my-vpn|1> activating new tasks
Sat, 2022-12-10, 13:50:10 09[IKE] <my-vpn|1> nothing to initiate
Sat, 2022-12-10, 13:50:10 09[MGR] <my-vpn|1> checkin IKEv2 SA my-vpn[1] with SPIs 916530b01588f5af_i a8d8ab9a2654dcfb_r
Sat, 2022-12-10, 13:50:10 09[MGR] <my-vpn|1> checkin of IKE_SA successful
Sat, 2022-12-10, 13:50:14 12[MGR] checkout IKEv2 SA with SPIs 916530b01588f5af_i 0000000000000000_r
Sat, 2022-12-10, 13:50:14 12[MGR] IKE_SA my-vpn[1] successfully checked out
Sat, 2022-12-10, 13:50:14 12[MGR] <my-vpn|1> checkin IKEv2 SA my-vpn[1] with SPIs 916530b01588f5af_i a8d8ab9a2654dcfb_r
Sat, 2022-12-10, 13:50:14 12[MGR] <my-vpn|1> checkin of IKE_SA successful
Sat, 2022-12-10, 13:50:14 11[MGR] checkout IKEv2 SA with SPIs 916530b01588f5af_i a8d8ab9a2654dcfb_r
Sat, 2022-12-10, 13:50:14 11[MGR] IKE_SA my-vpn[1] successfully checked out
Sat, 2022-12-10, 13:50:14 11[MGR] <my-vpn|1> checkin IKEv2 SA my-vpn[1] with SPIs 916530b01588f5af_i a8d8ab9a2654dcfb_r
Sat, 2022-12-10, 13:50:14 11[MGR] <my-vpn|1> checkin of IKE_SA successful
```

**Reply by Thermi** [reply]
Does it change if you move the address to the bridge as well?

**Reply by bitshifter1** [reply]
No difference.

```
root@host1:~ ip address
1: lo: <LOOPBACK,UP,LOWER_UP> mtu 65536 qdisc noqueue state UNKNOWN group default qlen 1000
    link/loopback 00:00:00:00:00:00 brd 00:00:00:00:00:00
    inet 127.0.0.1/8 scope host lo
       valid_lft forever preferred_lft forever
2: sit0@NONE: <NOARP> mtu 1480 qdisc noop state DOWN group default qlen 1000
    link/sit 0.0.0.0 brd 0.0.0.0
3: eth0: <BROADCAST,MULTICAST,UP,LOWER_UP> mtu 1500 qdisc mq master br0 state UP group default qlen 1000
    link/ether 00:30:de:00:02:16 brd ff:ff:ff:ff:ff:ff
5: wwan0: <BROADCAST,MULTICAST> mtu 1500 qdisc noop state DOWN group default qlen 1000
    link/ether f6:58:e1:8d:2e:2a brd ff:ff:ff:ff:ff:ff
6: br0: <BROADCAST,MULTICAST,UP,LOWER_UP> mtu 1500 qdisc noqueue state UP group default qlen 1000
    link/ether 00:30:de:00:02:16 brd ff:ff:ff:ff:ff:ff
    inet 192.168.1.37/24 brd 192.168.1.255 scope global br0
       valid_lft forever preferred_lft forever
    inet 10.8.1.1/24 scope global br0
       valid_lft forever preferred_lft forever
```

**Comment by bitshifter1** [comment]
Do you think it's most likely to be a strongswan, or a kernel issue?

**Reply by Thermi** [reply]
Kernel issue definitely, strongSwan does not touch the packets.

**Reply by bitshifter1** [reply]
Ok, thanks a lot. Are you looking into that?

**Comment by Thermi** [comment]
No, because it's not my area of expertise really and it's not a good thing to spend my time on these days really. I think @ecdsa would be better or maybe Paul or a different person working on the XFRM code.

On January 24, 2023 8:05:45 AM UTC, Oliver Rohe ***@***.***> wrote:
>Ok, thanks a lot. Are you looking into that?
>
>-- 
>Reply to this email directly or view it on GitHub:
>https://github.com/strongswan/strongswan/discussions/1450#discussioncomment-4763987
>You are receiving this because you were mentioned.
>
>Message ID: ***@***.***>
-- 
Sent from mobile. Please excuse any typos or brevity

**Reply by bitshifter1** [reply]
Ok, do you guys want me to create an issue from this discussion?

**Reply by tobiasbrunner** [reply]
As @Thermi already mentioned, it's a kernel issue. So creating an issue here would be pretty much pointless. You better report it to e.g. the [netdev mailing list](http://vger.kernel.org/vger-lists.html#netdev) if you feel something doesn't work as intended.

Without having looked too deep into this, I'm not sure how this is supposed to work (using the same subnets on both sides via a layer 3 VPN).
