### DISCUSSION TITLE
xfrm and GRE interfaces, compatibility of swanctl configs

### DISCUSSION THREAD

**Discussion by iluffk** [strongswan/strongswan#2736] [Q&A] [answered]
Hi.
I have 2 VM:
vm1 - with swanctl 10.252.2.101
vm2 - with ipsec.conf 10.252.72.63

I have configured xfrm on VM1 and VTI on VM2 and it is working ok.
But i need to provide compatibility with different clients that use GRE.
I tried to reconfigure VM2 to use gre how it decribed here https://docs.strongswan.org/docs/latest/features/routeBasedVpn.html#_gre_tunnels and as I understand I need to use gre interfaces on 2 sides. Ok.

I tried to create interfaces:

VM1
```
ip link add gre-test type gre key 133 ttl 64 local 10.252.2.101 remote 10.252.72.63
ip l set gre-test mtu 1350
ip l set gre-test up
ip a add 169.254.255.6/30 dev gre-test
```

VM2
```
ip link add gre-test type gre key 133 ttl 64 local 10.252.72.63 remote 10.252.2.101
ip l set gre-test mtu 1350
ip l set gre-test up
ip a add 169.254.255.5/30 dev gre-test
```

And it doesn't work.

I also tried to add 
                remote_ts = 0.0.0.0/0[gre]
                local_ts = 0.0.0.0/0[gre]
in my swanctl config, unfortunately it didn't help...

I have this config on VM1:
/etc/strongswan.d/charon/kernel-libipsec.conf  load = no
and  strongswan.d/charon/kernel-netlink.conf - load = yes

```
connections {
    l7-lb {
        version = 2
        proposals = aes256-sha256-x25519, aes128-sha256-x25519, aes256-sha256-modp2048, aes128-sha256-modp2048,aes128gcm16-x25519-sha256-aes256gcm16-modp2048-aes256ccm16-chacha20poly1305-aes192gcm16,chacha20poly1305-sha512-curve25519-prfsha512,aes256gcm16-sha384-prfsha384-ecp384
#        proposals = aes128gcm16-x25519-sha256-aes256gcm16-modp2048-aes256ccm16-chacha20poly1305-aes192gcm16
        remote_addrs = 10.252.72.63
        local_addrs = 10.252.2.101

        remote {
            auth = psk
            id = 10.252.72.63
              }
        local {
            auth = psk
            id = 10.252.2.101
               }
        children {
             l7-lb {
                remote_ts = 0.0.0.0/0
                local_ts = 0.0.0.0/0
esp_proposals = aes128gcm16, aes256gcm16, aes128gcm128-x25519-esn, chacha20poly1305
                mode = tunnel #transport
                policies_fwd_out = yes
                start_action = start
		hw_offload = auto
               # hw_offload = yes/auto/full
#        mark_in = 624
#        mark_out = 624
		if_id_in = 624
		if_id_out = 624
#		set_mark_out = 624
#		set_mark_in = 624
#		mode = pass
                }            
            }
    }
}
secrets {
    ike-l7-lb {
        id = 10.252.72.63
        secret = AAAAAAAAAAAAAAA
    }
}
```

Please help, how  to add compatibility for working xfrm (vti) interfaces and GRE?

**Comment by tobiasbrunner** [comment]
> Please help, how to add compatibility for working xfrm (vti) interfaces and GRE?

Those are completely different approaches. GRE adds an additional encapsulation layer, so you have to use that on both ends and without XFRM interfaces (i.e. use `dynamic` as traffic selector, optionally with `[gre]`, and no interface IDs).

**Reply by iluffk** [reply]
Yes, I got that on both sides I must use GRE, but it is not working...

On VM2 I have right now config:
```
        keyexchange = ikev2
        left = 10.252.72.63
        right = 10.252.2.101
        authby = secret
        leftid = 10.252.72.63
        rightid = 10.252.2.101
        leftsubnet = dynamic[gre]
        rightsubnet = dynamic[gre]
        mark = 133
        type = transport
        ike = aes256-sha256-x25519, aes128-sha256-x25519, aes256-sha256-modp2048, aes128-sha256-modp2048,aes128gcm16-x25519-sha256-aes256gcm16-modp2048-aes256ccm16-chacha20poly1305-aes192gcm16,chacha20poly1305-sha512-curve25519-prfsha512,aes256gcm16-sha384-prfsha384-ecp384
        esp = aes128gcm16, aes256gcm16, aes128gcm128-x25519-esn, chacha20poly1305
        ikelifetime = 28800s
        lifetime = 3600s
        auto = start
```
```
ip tunnel add gre-vm1 local 10.252.72.63 remote 10.252.2.101 mode gre key 133
ip l set gre-vm1 up
ip  a add 169.254.255.5/30 dev gre-vm1
```

and on VM1:
```
connections {
    l7-lb {
        version = 2
        proposals = aes256-sha256-x25519, aes128-sha256-x25519, aes256-sha256-modp2048, aes128-sha256-modp2048,aes128gcm16-x25519-sha256-aes256gcm16-modp2048-aes256ccm16-chacha20poly1305-aes192gcm16,chacha20poly1305-sha512-curve25519-prfsha512,aes256gcm16-sha384-prfsha384-ecp384
#        proposals = aes128gcm16-x25519-sha256-aes256gcm16-modp2048-aes256ccm16-chacha20poly1305-aes192gcm16
        remote_addrs = 10.252.72.63
        local_addrs = 10.252.2.101

        remote {
            auth = psk
            id = 10.252.72.63
              }
        local {
            auth = psk
            id = 10.252.2.101
               }
        children {
             l7-lb {
                remote_ts = dynamic[gre]
                local_ts = dynamic[gre]
esp_proposals = aes128gcm16, aes256gcm16, aes128gcm128-x25519-esn, chacha20poly1305
                mode = transport
                policies_fwd_out = yes
                start_action = start

                mark_in = 133
                mark_out = 133

                }            
            }
    }
}
secrets {
    ike-l7-lb {
        id = 10.252.72.63
        secret = AAAAAAAAAAAAAAA
    }
}
```
interface
```
ip tunnel add gre-vm2 local 10.252.2.101 remote 10.252.72.63  mode gre key 133
ip l set gre-vm2 up
ip  a add 169.254.255.6/30 dev gre-vm2
```
I do ping from VM2 to VM1 and dump traffic:

VM1:
 tcpdump -niany icmp or esp
```
tcpdump: data link type LINUX_SLL2
tcpdump: verbose output suppressed, use -v[v]... for full protocol decode
listening on any, link-type LINUX_SLL2 (Linux cooked v2), snapshot length 262144 bytes
12:11:49.099565 gre-vm2 In  IP 169.254.255.5 > 169.254.255.6: ICMP echo request, id 40413, seq 62, length 64
12:11:49.099567 gre-vm2 Out IP 169.254.255.6 > 169.254.255.5: ICMP echo reply, id 40413, seq 62, length 64
12:11:49.099572 ens3f0np0 Out IP 10.252.2.101 > 10.252.72.63: ESP(spi=0xca029051,seq=0x114), length 148
12:11:50.123554 gre-vm2 In  IP 169.254.255.5 > 169.254.255.6: ICMP echo request, id 40413, seq 63, length 64
12:11:50.123556 gre-vm2 Out IP 169.254.255.6 > 169.254.255.5: ICMP echo reply, id 40413, seq 63, length 64
12:11:50.123559 ens3f0np0 Out IP 10.252.2.101 > 10.252.72.63: ESP(spi=0xca029051,seq=0x115), length 148
```
```
ip xfrm  policy 
src 10.252.2.101/32 dst 10.252.72.63/32 proto gre 
	dir fwd priority 366976 ptype main 
	mark 0x85/0xffffffff 
src 10.252.2.101/32 dst 10.252.72.63/32 proto gre 
	dir out priority 366975 ptype main 
	mark 0x85/0xffffffff 
	tmpl src 10.252.2.101 dst 10.252.72.63
		proto esp spi 0xca029051 reqid 1 mode tunnel
src 10.252.72.63/32 dst 10.252.2.101/32 proto gre 
	dir fwd priority 366975 ptype main 
	mark 0x85/0xffffffff 
	tmpl src 10.252.72.63 dst 10.252.2.101
		proto esp reqid 1 mode tunnel
src 10.252.72.63/32 dst 10.252.2.101/32 proto gre 
	dir in priority 366975 ptype main 
	mark 0x85/0xffffffff 
	tmpl src 10.252.72.63 dst 10.252.2.101
		proto esp reqid 1 mode tunnel
src 169.254.255.5/32 dst 169.254.255.5/32 
	dir fwd priority 167231 ptype main 
src 169.254.255.5/32 dst 169.254.255.5/32 
	dir in priority 167231 ptype main 
src 169.254.255.5/32 dst 169.254.255.5/32 
	dir out priority 167231 ptype main 
src 169.254.255.4/30 dst 169.254.255.4/30 
	dir fwd priority 169279 ptype main 
src 169.254.255.4/30 dst 169.254.255.4/30 
	dir in priority 169279 ptype main 
src 169.254.255.4/30 dst 169.254.255.4/30 
	dir out priority 169279 ptype main 
src 10.252.2.100/31 dst 10.252.2.100/31 
	dir fwd priority 168255 ptype main 
src 10.252.2.100/31 dst 10.252.2.100/31 
	dir in priority 168255 ptype main 
src 10.252.2.100/31 dst 10.252.2.100/31 
	dir out priority 168255 ptype main 
src 10.252.1.100/31 dst 10.252.1.100/31 
	dir fwd priority 168255 ptype main 
src 10.252.1.100/31 dst 10.252.1.100/31 
	dir in priority 168255 ptype main 
src 10.252.1.100/31 dst 10.252.1.100/31 
	dir out priority 168255 ptype main 
src 4.4.4.4/31 dst 4.4.4.4/31 
	dir fwd priority 168255 ptype main 
src 4.4.4.4/31 dst 4.4.4.4/31 
	dir in priority 168255 ptype main 
src 4.4.4.4/31 dst 4.4.4.4/31 
	dir out priority 168255 ptype main 
src ::/0 dst ::/0 
	socket in priority 0 ptype main 
src ::/0 dst ::/0 
	socket out priority 0 ptype main 
src ::/0 dst ::/0 proto udp sport 4500 dev ens3f1np1 
	dir out priority 32 ptype main 
src ::/0 dst ::/0 proto udp dport 4500 dev ens3f1np1 
	dir in priority 32 ptype main 
src ::/0 dst ::/0 proto udp sport 4500 dev ens3f0np0 
	dir out priority 32 ptype main 
src ::/0 dst ::/0 proto udp dport 4500 dev ens3f0np0 
	dir in priority 32 ptype main 
src ::/0 dst ::/0 
	socket in priority 0 ptype main 
src ::/0 dst ::/0 
	socket out priority 0 ptype main 
src ::/0 dst ::/0 proto udp sport 500 dev ens3f1np1 
	dir out priority 32 ptype main 
src ::/0 dst ::/0 proto udp dport 500 dev ens3f1np1 
	dir in priority 32 ptype main 
src ::/0 dst ::/0 proto udp sport 500 dev ens3f0np0 
	dir out priority 32 ptype main 
src ::/0 dst ::/0 proto udp dport 500 dev ens3f0np0 
	dir in priority 32 ptype main 
src 0.0.0.0/0 dst 0.0.0.0/0 
	socket in priority 0 ptype main 
src 0.0.0.0/0 dst 0.0.0.0/0 
	socket out priority 0 ptype main 
src 0.0.0.0/0 dst 0.0.0.0/0 proto udp sport 4500 dev ens3f1np1 
	dir out priority 32 ptype main 
src 0.0.0.0/0 dst 0.0.0.0/0 proto udp dport 4500 dev ens3f1np1 
	dir in priority 32 ptype main 
src 0.0.0.0/0 dst 0.0.0.0/0 proto udp sport 4500 dev ens3f0np0 
	dir out priority 32 ptype main 
src 0.0.0.0/0 dst 0.0.0.0/0 proto udp dport 4500 dev ens3f0np0 
	dir in priority 32 ptype main 
src 0.0.0.0/0 dst 0.0.0.0/0 
	socket in priority 0 ptype main 
src 0.0.0.0/0 dst 0.0.0.0/0 
	socket out priority 0 ptype main 
src 0.0.0.0/0 dst 0.0.0.0/0 proto udp sport 500 dev ens3f1np1 
	dir out priority 32 ptype main 
src 0.0.0.0/0 dst 0.0.0.0/0 proto udp dport 500 dev ens3f1np1 
	dir in priority 32 ptype main 
src 0.0.0.0/0 dst 0.0.0.0/0 proto udp sport 500 dev ens3f0np0 
	dir out priority 32 ptype main 
src 0.0.0.0/0 dst 0.0.0.0/0 proto udp dport 500 dev ens3f0np0 
	dir in priority 32 ptype main 
```


VM2:
 tcpdump -niany esp or icmp
```
tcpdump: data link type LINUX_SLL2
tcpdump: verbose output suppressed, use -v[v]... for full protocol decode
listening on any, link-type LINUX_SLL2 (Linux cooked v2), snapshot length 262144 bytes
12:12:55.499819 eno02 In  IP 10.252.2.101 > 10.252.72.63: ESP(spi=0xca029051,seq=0x15a), length 124
12:12:55.595369 gre-vm1 Out IP 169.254.255.5 > 169.254.255.6: ICMP echo request, id 40413, seq 127, length 64
12:12:55.595851 eno02 In  IP 10.252.2.101 > 10.252.72.63: ESP(spi=0xca029051,seq=0x15b), length 148
12:12:56.523800 eno02 In  IP 10.252.2.101 > 10.252.72.63: ESP(spi=0xca029051,seq=0x15c), length 124
12:12:56.619357 gre-vm1 Out IP 169.254.255.5 > 169.254.255.6: ICMP echo request, id 40413, seq 128, length 64
12:12:56.619831 eno02 In  IP 10.252.2.101 > 10.252.72.63: ESP(spi=0xca029051,seq=0x15d), length 148
```
```
ip xfrm  policy 
src 10.252.72.63/32 dst 10.252.2.101/32 proto gre 
	dir out priority 366975 ptype main 
	mark 0x85/0xffffffff 
	tmpl src 10.252.72.63 dst 10.252.2.101
		proto esp spi 0xc0a6cc3c reqid 1 mode tunnel
src 10.252.2.101/32 dst 10.252.72.63/32 proto gre 
	dir fwd priority 366975 ptype main 
	mark 0x85/0xffffffff 
	tmpl src 10.252.2.101 dst 10.252.72.63
		proto esp reqid 1 mode tunnel
src 10.252.2.101/32 dst 10.252.72.63/32 proto gre 
	dir in priority 366975 ptype main 
	mark 0x85/0xffffffff 
	tmpl src 10.252.2.101 dst 10.252.72.63
		proto esp reqid 1 mode tunnel
src 0.0.0.0/0 dst 0.0.0.0/0 
	socket in priority 0 ptype main 
src 0.0.0.0/0 dst 0.0.0.0/0 
	socket out priority 0 ptype main 
src 0.0.0.0/0 dst 0.0.0.0/0 
	socket in priority 0 ptype main 
src 0.0.0.0/0 dst 0.0.0.0/0 
	socket out priority 0 ptype main 
src ::/0 dst ::/0 
	socket in priority 0 ptype main 
src ::/0 dst ::/0 
	socket out priority 0 ptype main 
src ::/0 dst ::/0 
	socket in priority 0 ptype main 
src ::/0 dst ::/0 
	socket out priority 0 ptype main 
```

**Reply by iluffk** [reply]
And if I stop ipsec, then ping works.

**Reply by tobiasbrunner** [reply]
No marks are needed on either side.

**Reply by iluffk** [reply]
If I delete marks - I don't see traffic at all

**Reply by iluffk** [reply]
I also check this manual https://www.strongswan.org/testing/testresults/route-based/net2net-gre/ and didn't find any additional info about gre in ipsec

**Reply by iluffk** [reply]
it seems that no decryption happens because I don't see icmp request:
VM2:
```
tcpdump -niany esp or icmp
tcpdump: data link type LINUX_SLL2
tcpdump: verbose output suppressed, use -v[v]... for full protocol decode
listening on any, link-type LINUX_SLL2 (Linux cooked v2), snapshot length 262144 bytes
12:51:36.386974 eno02 In  IP 10.252.2.101 > 10.252.72.63: ESP(spi=0xc25fa42f,seq=0x14a), length 148
12:51:39.309062 eno02 In  IP 10.252.2.101 > 10.252.72.63: ESP(spi=0xc25fa42f,seq=0x14b), length 148
```

**Reply by tobiasbrunner** [reply]
> If I delete marks - I don't see traffic at all


It can't work with marks because there is nothing marking the packets when using GRE (unless you do that yourself, but why would you).

> I also check this manual https://www.strongswan.org/testing/testresults/route-based/net2net-gre/ and didn't find any additional info about gre in ipsec

What additional information?



> it seems that no decryption happens because I don't see icmp request:

Looks like there is only traffic in one direction. Maybe an issue at the other end (e.g. with firewall rules).

**Reply by iluffk** [reply]
No. there is no firewalls. It works with vti or xfrm interfaces, but with gre - no. Maybe I should turn on\off some plugin?
If I deleted mark, then traffic will go  not in tunnel
gre-vm1 Out IP 169.254.255.5 > 169.254.255.6: ICMP echo request, id 47404, seq 16, length 64
eno01 Out IP 10.252.72.63 > 10.252.2.101: GREv0, length 88: IP 169.254.255.5 > 169.254.255.6: ICMP echo request, id 33668, seq 31, length 64

**Reply by tobiasbrunner** [reply]
> Maybe I should turn on\off some plugin?

What plugin?

> If I deleted mark, then traffic will go not in tunnel

Who marks the traffic? Are you still using VTI interfaces?

**Reply by iluffk** [reply]
I don't know, maybe I should change one of this?
/etc/strongswan.d/charon/kernel-libipsec.conf load = no
and strongswan.d/charon/kernel-netlink.conf - load = yes

No, I use GRE as in mentoined in  manual, and as you advised I deleted marks from config strongswan.

**Reply by tobiasbrunner** [reply]
> I don't know, maybe I should change one of this?

No, you definitely only want to use `kernel-netlink`.

> No, I use GRE as in mentoined in manual, and as you advised I deleted marks from config strongswan.

You said if marks are configured, IPsec traffic is exchanged. That means you either still have VTI interfaces around that get used, or have firewall rules installed that cause traffic to get marked. Otherwise, policies won't match and there won't be any IPsec traffic.

**Reply by iluffk** [reply]
I will check all again

**Reply by iluffk** [reply]
Not working...
Should I specify remote_ts \ local_ts excaclty as IP on  interface grep?

**Reply by tobiasbrunner** [reply]
If you are referring to the addresses configured with `local` and `remote` when the interface is created and if they aren't the same as the IKE/ESP endpoints, then yes (but in the output you posted so far they looked the same).

**Reply by iluffk** [reply]
I have recreated all configs and got the same results:

On one side VM
```
config setup
    # strictcrlpolicy=yes
    # uniqueids = no

# Add connections here.

conn efipsec01
        keyexchange = ikev2
        left = 10.252.72.63
        right = 10.252.2.101
        authby = secret
        leftid = 10.252.72.63
        rightid = 10.252.2.101

        leftsubnet = dynamic[gre]
        rightsubnet = dynamic[gre]

        type = transport

        ike = aes256-sha256-x25519, aes128-sha256-x25519, aes256-sha256-modp2048, aes128-sha256-modp2048,aes128gcm16-x25519-sha256-aes256gcm16-modp2048-aes256ccm16-chacha20poly1305-aes192gcm16,chacha20poly1305-sha512-curve25519-prfsha512,aes256gcm16-sha384-prfsha384-ecp384
        esp = aes128gcm16, aes256gcm16, aes128gcm128-x25519-esn, chacha20poly1305
        ikelifetime = 28800s
        lifetime = 3600s
        auto = start
```
```
gre-ix@NONE: <POINTOPOINT,NOARP,UP,LOWER_UP> mtu 1476 qdisc noqueue state UNKNOWN mode DEFAULT group default qlen 1000
    inet 10.10.10.1/30 scope global gre-ix
    link/gre 10.252.72.63 peer 10.252.2.101 promiscuity 0  allmulti 0 minmtu 68 maxmtu 65511 
    gre remote 10.252.2.101 local 10.252.72.63 ttl inherit addrgenmode eui64 numtxqueues 1 numrxqueues 1 gso_max_size 65536 gso_max_segs 65535 tso_max_size 65536 tso_max_segs 65535 gro_max_size 65536 
```
ipsec statusall
```
Connections:
   efipsec01:  10.252.72.63...10.252.2.101  IKEv2
   efipsec01:   local:  [10.252.72.63] uses pre-shared key authentication
   efipsec01:   remote: [10.252.2.101] uses pre-shared key authentication
   efipsec01:   child:  0.0.0.0/0 === 0.0.0.0/0 TUNNEL
Security Associations (1 up, 0 connecting):
   efipsec01[1]: ESTABLISHED 2 minutes ago, 10.252.72.63[10.252.72.63]...10.252.2.101[10.252.2.101]
   efipsec01[1]: IKEv2 SPIs: 5b16ca665c0b08d1_i* 1fc3020d657f93f9_r, pre-shared key reauthentication in 7 hours
   efipsec01[1]: IKE proposal: AES_CBC_256/HMAC_SHA2_256_128/PRF_HMAC_SHA2_256/CURVE_25519
   efipsec01{1}:  INSTALLED, TUNNEL, reqid 1, ESP SPIs: c2568747_i cb430867_o
   efipsec01{1}:  AES_GCM_16_128, 0 bytes_i, 0 bytes_o, rekeying in 42 minutes
   efipsec01{1}:   10.252.72.63/32[gre] === 10.252.2.101/32[gre]
```


============================================
on other side:
```
connections {
    l7-lb {
        version = 2
        proposals = aes256-sha256-x25519, aes128-sha256-x25519, aes256-sha256-modp2048, aes128-sha256-modp2048,aes128gcm16-x25519-sha256-aes256gcm16-modp2048-aes256ccm16-chacha20poly1305-aes192gcm16,chacha20poly1305-sha512-curve25519-prfsha512,aes256gcm16-sha384-prfsha384-ecp384
        remote_addrs = 10.252.72.63
        local_addrs = 10.252.2.101
        remote {
            auth = psk
            id = 10.252.72.63
              }
        local {
            auth = psk
            id = 10.252.2.101
               }
        children {
             l7-lb {
                remote_ts = dynamic[gre]
                local_ts = dynamic[gre]

esp_proposals = aes128gcm16, aes256gcm16, aes128gcm128-x25519-esn, chacha20poly1305
                mode = transport

                }            
            }
    }
}
secrets {
    ike-l7-lb {
        id = 10.252.72.63
        secret = AAAAAAAAAAAAAAA
    }
}
```
ip -d link show
```
48: gre-sd@NONE: <POINTOPOINT,NOARP,UP,LOWER_UP> mtu 1476 qdisc noqueue state UNKNOWN mode DEFAULT group default qlen 1000
    inet 10.10.10.2/30 scope global gre-sd
    link/gre 10.252.2.101 peer 10.252.72.63 promiscuity 0  allmulti 0 minmtu 68 maxmtu 65511 
    gre remote 10.252.72.63 local 10.252.2.101 ttl inherit addrgenmode eui64 numtxqueues 1 numrxqueues 1 gso_max_size 65536 gso_max_segs 65535 tso_max_size 65536 tso_max_segs 65535 gro_max_size 65536
```
swanctl -l
```
l7-lb: #1, ESTABLISHED, IKEv2, 5b16ca665c0b08d1_i 1fc3020d657f93f9_r*
  local  '10.252.2.101' @ 10.252.2.101[4500]
  remote '10.252.72.63' @ 10.252.72.63[4500]
  AES_CBC-256/HMAC_SHA2_256_128/PRF_HMAC_SHA2_256/CURVE_25519
  established 277s ago, rekeying in 13117s
  l7-lb: #1, reqid 1, INSTALLED, TUNNEL, ESP:AES_GCM_16-128
    installed 277s ago, rekeying in 2981s, expires in 3683s
    in  cb430867,      0 bytes,     0 packets
    out c2568747,      0 bytes,     0 packets
    local  10.252.2.101/32[gre]
    remote 10.252.72.63/32[gre]
```

When I tried to ping  from gre 10.10.10.1/30  to 10.10.10.2/30 in dump I see:
on one side (sender):
```
tcpdump -niany esp or icmp or host 10.252.2.101
tcpdump: data link type LINUX_SLL2
tcpdump: verbose output suppressed, use -v[v]... for full protocol decode
listening on any, link-type LINUX_SLL2 (Linux cooked v2), snapshot length 262144 bytes
17:59:56.203354 gre-ix Out IP 10.10.10.1 > 10.10.10.2: ICMP echo request, id 47738, seq 342, length 64
17:59:56.203363 eno01 Out IP 10.252.72.63 > 10.252.2.101: GREv0, length 88: IP 10.10.10.1 > 10.10.10.2: ICMP echo request, id 47738, seq 342, length 64
^C 
```

Received:
```
tcpdump -niany icmp or esp or host 10.252.72.63
tcpdump: data link type LINUX_SLL2
tcpdump: verbose output suppressed, use -v[v]... for full protocol decode
listening on any, link-type LINUX_SLL2 (Linux cooked v2), snapshot length 262144 bytes
18:00:21.781217 ens3f0np0 In  IP 10.252.72.63 > 10.252.2.101: GREv0, length 88: IP 10.10.10.1 > 10.10.10.2: ICMP echo request, id 47738, seq 367, length 64
18:00:22.795730 ens3f0np0 In  IP 10.252.72.63 > 10.252.2.101: GREv0, length 88: IP 10.10.10.1 > 10.10.10.2: ICMP echo request, id 47738, seq 368, length 64
^C
```
No firewalls, no other vti\xfrm interfaces.


Seems that on sender packets didn't catch to IPsec...

**Reply by tobiasbrunner** [reply]
Are IPsec policies installed on both sides (`ip -s xfrm policy`)?  Have you played around with the `disable_policy` sysctl?

**Reply by iluffk** [reply]
Yes, I tried disable_policy, but nothing changed.
One side - VM2
```
 ip -s xfrm policy 
src 10.252.72.63/32 dst 10.252.2.101/32 proto gre uid 0
	dir out action allow index 23241 priority 366975 ptype main share any flag  (0x00000000)
	lifetime config:
	  limit: soft (INF)(bytes), hard (INF)(bytes)
	  limit: soft (INF)(packets), hard (INF)(packets)
	  expire add: soft 0(sec), hard 0(sec)
	  expire use: soft 0(sec), hard 0(sec)
	lifetime current:
	  0(bytes), 0(packets)
	  add 2025-03-25 14:37:14 use -
	mark 0x85/0xffffffff 
	tmpl src 10.252.72.63 dst 10.252.2.101
		proto esp spi 0xc6216e3d(3324079677) reqid 1(0x00000001) mode tunnel
		level required share any 
		enc-mask ffffffff auth-mask ffffffff comp-mask ffffffff
src 10.252.2.101/32 dst 10.252.72.63/32 proto gre uid 0
	dir fwd action allow index 23234 priority 366975 ptype main share any flag  (0x00000000)
	lifetime config:
	  limit: soft (INF)(bytes), hard (INF)(bytes)
	  limit: soft (INF)(packets), hard (INF)(packets)
	  expire add: soft 0(sec), hard 0(sec)
	  expire use: soft 0(sec), hard 0(sec)
	lifetime current:
	  0(bytes), 0(packets)
	  add 2025-03-25 14:37:14 use -
	mark 0x85/0xffffffff 
	tmpl src 10.252.2.101 dst 10.252.72.63
		proto esp spi 0x00000000(0) reqid 1(0x00000001) mode tunnel
		level required share any 
		enc-mask ffffffff auth-mask ffffffff comp-mask ffffffff
src 10.252.2.101/32 dst 10.252.72.63/32 proto gre uid 0
	dir in action allow index 23224 priority 366975 ptype main share any flag  (0x00000000)
	lifetime config:
	  limit: soft (INF)(bytes), hard (INF)(bytes)
	  limit: soft (INF)(packets), hard (INF)(packets)
	  expire add: soft 0(sec), hard 0(sec)
	  expire use: soft 0(sec), hard 0(sec)
	lifetime current:
	  0(bytes), 0(packets)
	  add 2025-03-25 14:37:14 use -
	mark 0x85/0xffffffff 
	tmpl src 10.252.2.101 dst 10.252.72.63
		proto esp spi 0x00000000(0) reqid 1(0x00000001) mode tunnel
		level required share any 
		enc-mask ffffffff auth-mask ffffffff comp-mask ffffffff
src 0.0.0.0/0 dst 0.0.0.0/0 uid 0
	socket in action allow index 23171 priority 0 ptype main share any flag  (0x00000000)
	lifetime config:
	  limit: soft 0(bytes), hard 0(bytes)
	  limit: soft 0(packets), hard 0(packets)
	  expire add: soft 0(sec), hard 0(sec)
	  expire use: soft 0(sec), hard 0(sec)
	lifetime current:
	  0(bytes), 0(packets)
	  add 2025-03-24 17:53:58 use 2025-03-25 14:37:14
src 0.0.0.0/0 dst 0.0.0.0/0 uid 0
	socket out action allow index 23164 priority 0 ptype main share any flag  (0x00000000)
	lifetime config:
	  limit: soft 0(bytes), hard 0(bytes)
	  limit: soft 0(packets), hard 0(packets)
	  expire add: soft 0(sec), hard 0(sec)
	  expire use: soft 0(sec), hard 0(sec)
	lifetime current:
	  0(bytes), 0(packets)
	  add 2025-03-24 17:53:58 use 2025-03-25 14:37:14
src 0.0.0.0/0 dst 0.0.0.0/0 uid 0
	socket in action allow index 23155 priority 0 ptype main share any flag  (0x00000000)
	lifetime config:
	  limit: soft 0(bytes), hard 0(bytes)
	  limit: soft 0(packets), hard 0(packets)
	  expire add: soft 0(sec), hard 0(sec)
	  expire use: soft 0(sec), hard 0(sec)
	lifetime current:
	  0(bytes), 0(packets)
	  add 2025-03-24 17:53:58 use 2025-03-24 17:53:58
src 0.0.0.0/0 dst 0.0.0.0/0 uid 0
	socket out action allow index 23148 priority 0 ptype main share any flag  (0x00000000)
	lifetime config:
	  limit: soft 0(bytes), hard 0(bytes)
	  limit: soft 0(packets), hard 0(packets)
	  expire add: soft 0(sec), hard 0(sec)
	  expire use: soft 0(sec), hard 0(sec)
	lifetime current:
	  0(bytes), 0(packets)
	  add 2025-03-24 17:53:58 use 2025-03-24 17:53:58
src ::/0 dst ::/0 uid 0
	socket in action allow index 23139 priority 0 ptype main share any flag  (0x00000000)
	lifetime config:
	  limit: soft 0(bytes), hard 0(bytes)
	  limit: soft 0(packets), hard 0(packets)
	  expire add: soft 0(sec), hard 0(sec)
	  expire use: soft 0(sec), hard 0(sec)
	lifetime current:
	  0(bytes), 0(packets)
	  add 2025-03-24 17:53:58 use -
src ::/0 dst ::/0 uid 0
	socket out action allow index 23132 priority 0 ptype main share any flag  (0x00000000)
	lifetime config:
	  limit: soft 0(bytes), hard 0(bytes)
	  limit: soft 0(packets), hard 0(packets)
	  expire add: soft 0(sec), hard 0(sec)
	  expire use: soft 0(sec), hard 0(sec)
	lifetime current:
	  0(bytes), 0(packets)
	  add 2025-03-24 17:53:58 use -
src ::/0 dst ::/0 uid 0
	socket in action allow index 23123 priority 0 ptype main share any flag  (0x00000000)
	lifetime config:
	  limit: soft 0(bytes), hard 0(bytes)
	  limit: soft 0(packets), hard 0(packets)
	  expire add: soft 0(sec), hard 0(sec)
	  expire use: soft 0(sec), hard 0(sec)
	lifetime current:
	  0(bytes), 0(packets)
	  add 2025-03-24 17:53:58 use -
src ::/0 dst ::/0 uid 0
	socket out action allow index 23116 priority 0 ptype main share any flag  (0x00000000)
	lifetime config:
	  limit: soft 0(bytes), hard 0(bytes)
	  limit: soft 0(packets), hard 0(packets)
	  expire add: soft 0(sec), hard 0(sec)
	  expire use: soft 0(sec), hard 0(sec)
	lifetime current:
	  0(bytes), 0(packets)
	  add 2025-03-24 17:53:58 use -
```

another side - VM1:
```
ip -s xfrm policy 
src 10.252.2.101/32 dst 10.252.72.63/32 proto gre uid 0
	dir out action allow index 14833 priority 366975 ptype main share any flag  (0x00000000)
	lifetime config:
	  limit: soft (INF)(bytes), hard (INF)(bytes)
	  limit: soft (INF)(packets), hard (INF)(packets)
	  expire add: soft 0(sec), hard 0(sec)
	  expire use: soft 0(sec), hard 0(sec)
	lifetime current:
	  0(bytes), 0(packets)
	  add 2025-03-25 14:37:14 use 2025-03-25 14:43:11
	tmpl src 10.252.2.101 dst 10.252.72.63
		proto esp spi 0xcaa652a6(3399897766) reqid 1(0x00000001) mode tunnel
		level required share any 
		enc-mask ffffffff auth-mask ffffffff comp-mask ffffffff
src 10.252.72.63/32 dst 10.252.2.101/32 proto gre uid 0
	dir fwd action allow index 14826 priority 366975 ptype main share any flag  (0x00000000)
	lifetime config:
	  limit: soft (INF)(bytes), hard (INF)(bytes)
	  limit: soft (INF)(packets), hard (INF)(packets)
	  expire add: soft 0(sec), hard 0(sec)
	  expire use: soft 0(sec), hard 0(sec)
	lifetime current:
	  0(bytes), 0(packets)
	  add 2025-03-25 14:37:14 use -
	tmpl src 10.252.72.63 dst 10.252.2.101
		proto esp spi 0x00000000(0) reqid 1(0x00000001) mode tunnel
		level required share any 
		enc-mask ffffffff auth-mask ffffffff comp-mask ffffffff
src 10.252.72.63/32 dst 10.252.2.101/32 proto gre uid 0
	dir in action allow index 14816 priority 366975 ptype main share any flag  (0x00000000)
	lifetime config:
	  limit: soft (INF)(bytes), hard (INF)(bytes)
	  limit: soft (INF)(packets), hard (INF)(packets)
	  expire add: soft 0(sec), hard 0(sec)
	  expire use: soft 0(sec), hard 0(sec)
	lifetime current:
	  0(bytes), 0(packets)
	  add 2025-03-25 14:37:14 use -
	tmpl src 10.252.72.63 dst 10.252.2.101
		proto esp spi 0x00000000(0) reqid 1(0x00000001) mode tunnel
		level required share any 
		enc-mask ffffffff auth-mask ffffffff comp-mask ffffffff
src 10.252.2.100/31 dst 10.252.2.100/31 uid 0
	dir fwd action allow index 14762 priority 168255 ptype main share any flag  (0x00000000)
	lifetime config:
	  limit: soft (INF)(bytes), hard (INF)(bytes)
	  limit: soft (INF)(packets), hard (INF)(packets)
	  expire add: soft 0(sec), hard 0(sec)
	  expire use: soft 0(sec), hard 0(sec)
	lifetime current:
	  0(bytes), 0(packets)
	  add 2025-03-24 17:53:52 use -
src 10.252.2.100/31 dst 10.252.2.100/31 uid 0
	dir in action allow index 14752 priority 168255 ptype main share any flag  (0x00000000)
	lifetime config:
	  limit: soft (INF)(bytes), hard (INF)(bytes)
	  limit: soft (INF)(packets), hard (INF)(packets)
	  expire add: soft 0(sec), hard 0(sec)
	  expire use: soft 0(sec), hard 0(sec)
	lifetime current:
	  0(bytes), 0(packets)
	  add 2025-03-24 17:53:52 use -
src 10.252.2.100/31 dst 10.252.2.100/31 uid 0
	dir out action allow index 14745 priority 168255 ptype main share any flag  (0x00000000)
	lifetime config:
	  limit: soft (INF)(bytes), hard (INF)(bytes)
	  limit: soft (INF)(packets), hard (INF)(packets)
	  expire add: soft 0(sec), hard 0(sec)
	  expire use: soft 0(sec), hard 0(sec)
	lifetime current:
	  0(bytes), 0(packets)
	  add 2025-03-24 17:53:52 use -
src 10.252.1.100/31 dst 10.252.1.100/31 uid 0
	dir fwd action allow index 14738 priority 168255 ptype main share any flag  (0x00000000)
	lifetime config:
	  limit: soft (INF)(bytes), hard (INF)(bytes)
	  limit: soft (INF)(packets), hard (INF)(packets)
	  expire add: soft 0(sec), hard 0(sec)
	  expire use: soft 0(sec), hard 0(sec)
	lifetime current:
	  0(bytes), 0(packets)
	  add 2025-03-24 17:53:52 use -
src 10.252.1.100/31 dst 10.252.1.100/31 uid 0
	dir in action allow index 14728 priority 168255 ptype main share any flag  (0x00000000)
	lifetime config:
	  limit: soft (INF)(bytes), hard (INF)(bytes)
	  limit: soft (INF)(packets), hard (INF)(packets)
	  expire add: soft 0(sec), hard 0(sec)
	  expire use: soft 0(sec), hard 0(sec)
	lifetime current:
	  0(bytes), 0(packets)
	  add 2025-03-24 17:53:52 use -
src 10.252.1.100/31 dst 10.252.1.100/31 uid 0
	dir out action allow index 14721 priority 168255 ptype main share any flag  (0x00000000)
	lifetime config:
	  limit: soft (INF)(bytes), hard (INF)(bytes)
	  limit: soft (INF)(packets), hard (INF)(packets)
	  expire add: soft 0(sec), hard 0(sec)
	  expire use: soft 0(sec), hard 0(sec)
	lifetime current:
	  0(bytes), 0(packets)
	  add 2025-03-24 17:53:52 use -
src 10.10.10.1/32 dst 10.10.10.1/32 uid 0
	dir fwd action allow index 14714 priority 167231 ptype main share any flag  (0x00000000)
	lifetime config:
	  limit: soft (INF)(bytes), hard (INF)(bytes)
	  limit: soft (INF)(packets), hard (INF)(packets)
	  expire add: soft 0(sec), hard 0(sec)
	  expire use: soft 0(sec), hard 0(sec)
	lifetime current:
	  0(bytes), 0(packets)
	  add 2025-03-24 17:53:52 use -
src 10.10.10.1/32 dst 10.10.10.1/32 uid 0
	dir in action allow index 14704 priority 167231 ptype main share any flag  (0x00000000)
	lifetime config:
	  limit: soft (INF)(bytes), hard (INF)(bytes)
	  limit: soft (INF)(packets), hard (INF)(packets)
	  expire add: soft 0(sec), hard 0(sec)
	  expire use: soft 0(sec), hard 0(sec)
	lifetime current:
	  0(bytes), 0(packets)
	  add 2025-03-24 17:53:52 use -
src 10.10.10.1/32 dst 10.10.10.1/32 uid 0
	dir out action allow index 14697 priority 167231 ptype main share any flag  (0x00000000)
	lifetime config:
	  limit: soft (INF)(bytes), hard (INF)(bytes)
	  limit: soft (INF)(packets), hard (INF)(packets)
	  expire add: soft 0(sec), hard 0(sec)
	  expire use: soft 0(sec), hard 0(sec)
	lifetime current:
	  0(bytes), 0(packets)
	  add 2025-03-24 17:53:52 use -
src 10.10.10.0/30 dst 10.10.10.0/30 uid 0
	dir fwd action allow index 14690 priority 169279 ptype main share any flag  (0x00000000)
	lifetime config:
	  limit: soft (INF)(bytes), hard (INF)(bytes)
	  limit: soft (INF)(packets), hard (INF)(packets)
	  expire add: soft 0(sec), hard 0(sec)
	  expire use: soft 0(sec), hard 0(sec)
	lifetime current:
	  0(bytes), 0(packets)
	  add 2025-03-24 17:53:52 use -
src 10.10.10.0/30 dst 10.10.10.0/30 uid 0
	dir in action allow index 14680 priority 169279 ptype main share any flag  (0x00000000)
	lifetime config:
	  limit: soft (INF)(bytes), hard (INF)(bytes)
	  limit: soft (INF)(packets), hard (INF)(packets)
	  expire add: soft 0(sec), hard 0(sec)
	  expire use: soft 0(sec), hard 0(sec)
	lifetime current:
	  0(bytes), 0(packets)
	  add 2025-03-24 17:53:52 use 2025-03-24 17:53:58
src 10.10.10.0/30 dst 10.10.10.0/30 uid 0
	dir out action allow index 14673 priority 169279 ptype main share any flag  (0x00000000)
	lifetime config:
	  limit: soft (INF)(bytes), hard (INF)(bytes)
	  limit: soft (INF)(packets), hard (INF)(packets)
	  expire add: soft 0(sec), hard 0(sec)
	  expire use: soft 0(sec), hard 0(sec)
	lifetime current:
	  0(bytes), 0(packets)
	  add 2025-03-24 17:53:52 use 2025-03-25 14:43:43
src 0.0.0.0/0 dst 0.0.0.0/0 uid 0
	socket in action allow index 14547 priority 0 ptype main share any flag  (0x00000000)
	lifetime config:
	  limit: soft 0(bytes), hard 0(bytes)
	  limit: soft 0(packets), hard 0(packets)
	  expire add: soft 0(sec), hard 0(sec)
	  expire use: soft 0(sec), hard 0(sec)
	lifetime current:
	  0(bytes), 0(packets)
	  add 2025-03-24 17:53:52 use 2025-03-25 14:37:14
src 0.0.0.0/0 dst 0.0.0.0/0 uid 0
	socket out action allow index 14540 priority 0 ptype main share any flag  (0x00000000)
	lifetime config:
	  limit: soft 0(bytes), hard 0(bytes)
	  limit: soft 0(packets), hard 0(packets)
	  expire add: soft 0(sec), hard 0(sec)
	  expire use: soft 0(sec), hard 0(sec)
	lifetime current:
	  0(bytes), 0(packets)
	  add 2025-03-24 17:53:52 use 2025-03-25 14:37:14
src 0.0.0.0/0 dst 0.0.0.0/0 proto udp sport 4500 dev ens3f1np1 uid 0
	dir out action allow index 14529 priority 32 ptype main share any flag  (0x00000000)
	lifetime config:
	  limit: soft (INF)(bytes), hard (INF)(bytes)
	  limit: soft (INF)(packets), hard (INF)(packets)
	  expire add: soft 0(sec), hard 0(sec)
	  expire use: soft 0(sec), hard 0(sec)
	lifetime current:
	  0(bytes), 0(packets)
	  add 2025-03-24 17:53:52 use -
src 0.0.0.0/0 dst 0.0.0.0/0 proto udp dport 4500 dev ens3f1np1 uid 0
	dir in action allow index 14520 priority 32 ptype main share any flag  (0x00000000)
	lifetime config:
	  limit: soft (INF)(bytes), hard (INF)(bytes)
	  limit: soft (INF)(packets), hard (INF)(packets)
	  expire add: soft 0(sec), hard 0(sec)
	  expire use: soft 0(sec), hard 0(sec)
	lifetime current:
	  0(bytes), 0(packets)
	  add 2025-03-24 17:53:52 use -
src 0.0.0.0/0 dst 0.0.0.0/0 proto udp sport 4500 dev ens3f0np0 uid 0
	dir out action allow index 14513 priority 32 ptype main share any flag  (0x00000000)
	lifetime config:
	  limit: soft (INF)(bytes), hard (INF)(bytes)
	  limit: soft (INF)(packets), hard (INF)(packets)
	  expire add: soft 0(sec), hard 0(sec)
	  expire use: soft 0(sec), hard 0(sec)
	lifetime current:
	  0(bytes), 0(packets)
	  add 2025-03-24 17:53:52 use -
src 0.0.0.0/0 dst 0.0.0.0/0 proto udp dport 4500 dev ens3f0np0 uid 0
	dir in action allow index 14504 priority 32 ptype main share any flag  (0x00000000)
	lifetime config:
	  limit: soft (INF)(bytes), hard (INF)(bytes)
	  limit: soft (INF)(packets), hard (INF)(packets)
	  expire add: soft 0(sec), hard 0(sec)
	  expire use: soft 0(sec), hard 0(sec)
	lifetime current:
	  0(bytes), 0(packets)
	  add 2025-03-24 17:53:52 use -
src 0.0.0.0/0 dst 0.0.0.0/0 uid 0
	socket in action allow index 14499 priority 0 ptype main share any flag  (0x00000000)
	lifetime config:
	  limit: soft 0(bytes), hard 0(bytes)
	  limit: soft 0(packets), hard 0(packets)
	  expire add: soft 0(sec), hard 0(sec)
	  expire use: soft 0(sec), hard 0(sec)
	lifetime current:
	  0(bytes), 0(packets)
	  add 2025-03-24 17:53:52 use 2025-03-24 17:53:58
src 0.0.0.0/0 dst 0.0.0.0/0 uid 0
	socket out action allow index 14492 priority 0 ptype main share any flag  (0x00000000)
	lifetime config:
	  limit: soft 0(bytes), hard 0(bytes)
	  limit: soft 0(packets), hard 0(packets)
	  expire add: soft 0(sec), hard 0(sec)
	  expire use: soft 0(sec), hard 0(sec)
	lifetime current:
	  0(bytes), 0(packets)
	  add 2025-03-24 17:53:52 use 2025-03-24 17:53:58
src 0.0.0.0/0 dst 0.0.0.0/0 proto udp sport 500 dev ens3f1np1 uid 0
	dir out action allow index 14481 priority 32 ptype main share any flag  (0x00000000)
	lifetime config:
	  limit: soft (INF)(bytes), hard (INF)(bytes)
	  limit: soft (INF)(packets), hard (INF)(packets)
	  expire add: soft 0(sec), hard 0(sec)
	  expire use: soft 0(sec), hard 0(sec)
	lifetime current:
	  0(bytes), 0(packets)
	  add 2025-03-24 17:53:52 use -
src 0.0.0.0/0 dst 0.0.0.0/0 proto udp dport 500 dev ens3f1np1 uid 0
	dir in action allow index 14472 priority 32 ptype main share any flag  (0x00000000)
	lifetime config:
	  limit: soft (INF)(bytes), hard (INF)(bytes)
	  limit: soft (INF)(packets), hard (INF)(packets)
	  expire add: soft 0(sec), hard 0(sec)
	  expire use: soft 0(sec), hard 0(sec)
	lifetime current:
	  0(bytes), 0(packets)
	  add 2025-03-24 17:53:52 use -
src 0.0.0.0/0 dst 0.0.0.0/0 proto udp sport 500 dev ens3f0np0 uid 0
	dir out action allow index 14465 priority 32 ptype main share any flag  (0x00000000)
	lifetime config:
	  limit: soft (INF)(bytes), hard (INF)(bytes)
	  limit: soft (INF)(packets), hard (INF)(packets)
	  expire add: soft 0(sec), hard 0(sec)
	  expire use: soft 0(sec), hard 0(sec)
	lifetime current:
	  0(bytes), 0(packets)
	  add 2025-03-24 17:53:52 use -
src 0.0.0.0/0 dst 0.0.0.0/0 proto udp dport 500 dev ens3f0np0 uid 0
	dir in action allow index 14456 priority 32 ptype main share any flag  (0x00000000)
	lifetime config:
	  limit: soft (INF)(bytes), hard (INF)(bytes)
	  limit: soft (INF)(packets), hard (INF)(packets)
	  expire add: soft 0(sec), hard 0(sec)
	  expire use: soft 0(sec), hard 0(sec)
	lifetime current:
	  0(bytes), 0(packets)
	  add 2025-03-24 17:53:52 use -
```

**Reply by iluffk** [reply]
it seems that on VM2 no policy for GRE

**Reply by tobiasbrunner** [reply, marked as answer]
> Yes, I tried disable_policy, but nothing changed.

The point is that you don't want to disable them! (It's only in the docs for VTI interfaces as they explicitly do a policy check themselves, so I thought you might have done that now as well.)

> it seems that on VM2 no policy for GRE

What do you mean? There is one in the output. But none of the policies are getting used (`use -`).

> mark 0x85/0xffffffff

This on VM2 is clearly wrong. You apparently still have a mark configured.

**Reply by iluffk** [reply]
Tobias, thank you. I found  my mistake with config file location...
